,age_upon_outcome,animal_id,animal_type,breed,color,date_of_birth,datetime,monthyear,outcome_subtype,outcome_type,sex_upon_outcome,location_lat,location_long,age_upon_outcome_in_weeks,name,breed_id,Chip_ID
1.0,3 years,A746874,Cat,Domestic Shorthair Mix,Black/White,2014-04-10,4/11/2017 9:00,2017-04-11T09:00:00,SCRP,Transfer,Neutered Male,30.50665787,-97.34087807,156.7678571,,,
2.0,1 year,A725717,Cat,Domestic Shorthair Mix,Silver Tabby,2015-05-02,5/6/2016 10:49,2016-05-06T10:49:00,SCRP,Transfer,Spayed Female,30.65259846,-97.74199635,52.92152778,,,
3.0,2 years,A716330,Dog,Chihuahua Shorthair Mix,Brown/White,2013-11-18,12/28/2015 18:43,2015-12-28T18:43:00,,Adoption,Neutered Male,30.75957481,-97.55237538,110.1114087,Frank,,
4.0,7 months,A733653,Cat,Siamese Mix,Seal Point,2016-01-25,8/27/2016 18:11,2016-08-27T18:11:00,,Adoption,Intact Female,30.31880634,-97.72403767,30.82251984,Kitty,,
5.0,2 years,A691584,Dog,Labrador Retriever Mix,Tan/White,2012-11-06,5/30/2015 13:48,2015-05-30T13:48:00,,Return to Owner,Neutered Male,30.71048156,-97.56229744,133.6535714,Luke,,
6.0,5 years,A696004,Dog,Cardigan Welsh Corgi Mix,Sable/White,2010-01-27,1/28/2015 10:39,2015-01-28T10:39:00,Rabies Risk,Euthanasia,Spayed Female,30.67373659,-97.70797153,261.0633929,Lucy,,
7.0,2 years,A673830,Dog,Pit Bull Mix,Black/White,2012-03-03,3/19/2014 15:15,2014-03-19T15:15:00,Aggressive,Euthanasia,Neutered Male,30.29542566,-97.31366421,106.6622024,*Seth,,
8.0,1 year,A736551,Dog,Labrador Retriever/Australian Cattle Dog,Black,2015-10-12,11/27/2016 18:00,2016-11-27T18:00:00,,Adoption,Spayed Female,30.44432128,-97.73269803,58.96428571,*Mia,,
9.0,3 years,A720214,Dog,Labrador Retriever Mix,Red/White,2013-02-04,2/11/2016 12:41,2016-02-11T12:41:00,,Adoption,Spayed Female,30.38706482,-97.36843397,157.5040675,Blessing,,
10.0,3 months,A664290,Cat,Domestic Shorthair Mix,Tortie,2013-09-01,12/8/2013 14:58,2013-12-08T14:58:00,,Adoption,Spayed Female,30.75831055,-97.6182922,14.0890873,*Taylor,,
11.0,1 year,A721199,Dog,Dachshund Wirehair Mix,Tan/White,2015-02-23,2/27/2016 17:49,2016-02-27T17:49:00,,Adoption,Spayed Female,30.72902728,-97.37533282,52.8203373,Belle,,
12.0,1 year,A664843,Dog,Pit Bull Mix,Brown/White,2013-06-09,8/18/2014 17:24,2014-08-18T17:24:00,Partner,Transfer,Neutered Male,30.45155494,-97.47410451,62.24642857,Sherlock,,
13.0,1 year,A700408,Cat,Domestic Shorthair Mix,Brown Tabby/White,2014-04-13,4/15/2015 13:34,2015-04-15T13:34:00,,Return to Owner,Spayed Female,30.41011545,-97.56241567,52.5093254,Nyla,,
14.0,2 years,A742287,Dog,Boxer/Bullmastiff,Brown Brindle/White,2015-01-18,2/11/2017 12:30,2017-02-11T12:30:00,,Adoption,Neutered Male,30.45511486,-97.30877805,107.9315476,*Kawhi,,
15.0,3 years,A712638,Dog,Pit Bull Mix,Red/White,2012-09-26,7/18/2016 17:52,2016-07-18T17:52:00,Partner,Transfer,Neutered Male,30.57982992,-97.55884879,198.8206349,Marcus,,
16.0,5 years,A723742,Dog,Miniature Schnauzer Mix,Black/White,2011-04-05,4/10/2016 17:27,2016-04-10T17:27:00,,Adoption,Spayed Female,30.47928849,-97.40885316,261.8181548,Gretchen,,
17.0,6 months,A668960,Dog,Pit Bull Mix,Blue/White,2013-06-12,12/27/2013 16:56,2013-12-27T16:56:00,,Adoption,Spayed Female,30.59434108,-97.24899336,28.38650794,*Gigi,,
18.0,2 months,A693288,Cat,Domestic Shorthair Mix,Brown Tabby/White,2014-09-28,12/9/2014 18:36,2014-12-09T18:36:00,,Adoption,Spayed Female,30.45276783,-97.46205072,10.39642857,,,
19.0,4 months,A709511,Cat,Domestic Medium Hair Mix,White/Black,2015-07-10,11/13/2015 14:00,2015-11-13T14:00:00,Foster,Adoption,Neutered Male,30.52028775,-97.65742044,18.08333333,*Toad,,
20.0,1 year,A693126,Dog,American Bulldog Mix,White/Brown,2013-12-02,2/28/2015 17:42,2015-02-28T17:42:00,,Adoption,Neutered Male,30.5777123,-97.64388266,64.81964286,George,,
21.0,2 years,A730354,Dog,Pit Bull Mix,Blue/White,2015-07-02,7/1/2017 18:11,2017-07-01T18:11:00,,Adoption,Spayed Female,30.48156897,-97.36949609,104.3939484,Mia,,
22.0,5 years,A615748,Dog,Labrador Retriever Mix,Black,2009-12-11,10/26/2015 18:13,2015-10-26T18:13:00,Suffering,Euthanasia,Neutered Male,30.71720698,-97.29528331,306.537004,Blackie,,
23.0,2 years,A692137,Dog,Pit Bull Mix,Blue/White,2013-05-15,3/1/2016 15:26,2016-03-01T15:26:00,Partner,Transfer,Intact Male,30.36915965,-97.3810872,145.9490079,Shadow,,
24.0,3 weeks,A704707,Cat,Siamese Mix,Seal Point,2015-05-17,6/8/2015 16:25,2015-06-08T16:25:00,Partner,Transfer,Unknown,30.70993564,-97.69685334,3.240575397,,,
25.0,2 months,A725966,Cat,Domestic Shorthair Mix,Tortie,2016-03-20,5/24/2016 11:01,2016-05-24T11:01:00,,Adoption,Spayed Female,30.52017076,-97.53178243,9.351289683,*Star,,
26.0,1 year,A743231,Cat,Domestic Shorthair Mix,Black,2016-02-06,2/7/2017 9:00,2017-02-07T09:00:00,SCRP,Transfer,Intact Female,30.2920164,-97.42662919,52.48214286,,,
27.0,2 years,A764418,Dog,Chihuahua Shorthair Mix,Tan/White,2015-12-29,12/30/2017 11:58,2017-12-30T11:58:00,,Return to Owner,Neutered Male,30.27716894,-97.71227555,104.6426587,Burro,,
28.0,1 year,A743879,Dog,Pit Bull Mix,Black/White,2016-02-18,6/16/2017 14:58,2017-06-16T14:58:00,Partner,Transfer,Spayed Female,30.75736753,-97.46674216,69.23194444,*Tallulah,,
29.0,2 months,A756064,Cat,Domestic Shorthair Mix,Blue,2017-06-13,8/16/2017 0:00,2017-08-16T00:00:00,Partner,Transfer,Intact Male,30.29341166,-97.29019484,9.142857143,,,
30.0,3 years,A648094,Dog,Dachshund/Chihuahua Shorthair,Red,2012-11-21,7/21/2016 18:58,2016-07-21T18:58:00,,Adoption,Neutered Male,30.7173271,-97.48834083,191.255754,Brawndo,,
31.0,5 years,A651202,Dog,Maltese Mix,White,2009-04-07,9/6/2014 17:11,2014-09-06T17:11:00,,Return to Owner,Spayed Female,30.48740064,-97.73007411,282.6737103,Daisy,,
32.0,3 months,A687515,Cat,Domestic Shorthair Mix,Orange Tabby,2014-05-29,9/7/2014 18:30,2014-09-07T18:30:00,,Adoption,Spayed Female,30.53705367,-97.56848156,14.53869048,Dinah,,
33.0,2 years,A709958,Dog,Australian Cattle Dog Mix,Brown Brindle/White,2013-08-15,8/23/2015 19:23,2015-08-23T19:23:00,,Adoption,Intact Female,30.69373851,-97.57660032,105.5439484,Jack,,
34.0,3 months,A753983,Cat,Domestic Shorthair Mix,Orange Tabby,2017-04-13,7/16/2017 19:19,2017-07-16T19:19:00,Snr,Transfer,Unknown,30.43018877,-97.58375536,13.54355159,,,
35.0,7 years,A712377,Cat,Domestic Shorthair Mix,Brown Tabby/White,2008-09-22,9/23/2015 9:00,2015-09-23T09:00:00,SCRP,Transfer,Neutered Male,30.59149195,-97.64170614,365.3392857,,,
36.0,6 months,A706953,Dog,Labrador Retriever Mix,Yellow,2014-12-06,7/6/2015 11:33,2015-07-06T11:33:00,Medical,Euthanasia,Intact Female,30.54808024,-97.29699691,30.35446429,,,
37.0,3 months,A739519,Cat,Domestic Shorthair Mix,Brown Tabby,2016-11-06,2/11/2017 18:46,2017-02-11T18:46:00,,Adoption,Spayed Female,30.68318128,-97.24581916,13.96884921,Mojito,,
38.0,2 months,A760125,Cat,Domestic Shorthair Mix,White/Black,2017-07-29,10/17/2017 0:00,2017-10-17T00:00:00,Partner,Transfer,Neutered Male,30.5414257,-97.46339942,11.42857143,,,
39.0,1 year,A707145,Dog,Dachshund Mix,Brown/White,2014-07-08,7/10/2015 14:01,2015-07-10T14:01:00,Partner,Transfer,Intact Female,30.32625576,-97.58265481,52.51200397,Puppy,,
40.0,2 months,A710726,Cat,Domestic Shorthair Mix,Torbie,2015-08-04,10/24/2015 18:17,2015-10-24T18:17:00,,Adoption,Spayed Female,30.38500588,-97.52092098,11.68025794,*Zara,,
41.0,2 years,A699587,Dog,Miniature Poodle Mix,White,2013-03-30,4/3/2015 17:26,2015-04-03T17:26:00,,Adoption,Spayed Female,30.28807307,-97.70830367,104.9609127,Paisley,,
42.0,1 year,A691043,Dog,Pug/Chihuahua Shorthair,Tan/Black,2013-07-29,11/2/2014 12:50,2014-11-02T12:50:00,Partner,Transfer,Intact Male,30.60249091,-97.55654615,65.93353175,Thor,,
43.0,2 years,A697233,Dog,Pit Bull Mix,Tan/White,2013-02-20,4/5/2015 14:10,2015-04-05T14:10:00,Partner,Transfer,Neutered Male,30.30918992,-97.40739133,110.655754,*Tolliver,,
44.0,8 years,A724746,Cat,Domestic Shorthair Mix,Orange Tabby,2008-04-21,4/22/2016 14:25,2016-04-22T14:25:00,Partner,Transfer,Intact Male,30.37348254,-97.48765347,417.6572421,,,
45.0,6 years,A674774,Dog,German Shepherd/Labrador Retriever,Brown/Black,2008-03-18,3/19/2014 17:06,2014-03-19T17:06:00,,Return to Owner,Neutered Male,30.65866278,-97.58143998,313.2446429,Brownie,,
46.0,1 month,A683445,Cat,Domestic Shorthair Mix,Orange Tabby/White,2014-06-03,7/17/2014 7:55,2014-07-17T07:55:00,In Kennel,Died,Intact Male,30.49484256,-97.45888531,6.332837302,*Blynn,,
47.0,3 years,A672401,Dog,Siberian Husky Mix,Red/White,2011-02-09,2/9/2014 18:36,2014-02-09T18:36:00,,Return to Owner,Neutered Male,30.57311361,-97.43700345,156.6821429,Ziegen,,
48.0,1 year,A689217,Dog,Australian Cattle Dog/Beagle,White/Red,2013-09-30,10/11/2014 19:10,2014-10-11T19:10:00,,Adoption,Spayed Female,30.37078405,-97.37787508,53.82837302,Hot Dog,,
49.0,8 years,A742234,Dog,Yorkshire Terrier Mix,Brown/Black,2009-01-18,1/28/2017 11:17,2017-01-28T11:17:00,,Return to Owner,Neutered Male,30.35717928,-97.54670925,418.9243056,Coco,,
50.0,2 years,A721406,Dog,Labrador Retriever Mix,Cream/White,2014-02-26,5/4/2016 0:00,2016-05-04T00:00:00,,Adoption,Spayed Female,30.40951713,-97.41467687,114,Lanie,,
51.0,2 years,A680890,Dog,Miniature Poodle,White,2012-06-09,6/9/2014 18:21,2014-06-09T18:21:00,Suffering,Euthanasia,Intact Female,30.33199033,-97.55681744,104.3949405,,,
52.0,1 weeks,A723050,Cat,Domestic Shorthair Mix,Brown Tabby,2016-03-12,3/25/2016 18:49,2016-03-25T18:49:00,Partner,Transfer,Intact Male,30.35572526,-97.57433007,1.969146825,,,
53.0,4 weeks,A752695,Cat,Domestic Shorthair Mix,Brown Tabby/White,2017-05-26,6/27/2017 15:07,2017-06-27T15:07:00,Partner,Transfer,Intact Male,30.34659316,-97.31040717,4.66140873,,,
54.0,1 year,A715512,Cat,Domestic Shorthair Mix,Orange Tabby,2014-11-05,1/4/2016 0:00,2016-01-04T00:00:00,Partner,Transfer,Spayed Female,30.56026105,-97.29812215,60.71428571,*Lola,,
55.0,6 years,A699222,Dog,Beagle Mix,Tricolor,2009-06-14,6/19/2015 18:43,2015-06-19T18:43:00,Partner,Transfer,Neutered Male,30.75399569,-97.64060954,313.8256944,Scruffy,,
56.0,1 month,A728660,Cat,Domestic Shorthair Mix,Brown Tabby,2016-05-05,6/30/2016 13:25,2016-06-30T13:25:00,,Adoption,Intact Female,30.3384119,-97.50993768,8.079861111,Misty,,
57.0,7 years,A754845,Dog,Chow Chow Mix,Tan,2010-08-12,8/17/2017 16:03,2017-08-17T16:03:00,,Rto-Adopt,Spayed Female,30.54990388,-97.7055343,366.0955357,Coco,,
58.0,1 year,A730275,Dog,Chinese Sharpei Mix,Brown,2015-07-01,7/9/2016 17:53,2016-07-09T17:53:00,,Adoption,Spayed Female,30.58131511,-97.6206629,53.53501984,Chai,,
59.0,4 years,A689501,Dog,Chinese Crested Mix,Black/White,2010-10-04,10/9/2014 17:20,2014-10-09T17:20:00,,Adoption,Neutered Male,30.67946692,-97.57340233,209.531746,*Ping,,
60.0,2 months,A716822,Dog,Dachshund Mix,Red/White,2015-09-18,11/30/2015 16:53,2015-11-30T16:53:00,,Adoption,Spayed Female,30.52057505,-97.29186282,10.52906746,*Sally,,
61.0,1 year,A751029,Dog,Staffordshire Mix,Blue/White,2016-06-03,6/9/2017 18:23,2017-06-09T18:23:00,,Adoption,Spayed Female,30.31964759,-97.57250821,53.1094246,,,
62.0,1 year,A669824,Dog,Labrador Retriever Mix,Black,2013-07-27,11/15/2014 15:19,2014-11-15T15:19:00,Partner,Transfer,Neutered Male,30.61943385,-97.65793522,68.09117063,Jackson,,
63.0,2 years,A728144,Dog,Border Collie/Queensland Heeler,Black/White,2014-05-31,6/5/2016 15:43,2016-06-05T15:43:00,,Adoption,Spayed Female,30.2947529,-97.42794279,105.2364087,Lilly,,
64.0,1 year,A708999,Dog,Australian Cattle Dog Mix,Brown Brindle/White,2014-11-03,12/15/2015 11:00,2015-12-15T11:00:00,Foster,Adoption,Spayed Female,30.47034592,-97.68516405,58.20833333,*Daisy,,
65.0,10 years,A671822,Dog,German Shepherd Mix,Black/Tan,2006-01-31,10/11/2016 10:03,2016-10-11T10:03:00,Foster,Adoption,Neutered Male,30.71187663,-97.29993658,558.0598214,*Milo,,
66.0,6 months,A713150,Cat,Domestic Medium Hair Mix,Blue/White,2015-04-03,10/4/2015 9:00,2015-10-04T09:00:00,SCRP,Transfer,Unknown,30.64900565,-97.30064327,26.33928571,,,
67.0,12 years,A745946,Dog,Chihuahua Shorthair,White/Tan,2005-03-29,8/7/2017 12:47,2017-08-07T12:47:00,Foster,Adoption,Neutered Male,30.70033509,-97.57274898,644.9332341,*Toodles,,
68.0,4 years,A752436,Dog,Yorkshire Terrier Mix,Tricolor,2013-06-22,6/23/2017 16:48,2017-06-23T16:48:00,,Return to Owner,Neutered Male,30.5804325,-97.54040821,208.9571429,Rylie,,
69.0,3 years,A725549,Cat,Domestic Shorthair Mix,Brown Tabby/White,2013-04-30,6/12/2016 18:13,2016-06-12T18:13:00,,Adoption,Spayed Female,30.3496663,-97.33311828,162.8227183,Diz,,
70.0,3 months,A683276,Other,Raccoon Mix,Black/Gray,2014-04-08,7/9/2014 8:52,2014-07-09T08:52:00,Rabies Risk,Euthanasia,Unknown,30.51067461,-97.2826788,13.19563492,,,
71.0,2 years,A762414,Other,Raccoon,Gray/Black,2015-11-20,11/21/2017 8:20,2017-11-21T08:20:00,Suffering,Euthanasia,Unknown,30.37189262,-97.47742722,104.6210317,,,
72.0,1 year,A712292,Dog,Chihuahua Shorthair Mix,Tan/White,2014-09-20,9/21/2015 12:18,2015-09-21T12:18:00,,Return to Owner,Spayed Female,30.76455889,-97.63048225,52.35892857,Peanut,,
73.0,2 months,A666065,Cat,Domestic Shorthair Mix,Brown Tabby/White,2013-08-26,11/9/2013 18:14,2013-11-09T18:14:00,,Adoption,Spayed Female,30.54302876,-97.68624353,10.82281746,Sandy,,
74.0,9 years,A582826,Dog,Beagle,Tricolor,2005-08-26,8/18/2015 11:11,2015-08-18T11:11:00,,Return to Owner,Neutered Male,30.33616352,-97.45077998,520.637996,Charlie,,
75.0,5 months,A734883,Cat,Domestic Shorthair Mix,Blue Tabby/White,2016-04-14,9/27/2016 22:24,2016-09-27T22:24:00,,Adoption,Neutered Male,30.49847798,-97.59303322,23.84761905,,,
76.0,10 months,A703777,Cat,Domestic Shorthair Mix,Black Smoke,2015-04-21,3/11/2016 11:10,2016-03-11T11:10:00,Foster,Adoption,Spayed Female,30.44457432,-97.30198317,46.49503968,Whisper,,
77.0,4 years,A756786,Dog,Chihuahua Longhair/Yorkshire Terrier,White/Tan,2013-08-25,8/28/2017 19:08,2017-08-28T19:08:00,,Adoption,Neutered Male,30.47382989,-97.56716593,209.256746,Bebe,,
78.0,1 year,A690377,Dog,Pit Bull Mix,Black/White,2013-10-19,2/20/2015 15:07,2015-02-20T15:07:00,,Adoption,Neutered Male,30.58040417,-97.34413054,69.94712302,*Pagani,,
79.0,4 weeks,A674079,Other,Bat,Brown/Black,2014-02-07,3/7/2014 10:46,2014-03-07T10:46:00,Rabies Risk,Euthanasia,Unknown,30.76078922,-97.70866883,4.064087302,,,
80.0,4 months,A687309,Dog,Miniature Poodle Mix,Cream,2014-05-03,9/7/2014 16:48,2014-09-07T16:48:00,Partner,Transfer,Neutered Male,30.34981432,-97.33557631,18.24285714,,,
81.0,11 months,A678782,Cat,Domestic Shorthair Mix,Black,2014-03-28,3/2/2015 15:10,2015-03-02T15:10:00,Partner,Transfer,Neutered Male,30.29583866,-97.55849055,48.51884921,Fred,,
82.0,3 years,A723765,Dog,Queensland Heeler Mix,White/Red Merle,2013-04-06,4/6/2016 16:50,2016-04-06T16:50:00,,Return to Owner,Spayed Female,30.27694519,-97.31492229,156.671627,Dewie,,
83.0,4 years,A738497,Cat,Domestic Shorthair Mix,Brown Tabby,2012-11-16,12/22/2016 13:35,2016-12-22T13:35:00,Partner,Transfer,Spayed Female,30.68063452,-97.66787545,213.937996,*Kyleigh,,
84.0,1 year,A704521,Cat,Domestic Shorthair Mix,Orange Tabby,2014-06-05,6/24/2015 16:41,2015-06-24T16:41:00,Partner,Transfer,Spayed Female,30.49896344,-97.67515706,54.95644841,*Goldie,,
85.0,11 years,A323668,Dog,Australian Cattle Dog Mix,Tricolor,2003-05-15,3/6/2015 17:36,2015-03-06T17:36:00,,Return to Owner,Neutered Male,30.50798908,-97.55348875,616.247619,Ringo,,
86.0,6 years,A724022,Dog,Chihuahua Shorthair Mix,Tan/Red,2011-04-10,5/24/2017 16:15,2017-05-24T16:15:00,,Return to Owner,Neutered Male,30.40541623,-97.5924478,319.5252976,Pepe,,
87.0,1 year,A724478,Dog,Flat Coat Retriever Mix,Black,2015-04-18,5/4/2016 16:45,2016-05-04T16:45:00,,Adoption,Neutered Male,30.52659064,-97.64024461,54.67113095,Shadow,,
88.0,7 years,A663438,Dog,Labrador Retriever Mix,Sable,2006-09-18,6/14/2014 16:40,2014-06-14T16:40:00,,Adoption,Spayed Female,30.71339193,-97.30775521,403.8134921,Bonny,,
89.0,1 year,A724814,Cat,Domestic Shorthair Mix,Black,2015-04-22,6/28/2016 0:00,2016-06-28T00:00:00,,Adoption,Spayed Female,30.44652034,-97.67756338,61.85714286,*Oaxaca,,
90.0,4 months,A765965,Dog,Pointer Mix,Chocolate/White,2017-09-30,2/1/2018 16:11,2018-02-01T16:11:00,,Adoption,Spayed Female,30.31972316,-97.25627018,17.81061508,Coco,,
91.0,14 years,A724729,Cat,Domestic Longhair Mix,Calico,2002-04-21,4/24/2016 15:52,2016-04-24T15:52:00,,Return to Owner,Spayed Female,30.42510298,-97.64833639,731.0944444,Victoria,,
92.0,2 years,A725343,Dog,Pit Bull Mix,Brown Brindle/White,2014-04-28,7/13/2016 18:13,2016-07-13T18:13:00,,Adoption,Spayed Female,30.42835987,-97.35458626,115.3941468,Luna,,
93.0,2 months,A707888,Cat,Domestic Shorthair Mix,Brown Tabby/White,2015-05-04,7/25/2015 12:01,2015-07-25T12:01:00,,Adoption,Neutered Male,30.34820438,-97.35051545,11.78581349,Sammy,,
94.0,2 months,A682638,Cat,Domestic Shorthair Mix,Brown Tabby,2014-05-15,7/18/2014 17:08,2014-07-18T17:08:00,,Adoption,Spayed Female,30.32132108,-97.3396321,9.24484127,Marie,,
95.0,1 year,A742473,Cat,Domestic Shorthair Mix,Brown Tabby/Brown,2016-01-22,1/23/2017 9:00,2017-01-23T09:00:00,SCRP,Transfer,Spayed Female,30.64241024,-97.52576656,52.48214286,,,
96.0,4 months,A742468,Cat,Domestic Shorthair Mix,Black,2016-09-22,1/28/2017 16:57,2017-01-28T16:57:00,,Adoption,Spayed Female,30.63338637,-97.4648295,18.38660714,Jiji,,
97.0,2 weeks,A694902,Dog,Pit Bull Mix,White/Tricolor,2014-12-22,1/8/2015 12:39,2015-01-08T12:39:00,,Return to Owner,Intact Female,30.6508855,-97.49358322,2.503869048,,,
98.0,10 months,A761936,Dog,Scottish Terrier Mix,Brown Brindle,2017-01-12,11/16/2017 12:54,2017-11-16T12:54:00,Partner,Transfer,Intact Male,30.61119534,-97.42060967,44.07678571,,,
99.0,1 year,A679645,Dog,Boxer/Queensland Heeler,White/Black,2013-05-24,6/17/2014 18:18,2014-06-17T18:18:00,Behavior,Euthanasia,Neutered Male,30.49388078,-97.37954544,55.68035714,*Calvin,,
100.0,2 months,A665579,Cat,Domestic Shorthair Mix,Black,2013-08-19,11/4/2013 15:09,2013-11-04T15:09:00,Partner,Transfer,Neutered Male,30.62338383,-97.67180824,11.09017857,*Candy,,
101.0,1 year,A734988,Dog,Catahoula Mix,Brown Brindle/White,2015-09-16,1/3/2017 16:15,2017-01-03T16:15:00,,Adoption,Spayed Female,30.59386336,-97.29242243,67.95386905,*Avalon,,
102.0,4 months,A664597,Dog,Pit Bull Mix,Blue/White,2013-06-05,10/11/2013 14:00,2013-10-11T14:00:00,Partner,Transfer,Intact Female,30.35627644,-97.39334418,18.36904762,Phoebe,,
103.0,5 years,A763871,Dog,Great Pyrenees Mix,Cream,2012-06-18,12/18/2017 16:00,2017-12-18T16:00:00,,Return to Owner,Intact Male,30.35206139,-97.71263714,287.0952381,Guardian,,
104.0,2 years,A717889,Dog,Pit Bull Mix,White/Black,2013-12-17,1/21/2016 19:18,2016-01-21T19:18:00,,Adoption,Spayed Female,30.31064806,-97.32099504,109.4005952,Lulu,,
105.0,3 years,A705317,Dog,Boxer Mix,Brown Brindle/White,2012-06-16,6/23/2015 17:54,2015-06-23T17:54:00,,Adoption,Spayed Female,30.66172858,-97.27452998,157.535119,*Gretel,,
106.0,5 years,A722207,Dog,Labrador Retriever Mix,Red,2011-03-12,3/12/2016 18:11,2016-03-12T18:11:00,,Return to Owner,Spayed Female,30.47977633,-97.55793438,261.1082341,Honey,,
107.0,1 year,A681101,Cat,Domestic Shorthair Mix,Brown Tabby,2013-06-12,6/19/2014 14:36,2014-06-19T14:36:00,Partner,Transfer,Spayed Female,30.59178052,-97.73211734,53.2297619,Spaghetti,,
108.0,2 years,A732772,Cat,Domestic Shorthair Mix,Black/White,2014-08-13,8/13/2016 16:44,2016-08-13T16:44:00,Partner,Transfer,Intact Female,30.50725261,-97.5041827,104.5281746,,,
109.0,3 weeks,A736742,Cat,Domestic Shorthair Mix,Black Tabby,2016-09-24,10/16/2016 17:45,2016-10-16T17:45:00,Partner,Transfer,Unknown,30.44043841,-97.71263698,3.248511905,,,
110.0,7 months,A735432,Cat,Domestic Shorthair,White/Brown Tabby,2016-03-23,11/11/2016 12:39,2016-11-11T12:39:00,,Adoption,Spayed Female,30.46077836,-97.68553695,33.3610119,*Ninfa,,
111.0,6 years,A729315,Dog,Chihuahua Shorthair Mix,Tricolor,2010-01-16,6/20/2016 0:00,2016-06-20T00:00:00,Partner,Transfer,Spayed Female,30.51642112,-97.72124964,335.2857143,Abby,,
112.0,1 year,A748631,Dog,Chihuahua Shorthair Mix,Black,2016-05-04,5/8/2017 17:01,2017-05-08T17:01:00,,Adoption,Spayed Female,30.68789573,-97.24791016,52.8155754,,,
113.0,3 years,A669295,Dog,Labrador Retriever Mix,Brown,2010-12-18,4/4/2014 18:37,2014-04-04T18:37:00,,Adoption,Neutered Male,30.74707663,-97.26533295,171.9679563,Niko,,
114.0,10 months,A704099,Dog,American Bulldog Mix,White/Brown,2014-08-01,6/11/2015 16:48,2015-06-11T16:48:00,,Adoption,Spayed Female,30.69532699,-97.71059371,44.95714286,*Sarah,,
115.0,5 months,A673387,Cat,Domestic Shorthair Mix,Brown Tabby/White,2013-09-23,3/2/2014 16:43,2014-03-02T16:43:00,,Adoption,Neutered Male,30.33977396,-97.49226594,22.95664683,Alex,,
116.0,2 years,A723147,Dog,Pit Bull Mix,Brown/Black,2014-03-27,4/6/2016 16:47,2016-04-06T16:47:00,,Return to Owner,Spayed Female,30.32836625,-97.34589456,105.9570437,Major,,
117.0,2 years,A718636,Dog,Pit Bull Mix,Brown Brindle/White,2014-01-03,4/1/2016 15:06,2016-04-01T15:06:00,,Adoption,Neutered Male,30.66066978,-97.67683189,117.089881,*Hans Knut,,
118.0,1 year,A685713,Other,Armadillo Mix,Gray,2013-08-11,8/12/2014 10:36,2014-08-12T10:36:00,Medical,Euthanasia,Unknown,30.52182784,-97.25263933,52.34880952,,,
119.0,2 months,A706329,Cat,Domestic Shorthair Mix,Brown Tabby,2015-06-05,8/30/2015 16:24,2015-08-30T16:24:00,Offsite,Adoption,Spayed Female,30.64848189,-97.69971671,12.38333333,*Flopsy,,
120.0,7 years,A743006,Dog,Dachshund Longhair Mix,Blue Tick,2010-02-02,2/2/2017 18:53,2017-02-02T18:53:00,,Return to Owner,Intact Male,30.38624168,-97.36200488,365.3981151,Elmer,,
121.0,5 months,A750619,Dog,Labrador Retriever Mix,Blue,2016-12-07,6/2/2017 18:26,2017-06-02T18:26:00,,Adoption,Spayed Female,30.31434761,-97.68780188,25.39543651,Carrie,,
122.0,6 years,A740541,Cat,Domestic Medium Hair Mix,Black/White,2010-12-19,12/19/2016 18:44,2016-12-19T18:44:00,,Return to Owner,Neutered Male,30.58501204,-97.49484296,313.2543651,Georgie Boy,,
123.0,1 year,A669638,Dog,Pit Bull Mix,Tan/White,2012-12-23,7/29/2014 12:58,2014-07-29T12:58:00,Partner,Transfer,Neutered Male,30.27938659,-97.3127575,83.36289683,Rufus,,
124.0,4 years,A549989,Cat,Domestic Shorthair Mix,Black/White,2009-05-09,10/12/2013 18:58,2013-10-12T18:58:00,,Adoption,Neutered Male,30.65917154,-97.65202046,231.1128968,Bert,,
125.0,1 year,A710766,Other,Bat Mix,Brown,2014-08-27,8/27/2015 14:23,2015-08-27T14:23:00,Rabies Risk,Euthanasia,Unknown,30.36045071,-97.72157978,52.22847222,,,
126.0,2 years,A691714,Dog,Chihuahua Shorthair Mix,Tricolor,2012-11-08,2/23/2015 13:25,2015-02-23T13:25:00,Partner,Transfer,Neutered Male,30.71708329,-97.55459904,119.6512897,Archer,,
127.0,6 years,A645075,Dog,Labrador Retriever Mix,Chocolate,2008-01-02,11/25/2014 10:40,2014-11-25T10:40:00,Aggressive,Euthanasia,Intact Male,30.29971277,-97.277658,359.9206349,Bear,,
128.0,2 years,A731542,Dog,Pit Bull Mix,Brown Brindle/White,2014-07-23,9/2/2016 17:49,2016-09-02T17:49:00,,Return to Owner,Neutered Male,30.54334757,-97.73988026,110.3917659,Roscoe,,
129.0,1 month,A745619,Dog,English Bulldog Mix,Black/White,2017-01-21,3/23/2017 16:08,2017-03-23T16:08:00,Partner,Transfer,Intact Female,30.73843869,-97.3251826,8.81031746,,,
130.0,2 years,A705676,Dog,Chihuahua Shorthair Mix,White/Tan,2013-06-20,7/4/2015 13:31,2015-07-04T13:31:00,,Adoption,Spayed Female,30.62075983,-97.30352288,106.3661706,*Lacey,,
131.0,1 year,A692656,Dog,Labrador Retriever Mix,Yellow,2013-11-24,12/4/2014 17:26,2014-12-04T17:26:00,Partner,Transfer,Neutered Male,30.70002536,-97.45803038,53.67519841,Gordo,,
132.0,2 years,A684391,Dog,Jack Russell Terrier Mix,White/Black,2012-07-22,8/22/2014 18:25,2014-08-22T18:25:00,,Adoption,Neutered Male,30.70276111,-97.26885632,108.8239087,,,
133.0,2 years,A753658,Dog,Beagle Mix,Red,2015-07-09,7/11/2017 11:49,2017-07-11T11:49:00,Partner,Transfer,Intact Female,30.56228725,-97.58571392,104.784623,,,
134.0,3 years,A731736,Dog,Pit Bull Mix,White,2013-07-26,3/2/2017 13:06,2017-03-02T13:06:00,Partner,Transfer,Spayed Female,30.28601105,-97.39748006,187.935119,Novah,,
135.0,2 months,A688274,Dog,Chihuahua Shorthair Mix,Sable/White,2014-07-17,9/20/2014 15:33,2014-09-20T15:33:00,Offsite,Adoption,Spayed Female,30.50137197,-97.52907822,9.37827381,,,
136.0,2 years,A750398,Dog,Chihuahua Shorthair Mix,White/Tan,2015-05-26,5/30/2017 18:04,2017-05-30T18:04:00,,Adoption,Neutered Male,30.73005867,-97.42570446,105.1075397,,,
137.0,2 years,A765203,Other,Fox Mix,Brown,2016-01-15,1/17/2018 8:35,2018-01-17T08:35:00,,Euthanasia,Unknown,30.70631818,-97.63959111,104.765377,,,
138.0,4 months,A721005,Dog,Labrador Retriever Mix,Black,2015-10-19,2/23/2016 17:00,2016-02-23T17:00:00,,Adoption,Spayed Female,30.27628227,-97.54219909,18.24404762,,,
139.0,6 months,A690312,Cat,Domestic Shorthair Mix,Blue Tabby,2014-04-18,10/20/2014 9:00,2014-10-20T09:00:00,SCRP,Transfer,Intact Female,30.52814344,-97.60996465,26.48214286,,,
140.0,3 years,A759566,Dog,Chihuahua Shorthair/Rat Terrier,Cream,2014-04-03,10/21/2017 11:35,2017-10-21T11:35:00,,Adoption,Neutered Male,30.54029858,-97.46834848,185.3546627,Hiro,,
141.0,10 months,A693176,Dog,Beagle Mix,Tan/White,2014-02-03,12/7/2014 17:06,2014-12-07T17:06:00,,Adoption,Spayed Female,30.59818808,-97.35274981,43.95892857,Dakota,,
142.0,13 years,A634994,Cat,Domestic Shorthair Mix,Brown Tabby/White,2004-04-30,4/30/2017 15:50,2017-04-30T15:50:00,,Return to Owner,Spayed Female,30.6803902,-97.24908104,678.3799603,Jolie,,
143.0,8 years,A710709,Dog,Australian Kelpie Mix,Black/Tan,2007-08-26,9/13/2015 16:02,2015-09-13T16:02:00,,Adoption,Spayed Female,30.32102391,-97.26504888,420.0954365,*Gwen,,
144.0,7 years,A726589,Cat,Domestic Shorthair Mix,Black/White,2009-05-19,11/12/2016 14:56,2016-11-12T14:56:00,Foster,Adoption,Neutered Male,30.3459586,-97.26629977,390.6603175,Kramer,,
145.0,2 months,A726388,Cat,Domestic Longhair Mix,Blue Tabby/White,2016-04-10,6/28/2016 16:50,2016-06-28T16:50:00,,Adoption,Spayed Female,30.36481523,-97.3592239,11.3859127,*Cobalt,,
146.0,3 months,A682162,Cat,Domestic Shorthair Mix,Calico,2014-03-25,7/13/2014 11:25,2014-07-13T11:25:00,Foster,Adoption,Spayed Female,30.51352275,-97.2540721,15.78224206,Khalesi,,
147.0,2 years,A663015,Dog,Miniature Pinscher Mix,Black/Tan,2011-09-11,7/15/2014 17:10,2014-07-15T17:10:00,,Adoption,Neutered Male,30.37585681,-97.30292432,148.3878968,Bugs,,
148.0,1 year,A691834,Dog,Miniature Schnauzer/Jack Russell Terrier,Brown/Black,2013-11-10,1/20/2015 18:53,2015-01-20T18:53:00,,Return to Owner,Spayed Female,30.62604312,-97.71655576,62.39811508,Fifi,,
149.0,12 years,A716224,Dog,Australian Shepherd Mix,Brown/Red Tick,2003-11-17,11/17/2015 16:45,2015-11-17T16:45:00,,Return to Owner,Neutered Male,30.7187957,-97.59758949,626.2425595,Skylos,,
150.0,8 years,A697686,Cat,Domestic Longhair Mix,Black/White,2007-02-26,8/12/2015 12:02,2015-08-12T12:02:00,Suffering,Euthanasia,Spayed Female,30.33585544,-97.52633892,441.3573413,*Remy,,
151.0,2 months,A749815,Cat,Domestic Medium Hair Mix,Black,2017-04-20,7/6/2017 16:01,2017-07-06T16:01:00,Foster,Adoption,Spayed Female,30.45894011,-97.3632575,11.0953373,,,
152.0,2 years,A716434,Dog,Blue Lacy,Brown/White,2013-11-19,11/27/2015 18:58,2015-11-27T18:58:00,,Adoption,Spayed Female,30.44966548,-97.72840732,105.5414683,*Bonnie,,
153.0,3 months,A749370,Cat,Domestic Medium Hair Mix,Tortie,2017-02-11,5/18/2017 17:37,2017-05-18T17:37:00,,Adoption,Spayed Female,30.27288419,-97.54763633,13.81914683,,,
154.0,3 years,A665831,Dog,Labrador Retriever/Pit Bull,Red,2013-03-23,11/18/2016 19:13,2016-11-18T19:13:00,,Return to Owner,Neutered Male,30.60684677,-97.73914785,190.9715278,Smokey,,
155.0,4 months,A751678,Dog,Chihuahua Shorthair Mix,Cream,2017-02-11,6/22/2017 18:45,2017-06-22T18:45:00,,Adoption,Spayed Female,30.73370713,-97.24483533,18.82589286,Canela,,
156.0,1 weeks,A687008,Cat,Domestic Shorthair Mix,Black/White,2014-08-20,8/30/2014 12:58,2014-08-30T12:58:00,Partner,Transfer,Intact Male,30.71226628,-97.61046441,1.505753968,,,
157.0,2 weeks,A677571,Cat,Domestic Medium Hair Mix,Blue Tabby/White,2014-04-06,4/26/2014 15:25,2014-04-26T15:25:00,Partner,Transfer,Intact Male,30.61467282,-97.59343759,2.94890873,,,
158.0,7 months,A662943,Cat,Domestic Shorthair Mix,Black,2013-03-10,10/13/2013 18:25,2013-10-13T18:25:00,,Adoption,Neutered Male,30.33746674,-97.33105616,31.10962302,*Harry,,
159.0,4 years,A703522,Dog,Miniature Schnauzer Mix,White,2010-12-25,6/8/2015 17:03,2015-06-08T17:03:00,,Adoption,Spayed Female,30.43781327,-97.73869907,232.3872024,Bella,,
160.0,1 year,A703739,Other,Rex Mix,Brown/White,2014-05-28,6/3/2015 9:37,2015-06-03T09:37:00,In Kennel,Died,Unknown,30.65261266,-97.61244559,53.05724206,,,
161.0,2 years,A696155,Dog,Pit Bull Mix,Red,2013-01-30,12/5/2015 12:30,2015-12-05T12:30:00,,Return to Owner,Neutered Male,30.4738122,-97.72393135,148.5029762,Brurdaoex,,
162.0,2 months,A675365,Dog,Labrador Retriever Mix,Cream,2013-12-30,3/30/2014 18:16,2014-03-30T18:16:00,,Adoption,Spayed Female,30.74723691,-97.55756004,12.96587302,,,
163.0,11 months,A659830,Dog,Labrador Retriever/Doberman Pinsch,Black,2013-07-23,6/25/2014 13:29,2014-06-25T13:29:00,Foster,Adoption,Neutered Male,30.537151,-97.39774578,48.22311508,*Harry,,
164.0,1 weeks,A680705,Cat,Domestic Shorthair Mix,Black/White,2014-05-28,6/6/2014 14:39,2014-06-06T14:39:00,Partner,Transfer,Intact Male,30.31091243,-97.34131021,1.372916667,,,
165.0,3 years,A749468,Cat,Domestic Shorthair Mix,Orange Tabby,2014-05-15,5/26/2017 18:56,2017-05-26T18:56:00,Snr,Transfer,Neutered Male,30.6481838,-97.29247126,158.2555556,,,
166.0,2 years,A742094,Other,Bat Mix,Brown,2015-01-14,1/15/2017 8:57,2017-01-15T08:57:00,Rabies Risk,Euthanasia,Unknown,30.76216703,-97.34025935,104.6247024,,,
167.0,3 years,A715876,Dog,German Shepherd Mix,Black/Tan,2012-11-11,11/25/2015 11:49,2015-11-25T11:49:00,,Adoption,Spayed Female,30.46232364,-97.49213469,158.4989087,Precious,,
168.0,1 year,A709833,Cat,Domestic Shorthair Mix,Blue/White,2014-08-13,8/14/2015 9:00,2015-08-14T09:00:00,SCRP,Transfer,Unknown,30.27863656,-97.37947218,52.33928571,,,
169.0,2 months,A706256,Dog,German Shepherd Mix,Tan,2015-04-30,7/2/2015 17:40,2015-07-02T17:40:00,,Adoption,Neutered Male,30.28475734,-97.32908816,9.10515873,*Groot,,
170.0,4 months,A732728,Cat,Domestic Shorthair Mix,Black,2016-04-12,8/13/2016 16:42,2016-08-13T16:42:00,Partner,Transfer,Intact Male,30.39929667,-97.28174277,17.67083333,,,
171.0,5 months,A711243,Cat,Domestic Shorthair Mix,Cream Tabby,2015-04-04,9/5/2015 9:00,2015-09-05T09:00:00,SCRP,Transfer,Intact Male,30.53490013,-97.27882834,22.05357143,,,
172.0,1 month,A692638,Dog,Australian Cattle Dog Mix,Blue Merle,2014-10-13,12/8/2014 18:30,2014-12-08T18:30:00,Foster,Adoption,Spayed Female,30.67333994,-97.62242819,8.110119048,,,
173.0,1 year,A684424,Cat,Domestic Shorthair Mix,Black,2013-07-23,7/26/2014 11:43,2014-07-26T11:43:00,Partner,Transfer,Intact Female,30.28629453,-97.36099559,52.64117063,Midnight,,
174.0,2 months,A680005,Dog,Australian Kelpie Mix,Tan/Black,2014-03-29,6/1/2014 18:16,2014-06-01T18:16:00,,Adoption,Neutered Male,30.33304315,-97.39934116,9.251587302,,,
175.0,2 years,A622351,Dog,Chihuahua Shorthair Mix,Brown,2011-08-19,2/24/2014 11:17,2014-02-24T11:17:00,Partner,Transfer,Intact Male,30.28053463,-97.72932469,131.4957341,Alvin,,
176.0,7 years,A565498,Dog,Rottweiler/Labrador Retriever,Black/Tan,2007-01-25,2/5/2014 15:49,2014-02-05T15:49:00,,Return to Owner,Neutered Male,30.33252145,-97.34082276,366.9512897,Dukey,,
177.0,1 year,A673261,Dog,German Shepherd/Doberman Pinsch,Black/Tan,2013-02-21,4/27/2014 16:02,2014-04-27T16:02:00,,Adoption,Neutered Male,30.44358528,-97.24672573,61.52400794,Danny,,
178.0,1 month,A752260,Other,Raccoon Mix,Gray/Black,2017-04-20,6/20/2017 14:06,2017-06-20T14:06:00,Medical,Euthanasia,Unknown,30.52088368,-97.38291113,8.798214286,,,
179.0,2 months,A694422,Cat,Domestic Shorthair Mix,Calico,2014-11-15,1/24/2015 11:39,2015-01-24T11:39:00,Partner,Transfer,Spayed Female,30.39964529,-97.67599041,10.06934524,*Calla,,
180.0,5 years,A661631,Dog,Yorkshire Terrier/Yorkshire Terrier,Brown,2011-08-22,3/4/2017 18:14,2017-03-04T18:14:00,,Adoption,Neutered Male,30.52787152,-97.52451282,288.8228175,Peke,,
181.0,2 months,A702839,Cat,Domestic Shorthair Mix,Tortie,2015-04-18,7/18/2015 16:47,2015-07-18T16:47:00,Foster,Adoption,Spayed Female,30.40128963,-97.26853051,13.09990079,*Tort,,
182.0,1 year,A755069,Other,Bat,Brown,2016-07-28,7/31/2017 9:48,2017-07-31T09:48:00,Rabies Risk,Euthanasia,Unknown,30.35055168,-97.62907391,52.6297619,,,
183.0,2 years,A743493,Dog,Great Dane Mix,Black,2014-06-02,2/11/2017 15:18,2017-02-11T15:18:00,,Return to Owner,Neutered Male,30.28973518,-97.30774743,140.8053571,King,,
184.0,1 month,A751734,Cat,Domestic Shorthair Mix,Blue,2017-05-05,6/18/2017 17:24,2017-06-18T17:24:00,Partner,Transfer,Intact Female,30.64536484,-97.47681018,6.389285714,*Hannah,,
185.0,2 years,A716081,Dog,Pomeranian Mix,Buff,2013-11-13,12/2/2015 0:00,2015-12-02T00:00:00,Partner,Transfer,Intact Male,30.52456379,-97.40271571,107,Baby Bear,,
186.0,2 years,A686576,Dog,Labrador Retriever Mix,Buff,2012-08-23,8/27/2014 16:04,2014-08-27T16:04:00,Partner,Transfer,Spayed Female,30.61499082,-97.44035894,104.9527778,,,
187.0,1 year,A705201,Dog,Cardigan Welsh Corgi Mix,White,2014-06-14,6/28/2015 17:51,2015-06-28T17:51:00,,Adoption,Spayed Female,30.59353476,-97.60560951,54.24910714,Daisy,,
188.0,3 years,A733000,Other,Bat,Brown,2013-08-16,8/16/2016 9:03,2016-08-16T09:03:00,Rabies Risk,Euthanasia,Unknown,30.65727471,-97.49923897,156.6252976,,,
189.0,1 year,A719360,Dog,Labrador Retriever Mix,Black/White,2015-11-18,7/16/2017 23:09,2017-07-16T23:09:00,,Adoption,Neutered Male,30.31503893,-97.6910306,86.70922619,Champ,,
190.0,7 years,A726037,Dog,Chinese Sharpei Mix,Brown Brindle,2009-05-05,5/5/2016 13:37,2016-05-05T13:37:00,,Return to Owner,Spayed Female,30.70041254,-97.25586156,365.3667659,Rocca,,
191.0,8 months,A736057,Cat,Domestic Shorthair Mix,Blue Tabby,2016-03-03,11/26/2016 14:27,2016-11-26T14:27:00,Partner,Transfer,Neutered Male,30.32222733,-97.57932021,38.37172619,Devin,,
192.0,3 years,A684915,Dog,Maltese Mix,White,2011-07-30,8/6/2014 18:50,2014-08-06T18:50:00,,Adoption,Neutered Male,30.43146859,-97.41990509,157.6835317,*Yogi,,
193.0,2 months,A728227,Dog,Pit Bull Mix,Brown,2016-04-01,6/6/2016 15:04,2016-06-06T15:04:00,,Adoption,Spayed Female,30.72935849,-97.64203111,9.518253968,,,
194.0,1 year,A686233,Cat,Domestic Shorthair Mix,Blue Tabby/White,2013-02-18,10/14/2014 14:52,2014-10-14T14:52:00,Partner,Transfer,Neutered Male,30.61534186,-97.67269395,86.23134921,Marvin,,
195.0,1 year,A763060,Dog,Pit Bull Mix,White,2016-12-02,1/9/2018 17:46,2018-01-09T17:46:00,Foster,Adoption,Spayed Female,30.32705511,-97.6846677,57.67718254,*Cambria,,
196.0,1 year,A750139,Cat,Domestic Shorthair Mix,Black,2015-11-23,6/9/2017 12:52,2017-06-09T12:52:00,Partner,Transfer,Neutered Male,30.52836194,-97.54050738,80.64801587,,,
197.0,2 years,A758439,Dog,Staffordshire Mix,Fawn,2015-09-16,11/16/2017 11:10,2017-11-16T11:10:00,,Adoption,Spayed Female,30.50737861,-97.44443933,113.2093254,Bae,,
198.0,8 years,A758897,Dog,Miniature Pinscher Mix,Black,2009-09-23,9/24/2017 14:50,2017-09-24T14:50:00,Partner,Transfer,Intact Female,30.42744025,-97.6948322,417.6597222,Dumpling,,
199.0,2 years,A675506,Cat,Domestic Shorthair Mix,Black,2012-03-28,4/1/2014 13:21,2014-04-01T13:21:00,,Return to Owner,Neutered Male,30.55214211,-97.52728008,104.9366071,Justice,,
200.0,5 years,A765802,Cat,Domestic Longhair Mix,Black/White,2013-01-27,1/31/2018 18:05,2018-01-31T18:05:00,Snr,Transfer,Neutered Male,30.73704834,-97.59023938,261.5362103,,,
201.0,6 years,A548770,Cat,Domestic Shorthair Mix,Orange Tabby/White,2007-07-05,11/5/2013 15:19,2013-11-05T15:19:00,Rabies Risk,Euthanasia,Neutered Male,30.36032346,-97.38523969,330.8054563,Firecat,,
202.0,1 year,A739227,Cat,Domestic Shorthair Mix,Gray/White,2015-11-29,11/30/2016 9:00,2016-11-30T09:00:00,SCRP,Transfer,Intact Female,30.57220289,-97.59333187,52.48214286,,,
203.0,5 years,A670612,Dog,Beagle,Brown/White,2011-09-04,11/18/2016 14:08,2016-11-18T14:08:00,,Return to Owner,Intact Female,30.269928,-97.71110784,271.7984127,Sheila,,
204.0,3 years,A675567,Dog,Siberian Husky Mix,Black/White,2010-11-24,3/30/2014 8:56,2014-03-30T08:56:00,,Return to Owner,Spayed Female,30.53735617,-97.50347425,174.6246032,Lola,,
205.0,2 months,A707763,Cat,Domestic Shorthair Mix,Cream Tabby,2015-04-26,7/19/2015 13:48,2015-07-19T13:48:00,Foster,Adoption,Spayed Female,30.31920515,-97.61177001,12.08214286,Tinkerbell,,
206.0,1 year,A733433,Other,Bat,Black/Brown,2015-08-21,8/21/2016 16:42,2016-08-21T16:42:00,Rabies Risk,Euthanasia,Unknown,30.27045784,-97.65667539,52.38511905,,,
207.0,4 weeks,A679691,Other,Bat,Brown/Black,2014-04-24,5/25/2014 9:38,2014-05-25T09:38:00,In Kennel,Died,Unknown,30.36881794,-97.65976702,4.485912698,,,
208.0,1 year,A762373,Dog,Pit Bull Mix,Brown Brindle/Black,2016-11-19,11/19/2017 14:29,2017-11-19T14:29:00,,Return to Owner,Intact Female,30.36235403,-97.25965426,52.22906746,Tiny,,
209.0,5 years,A718671,Cat,Domestic Shorthair Mix,Blue Tabby,2011-01-04,1/11/2016 18:49,2016-01-11T18:49:00,,Adoption,Neutered Male,30.4085971,-97.26382992,261.9691468,Boris,,
210.0,3 years,A707346,Dog,Chihuahua Shorthair Mix,Chocolate/White,2012-07-11,7/15/2015 12:12,2015-07-15T12:12:00,,Adoption,Spayed Female,30.30499726,-97.3410131,157.072619,*Elsie,,
211.0,1 year,A713751,Cat,Domestic Medium Hair Mix,Brown Tabby,2014-10-12,10/21/2015 13:37,2015-10-21T13:37:00,Partner,Transfer,Neutered Male,30.49858975,-97.72092239,53.50962302,Big Boy,,
212.0,2 years,A761025,Dog,Catahoula Mix,Tan/Black,2015-10-27,1/14/2018 17:15,2018-01-14T17:15:00,,Adoption,Neutered Male,30.66618673,-97.62632748,115.8169643,*Glacier,,
213.0,1 year,A670923,Dog,Pit Bull Mix,Brown Brindle,2012-03-22,2/6/2014 14:01,2014-02-06T14:01:00,Behavior,Euthanasia,Spayed Female,30.73863238,-97.66435679,98.08343254,Kayna,,
214.0,10 months,A669721,Cat,Domestic Shorthair Mix,Calico,2013-02-26,12/30/2013 16:30,2013-12-30T16:30:00,,Adoption,Spayed Female,30.44043887,-97.54281088,43.95535714,*Peach,,
215.0,4 days,A697914,Cat,Domestic Shorthair Mix,Black/White,2015-02-27,3/3/2015 17:08,2015-03-03T17:08:00,Partner,Transfer,Unknown,30.42335024,-97.66366488,0.673412698,,,
216.0,1 year,A694785,Dog,German Shepherd Mix,Tan,2014-01-11,2/11/2015 12:32,2015-02-11T12:32:00,Partner,Transfer,Neutered Male,30.28138213,-97.2744914,56.64603175,Zazu,,
217.0,3 years,A759872,Cat,Domestic Shorthair Mix,White/Brown Tabby,2014-10-08,10/13/2017 19:09,2017-10-13T19:09:00,Snr,Transfer,Spayed Female,30.3997136,-97.54256116,157.3997024,,,
218.0,2 months,A687188,Dog,Pit Bull Mix,White,2014-06-17,9/6/2014 18:10,2014-09-06T18:10:00,,Adoption,Spayed Female,30.53753481,-97.59482018,11.67956349,*Miss Sally,,
219.0,3 months,A751403,Cat,Domestic Shorthair Mix,Blue Tabby,2017-03-07,7/1/2017 17:16,2017-07-01T17:16:00,,Adoption,Spayed Female,30.30693765,-97.71769557,16.67420635,*Genevieve,,
220.0,2 months,A752614,Cat,Domestic Shorthair Mix,Orange Tabby/White,2017-05-09,8/7/2017 18:14,2017-08-07T18:14:00,,Adoption,Neutered Male,30.45569098,-97.25727152,12.9656746,*Matt,,
221.0,2 years,A706341,Dog,Chihuahua Shorthair Mix,Black/White,2013-06-27,7/8/2015 15:14,2015-07-08T15:14:00,Partner,Transfer,Intact Female,30.62645852,-97.54006587,105.9478175,*Meg,,
222.0,2 years,A741975,Dog,Dachshund Mix,Brown/White,2015-01-12,1/13/2017 14:08,2017-01-13T14:08:00,,Return to Owner,Neutered Male,30.47487031,-97.28914783,104.6555556,Major,,
223.0,2 years,A667041,Dog,Carolina Dog Mix,White/Black,2011-11-11,2/3/2014 12:45,2014-02-03T12:45:00,,Adoption,Spayed Female,30.44616661,-97.47497993,116.5044643,Ethyl,,
224.0,2 years,A664931,Dog,Rat Terrier Mix,White/Brown,2012-10-11,12/4/2014 15:43,2014-12-04T15:43:00,,Return to Owner,Neutered Male,30.67528029,-97.55918827,112.0935516,Chester,,
225.0,2 years,A760262,Dog,Chihuahua Shorthair Mix,Black/Brown,2015-10-15,10/20/2017 10:04,2017-10-20T10:04:00,Partner,Transfer,Spayed Female,30.57680811,-97.54059793,105.2027778,*Betty,,
226.0,1 month,A682578,Dog,Miniature Poodle Mix,Black/White,2014-06-16,7/23/2014 16:02,2014-07-23T16:02:00,Partner,Transfer,Intact Female,30.35922992,-97.32395515,5.381150794,,,
227.0,2 months,A694291,Cat,Domestic Shorthair Mix,Orange Tabby,2014-10-24,1/9/2015 13:27,2015-01-09T13:27:00,Partner,Transfer,Intact Male,30.71572076,-97.31447301,11.08005952,*Larry,,
228.0,4 days,A686621,Cat,Domestic Shorthair Mix,Black/White,2014-08-20,8/24/2014 15:42,2014-08-24T15:42:00,Partner,Transfer,Intact Female,30.482402,-97.24619396,0.664880952,,,
229.0,1 year,A669415,Dog,Chihuahua Shorthair Mix,Brown/White,2012-06-20,12/29/2013 13:39,2013-12-29T13:39:00,,Adoption,Neutered Male,30.64852616,-97.69994254,79.65267857,,,
230.0,1 year,A720018,Dog,Pit Bull Mix,Brown Brindle/White,2015-02-01,2/16/2016 17:10,2016-02-16T17:10:00,,Adoption,Intact Female,30.7561854,-97.45821165,54.38789683,Ripley,,
231.0,3 weeks,A702969,Cat,Domestic Shorthair Mix,Black/White,2015-04-27,5/22/2015 14:19,2015-05-22T14:19:00,Partner,Transfer,Intact Female,30.43026234,-97.71861007,3.656646825,*Briana,,
232.0,1 month,A747673,Cat,Domestic Shorthair Mix,Brown Tabby,2017-03-20,4/25/2017 15:38,2017-04-25T15:38:00,Partner,Transfer,Intact Male,30.5196423,-97.30401013,5.235912698,*Benny,,
233.0,9 months,A700847,Dog,German Shepherd Mix,Brown/Black,2014-07-20,4/25/2015 16:29,2015-04-25T16:29:00,Partner,Transfer,Intact Female,30.42391147,-97.4399382,39.95525794,,,
234.0,2 years,A734683,Dog,Golden Retriever,Red,2014-09-11,9/15/2016 11:24,2016-09-15T11:24:00,Partner,Transfer,Spayed Female,30.48611496,-97.26911619,105.0678571,Sapphire,,
235.0,2 months,A669543,Dog,Labrador Retriever/German Shepherd,Chocolate,2013-10-22,12/24/2013 15:41,2013-12-24T15:41:00,,Adoption,Neutered Male,30.57207233,-97.59607345,9.093353175,Harley,,
236.0,2 months,A693174,Cat,Domestic Shorthair Mix,Torbie/White,2014-09-18,12/13/2014 17:28,2014-12-13T17:28:00,,Adoption,Intact Female,30.30521851,-97.63288134,12.38968254,*Sally,,
237.0,2 months,A726753,Cat,Domestic Shorthair Mix,Brown Tabby,2016-03-14,5/28/2016 15:43,2016-05-28T15:43:00,Partner,Transfer,Neutered Male,30.62759528,-97.54437515,10.8078373,*Bobby,,
238.0,6 months,A749267,Dog,Whippet/Plott Hound,Brown Brindle,2016-11-12,5/19/2017 15:34,2017-05-19T15:34:00,Partner,Transfer,Spayed Female,30.28399125,-97.488195,26.94980159,*Kewi,,
239.0,6 years,A739522,Dog,Pekingese Mix,Cream/White,2010-08-14,12/14/2016 18:02,2016-12-14T18:02:00,,Return to Owner,Neutered Male,30.45747484,-97.70847253,330.6787698,Pudgie,,
240.0,2 years,A738335,Cat,Domestic Shorthair Mix,Brown Tabby,2014-11-13,12/9/2016 15:59,2016-12-09T15:59:00,Partner,Transfer,Neutered Male,30.3297663,-97.35046539,108.237996,Newman,,
241.0,1 year,A744242,Dog,Miniature Schnauzer Mix,White,2016-02-25,3/8/2017 12:36,2017-03-08T12:36:00,,Return to Owner,Intact Male,30.31817813,-97.28184102,53.93214286,Jack,,
242.0,1 year,A690158,Cat,Domestic Shorthair Mix,Blue,2013-10-15,10/20/2014 9:00,2014-10-20T09:00:00,SCRP,Transfer,Intact Male,30.42936457,-97.27572499,52.91071429,,,
243.0,8 months,A756917,Dog,Labrador Retriever Mix,Black/White,2016-12-27,9/7/2017 14:37,2017-09-07T14:37:00,,Adoption,Spayed Female,30.45787113,-97.38934098,36.37271825,Kellsie,,
244.0,2 years,A707614,Dog,Pit Bull Mix,Black/White,2013-07-15,7/24/2015 17:34,2015-07-24T17:34:00,,Return to Owner,Neutered Male,30.63312479,-97.54884758,105.6759921,Cayenne,,
245.0,2 years,A736385,Dog,Brittany Mix,Tan/White,2014-10-09,10/10/2016 12:52,2016-10-10T12:52:00,,Return to Owner,Spayed Female,30.62748951,-97.48956012,104.6480159,Beretta,,
246.0,2 months,A734600,Cat,Domestic Shorthair Mix,Brown Tabby,2016-08-24,11/11/2016 18:45,2016-11-11T18:45:00,,Adoption,Neutered Male,30.63881629,-97.29372611,11.39732143,*Denny,,
247.0,2 years,A744959,Dog,Chihuahua Shorthair Mix,Tan,2015-03-10,4/3/2017 16:01,2017-04-03T16:01:00,Partner,Transfer,Neutered Male,30.59797959,-97.49705293,107.9524802,*George,,
248.0,1 year,A760012,Cat,Domestic Shorthair Mix,Calico,2016-10-11,10/16/2017 12:45,2017-10-16T12:45:00,Snr,Transfer,Intact Female,30.71355426,-97.29844529,52.93303571,,,
249.0,7 years,A666693,Dog,American Bulldog,White/Brown Brindle,2006-11-06,2/17/2014 12:38,2014-02-17T12:38:00,,Adoption,Spayed Female,30.57789901,-97.41832976,380.0751984,Daisy,,
250.0,14 years,A748160,Dog,Labrador Retriever Mix,Black/White,2003-05-02,5/2/2017 14:52,2017-05-02T14:52:00,,Return to Owner,Spayed Female,30.48710107,-97.60891707,730.6599206,Applez,,
251.0,4 months,A664583,Cat,Domestic Medium Hair Mix,Black/White,2013-06-05,10/7/2013 16:01,2013-10-07T16:01:00,SCRP,Transfer,Unknown,30.37032522,-97.37709849,17.80962302,,,
252.0,2 years,A742114,Cat,Domestic Shorthair Mix,Brown Tabby,2015-01-15,7/1/2017 11:44,2017-07-01T11:44:00,,Adoption,Neutered Male,30.56636584,-97.72321903,128.3555556,Jones,,
253.0,3 months,A733428,Cat,Domestic Medium Hair Mix,Blue Tabby,2016-05-30,9/17/2016 14:10,2016-09-17T14:10:00,,Adoption,Neutered Male,30.64270548,-97.53963927,15.79861111,*Hamilton,,
254.0,1 year,A736336,Dog,Siberian Husky Mix,White/Black,2015-10-09,10/9/2016 15:29,2016-10-09T15:29:00,,Return to Owner,Intact Female,30.41347943,-97.67194477,52.37787698,Sasha,,
255.0,1 year,A737044,Dog,Siberian Husky Mix,Sable/White,2015-10-21,10/26/2016 0:00,2016-10-26T00:00:00,Partner,Transfer,Spayed Female,30.53019475,-97.47912226,53,,,
256.0,3 years,A717863,Dog,German Shepherd Mix,Brown,2012-12-16,12/20/2015 0:00,2015-12-20T00:00:00,Partner,Transfer,Intact Male,30.59827441,-97.70125789,157,*Lucky,,
257.0,2 years,A699381,Other,Bat Mix,Brown,2013-03-26,3/27/2015 8:07,2015-03-27T08:07:00,Rabies Risk,Euthanasia,Unknown,30.34354659,-97.43922233,104.4768849,,,
258.0,1 month,A676320,Dog,Australian Cattle Dog Mix,Tricolor,2014-03-21,5/21/2014 17:10,2014-05-21T17:10:00,Foster,Adoption,Neutered Male,30.75601877,-97.28668171,8.816468254,Tucker,,
259.0,7 years,A750405,Dog,Labrador Retriever Mix,Chocolate,2010-05-31,6/24/2017 13:29,2017-06-24T13:29:00,Offsite,Adoption,Neutered Male,30.34244812,-97.45019709,368.7945437,*Lincoln,,
260.0,1 year,A738800,Dog,Scottish Terrier,Black/Black,2015-11-21,11/22/2016 16:19,2016-11-22T16:19:00,,Return to Owner,Neutered Male,30.70485705,-97.36059859,52.52569444,Walter,,
261.0,3 weeks,A711058,Cat,Domestic Shorthair Mix,Brown Tabby/White,2015-08-10,9/1/2015 14:05,2015-09-01T14:05:00,Partner,Transfer,Unknown,30.39802759,-97.57146108,3.226686508,,,
262.0,1 year,A673269,Cat,Domestic Shorthair Mix,Black,2013-02-21,3/15/2014 18:24,2014-03-15T18:24:00,,Adoption,Neutered Male,30.57894099,-97.7159025,55.3952381,*Curtis,,
263.0,6 years,A727193,Dog,Rhod Ridgeback Mix,Brown/Black,2010-05-19,5/19/2016 17:16,2016-05-19T17:16:00,,Return to Owner,Spayed Female,30.3272849,-97.40393646,313.2456349,Gigi,,
264.0,14 years,A381173,Dog,Labrador Retriever Mix,Brown/White,2000-08-06,8/6/2014 17:12,2014-08-06T17:12:00,,Return to Owner,Spayed Female,30.73002362,-97.41468912,730.5309524,Pepper,,
265.0,1 year,A669794,Dog,Rottweiler Mix,Black/Tan,2012-12-27,12/27/2013 15:46,2013-12-27T15:46:00,,Return to Owner,Spayed Female,30.39880741,-97.68168599,52.23670635,Nikita,,
266.0,9 years,A433746,Dog,Australian Shepherd Mix,White/Brown,2006-04-09,11/4/2015 0:00,2015-11-04T00:00:00,Partner,Transfer,Spayed Female,30.70514106,-97.68831966,499.4285714,Evette,,
267.0,3 years,A734651,Dog,Catahoula Mix,White/Black,2013-09-10,9/17/2016 15:25,2016-09-17T15:25:00,,Adoption,Spayed Female,30.74464231,-97.2666277,157.6631944,*Sheba,,
268.0,2 years,A719006,Dog,Dachshund/Chihuahua Shorthair,Chocolate,2014-01-11,1/25/2016 17:44,2016-01-25T17:44:00,,Adoption,Neutered Male,30.73520206,-97.68745988,106.3912698,Pablo,,
269.0,5 years,A665629,Dog,Australian Cattle Dog/Chow Chow,Red Merle/White,2009-10-20,7/31/2015 14:29,2015-07-31T14:29:00,Partner,Transfer,Neutered Male,30.28781222,-97.62995379,301.5147817,Baby Boy,,
270.0,3 years,A688427,Dog,American Bulldog Mix,White,2011-09-19,10/4/2014 18:46,2014-10-04T18:46:00,Partner,Transfer,Neutered Male,30.35889068,-97.52291095,158.8259921,,,
271.0,2 years,A716150,Dog,Miniature Schnauzer Mix,Silver/Black,2013-11-15,11/20/2015 17:53,2015-11-20T17:53:00,,Adoption,Neutered Male,30.64319715,-97.28766459,105.1064484,*Pancho,,
272.0,3 years,A734180,Dog,Labrador Retriever Mix,Black/White,2013-09-02,10/15/2016 17:08,2016-10-15T17:08:00,,Adoption,Neutered Male,30.59284969,-97.34071516,162.8162698,Jax,,
273.0,1 year,A760464,Dog,French Bulldog,Fawn,2016-10-20,10/20/2017 12:14,2017-10-20T12:14:00,,Return to Owner,Neutered Male,30.5219079,-97.53911633,52.2156746,Klaus,,
274.0,2 months,A712421,Cat,Domestic Shorthair Mix,White/Blue Tabby,2015-08-15,11/11/2015 13:53,2015-11-11T13:53:00,Foster,Adoption,Neutered Male,30.43864718,-97.58484507,12.65406746,*Cameron,,
275.0,2 years,A676777,Dog,Dutch Shepherd Mix,Brown Brindle,2012-04-16,4/25/2014 11:14,2014-04-25T11:14:00,,Return to Owner,Spayed Female,30.40959309,-97.54957682,105.6382937,Remy,,
276.0,3 months,A732255,Dog,Great Pyrenees/Pointer,White/Black,2016-05-04,8/10/2016 18:02,2016-08-10T18:02:00,,Adoption,Neutered Male,30.57505268,-97.49627667,14.10734127,*Benjamin,,
277.0,4 years,A693283,Dog,Pit Bull Mix,Tan/White,2012-12-05,11/23/2017 16:07,2017-11-23T16:07:00,,Return to Owner,Neutered Male,30.28147008,-97.38396593,259.2387897,Maximus,,
278.0,4 weeks,A709285,Other,Bat,Red,2015-07-07,8/7/2015 8:38,2015-08-07T08:38:00,Rabies Risk,Euthanasia,Unknown,30.66551278,-97.41447724,4.479960317,,,
279.0,11 months,A724073,Cat,Domestic Shorthair Mix,Calico,2015-05-11,4/16/2016 12:59,2016-04-16T12:59:00,,Adoption,Spayed Female,30.36530247,-97.55233245,48.79156746,Lily,,
280.0,6 years,A674453,Dog,Wire Hair Fox Terrier Mix,White/Tan,2008-03-13,3/14/2014 11:00,2014-03-14T11:00:00,Partner,Transfer,Spayed Female,30.65716771,-97.34722536,313.2083333,Lana,,
281.0,2 months,A738016,Cat,Domestic Shorthair Mix,Brown Tabby/White,2016-08-24,11/20/2016 15:54,2016-11-20T15:54:00,,Adoption,Spayed Female,30.32701414,-97.61092494,12.66607143,*Friday,,
282.0,12 years,A686683,Dog,German Shepherd Mix,White,2002-08-25,8/25/2014 15:09,2014-08-25T15:09:00,Suffering,Euthanasia,Intact Male,30.46368417,-97.4177712,626.2330357,Ira,,
283.0,2 months,A760662,Cat,Domestic Shorthair Mix,Black,2017-10-08,12/12/2017 9:40,2017-12-12T09:40:00,Foster,Adoption,Neutered Male,30.45037121,-97.51546113,9.343253968,,,
284.0,4 years,A687604,Cat,Domestic Shorthair Mix,Black,2010-09-07,9/7/2014 14:45,2014-09-07T14:45:00,Suffering,Euthanasia,Intact Male,30.67378853,-97.31582528,208.8020833,,,
285.0,8 years,A739719,Dog,Labrador Retriever Mix,Chocolate,2008-12-06,1/2/2017 17:39,2017-01-02T17:39:00,Foster,Adoption,Neutered Male,30.32364885,-97.48768809,421.3907738,Chubs,,
286.0,1 year,A735601,Dog,Labrador Retriever Mix,Black,2015-09-26,2/16/2017 13:23,2017-02-16T13:23:00,,Return to Owner,Spayed Female,30.53097641,-97.4744857,72.79394841,Olivia,,
287.0,1 year,A712665,Dog,Pit Bull Mix,Fawn/White,2014-09-26,11/17/2015 18:26,2015-11-17T18:26:00,,Return to Owner,Neutered Male,30.46471898,-97.69015351,59.68115079,*Jack Nick,,
288.0,3 years,A705339,Dog,Pit Bull Mix,Brown Brindle,2012-06-16,6/17/2015 11:06,2015-06-17T11:06:00,,Return to Owner,Spayed Female,30.38388215,-97.68677216,156.6375,Queenie,,
289.0,9 months,A669177,Dog,Labrador Retriever/Staffordshire,Black/White,2013-03-16,12/24/2013 14:43,2013-12-24T14:43:00,,Adoption,Intact Female,30.33450302,-97.64054046,40.51617063,Ally,,
290.0,1 year,A675047,Dog,Labrador Retriever Mix,Black/White,2013-03-22,3/30/2014 18:37,2014-03-30T18:37:00,,Adoption,Neutered Male,30.38175792,-97.45185427,53.39652778,Reggie,,
291.0,2 months,A681978,Cat,Domestic Shorthair Mix,Blue Tabby/White,2014-04-07,6/26/2014 17:15,2014-06-26T17:15:00,Partner,Transfer,Intact Female,30.54756296,-97.3398629,11.53125,,,
292.0,2 years,A642946,Cat,Domestic Shorthair Mix,Brown Tabby/White,2012-07-17,12/7/2014 13:31,2014-12-07T13:31:00,,Adoption,Spayed Female,30.56926315,-97.39612953,124.7947421,Zooey,,
293.0,3 years,A743073,Dog,Labrador Retriever/Australian Cattle Dog,White/Brown,2014-02-03,2/10/2017 13:32,2017-02-10T13:32:00,,Adoption,Spayed Female,30.69190354,-97.56635977,157.6519841,*Mika,,
294.0,5 years,A720472,Dog,Redbone Hound Mix,Red/Black,2011-02-10,2/10/2016 11:46,2016-02-10T11:46:00,,Return to Owner,Spayed Female,30.42922054,-97.56709988,260.9271825,Ladybird,,
295.0,2 years,A680319,Cat,Domestic Shorthair Mix,Brown Tabby/White,2012-06-01,6/1/2014 8:00,2014-06-01T08:00:00,SCRP,Transfer,Intact Male,30.57644842,-97.68256957,104.3333333,,,
296.0,4 years,A641779,Dog,Pit Bull Mix,White/Black,2011-11-13,7/26/2016 12:58,2016-07-26T12:58:00,,Return to Owner,Spayed Female,30.68513776,-97.41724023,245.3628968,Tonii Yayo,,
297.0,2 months,A710129,Cat,Domestic Shorthair Mix,Orange Tabby,2015-06-18,9/6/2015 12:31,2015-09-06T12:31:00,Partner,Transfer,Intact Female,30.57279027,-97.62591273,11.5030754,*Safiya,,
298.0,2 years,A700218,Cat,Domestic Shorthair Mix,Brown Tabby/Black,2013-04-10,4/10/2015 15:13,2015-04-10T15:13:00,Suffering,Euthanasia,Neutered Male,30.38693675,-97.58771082,104.3762897,,,
299.0,1 year,A668106,Bird,Rhode Island Mix,Yellow/Black,2012-11-27,12/1/2013 3:15,2013-12-01T03:15:00,Suffering,Euthanasia,Intact Male,30.53004273,-97.54861452,52.73363095,,,
300.0,2 months,A731911,Dog,Australian Cattle Dog/German Shepherd,Black/Tan,2016-05-14,8/10/2016 13:04,2016-08-10T13:04:00,,Return to Owner,Intact Male,30.67518205,-97.32797727,12.64920635,Cory,,
301.0,3 years,A686606,Dog,Australian Shepherd Mix,Brown Merle/Tan,2011-08-24,8/31/2014 13:14,2014-08-31T13:14:00,Partner,Transfer,Neutered Male,30.62892779,-97.59013451,157.6501984,Junior,,
302.0,1 year,A714666,Dog,Chihuahua Longhair Mix,Tan/White,2014-10-26,10/29/2015 18:38,2015-10-29T18:38:00,,Return to Owner,Intact Female,30.47054303,-97.62337269,52.68234127,Sandy,,
303.0,5 years,A698959,Dog,Labrador Retriever Mix,Black,2010-03-20,3/20/2015 17:25,2015-03-20T17:25:00,,Return to Owner,Intact Female,30.70523917,-97.60692464,260.9608135,Addy,,
304.0,13 years,A358879,Dog,German Shepherd,Brown/Black,2002-08-13,9/15/2015 16:22,2015-09-15T16:22:00,Suffering,Euthanasia,Neutered Male,30.44999948,-97.61854919,683.0974206,Simba,656174071f442de352558622,
305.0,2 years,A711357,Cat,Domestic Shorthair Mix,Torbie,2013-09-05,9/6/2015 9:00,2015-09-06T09:00:00,SCRP,Transfer,Unknown,30.74147147,-97.34098349,104.4821429,,,
306.0,1 year,A708460,Cat,Domestic Shorthair,Cream Tabby,2014-07-28,7/29/2015 9:00,2015-07-29T09:00:00,SCRP,Transfer,Unknown,30.33059504,-97.39188138,52.33928571,,,
307.0,1 year,A742169,Dog,Pit Bull,Blue/White,2016-01-16,12/15/2017 18:26,2017-12-15T18:26:00,,Adoption,Spayed Female,30.74080553,-97.35470709,99.96686508,*Pearl,,
308.0,3 months,A692031,Cat,Domestic Shorthair Mix,Black/White,2014-10-13,2/1/2015 17:55,2015-02-01T17:55:00,,Adoption,Neutered Male,30.52380179,-97.49676402,15.96378968,T-Rex,,
309.0,8 months,A719793,Dog,Pit Bull Mix,White/Tan,2015-06-01,2/1/2016 14:32,2016-02-01T14:32:00,,Return to Owner,Spayed Female,30.49900688,-97.46171286,35.08650794,Cece,,
310.0,6 months,A734240,Other,Rabbit Sh Mix,White/Black,2016-03-03,9/18/2016 10:41,2016-09-18T10:41:00,,Adoption,Intact Female,30.63861327,-97.25858005,28.4921627,,,
311.0,9 months,A708456,Other,Opossum,Gray,2014-09-28,7/29/2015 12:11,2015-07-29T12:11:00,Suffering,Euthanasia,Unknown,30.54076691,-97.3546943,43.50109127,,,
312.0,2 years,A698767,Dog,Bull Terrier Mix,White,2014-03-17,2/6/2017 17:46,2017-02-06T17:46:00,,Adoption,Neutered Male,30.58248764,-97.50169355,151.105754,Polo,,
313.0,3 months,A758948,Other,Squirrel Mix,Brown,2017-06-24,9/27/2017 19:18,2017-09-27T19:18:00,Rabies Risk,Euthanasia,Unknown,30.53960733,-97.30992939,13.68630952,,,
314.0,2 years,A671428,Dog,Swiss Hound/Pit Bull,Tan/White,2012-10-24,11/12/2014 19:32,2014-11-12T19:32:00,,Return to Owner,Neutered Male,30.69918144,-97.39776325,107.1162698,Little Foot,,
315.0,3 years,A678393,Dog,Miniature Poodle Mix,White/Apricot,2011-05-08,5/9/2014 17:54,2014-05-09T17:54:00,,Return to Owner,Spayed Female,30.42929933,-97.61617323,156.8208333,Bebe,,
316.0,8 months,A749157,Bird,Duck,Yellow,2016-09-11,5/15/2017 9:32,2017-05-15T09:32:00,Foster,Adoption,Unknown,30.44222708,-97.56628656,35.19960317,,,
317.0,2 months,A691775,Cat,Domestic Shorthair Mix,Orange Tabby,2014-09-09,11/14/2014 13:43,2014-11-14T13:43:00,Partner,Transfer,Neutered Male,30.50911472,-97.4528579,9.510218254,Nugget,,
318.0,1 month,A729618,Cat,Domestic Shorthair Mix,Calico,2016-05-14,6/24/2016 7:33,2016-06-24T07:33:00,Partner,Transfer,Intact Female,30.52220932,-97.43950969,5.902083333,*Apple,,
319.0,2 years,A755247,Dog,Pit Bull Mix,Black/White,2015-07-31,1/9/2018 17:52,2018-01-09T17:52:00,,Adoption,Neutered Male,30.57952553,-97.59938229,127.6777778,Dobie,,
320.0,3 years,A720636,Cat,Domestic Shorthair Mix,Black,2013-02-13,2/22/2016 16:00,2016-02-22T16:00:00,SCRP,Transfer,Unknown,30.6319987,-97.64395162,157.8095238,,,
321.0,4 years,A609335,Dog,Pit Bull Mix,White/Tan,2009-09-07,12/16/2013 15:31,2013-12-16T15:31:00,,Adoption,Neutered Male,30.66957023,-97.64158647,223.0923611,*Churley,,
322.0,2 years,A756323,Dog,Pit Bull Mix,White/Black,2015-08-17,8/19/2017 16:44,2017-08-19T16:44:00,,Adoption,Neutered Male,30.35743329,-97.39929939,104.8138889,Bongo,,
323.0,8 years,A688353,Dog,Boston Terrier,Black/White,2006-09-18,9/19/2014 16:42,2014-09-19T16:42:00,,Return to Owner,Neutered Male,30.42762622,-97.33888805,417.6708333,Rupert,,
324.0,2 months,A702633,Dog,Labrador Retriever Mix,Black/White,2015-03-16,5/20/2015 17:04,2015-05-20T17:04:00,,Adoption,Neutered Male,30.51866115,-97.35703441,9.387301587,,,
325.0,2 years,A711168,Dog,American Pit Bull Terrier Mix,Sable/White,2013-09-03,9/3/2015 11:41,2015-09-03T11:41:00,,Return to Owner,Intact Male,30.66965664,-97.62683029,104.3552579,Chucho,,
326.0,2 weeks,A735260,Cat,Domestic Shorthair Mix,Brown Tabby,2016-09-06,9/21/2016 14:16,2016-09-21T14:16:00,Partner,Transfer,Unknown,30.43234531,-97.64653482,2.227777778,,,
327.0,2 months,A759505,Dog,Labrador Retriever Mix,White,2017-08-02,10/4/2017 15:42,2017-10-04T15:42:00,,Return to Owner,Intact Female,30.36362807,-97.33347233,9.093452381,,,
328.0,1 year,A734612,Dog,Pit Bull Mix,Black/White,2015-09-19,9/20/2016 19:12,2016-09-20T19:12:00,,Return to Owner,Neutered Male,30.62793864,-97.48936581,52.54285714,Beans,,
329.0,7 years,A534502,Dog,Boxer Mix,Black Brindle/Brown,2008-11-17,9/23/2016 17:10,2016-09-23T17:10:00,,Return to Owner,Neutered Male,30.44412798,-97.47657935,409.6736111,Will,,
330.0,2 months,A692955,Cat,Domestic Shorthair Mix,Black/White,2014-10-29,1/24/2015 11:27,2015-01-24T11:27:00,Foster,Adoption,Spayed Female,30.42562437,-97.29896471,12.49672619,*Maria,,
331.0,2 months,A726249,Cat,Domestic Shorthair Mix,Torbie/White,2016-04-05,6/11/2016 13:41,2016-06-11T13:41:00,Foster,Adoption,Spayed Female,30.7413759,-97.62676239,9.652876984,*Myrtle,,
332.0,1 month,A751736,Cat,Domestic Shorthair Mix,Tortie,2017-04-27,6/18/2017 17:25,2017-06-18T17:25:00,Partner,Transfer,Intact Female,30.40702473,-97.35570444,7.532242063,*Jessa,,
333.0,5 years,A739113,Dog,Anatol Shepherd Mix,White/Tan,2011-11-28,11/28/2016 14:37,2016-11-28T14:37:00,,Return to Owner,Neutered Male,30.44630847,-97.57645876,261.087004,Gus,,
334.0,1 year,A675124,Other,Raccoon Mix,Black/Gray,2013-03-23,3/23/2014 17:30,2014-03-23T17:30:00,Suffering,Euthanasia,Unknown,30.39729229,-97.30530039,52.24702381,,,
335.0,2 months,A746862,Dog,Great Dane Mix,Black/White,2017-01-14,4/14/2017 17:13,2017-04-14T17:13:00,,Adoption,Spayed Female,30.41050771,-97.65025213,12.95962302,Harley,,
336.0,2 months,A758584,Cat,American Shorthair Mix,Orange Tabby/White,2017-09-09,11/26/2017 11:37,2017-11-26T11:37:00,,Adoption,Neutered Male,30.34914086,-97.47932913,11.21200397,,,
337.0,2 years,A693651,Other,Bat Mix,Brown,2012-12-12,12/13/2014 8:19,2014-12-13T08:19:00,Rabies Risk,Euthanasia,Unknown,30.28919326,-97.54597155,104.4780754,,,
338.0,1 year,A700824,Dog,Chihuahua Shorthair Mix,Brown/White,2013-10-20,4/24/2015 11:40,2015-04-24T11:40:00,,Adoption,Spayed Female,30.76500329,-97.62097274,78.78373016,Greta,,
339.0,3 months,A728158,Cat,Domestic Shorthair Mix,Orange Tabby/White,2016-05-01,8/5/2016 8:38,2016-08-05T08:38:00,Foster,Adoption,Neutered Male,30.51711047,-97.52339657,13.7656746,*Pete,,
340.0,2 years,A754340,Other,Bat Mix,Brown,2015-07-19,7/20/2017 9:10,2017-07-20T09:10:00,Enroute,Died,Unknown,30.56811652,-97.2793448,104.6259921,,,
341.0,8 years,A747978,Dog,Mastiff/Plott Hound,Red,2009-04-27,5/1/2017 8:38,2017-05-01T08:38:00,Suffering,Euthanasia,Intact Female,30.47193924,-97.4471395,418.0513889,,,
342.0,2 months,A680314,Dog,Australian Kelpie Mix,Chocolate/Tan,2014-06-01,8/10/2014 17:54,2014-08-10T17:54:00,Offsite,Adoption,Spayed Female,30.74441987,-97.55133064,10.10654762,*Lil Sis,,
343.0,2 years,A670897,Dog,Australian Cattle Dog/German Shorthair Pointer,White/Tricolor,2012-01-15,1/17/2014 17:57,2014-01-17T17:57:00,,Return to Owner,Neutered Male,30.37293458,-97.50450716,104.821131,Toby,,
344.0,4 months,A749888,Cat,Domestic Shorthair Mix,Black,2017-04-14,8/22/2017 17:23,2017-08-22T17:23:00,,Adoption,Neutered Male,30.28359219,-97.55643172,18.67490079,*Chocolate,,
345.0,2 years,A721221,Dog,Border Collie Mix,Black/White,2014-02-23,3/13/2016 14:51,2016-03-13T14:51:00,,Return to Owner,Spayed Female,30.58438744,-97.46783257,107.0883929,Gypsy,,
346.0,4 years,A616906,Cat,Maine Coon Mix,Brown Tabby/White,2010-07-01,6/30/2014 14:39,2014-06-30T14:39:00,Partner,Transfer,Spayed Female,30.27311349,-97.32191801,208.658631,Estrella,,
347.0,2 months,A705590,Dog,Australian Shepherd/Labrador Retriever,Black Brindle,2015-04-12,6/27/2015 13:19,2015-06-27T13:19:00,,Adoption,Neutered Male,30.70831791,-97.39246682,10.93640873,,,
348.0,2 weeks,A714703,Cat,Domestic Medium Hair Mix,Black,2015-10-12,10/27/2015 12:19,2015-10-27T12:19:00,Partner,Transfer,Intact Male,30.31009011,-97.38398844,2.216170635,,,
349.0,2 years,A703203,Dog,Chihuahua Shorthair Mix,White/Brown,2013-05-21,5/24/2015 17:59,2015-05-24T17:59:00,,Return to Owner,Spayed Female,30.37821894,-97.41708451,104.8213294,Chloe,,
350.0,13 years,A306362,Dog,Labrador Retriever/Chow Chow,Black,2002-07-13,7/18/2015 16:40,2015-07-18T16:40:00,,Return to Owner,Spayed Female,30.64589194,-97.69086273,679.0992063,Zoey,,
351.0,2 months,A744559,Dog,Labrador Retriever Mix,Chocolate/White,2017-02-08,5/4/2017 10:41,2017-05-04T10:41:00,Foster,Adoption,Neutered Male,30.36049561,-97.55239038,12.20644841,,,
352.0,1 month,A745920,Dog,Labrador Retriever Mix,Chocolate/Tan,2017-02-04,3/30/2017 18:50,2017-03-30T18:50:00,,Adoption,Neutered Male,30.34323616,-97.31946851,7.826388889,,,
353.0,3 months,A760023,Dog,Labrador Retriever Mix,Brown,2017-07-11,10/22/2017 18:28,2017-10-22T18:28:00,,Return to Owner,Neutered Male,30.70044169,-97.40825875,14.82420635,Max,,
354.0,3 years,A683204,Cat,Domestic Shorthair Mix,Orange Tabby,2011-07-09,8/2/2014 15:03,2014-08-02T15:03:00,Partner,Transfer,Neutered Male,30.46415261,-97.5021407,160.0895833,*Spencer,,
355.0,2 months,A725797,Cat,Domestic Shorthair Mix,Blue Tabby,2016-03-03,5/8/2016 13:37,2016-05-08T13:37:00,,Adoption,Intact Female,30.44745311,-97.38894972,9.509623016,Pistachio,,
356.0,1 year,A742079,Dog,Chihuahua Shorthair Mix,Black/Tan,2016-01-14,1/18/2017 18:22,2017-01-18T18:22:00,,Adoption,Neutered Male,30.59314505,-97.65778464,52.96646825,,,
357.0,5 months,A703811,Dog,Black Mouth Cur/Blue Lacy,Sable,2014-12-29,6/2/2015 16:40,2015-06-02T16:40:00,,Adoption,Spayed Female,30.5435113,-97.68192853,22.24206349,,,
358.0,6 years,A602693,Dog,Shih Tzu/Border Terrier,Tan/Black,2010-11-04,11/22/2016 16:19,2016-11-22T16:19:00,,Return to Owner,Spayed Female,30.42607056,-97.4428018,315.8114087,Wilma,,
359.0,8 years,A756165,Dog,Labrador Retriever Mix,Black/White,2009-08-15,8/17/2017 11:49,2017-08-17T11:49:00,,Return to Owner,Neutered Male,30.41694709,-97.31286544,417.784623,Millo,,
360.0,1 month,A750195,Cat,Domestic Shorthair Mix,Torbie,2017-04-09,5/27/2017 15:50,2017-05-27T15:50:00,,Adoption,Intact Female,30.41057877,-97.66632914,6.951388889,Rusty,,
361.0,3 years,A745093,Other,Bat Mix,Brown,2014-03-12,3/12/2017 18:07,2017-03-12T18:07:00,Rabies Risk,Euthanasia,Unknown,30.30167847,-97.45249335,156.6792659,,,
362.0,8 months,A689081,Dog,Australian Cattle Dog Mix,Red Merle,2014-01-29,10/4/2014 17:18,2014-10-04T17:18:00,,Adoption,Spayed Female,30.31753828,-97.37923051,35.53154762,*Becca,,
363.0,10 years,A671864,Dog,Golden Retriever Mix,Gold/White,2004-01-31,1/31/2014 16:37,2014-01-31T16:37:00,,Return to Owner,Neutered Male,30.30940417,-97.5465731,521.9560516,Krash,,
364.0,3 years,A755458,Dog,Rat Terrier Mix,Tricolor,2014-08-04,8/10/2017 11:00,2017-08-10T11:00:00,Partner,Transfer,Spayed Female,30.38352494,-97.30269324,157.4940476,Chiquis,,
365.0,2 months,A664113,Dog,German Shepherd Mix,Black/Tan,2013-07-29,10/3/2013 17:39,2013-10-03T17:39:00,,Adoption,Neutered Male,30.40143439,-97.39501919,9.533630952,Wrigley,,
366.0,2 years,A719167,Dog,Miniature Pinscher Mix,Black/Brown,2014-01-14,1/19/2016 16:58,2016-01-19T16:58:00,,Adoption,Neutered Male,30.5213086,-97.27914542,105.1009921,*Toby,,
367.0,2 months,A728626,Cat,Domestic Longhair Mix,White/Black,2016-05-08,7/25/2016 17:17,2016-07-25T17:17:00,,Adoption,Spayed Female,30.71031361,-97.46453443,11.24573413,Snowball,,
368.0,4 weeks,A684341,Cat,Snowshoe Mix,Seal Point,2014-06-22,7/23/2014 14:35,2014-07-23T14:35:00,Partner,Transfer,Intact Female,30.63626959,-97.57193569,4.515376984,Apple,,
369.0,3 years,A723814,Cat,Domestic Shorthair Mix,Brown Tabby,2013-04-07,7/2/2016 16:31,2016-07-02T16:31:00,,Adoption,Spayed Female,30.51248262,-97.27871412,168.9554563,Chiquita,,
370.0,4 years,A758041,Cat,Domestic Shorthair Mix,White/Blue,2013-09-10,9/10/2017 19:06,2017-09-10T19:06:00,Suffering,Euthanasia,Neutered Male,30.55547012,-97.59647588,208.8279762,,,
371.0,2 months,A692444,Cat,Domestic Medium Hair Mix,Black/White,2014-08-29,11/21/2014 12:03,2014-11-21T12:03:00,Medical,Euthanasia,Intact Male,30.35828019,-97.67377784,12.07172619,,,
372.0,9 years,A663149,Cat,Domestic Shorthair Mix,Brown Tabby/White,2004-09-13,1/18/2014 16:08,2014-01-18T16:08:00,Foster,Adoption,Spayed Female,30.47810249,-97.27304921,487.8103175,Princess,,
373.0,2 months,A679430,Cat,Domestic Shorthair Mix,Cream Tabby/White,2014-04-14,6/19/2014 14:41,2014-06-19T14:41:00,,Adoption,Neutered Male,30.44006815,-97.56006211,9.515972222,Four,,
374.0,5 months,A709312,Dog,Miniature Schnauzer Mix,Black/Brown,2015-03-07,8/11/2015 18:04,2015-08-11T18:04:00,,Adoption,Spayed Female,30.47426121,-97.48262897,22.53611111,,,
375.0,5 months,A719249,Dog,German Shepherd Mix,Black/Brown,2015-08-16,1/20/2016 18:07,2016-01-20T18:07:00,,Adoption,Spayed Female,30.55244068,-97.30811783,22.53640873,*Miso,,
376.0,7 years,A742958,Cat,Domestic Shorthair Mix,Blue/White,2010-02-06,2/11/2017 9:50,2017-02-11T09:50:00,Partner,Transfer,Neutered Male,30.32047534,-97.36965558,366.0585317,*Saints,,
377.0,4 years,A692079,Cat,Domestic Shorthair Mix,Calico,2010-11-14,11/14/2014 12:24,2014-11-14T12:24:00,Suffering,Euthanasia,Intact Female,30.53971021,-97.47882939,208.7880952,,,
378.0,3 weeks,A757236,Cat,Domestic Medium Hair Mix,Black,2017-08-09,8/31/2017 0:00,2017-08-31T00:00:00,Partner,Transfer,Unknown,30.47757563,-97.71461143,3.142857143,,,
379.0,2 years,A687505,Dog,Chihuahua Shorthair Mix,Black,2012-09-05,9/10/2014 17:21,2014-09-10T17:21:00,,Return to Owner,Spayed Female,30.45443121,-97.7203507,105.1032738,Lucky,,
380.0,2 years,A715041,Dog,Pit Bull Mix,Chocolate/White,2013-10-30,11/9/2015 11:44,2015-11-09T11:44:00,,Return to Owner,Spayed Female,30.54710522,-97.60083662,105.784127,Coco,,
381.0,1 month,A736066,Dog,Labrador Retriever Mix,Tan,2016-08-03,10/3/2016 17:17,2016-10-03T17:17:00,,Return to Owner,Intact Female,30.5045429,-97.39660932,8.817162698,,,
382.0,5 years,A688773,Dog,Shih Tzu Mix,White/Brown,2009-09-23,9/24/2014 16:46,2014-09-24T16:46:00,,Return to Owner,Neutered Male,30.67868688,-97.74057241,261.0998016,Chubs,,
383.0,2 months,A730192,Cat,Domestic Longhair Mix,Black,2016-04-30,7/1/2016 12:39,2016-07-01T12:39:00,,Adoption,Intact Male,30.50904806,-97.42065436,8.932440476,Sirius,,
384.0,3 years,A624949,Dog,German Shepherd Mix,Black/Tan,2010-09-01,4/30/2014 16:25,2014-04-30T16:25:00,Aggressive,Euthanasia,Neutered Male,30.47727436,-97.55473012,191.0977183,Axle,,
385.0,1 month,A668178,Cat,Domestic Shorthair Mix,Blue,2013-11-09,1/2/2014 18:37,2014-01-02T18:37:00,Foster,Adoption,Neutered Male,30.49203277,-97.45378011,7.825099206,*Owen,,
386.0,2 months,A729678,Cat,Domestic Shorthair Mix,Orange Tabby,2016-04-22,6/26/2016 17:19,2016-06-26T17:19:00,,Adoption,Neutered Male,30.58580564,-97.62575006,9.388789683,,,
387.0,4 weeks,A710686,Cat,Domestic Shorthair Mix,Brown Tabby,2015-07-26,8/29/2015 14:15,2015-08-29T14:15:00,Partner,Transfer,Intact Male,30.47801075,-97.57938028,4.941964286,*Legolas,,
388.0,2 years,A743329,Dog,Border Collie/Great Pyrenees,Tan/White,2015-02-08,2/20/2017 0:00,2017-02-20T00:00:00,Partner,Transfer,Neutered Male,30.56197735,-97.58235584,106.1428571,Sobeck,,
389.0,4 months,A725727,Dog,Pit Bull Mix,Tan/White,2016-01-02,5/10/2016 18:36,2016-05-10T18:36:00,,Adoption,Spayed Female,30.4994079,-97.58532838,18.53928571,*Lucinda,,
390.0,6 days,A674754,Cat,Domestic Shorthair Mix,Orange Tabby,2014-03-12,3/18/2014 11:47,2014-03-18T11:47:00,Partner,Transfer,Intact Male,30.75775868,-97.70220778,0.927281746,,,
391.0,6 months,A669598,Cat,Domestic Shorthair Mix,Black,2013-06-24,12/28/2013 14:37,2013-12-28T14:37:00,,Adoption,Intact Male,30.54528554,-97.45907176,26.80128968,Mugen,,
392.0,3 years,A719466,Dog,Australian Kelpie Mix,Blue,2013-01-20,1/20/2016 16:20,2016-01-20T16:20:00,,Return to Owner,Neutered Male,30.68105945,-97.48333417,156.5257937,Raymond,,
393.0,14 years,A657188,Cat,Domestic Shorthair Mix,Brown Tabby/White,1999-06-24,1/26/2014 16:24,2014-01-26T16:24:00,Foster,Adoption,Neutered Male,30.67451989,-97.30652714,761.5261905,Tommy,,
394.0,2 years,A716519,Cat,Domestic Medium Hair Mix,Orange Tabby/White,2013-11-20,11/24/2015 19:30,2015-11-24T19:30:00,SCRP,Transfer,Unknown,30.58896019,-97.51800753,104.9732143,,,
395.0,2 years,A686082,Dog,Siberian Husky Mix,Red/White,2012-08-16,8/20/2014 18:40,2014-08-20T18:40:00,,Adoption,Spayed Female,30.63800756,-97.48798493,104.968254,,,
396.0,3 years,A746407,Cat,Domestic Shorthair Mix,Blue Tabby,2014-04-02,6/24/2017 15:45,2017-06-24T15:45:00,Foster,Adoption,Neutered Male,30.30618647,-97.2703283,168.5223214,Milo,,
397.0,8 months,A739122,Cat,Domestic Shorthair Mix,Brown Tabby,2016-03-28,11/29/2016 9:00,2016-11-29T09:00:00,SCRP,Transfer,Neutered Male,30.69276198,-97.28944563,35.19642857,,,
398.0,1 month,A720525,Dog,Labrador Retriever Mix,Black/White,2015-12-17,2/13/2016 18:22,2016-02-13T18:22:00,,Adoption,Spayed Female,30.63074487,-97.424171,8.395039683,*Merida,,
399.0,3 weeks,A708416,Cat,Domestic Shorthair Mix,Orange Tabby,2015-07-05,7/27/2015 15:38,2015-07-27T15:38:00,Partner,Transfer,Unknown,30.7295441,-97.28724873,3.235912698,,,
400.0,11 months,A681819,Dog,German Shepherd,Black,2013-07-15,7/2/2014 16:40,2014-07-02T16:40:00,,Return to Owner,Spayed Female,30.50251693,-97.51734361,50.38492063,Ashes,656174071f442de352558622,
401.0,2 months,A664033,Dog,German Shepherd Mix,Tan/White,2013-07-27,10/2/2013 18:40,2013-10-02T18:40:00,,Adoption,Neutered Male,30.41143715,-97.40334426,9.682539683,*Billy,,
402.0,2 months,A728008,Cat,Domestic Shorthair Mix,Torbie,2016-04-14,6/22/2016 18:13,2016-06-22T18:13:00,Medical,Euthanasia,Intact Female,30.60325506,-97.26111838,9.965575397,,,
403.0,2 months,A684235,Cat,Domestic Longhair Mix,Brown Tabby/White,2014-04-29,7/22/2014 9:00,2014-07-22T09:00:00,SCRP,Transfer,Intact Male,30.32172001,-97.24612259,12.05357143,,,
404.0,6 months,A728040,Dog,Plott Hound Mix,Chocolate/White,2015-11-30,6/3/2016 17:40,2016-06-03T17:40:00,,Adoption,Neutered Male,30.30327714,-97.70394871,26.6765873,Nikola,,
405.0,1 year,A694186,Dog,Pit Bull Mix,Blue/White,2013-06-22,12/24/2014 17:22,2014-12-24T17:22:00,,Return to Owner,Neutered Male,30.595904,-97.32384938,78.67480159,Fossa,,
406.0,2 weeks,A753867,Cat,Domestic Medium Hair Mix,Black Smoke,2017-06-27,7/12/2017 14:14,2017-07-12T14:14:00,Partner,Transfer,Intact Male,30.38365201,-97.28588299,2.227579365,,,
407.0,3 years,A585131,Cat,Domestic Shorthair Mix,Calico,2010-09-22,6/14/2014 17:25,2014-06-14T17:25:00,,Return to Owner,Spayed Female,30.4091918,-97.26482169,194.5322421,Lupe Fleasco,,
408.0,2 years,A711379,Dog,Labrador Retriever Mix,Black/White,2013-09-06,9/6/2015 13:57,2015-09-06T13:57:00,,Return to Owner,Neutered Male,30.48121353,-97.34936025,104.36875,Turbo,,
409.0,2 months,A739417,Dog,Dachshund,Brown,2016-10-18,12/20/2016 23:03,2016-12-20T23:03:00,Foster,Adoption,Neutered Male,30.50045899,-97.65780531,9.137202381,*Tot,,
410.0,1 month,A707206,Dog,Pit Bull Mix,Black/White,2015-05-13,7/13/2015 11:20,2015-07-13T11:20:00,Partner,Transfer,Intact Male,30.67569283,-97.55778517,8.781746032,,,
411.0,1 year,A687934,Other,Bat,Brown,2013-09-12,9/12/2014 11:57,2014-09-12T11:57:00,Rabies Risk,Euthanasia,Unknown,30.47075246,-97.64202223,52.2139881,,,
412.0,12 years,A756445,Dog,Yorkshire Terrier Mix,Brown/Tan,2005-08-19,8/20/2017 11:42,2017-08-20T11:42:00,,Return to Owner,Neutered Male,30.29511419,-97.68591906,626.3553571,Gizmo,,
413.0,2 years,A681699,Cat,Domestic Longhair Mix,Black,2012-06-19,6/19/2014 18:43,2014-06-19T18:43:00,Partner,Transfer,Intact Male,30.66532307,-97.27195215,104.397123,,,
414.0,4 months,A747806,Cat,Domestic Shorthair,Calico,2017-04-11,8/12/2017 13:58,2017-08-12T13:58:00,Foster,Adoption,Spayed Female,30.66819999,-97.32970366,17.65456349,*Janet,,
415.0,1 year,A756523,Cat,American Shorthair Mix,Brown Tabby/White,2016-05-21,8/28/2017 16:32,2017-08-28T16:32:00,,Adoption,Neutered Male,30.75650255,-97.47995097,66.38412698,Bodie,,
416.0,3 years,A718312,Dog,Pit Bull Mix,Black/White,2012-12-27,1/8/2016 15:21,2016-01-08T15:21:00,,Return to Owner,Intact Male,30.53399204,-97.27438979,158.2342262,Lucky,,
417.0,3 years,A679728,Cat,Domestic Shorthair Mix,White,2011-05-25,6/16/2014 12:46,2014-06-16T12:46:00,Partner,Transfer,Spayed Female,30.43142747,-97.29160919,159.7902778,Jojo,,
418.0,8 months,A668206,Cat,Domestic Shorthair Mix,Calico,2013-03-29,12/27/2013 15:49,2013-12-27T15:49:00,Partner,Transfer,Spayed Female,30.31433517,-97.50458878,39.09414683,*Ciara,,
419.0,1 year,A664613,Dog,Border Collie/American Staffordshire Terrier,Black/White,2012-10-06,10/14/2013 11:47,2013-10-14T11:47:00,Partner,Transfer,Intact Female,30.5780649,-97.3774515,53.35585317,*Pammy,,
420.0,6 months,A687225,Cat,Domestic Shorthair Mix,Brown Tabby,2014-05-02,11/9/2014 17:40,2014-11-09T17:40:00,,Adoption,Spayed Female,30.27764686,-97.38173449,27.39087302,*Hope,,
421.0,2 months,A665694,Dog,German Shepherd Mix,Black/Tan,2013-08-21,10/27/2013 13:20,2013-10-27T13:20:00,Partner,Transfer,Intact Male,30.7586688,-97.41973583,9.650793651,,,
422.0,4 years,A621716,Dog,Pit Bull Mix,Chocolate/White,2010-03-11,9/15/2014 18:52,2014-09-15T18:52:00,,Return to Owner,Spayed Female,30.39255455,-97.32242743,235.6837302,*Maizy,,
423.0,2 years,A667109,Dog,American Bulldog/Labrador Retriever,Black/White,2011-11-12,12/11/2013 12:50,2013-12-11T12:50:00,,Adoption,Neutered Male,30.48797693,-97.73971023,108.6478175,Hank,,
424.0,2 months,A749612,Dog,Labrador Retriever Mix,White/Gray,2017-05-16,7/18/2017 12:00,2017-07-18T12:00:00,Foster,Adoption,Neutered Male,30.51401387,-97.38220122,9.071428571,*Prince,,
425.0,5 months,A685797,Other,Squirrel Mix,Brown,2014-02-12,8/12/2014 18:10,2014-08-12T18:10:00,Suffering,Euthanasia,Intact Female,30.42885784,-97.34838949,25.96527778,,,
426.0,7 years,A525136,Cat,American Shorthair Mix,Calico,2007-10-17,3/20/2015 11:01,2015-03-20T11:01:00,Partner,Transfer,Spayed Female,30.3170641,-97.60042881,387.3512897,Muneca,,
427.0,2 months,A702852,Cat,Domestic Shorthair Mix,Orange Tabby,2015-03-03,5/23/2015 11:16,2015-05-23T11:16:00,,Adoption,Neutered Male,30.59757501,-97.72337382,11.63849206,*Zeke,,
428.0,1 year,A750022,Cat,Domestic Shorthair Mix,Orange Tabby/White,2016-05-22,6/10/2017 10:54,2017-06-10T10:54:00,Partner,Transfer,Neutered Male,30.55903254,-97.47613024,54.92202381,*Hudson,,
429.0,2 years,A722427,Other,Opossum Mix,Gray,2014-03-16,3/16/2016 14:57,2016-03-16T14:57:00,Rabies Risk,Euthanasia,Unknown,30.50856976,-97.43857279,104.5175595,,,
430.0,1 year,A666852,Dog,Pit Bull Mix,Chocolate/White,2012-05-08,12/12/2013 15:17,2013-12-12T15:17:00,Aggressive,Euthanasia,Spayed Female,30.71201254,-97.52294958,83.37668651,*Bonnie,,
431.0,2 years,A743447,Dog,Chihuahua Shorthair Mix,Tan/White,2015-02-10,2/11/2017 15:25,2017-02-11T15:25:00,,Return to Owner,Neutered Male,30.6478024,-97.37273147,104.6631944,Squints,,
432.0,3 years,A674476,Cat,Domestic Shorthair Mix,Brown Tabby,2011-03-13,3/15/2014 17:49,2014-03-15T17:49:00,Suffering,Euthanasia,Intact Female,30.34252784,-97.39646074,156.9631944,*Fiona,,
433.0,3 years,A759045,Dog,Pit Bull Mix,White/Tan,2014-09-25,9/27/2017 14:25,2017-09-27T14:25:00,,Return to Owner,Intact Male,30.53358454,-97.62320062,156.9429563,Boss,,
434.0,2 years,A726876,Dog,Rottweiler,Black/Brown,2014-05-15,9/22/2016 19:08,2016-09-22T19:08:00,,Adoption,Neutered Male,30.37731165,-97.41899944,123.1138889,*Reuben,,
435.0,1 year,A752512,Cat,Domestic Shorthair Mix,Black,2016-06-23,7/3/2017 15:41,2017-07-03T15:41:00,Snr,Transfer,Intact Female,30.47493381,-97.31697965,53.66478175,*Lala,,
436.0,3 months,A729002,Cat,Domestic Shorthair Mix,Brown Tabby,2016-03-12,6/12/2016 13:09,2016-06-12T13:09:00,Suffering,Euthanasia,Intact Male,30.43005535,-97.66464592,13.22113095,,,
437.0,1 year,A746114,Other,Bat Mix,Brown,2016-03-28,3/29/2017 7:50,2017-03-29T07:50:00,Rabies Risk,Euthanasia,Unknown,30.44775348,-97.52880096,52.33234127,,,
438.0,2 weeks,A725791,Other,Opossum,Gray,2016-04-15,5/3/2016 12:38,2016-05-03T12:38:00,Underage,Euthanasia,Unknown,30.58494844,-97.46288063,2.646626984,,,
439.0,2 weeks,A680863,Bird,Duck,Yellow/Black,2014-05-25,6/10/2014 0:00,2014-06-10T00:00:00,Partner,Transfer,Unknown,30.6589808,-97.3750885,2.285714286,,,
440.0,6 months,A695938,Cat,Domestic Shorthair Mix,Tortie,2014-07-26,1/31/2015 18:19,2015-01-31T18:19:00,,Adoption,Spayed Female,30.65457534,-97.28139551,27.10902778,Callie,,
441.0,3 days,A704633,Cat,Domestic Shorthair Mix,White/Blue,2015-06-05,6/8/2015 11:10,2015-06-08T11:10:00,Partner,Transfer,Unknown,30.58101568,-97.5878691,0.495039683,,,
442.0,10 years,A762711,Dog,Catahoula Mix,Brown/White,2007-11-25,11/25/2017 15:19,2017-11-25T15:19:00,,Return to Owner,Neutered Male,30.30002048,-97.3326802,521.9483135,Willy,,
443.0,9 years,A707335,Dog,Pug Mix,Buff,2006-07-13,7/13/2015 18:03,2015-07-13T18:03:00,,Return to Owner,Intact Male,30.46007622,-97.3431438,469.678869,Killer,,
444.0,3 years,A753198,Cat,Domestic Shorthair Mix,Orange Tabby,2014-07-03,7/7/2017 15:48,2017-07-07T15:48:00,Snr,Transfer,Neutered Male,30.5739625,-97.36072544,157.2369048,,,
445.0,2 months,A728166,Cat,Domestic Shorthair Mix,Brown Tabby,2016-04-24,7/9/2016 17:54,2016-07-09T17:54:00,Foster,Adoption,Spayed Female,30.75894828,-97.29072227,10.96369048,*Kelly,,
446.0,2 years,A725930,Dog,Shih Tzu Mix,White/Buff,2014-05-03,5/7/2016 17:38,2016-05-07T17:38:00,,Adoption,Neutered Male,30.4958457,-97.44443126,105.1049603,Austin,,
447.0,3 months,A763045,Cat,Domestic Shorthair Mix,Brown Tabby/White,2017-08-17,12/9/2017 17:09,2017-12-09T17:09:00,,Adoption,Intact Male,30.41000745,-97.30275304,16.38779762,Tiger,,
448.0,2 years,A723943,Cat,Siamese Mix,Flame Point,2014-04-09,4/14/2016 19:11,2016-04-14T19:11:00,SCRP,Transfer,Neutered Male,30.57293589,-97.43694629,105.2570437,,,
449.0,4 years,A657492,Dog,Pit Bull Mix,White/Black,2010-06-28,9/29/2014 18:34,2014-09-29T18:34:00,,Return to Owner,Spayed Female,30.63180354,-97.35248924,222.1105159,Freckles,,
450.0,4 years,A665212,Dog,Labrador Retriever Mix,Brown/White,2009-10-15,12/26/2013 9:56,2013-12-26T09:56:00,,Adoption,Neutered Male,30.45504918,-97.43219032,219.059127,*Lonnie,,
451.0,4 months,A698702,Dog,German Shepherd/Alaskan Malamute,Sable/White,2014-11-16,3/21/2015 12:37,2015-03-21T12:37:00,,Adoption,Neutered Male,30.44324744,-97.51224986,17.93224206,,,
452.0,3 months,A671067,Dog,Miniature Pinscher Mix,Chocolate/Brown,2013-10-17,1/21/2014 17:12,2014-01-21T17:12:00,,Adoption,Spayed Female,30.59382256,-97.36618562,13.81666667,,,
453.0,7 months,A658511,Dog,Labrador Retriever/Pit Bull,Chocolate,2013-03-11,10/29/2013 9:07,2013-10-29T09:07:00,Foster,Adoption,Neutered Male,30.58080486,-97.71147142,33.19712302,*Jasper,,
454.0,1 month,A705436,Cat,Domestic Longhair Mix,Orange Tabby,2015-04-25,6/17/2015 12:14,2015-06-17T12:14:00,Suffering,Euthanasia,Intact Male,30.52721607,-97.6058551,7.644246032,,,
455.0,1 month,A713015,Cat,Siamese Mix,Seal Point,2015-09-01,10/11/2015 11:56,2015-10-11T11:56:00,Partner,Transfer,Intact Female,30.75387769,-97.60389732,5.78531746,*Cersei,,
456.0,14 years,A691761,Dog,Yorkshire Terrier,Silver/Tan,2000-11-09,11/9/2014 11:10,2014-11-09T11:10:00,,Return to Owner,Neutered Male,30.38939506,-97.62746823,730.4950397,Poopy,,
457.0,6 years,A730511,Dog,Pit Bull Mix,White/Brown,2010-10-22,11/30/2016 12:58,2016-11-30T12:58:00,Partner,Transfer,Neutered Male,30.47118194,-97.28581242,318.7914683,Rocky,,
458.0,2 months,A701213,Dog,German Shepherd Mix,Brown,2015-02-25,5/2/2015 21:23,2015-05-02T21:23:00,Offsite,Adoption,Neutered Male,30.66174546,-97.67399273,9.555853175,,,
459.0,1 month,A685106,Cat,Domestic Shorthair Mix,Brown Tabby,2014-07-06,9/2/2014 18:47,2014-09-02T18:47:00,,Adoption,Neutered Male,30.40582451,-97.66680812,8.397519841,*Larkspur,,
460.0,4 months,A716662,Cat,Domestic Shorthair Mix,Blue Tabby/White,2015-07-22,11/29/2015 18:19,2015-11-29T18:19:00,,Adoption,Neutered Male,30.47835936,-97.5812601,18.68045635,Archer,,
461.0,3 months,A722347,Dog,Pit Bull Mix,Tan/White,2015-12-15,3/19/2016 17:41,2016-03-19T17:41:00,,Adoption,Neutered Male,30.35160558,-97.55675551,13.67668651,,,
462.0,9 years,A663210,Cat,Domestic Shorthair Mix,Black,2004-09-14,4/12/2014 15:32,2014-04-12T15:32:00,Foster,Adoption,Neutered Male,30.70615215,-97.66565911,499.6638889,Charlie,,
463.0,1 weeks,A732887,Cat,Domestic Shorthair Mix,Calico,2016-08-04,8/14/2016 19:12,2016-08-14T19:12:00,Partner,Transfer,Unknown,30.32183632,-97.58168272,1.542857143,,,
464.0,1 year,A722331,Dog,Pit Bull Mix,Brown Brindle,2015-03-14,3/19/2016 17:26,2016-03-19T17:26:00,,Adoption,Neutered Male,30.73452137,-97.26480502,53.10376984,*Hendrix,,
465.0,4 years,A743066,Dog,German Shepherd Mix,White,2013-02-03,2/8/2017 0:00,2017-02-08T00:00:00,Partner,Transfer,Spayed Female,30.53373558,-97.58107569,209.4285714,Belle,,
466.0,6 years,A604679,Dog,Chihuahua Shorthair Mix,Cream,2008-12-27,1/1/2015 0:00,2015-01-01T00:00:00,Partner,Transfer,Neutered Male,30.61746476,-97.65174648,313.7142857,Snowball,,
467.0,3 weeks,A682131,Cat,Domestic Shorthair Mix,Brown Tabby,2014-06-02,6/24/2014 19:15,2014-06-24T19:15:00,Partner,Transfer,Intact Male,30.55359804,-97.70401446,3.257440476,,,
468.0,2 months,A675516,Cat,Domestic Shorthair Mix,Brown Tabby/White,2014-03-21,5/24/2014 15:25,2014-05-24T15:25:00,,Adoption,Spayed Female,30.45420529,-97.31710859,9.234623016,,,
469.0,6 years,A740539,Dog,Chihuahua Shorthair/Italian Greyhound,Tan/White,2010-12-19,12/22/2016 17:37,2016-12-22T17:37:00,Partner,Transfer,Spayed Female,30.36977945,-97.37584376,313.6762897,Bella,,
470.0,2 weeks,A748759,Cat,Domestic Shorthair Mix,Black,2017-04-24,5/9/2017 10:30,2017-05-09T10:30:00,In Kennel,Died,Intact Male,30.69910677,-97.59274715,2.205357143,,,
471.0,1 year,A724181,Dog,Queensland Heeler,White/Black,2015-08-13,9/24/2016 11:44,2016-09-24T11:44:00,,Return to Owner,Neutered Male,30.51564879,-97.58391191,58.35555556,Blue,,
472.0,1 year,A759132,Dog,Labrador Retriever Mix,White/Brown,2016-09-27,11/21/2017 15:08,2017-11-21T15:08:00,,Adoption,Spayed Female,30.70162025,-97.52915578,60.09007937,Lucy,,
473.0,3 years,A679072,Dog,Chihuahua Shorthair/Wire Hair Fox Terrier,White/Brown,2011-05-16,5/28/2014 17:55,2014-05-28T17:55:00,,Adoption,Neutered Male,30.51087002,-97.27676732,158.3923611,Rudy,,
474.0,6 months,A728751,Dog,Border Collie Mix,Chocolate/White,2015-12-08,7/2/2016 14:02,2016-07-02T14:02:00,,Adoption,Spayed Female,30.70452928,-97.45353173,29.65496032,Chloe,,
475.0,6 years,A719194,Dog,Beagle Mix,Tricolor,2011-01-27,4/4/2017 17:27,2017-04-04T17:27:00,Partner,Transfer,Spayed Female,30.58885,-97.49213587,322.8181548,Ginger,,
476.0,2 months,A677195,Cat,Domestic Shorthair Mix,Calico,2014-03-23,5/25/2014 18:26,2014-05-25T18:26:00,,Adoption,Spayed Female,30.33332968,-97.41560471,9.109722222,Rosie,,
477.0,2 weeks,A692326,Cat,Domestic Shorthair Mix,Blue Tabby,2014-11-03,11/18/2014 17:28,2014-11-18T17:28:00,Partner,Transfer,Intact Female,30.53817185,-97.65816642,2.246825397,,,
478.0,2 months,A676728,Cat,Domestic Shorthair Mix,Orange Tabby,2014-04-12,7/12/2014 20:15,2014-07-12T20:15:00,Foster,Adoption,Neutered Male,30.54187348,-97.51910127,13.12053571,Macduff,,
479.0,2 months,A755431,Cat,Domestic Shorthair Mix,Brown Tabby,2017-07-03,9/30/2017 9:58,2017-09-30T09:58:00,Foster,Adoption,Spayed Female,30.54192974,-97.25135943,12.77361111,*Buttercup,,
480.0,1 month,A692060,Cat,Domestic Shorthair Mix,Black/White,2014-10-06,11/13/2014 18:37,2014-11-13T18:37:00,Suffering,Euthanasia,Intact Female,30.54699552,-97.24752867,5.539384921,,,
481.0,1 year,A717535,Dog,Beagle Mix,Tricolor,2014-12-09,12/15/2015 15:31,2015-12-15T15:31:00,,Adoption,Spayed Female,30.49533551,-97.51278319,53.09236111,Daisy,,
482.0,1 year,A667409,Cat,Domestic Medium Hair Mix,Black,2012-11-17,11/22/2013 17:17,2013-11-22T17:17:00,SCRP,Transfer,Neutered Male,30.33222398,-97.44233516,52.96001984,Herby,,
483.0,2 months,A705802,Dog,Treeing Walker Coonhound Mix,Tricolor,2015-04-06,6/21/2015 17:47,2015-06-21T17:47:00,Partner,Transfer,Unknown,30.46699669,-97.55440814,10.96299603,,,
484.0,4 weeks,A690555,Cat,Domestic Shorthair Mix,Black/White,2014-09-22,10/25/2014 10:53,2014-10-25T10:53:00,Partner,Transfer,Intact Male,30.40109608,-97.54564459,4.77906746,*Chip,,
485.0,4 years,A696188,Dog,Pit Bull Mix,Blue/White,2011-01-30,2/2/2015 16:16,2015-02-02T16:16:00,,Return to Owner,Intact Female,30.29159304,-97.56433501,209.2396825,Maya,,
486.0,1 year,A692350,Cat,Domestic Shorthair Mix,Torbie,2013-11-18,11/25/2014 18:39,2014-11-25T18:39:00,SCRP,Transfer,Intact Female,30.62231485,-97.55690802,53.25386905,,,
487.0,3 months,A737550,Cat,Domestic Shorthair Mix,Brown Tabby/White,2016-09-26,1/12/2017 9:36,2017-01-12T09:36:00,Foster,Adoption,Neutered Male,30.68798126,-97.52722705,15.48571429,Ernie,,
488.0,2 months,A687998,Cat,Domestic Shorthair Mix,Black,2014-07-13,9/18/2014 16:24,2014-09-18T16:24:00,,Adoption,Neutered Male,30.35566593,-97.39412419,9.669047619,*Rabbit,,
489.0,9 years,A517501,Cat,Ragdoll Mix,Calico Point,2006-04-26,10/17/2015 15:44,2015-10-17T15:44:00,,Adoption,Spayed Female,30.71748705,-97.25971314,494.5222222,Snow Kitty,,
490.0,5 months,A670634,Dog,Plott Hound Mix,Brown Brindle,2013-08-12,1/28/2014 15:52,2014-01-28T15:52:00,,Adoption,Spayed Female,30.66777859,-97.42687894,24.23730159,*Eliza,,
491.0,2 years,A669460,Dog,Pomeranian/Border Terrier,Buff,2011-12-21,12/24/2013 15:46,2013-12-24T15:46:00,,Adoption,Neutered Male,30.48081225,-97.46033599,104.9509921,Pancho,,
492.0,1 year,A667030,Dog,Dachshund/Labrador Retriever,Tan,2013-05-04,5/7/2014 14:04,2014-05-07T14:04:00,,Adoption,Spayed Female,30.68323803,-97.70381942,52.65515873,*Sugar,,
493.0,2 years,A705722,Cat,Domestic Shorthair Mix,Brown Tabby/White,2013-06-20,7/27/2015 17:54,2015-07-27T17:54:00,Foster,Adoption,Spayed Female,30.32553831,-97.5900131,109.6779762,,,
494.0,2 months,A728536,Cat,Domestic Shorthair Mix,Brown Tabby,2016-05-05,7/9/2016 17:58,2016-07-09T17:58:00,Foster,Adoption,Neutered Male,30.52132759,-97.50078768,9.39265873,*Tommy,,
495.0,2 months,A719482,Cat,Domestic Medium Hair Mix,Brown Tabby/White,2015-11-14,1/22/2016 17:37,2016-01-22T17:37:00,,Adoption,Neutered Male,30.66503354,-97.33113414,9.962003968,,,
496.0,2 weeks,A725880,Cat,Domestic Shorthair Mix,White/Black,2016-04-18,5/3/2016 15:58,2016-05-03T15:58:00,Partner,Transfer,Unknown,30.61318979,-97.33009561,2.237896825,,,
497.0,2 months,A681780,Cat,Domestic Shorthair Mix,Black,2014-04-06,6/27/2014 14:18,2014-06-27T14:18:00,,Adoption,Neutered Male,30.54180303,-97.26637225,11.79940476,Maybe,,
498.0,2 years,A756818,Cat,Domestic Shorthair Mix,Tortie,2015-08-25,9/3/2017 16:10,2017-09-03T16:10:00,,Adoption,Spayed Female,30.57724495,-97.37597261,105.8105159,*Vanillope,,
499.0,1 year,A694430,Dog,Pit Bull Mix,Brown,2013-12-28,1/26/2015 16:19,2015-01-26T16:19:00,,Adoption,Spayed Female,30.28045842,-97.32542364,56.3828373,Chica,,
500.0,1 year,A675587,Other,Raccoon Mix,Black/Gray,2013-03-29,3/30/2014 14:45,2014-03-30T14:45:00,Rabies Risk,Euthanasia,Unknown,30.6598662,-97.48064348,52.3735119,,,
501.0,2 weeks,A680857,Bird,Duck,Yellow/Black,2014-05-25,6/10/2014 0:00,2014-06-10T00:00:00,Partner,Transfer,Unknown,30.68099708,-97.31416586,2.285714286,,,
502.0,4 months,A659172,Dog,Chihuahua Shorthair Mix,Black/Tan,2013-06-05,10/7/2013 18:00,2013-10-07T18:00:00,Foster,Adoption,Spayed Female,30.2953604,-97.54330769,17.82142857,Lexi,,
503.0,1 year,A703381,Cat,Domestic Shorthair Mix,Brown Tabby,2014-05-24,6/2/2015 9:07,2015-06-02T09:07:00,Suffering,Euthanasia,Intact Female,30.591366,-97.44274385,53.4828373,,,
504.0,8 years,A759534,Dog,Beagle Mix,Tricolor,2009-10-03,10/4/2017 11:09,2017-10-04T11:09:00,,Return to Owner,Intact Female,30.38052846,-97.42752131,417.6377976,Looloo,,
505.0,6 years,A677736,Dog,Miniature Poodle,White,2008-04-28,5/4/2014 18:18,2014-05-04T18:18:00,Partner,Transfer,Spayed Female,30.37327051,-97.63823534,313.9660714,Curly,,
506.0,1 year,A698647,Dog,Miniature Pinscher Mix,Black/Brown,2014-01-15,3/29/2015 17:22,2015-03-29T17:22:00,,Adoption,Neutered Male,30.4616499,-97.28432733,62.67480159,Shadow,,
507.0,2 weeks,A702814,Cat,Domestic Shorthair Mix,Black,2015-05-03,5/18/2015 13:38,2015-05-18T13:38:00,Partner,Transfer,Unknown,30.48961233,-97.6707266,2.224007937,,,
508.0,4 months,A670311,Cat,Domestic Shorthair Mix,Black/White,2013-09-05,1/13/2014 17:55,2014-01-13T17:55:00,,Adoption,Neutered Male,30.48122575,-97.50361148,18.6780754,*Tim,,
509.0,1 week,A746690,Cat,Domestic Longhair Mix,Gray/White,2017-03-31,4/7/2017 14:08,2017-04-07T14:08:00,Partner,Transfer,Unknown,30.27478963,-97.61028368,1.084126984,,,
510.0,2 months,A683054,Dog,Boxer Mix,Brown/Black,2014-05-06,7/10/2014 18:52,2014-07-10T18:52:00,,Adoption,Neutered Male,30.43319788,-97.52942031,9.398015873,Shadow,,
511.0,10 years,A545644,Dog,Miniature Pinscher,Chocolate/Tan,2007-06-05,12/17/2017 16:11,2017-12-17T16:11:00,,Adoption,Neutered Male,30.56828834,-97.3148639,549.8106151,Lucky,,
512.0,2 months,A744574,Cat,Domestic Medium Hair Mix,Orange Tabby,2016-12-12,3/3/2017 17:12,2017-03-03T17:12:00,,Return to Owner,Intact Male,30.68546785,-97.40333875,11.67380952,Henry,,
513.0,3 months,A731531,Cat,Domestic Shorthair Mix,Black/White,2016-06-16,9/16/2016 0:00,2016-09-16T00:00:00,Foster,Adoption,Spayed Female,30.65611078,-97.36109799,13.14285714,*Alex,,
514.0,2 months,A676868,Cat,Domestic Medium Hair Mix,Calico,2014-03-06,5/23/2014 16:43,2014-05-23T16:43:00,,Adoption,Spayed Female,30.70658333,-97.30753283,11.24236111,*Pinkie Pie,,
515.0,1 year,A715517,Dog,Labrador Retriever/Pit Bull,Chocolate/White,2014-11-05,1/31/2016 16:17,2016-01-31T16:17:00,,Adoption,Spayed Female,30.55796074,-97.67686118,64.66835317,*Desi,,
516.0,4 years,A707181,Dog,Labrador Retriever Mix,Tan/White,2011-07-09,9/16/2015 13:05,2015-09-16T13:05:00,,Adoption,Neutered Male,30.44514811,-97.61567005,218.6493056,Stripe,,
517.0,2 months,A684373,Cat,Domestic Shorthair Mix,Brown Tabby/White,2014-05-05,7/27/2014 17:11,2014-07-27T17:11:00,,Adoption,Neutered Male,30.37799374,-97.38154093,11.9594246,*Henry,,
518.0,7 years,A596202,Dog,Labrador Retriever Mix,Black,2009-04-04,7/28/2016 16:55,2016-07-28T16:55:00,,Adoption,Neutered Male,30.4042326,-97.31410238,381.8149802,Lucky,,
519.0,2 years,A717102,Dog,Pit Bull Mix,Blue/White,2013-12-02,3/6/2016 18:13,2016-03-06T18:13:00,,Adoption,Neutered Male,30.41303891,-97.41699078,117.9655754,*Rufus,,
520.0,1 year,A750419,Dog,Chihuahua Shorthair Mix,Brown/White,2016-05-27,5/28/2017 13:06,2017-05-28T13:06:00,,Return to Owner,Spayed Female,30.44472395,-97.53602497,52.36369048,Sally,,
521.0,2 weeks,A686192,Cat,Domestic Shorthair Mix,Brown Tabby/White,2014-08-03,8/18/2014 14:31,2014-08-18T14:31:00,Partner,Transfer,Intact Male,30.30137924,-97.7212619,2.229265873,,,
522.0,1 year,A687200,Dog,Miniature Pinscher Mix,Black/Tan,2013-09-02,9/9/2014 16:34,2014-09-09T16:34:00,,Adoption,Spayed Female,30.7131611,-97.31311756,53.24146825,*Spring,,
523.0,2 months,A729274,Cat,Domestic Shorthair Mix,Tortie,2016-04-27,7/9/2016 12:02,2016-07-09T12:02:00,,Adoption,Spayed Female,30.75881813,-97.5870631,10.50019841,,,
524.0,1 month,A665447,Cat,Domestic Shorthair Mix,Brown Tabby,2013-09-18,11/9/2013 0:09,2013-11-09T00:09:00,Partner,Transfer,Intact Male,30.75450561,-97.5348698,7.429464286,*Hubble,,
525.0,2 years,A729510,Other,Squirrel Mix,Brown/Gray,2014-06-19,7/4/2016 10:40,2016-07-04T10:40:00,,Disposal,Unknown,30.68562134,-97.48912241,106.6349206,,,
526.0,3 days,A682465,Cat,Domestic Shorthair Mix,Black/White,2014-06-25,6/28/2014 13:32,2014-06-28T13:32:00,Partner,Transfer,Intact Female,30.52318326,-97.64131208,0.509126984,,,
527.0,2 years,A679005,Cat,Domestic Longhair Mix,Orange Tabby,2012-05-15,5/25/2014 17:34,2014-05-25T17:34:00,SCRP,Transfer,Intact Female,30.62216014,-97.70194511,105.8188492,,,
528.0,8 months,A695920,Dog,Pit Bull Mix,Brown/White,2014-05-25,1/30/2015 18:14,2015-01-30T18:14:00,,Adoption,Spayed Female,30.62791024,-97.25122785,35.82281746,*Wanda,,
529.0,3 months,A703805,Cat,Domestic Shorthair Mix,Brown Tabby/White,2015-05-13,8/29/2015 14:14,2015-08-29T14:14:00,Offsite,Adoption,Spayed Female,30.31986207,-97.5164347,15.51329365,*Bitsie,,
530.0,3 months,A692580,Dog,Jack Russell Terrier Mix,Liver/White,2014-08-23,11/29/2014 12:43,2014-11-29T12:43:00,Partner,Transfer,Intact Female,30.45671918,-97.40963249,14.07569444,,,
531.0,5 months,A677643,Dog,Yorkshire Terrier Mix,Silver/Tan,2013-11-27,5/2/2014 18:36,2014-05-02T18:36:00,Partner,Transfer,Neutered Male,30.59490035,-97.59121691,22.39642857,,,
532.0,6 years,A765126,Dog,Pit Bull Mix,Brown Brindle/White,2012-01-13,1/23/2018 14:01,2018-01-23T14:01:00,,Adoption,Spayed Female,30.65415309,-97.54271051,314.6548611,*Dottie,,
533.0,8 months,A664951,Dog,Chihuahua Shorthair Mix,Tricolor,2013-02-15,10/18/2013 16:19,2013-10-18T16:19:00,,Adoption,Spayed Female,30.74706195,-97.65468275,35.09712302,Twinkle,,
534.0,1 year,A671534,Cat,Snowshoe,Seal Point/White,2013-01-26,3/31/2014 18:14,2014-03-31T18:14:00,,Adoption,Spayed Female,30.75145781,-97.43398122,61.39424603,Stella,,
535.0,2 years,A664812,Dog,Pit Bull Mix,Black/White,2011-04-12,3/7/2014 15:46,2014-03-07T15:46:00,Aggressive,Euthanasia,Intact Male,30.53711628,-97.4104975,151.5224206,Blue,,
536.0,1 year,A683157,Cat,Domestic Longhair Mix,Black Smoke,2013-07-07,7/8/2014 9:00,2014-07-08T09:00:00,SCRP,Transfer,Intact Female,30.35333831,-97.54523747,52.33928571,,,
537.0,2 years,A763702,Dog,Chihuahua Shorthair Mix,Brown,2015-12-14,12/20/2017 16:57,2017-12-20T16:57:00,,Adoption,Spayed Female,30.57286582,-97.27865724,105.3866071,Evita,,
538.0,4 months,A724973,Dog,Labrador Retriever Mix,Black/White,2015-12-23,4/24/2016 17:13,2016-04-24T17:13:00,,Return to Owner,Neutered Male,30.45151352,-97.26801736,17.67390873,Sir,,
539.0,3 years,A726718,Dog,Mexican Hairless Mix,Gray,2013-05-13,5/17/2016 18:59,2016-05-17T18:59:00,,Adoption,Spayed Female,30.34483572,-97.49903742,157.2558532,Iris,,
540.0,2 months,A683706,Cat,Domestic Longhair Mix,Black/White,2014-06-08,9/1/2014 14:45,2014-09-01T14:45:00,Foster,Adoption,Spayed Female,30.67270933,-97.37063205,12.23065476,*Gloria,,
541.0,2 months,A730834,Cat,Domestic Medium Hair Mix,Black,2016-06-21,9/2/2016 18:49,2016-09-02T18:49:00,,Adoption,Spayed Female,30.64893497,-97.45359935,10.5405754,*Ebony,,
542.0,2 years,A676098,Dog,Queensland Heeler Mix,Red/Red Tick,2012-04-04,4/28/2014 18:01,2014-04-28T18:01:00,,Adoption,Neutered Male,30.58700673,-97.46734917,107.8215278,*Cato,,
543.0,4 years,A632357,Cat,Domestic Shorthair Mix,Calico,2012-03-15,6/29/2016 19:19,2016-06-29T19:19:00,,Adoption,Spayed Female,30.64622151,-97.71806547,223.972123,Mischa,,
544.0,4 months,A685000,Dog,Black Mouth Cur,Tan,2014-04-16,8/31/2014 16:20,2014-08-31T16:20:00,,Adoption,Spayed Female,30.28778468,-97.61037347,19.66865079,Fluffy,,
545.0,5 months,A665972,Dog,Plott Hound Mix,Brown Brindle,2013-05-25,11/10/2013 18:16,2013-11-10T18:16:00,,Adoption,Neutered Male,30.57754771,-97.48037229,24.2515873,Simba,,
546.0,1 year,A694545,Dog,Chihuahua Shorthair Mix,White/Tan,2013-12-30,1/5/2015 16:53,2015-01-05T16:53:00,,Return to Owner,Neutered Male,30.29827359,-97.57292146,53.10049603,Rider,,
547.0,7 months,A739373,Cat,Domestic Shorthair Mix,Blue Tabby,2016-05-01,12/24/2016 15:10,2016-12-24T15:10:00,,Adoption,Neutered Male,30.51596554,-97.26059906,33.94742063,Smokey,,
548.0,6 years,A703254,Cat,Domestic Shorthair Mix,Black/White,2009-05-22,6/25/2015 16:54,2015-06-25T16:54:00,,Adoption,Neutered Male,30.44269355,-97.5171668,317.9577381,*Hudson,,
549.0,6 years,A749092,Dog,Labrador Retriever,Brown,2011-01-12,5/13/2017 17:22,2017-05-13T17:22:00,,Return to Owner,Neutered Male,30.28855939,-97.31124215,330.5319444,Lucas,656174071f442de352558621,
550.0,1 year,A680520,Dog,Catahoula/Pit Bull,Brown Merle/White,2013-06-03,7/3/2014 15:42,2014-07-03T15:42:00,,Adoption,Spayed Female,30.46110994,-97.53374314,56.52202381,Cookie,,
551.0,4 years,A662100,Dog,German Shepherd,Brown/Black,2010-03-01,2/19/2015 12:59,2015-02-19T12:59:00,Partner,Transfer,Neutered Male,30.32371576,-97.68786343,259.5058532,Beaux,656174071f442de352558622,
552.0,10 months,A718870,Dog,Rottweiler Mix,Black/Brown,2015-09-08,8/7/2016 13:07,2016-08-07T13:07:00,,Return to Owner,Spayed Female,30.672849,-97.47282549,47.79236111,Samantha,,
553.0,1 weeks,A734138,Cat,Domestic Shorthair Mix,Black,2016-08-24,9/1/2016 19:12,2016-09-01T19:12:00,Partner,Transfer,Intact Female,30.75103786,-97.34330176,1.257142857,,,
554.0,4 years,A687175,Dog,Labrador Retriever,Black/White,2010-09-02,11/11/2014 13:16,2014-11-11T13:16:00,,Adoption,Spayed Female,30.38799523,-97.42729371,218.793254,*Carla,656174071f442de352558621,
555.0,1 day,A688511,Cat,Domestic Shorthair Mix,Calico,2014-09-19,9/20/2014 15:31,2014-09-20T15:31:00,Partner,Transfer,Unknown,30.49174437,-97.66219543,0.235218254,,,
556.0,5 days,A728845,Cat,Domestic Shorthair Mix,Blue Tabby,2016-06-06,6/11/2016 17:42,2016-06-11T17:42:00,Partner,Transfer,Unknown,30.65908021,-97.42920724,0.819642857,,,
557.0,2 months,A760485,Cat,Domestic Shorthair Mix,Black,2017-09-10,11/24/2017 16:19,2017-11-24T16:19:00,,Adoption,Neutered Male,30.54587883,-97.27171405,10.81140873,Memow,,
558.0,8 months,A695615,Dog,German Shepherd Mix,Sable,2014-05-19,1/19/2015 13:22,2015-01-19T13:22:00,,Return to Owner,Neutered Male,30.61878009,-97.63593754,35.07956349,Francis,,
559.0,2 years,A752579,Dog,Pit Bull Mix,Blue/White,2015-06-24,1/30/2018 12:56,2018-01-30T12:56:00,,Adoption,Neutered Male,30.74297531,-97.48879959,135.934127,Faneto,,
560.0,3 months,A707363,Cat,Domestic Shorthair Mix,Black/White,2015-05-29,9/12/2015 18:12,2015-09-12T18:12:00,,Adoption,Neutered Male,30.51442397,-97.65868234,15.25119048,*Xane,,
561.0,8 months,A694478,Dog,Pbgv,Brown,2014-04-29,1/1/2015 18:58,2015-01-01T18:58:00,,Adoption,Spayed Female,30.33033092,-97.34016145,35.39861111,Trixie,,
562.0,3 months,A722989,Dog,Pit Bull,Black/White,2016-02-27,6/10/2016 12:27,2016-06-10T12:27:00,Foster,Adoption,Neutered Male,30.66585861,-97.34512392,14.93125,,,
563.0,5 years,A698909,Dog,Akita Mix,White/Brown,2011-03-19,7/26/2016 14:51,2016-07-26T14:51:00,,Return to Owner,Neutered Male,30.34733517,-97.25272094,279.5169643,Panda,,
564.0,2 years,A760244,Dog,Catahoula Mix,White/Tan,2015-10-15,10/16/2017 17:34,2017-10-16T17:34:00,Partner,Transfer,Intact Female,30.56502416,-97.67593902,104.6759921,,,
565.0,1 year,A665548,Other,Rabbit Sh Mix,Tan/White,2012-10-19,10/23/2013 17:03,2013-10-23T17:03:00,Partner,Transfer,Intact Female,30.70017861,-97.36692429,52.81577381,Baby,,
566.0,4 months,A731292,Cat,Domestic Shorthair Mix,Orange Tabby,2016-02-19,7/20/2016 9:00,2016-07-20T09:00:00,SCRP,Transfer,Intact Male,30.49328369,-97.46063148,21.76785714,,,
567.0,8 years,A682772,Cat,Domestic Shorthair Mix,Black/White,2006-07-02,7/8/2014 11:35,2014-07-08T11:35:00,Suffering,Euthanasia,Spayed Female,30.46957104,-97.38375099,418.3546627,,,
568.0,3 years,A647338,Dog,Pit Bull Mix,White/Red,2012-08-08,10/1/2015 12:33,2015-10-01T12:33:00,Partner,Transfer,Neutered Male,30.46557512,-97.57565709,164.2175595,Pinocchio,,
569.0,2 months,A698073,Dog,Labrador Retriever/Blue Lacy,Blue/White,2014-12-21,3/9/2015 18:51,2015-03-09T18:51:00,,Adoption,Spayed Female,30.4084386,-97.30139391,11.25505952,Bella,,
570.0,2 months,A689935,Cat,Domestic Shorthair Mix,Brown Tabby/White,2014-08-11,10/15/2014 19:06,2014-10-15T19:06:00,,Return to Owner,Spayed Female,30.59160412,-97.73797537,9.399404762,Happy,,
571.0,2 months,A714104,Dog,Pit Bull Mix,Brown,2015-08-18,10/20/2015 15:49,2015-10-20T15:49:00,Partner,Transfer,Intact Female,30.35532283,-97.52599499,9.094146825,*Paisley,,
572.0,5 years,A718648,Dog,Miniature Schnauzer Mix,Gray/White,2011-07-05,12/1/2016 17:04,2016-12-01T17:04:00,,Return to Owner,Spayed Female,30.68692035,-97.47098284,282.3873016,Xena,,
573.0,5 months,A705387,Dog,Chihuahua Shorthair Mix,Tan,2015-01-16,6/24/2015 14:00,2015-06-24T14:00:00,,Adoption,Neutered Male,30.67185152,-97.25792475,22.79761905,Conan,,
574.0,2 years,A671931,Dog,Pit Bull Mix,Brown Brindle,2012-02-01,3/6/2014 16:26,2014-03-06T16:26:00,,Adoption,Spayed Female,30.4411955,-97.6293119,109.2406746,*Sophia,,
575.0,6 months,A757841,Cat,American Shorthair Mix,Black/White,2017-03-07,9/27/2017 15:59,2017-09-27T15:59:00,Partner,Transfer,Spayed Female,30.52955432,-97.37302396,29.23799603,*Winkin,,
576.0,3 months,A715879,Cat,Domestic Shorthair Mix,Black,2015-09-11,12/19/2015 14:20,2015-12-19T14:20:00,,Adoption,Spayed Female,30.74522856,-97.55720733,14.2281746,*Eva,,
577.0,5 months,A673493,Cat,Domestic Shorthair Mix,Tortie/White,2014-02-25,8/1/2014 10:28,2014-08-01T10:28:00,Foster,Adoption,Spayed Female,30.70106345,-97.456595,22.49087302,,,
578.0,4 months,A667061,Cat,Domestic Shorthair,Black,2013-07-12,11/23/2013 14:53,2013-11-23T14:53:00,,Adoption,Spayed Female,30.50766269,-97.3614745,19.23144841,*Bella,,
579.0,1 year,A740698,Dog,Pit Bull Mix,Brown/White,2016-03-21,6/26/2017 19:00,2017-06-26T19:00:00,,Return to Owner,Intact Male,30.34072459,-97.3801798,66.11309524,Biggie,,
580.0,3 years,A691485,Dog,Boxer/Pit Bull,Tricolor,2013-05-05,2/27/2017 12:29,2017-02-27T12:29:00,Partner,Transfer,Spayed Female,30.68692853,-97.60597878,199.2171627,*Twyla,,
581.0,6 years,A712018,Dog,Pomeranian/Chihuahua Longhair,Buff/White,2009-09-15,9/19/2015 16:37,2015-09-19T16:37:00,,Return to Owner,Spayed Female,30.76686294,-97.2675031,313.6703373,,,
582.0,1 year,A751840,Other,Guinea Pig Mix,Gray,2016-06-13,6/16/2017 7:44,2017-06-16T07:44:00,Partner,Transfer,Intact Male,30.74131182,-97.43006754,52.61746032,,,
583.0,1 year,A758221,Cat,Domestic Shorthair Mix,Orange Tabby,2016-09-12,10/5/2017 0:00,2017-10-05T00:00:00,Partner,Transfer,Spayed Female,30.29463284,-97.36926181,55.42857143,*Deb,,
584.0,4 months,A711793,Cat,Domestic Shorthair Mix,Brown Tabby,2015-05-12,9/12/2015 13:11,2015-09-12T13:11:00,,Return to Owner,Unknown,30.67146662,-97.28956027,17.64990079,,,
585.0,5 years,A752044,Dog,Rottweiler Mix,Black/Tan,2012-06-17,6/17/2017 14:20,2017-06-17T14:20:00,Partner,Transfer,Intact Female,30.4938988,-97.52294325,260.9424603,Cita,,
586.0,3 months,A723979,Dog,Chihuahua Shorthair Mix,White/Tan,2015-12-30,4/15/2016 0:00,2016-04-15T00:00:00,,Adoption,Neutered Male,30.26857692,-97.71644272,15.28571429,*Bobby,,
587.0,1 year,A741918,Dog,Australian Cattle Dog Mix,Black,2016-01-11,1/15/2017 10:05,2017-01-15T10:05:00,Partner,Transfer,Intact Female,30.45221607,-97.32082612,52.9171627,,,
588.0,11 years,A705192,Dog,Border Collie,Chocolate/White,2004-06-15,6/15/2015 15:02,2015-06-15T15:02:00,,Return to Owner,Neutered Male,30.46061941,-97.49804595,573.946627,Jaco,,
589.0,7 years,A727888,Cat,Domestic Longhair Mix,Blue Tabby,2009-05-31,9/27/2016 9:11,2016-09-27T09:11:00,Foster,Adoption,Neutered Male,30.41948972,-97.57655963,382.340377,*Whiskers,,
590.0,2 years,A718094,Dog,German Shepherd Mix,Red,2013-12-21,1/4/2016 14:48,2016-01-04T14:48:00,,Adoption,Neutered Male,30.68465519,-97.59138064,106.3738095,*Captain,,
591.0,3 years,A666545,Cat,Domestic Shorthair Mix,Brown Tabby,2010-11-03,11/5/2013 16:17,2013-11-05T16:17:00,SCRP,Transfer,Intact Female,30.3021622,-97.45390618,156.9540675,,,
592.0,7 years,A559477,Dog,English Bulldog,Tan/White,2008-04-24,11/12/2015 18:04,2015-11-12T18:04:00,Partner,Transfer,Intact Male,30.29170426,-97.65558016,394.1075397,Mento,,
593.0,4 weeks,A727177,Cat,Domestic Shorthair Mix,Seal Point,2016-04-19,5/19/2016 15:01,2016-05-19T15:01:00,Partner,Transfer,Intact Female,30.40282726,-97.30300109,4.375099206,,,
594.0,1 year,A738655,Cat,Domestic Shorthair Mix,Blue Tabby,2015-11-19,12/27/2016 15:58,2016-12-27T15:58:00,,Adoption,Spayed Female,30.32720233,-97.33984872,57.8093254,Skinny,,
595.0,6 months,A694254,Dog,Manchester Terrier Mix,Black/Brown,2014-06-23,12/28/2014 17:51,2014-12-28T17:51:00,,Adoption,Neutered Male,30.32136866,-97.59919111,26.96339286,Titan,,
596.0,2 years,A674872,Dog,Jack Russell Terrier,White/Brown,2012-03-19,3/20/2014 11:10,2014-03-20T11:10:00,,Return to Owner,Spayed Female,30.64571404,-97.29553743,104.4950397,Lady,,
597.0,5 months,A727104,Dog,Labrador Retriever Mix,Black,2015-12-18,6/6/2016 15:34,2016-06-06T15:34:00,,Adoption,Spayed Female,30.3927522,-97.30191503,24.52123016,Goose,,
598.0,2 months,A762809,Cat,Domestic Shorthair Mix,Brown Tabby,2017-09-20,12/3/2017 18:04,2017-12-03T18:04:00,,Adoption,Spayed Female,30.61892962,-97.3201891,10.67896825,,,
599.0,3 weeks,A711600,Cat,Domestic Shorthair Mix,White,2015-08-18,9/9/2015 15:21,2015-09-09T15:21:00,Partner,Transfer,Intact Male,30.50954535,-97.59685643,3.23422619,,,
600.0,4 months,A759874,Dog,Miniature Pinscher,Black/Tan,2017-06-08,10/24/2017 17:58,2017-10-24T17:58:00,,Adoption,Spayed Female,30.43992681,-97.65814942,19.82123016,*Ariel,,
601.0,6 months,A706030,Dog,Bearded Collie Mix,Blue Merle/White,2014-12-23,6/27/2015 18:35,2015-06-27T18:35:00,,Adoption,Spayed Female,30.48671612,-97.51918683,26.68204365,Caicos,,
602.0,6 months,A664384,Other,Raccoon Mix,Brown,2013-04-02,10/2/2013 18:36,2013-10-02T18:36:00,Rabies Risk,Euthanasia,Unknown,30.71904022,-97.3192666,26.25357143,,,
603.0,2 years,A702471,Dog,American Pit Bull Terrier/Labrador Retriever,Brown Brindle/White,2013-05-14,11/15/2015 18:13,2015-11-15T18:13:00,,Return to Owner,Spayed Female,30.28250607,-97.70133943,130.8227183,Simona,,
604.0,5 years,A669801,Dog,Pit Bull/Boxer,White/Brown,2010-06-27,5/21/2016 14:00,2016-05-21T14:00:00,Partner,Transfer,Spayed Female,30.44406338,-97.63060569,307.9404762,Lilly,,
605.0,1 year,A731082,Dog,Dachshund Mix,White/Tan,2015-07-15,7/20/2016 11:36,2016-07-20T11:36:00,,Adoption,Neutered Male,30.49685473,-97.52886179,53.06904762,,,
606.0,9 years,A387083,Dog,Labrador Retriever Mix,Tan,2004-11-27,2/12/2014 11:12,2014-02-12T11:12:00,,Return to Owner,Spayed Female,30.42564307,-97.62103706,480.6380952,Goldie,,
607.0,3 years,A673401,Dog,Chihuahua Shorthair Mix,Yellow/White,2011-02-23,2/24/2014 13:50,2014-02-24T13:50:00,Partner,Transfer,Neutered Male,30.30707922,-97.29446209,156.796627,,,
608.0,1 month,A756565,Cat,Siamese Mix,Lynx Point,2017-06-28,8/26/2017 15:39,2017-08-26T15:39:00,,Adoption,Intact Female,30.41612086,-97.51644239,8.52172619,Mini,,
609.0,3 weeks,A709315,Cat,Domestic Shorthair Mix,Brown Tabby,2015-07-21,8/11/2015 0:00,2015-08-11T00:00:00,Partner,Transfer,Intact Male,30.45477757,-97.66329125,3,,,
610.0,1 month,A748667,Cat,Domestic Shorthair Mix,Brown Tabby/White,2017-04-10,6/3/2017 13:59,2017-06-03T13:59:00,Foster,Adoption,Neutered Male,30.69661448,-97.44652461,7.797519841,Pickle,,
611.0,2 years,A678639,Dog,Boxer Mix,Brown Brindle/White,2011-11-11,5/22/2014 13:37,2014-05-22T13:37:00,Partner,Transfer,Spayed Female,30.55819077,-97.64686275,131.9381944,,,
612.0,3 months,A669114,Cat,Domestic Shorthair Mix,Orange Tabby,2013-09-14,12/23/2013 11:27,2013-12-23T11:27:00,Partner,Transfer,Neutered Male,30.73872901,-97.54730294,14.35386905,*Joe,,
613.0,3 years,A762568,Dog,Mastiff Mix,Tan/White,2014-11-21,12/1/2017 13:34,2017-12-01T13:34:00,,Return to Owner,Intact Male,30.53801187,-97.60867226,158.080754,Saint,,
614.0,1 year,A744282,Cat,Domestic Shorthair Mix,Brown Tabby,2016-02-26,2/27/2017 9:00,2017-02-27T09:00:00,SCRP,Transfer,Neutered Male,30.51117605,-97.70173134,52.48214286,,,
615.0,3 years,A742892,Dog,Pit Bull Mix,Black,2014-01-30,2/11/2017 17:57,2017-02-11T17:57:00,,Adoption,Neutered Male,30.76703407,-97.4246126,158.3925595,*Finch,,
616.0,5 months,A684362,Cat,Siamese Mix,Tortie Point,2014-05-26,11/11/2014 17:41,2014-11-11T17:41:00,,Adoption,Spayed Female,30.34634288,-97.49297299,24.24811508,Bella,,
617.0,3 years,A670407,Dog,Pit Bull Mix,Brown Brindle/White,2011-01-07,3/13/2014 12:40,2014-03-13T12:40:00,,Adoption,Neutered Male,30.58824603,-97.31001791,165.9325397,Buster,,
618.0,3 months,A726717,Cat,Domestic Shorthair Mix,White/Brown,2016-04-01,7/24/2016 17:14,2016-07-24T17:14:00,Foster,Adoption,Spayed Female,30.52466369,-97.60884959,16.38829365,*Dumpling,,
619.0,3 years,A702726,Dog,Labrador Retriever Mix,Black,2012-05-20,5/20/2015 18:50,2015-05-20T18:50:00,,Return to Owner,Neutered Male,30.53626735,-97.49199913,156.5406746,Mulder,,
620.0,2 years,A691123,Other,Bat Mix,Brown,2012-10-30,10/31/2014 8:16,2014-10-31T08:16:00,Rabies Risk,Euthanasia,Unknown,30.6978237,-97.49832242,104.4777778,,,
621.0,2 months,A670154,Dog,Border Collie Mix,Cream/White,2013-10-22,1/6/2014 17:51,2014-01-06T17:51:00,,Adoption,Neutered Male,30.34724022,-97.65890418,10.96339286,Bevo,,
622.0,2 years,A741441,Dog,Doberman Pinsch,Blue/Tan,2015-01-04,1/4/2017 14:02,2017-01-04T14:02:00,,Return to Owner,Intact Male,30.61762909,-97.42492847,104.5121032,Deeohgee,,
623.0,1 year,A720063,Dog,Chinese Sharpei Mix,Black/Brown,2014-08-02,2/11/2016 12:01,2016-02-11T12:01:00,,Return to Owner,Intact Male,30.36459179,-97.47666065,79.78581349,Kiko,,
624.0,1 year,A701947,Dog,Labrador Retriever Mix,Red Tick/White,2014-12-10,1/2/2016 17:59,2016-01-02T17:59:00,Partner,Transfer,Neutered Male,30.33332942,-97.42084658,55.53561508,Ruffs,,
625.0,4 months,A699490,Dog,Pit Bull/Boxer,Fawn/White,2014-11-28,4/1/2015 19:33,2015-04-01T19:33:00,,Return to Owner,Neutered Male,30.65554232,-97.48302471,17.83065476,,,
626.0,4 months,A672437,Dog,American Pit Bull Terrier Mix,Black/White,2013-12-17,4/27/2014 15:30,2014-04-27T15:30:00,,Return to Owner,Spayed Female,30.33880494,-97.33533424,18.80654762,Midnight,,
627.0,2 months,A702979,Cat,Domestic Shorthair Mix,Black,2015-04-07,7/3/2015 13:04,2015-07-03T13:04:00,Foster,Adoption,Neutered Male,30.34933405,-97.61256269,12.50634921,*Jackson,,
628.0,5 years,A729736,Dog,Pit Bull Mix,Black/White,2011-06-23,6/23/2016 17:47,2016-06-23T17:47:00,,Return to Owner,Neutered Male,30.39378714,-97.32864797,261.1058532,Jake,,
629.0,2 years,A695222,Dog,Flat Coat Retriever Mix,Black/White,2013-01-11,1/15/2015 18:19,2015-01-15T18:19:00,,Adoption,Neutered Male,30.3577825,-97.58779817,104.9661706,Bochy,,
630.0,10 years,A693181,Cat,Domestic Shorthair Mix,Black/White,2004-12-06,2/6/2015 14:00,2015-02-06T14:00:00,,Adoption,Spayed Female,30.29156893,-97.28683766,530.6547619,*Gracie Lou,,
631.0,3 months,A710398,Cat,Domestic Shorthair Mix,Black/White,2015-07-25,11/2/2015 15:56,2015-11-02T15:56:00,Foster,Adoption,Neutered Male,30.7067776,-97.26898553,14.38055556,*Baxter,,
632.0,2 years,A752422,Cat,Domestic Shorthair Mix,Black,2015-06-22,8/24/2017 14:46,2017-08-24T14:46:00,Foster,Adoption,Neutered Male,30.46042161,-97.27964344,113.5164683,Mr. Skittles,,
633.0,6 months,A733071,Cat,Domestic Shorthair Mix,Calico,2016-02-16,8/20/2016 18:47,2016-08-20T18:47:00,,Adoption,Spayed Female,30.55331575,-97.41962833,26.68323413,*Alyssia,,
634.0,1 weeks,A709715,Cat,Domestic Shorthair Mix,Black/White,2015-07-30,8/12/2015 14:24,2015-08-12T14:24:00,Partner,Transfer,Unknown,30.46665241,-97.66896114,1.942857143,,,
635.0,2 years,A731563,Cat,Domestic Shorthair Mix,White/Blue,2014-07-24,7/25/2016 9:00,2016-07-25T09:00:00,SCRP,Transfer,Intact Male,30.46316567,-97.65092373,104.625,*Sparkle,,
636.0,2 months,A726725,Cat,Domestic Shorthair Mix,Torbie,2016-04-06,6/19/2016 16:35,2016-06-19T16:35:00,,Adoption,Spayed Female,30.63479433,-97.50526319,10.67013889,*Alex,,
637.0,1 year,A722209,Cat,Domestic Shorthair Mix,Black/White,2015-03-12,3/21/2016 12:26,2016-03-21T12:26:00,SCRP,Transfer,Neutered Male,30.58879939,-97.72424724,53.64543651,,,
638.0,1 month,A760397,Cat,Domestic Shorthair Mix,White/Brown Tabby,2017-09-25,11/6/2017 17:49,2017-11-06T17:49:00,Partner,Transfer,Intact Female,30.53306848,-97.53641037,6.106051587,,,
639.0,13 years,A757447,Dog,Chihuahua Shorthair Mix,Brown,2004-09-03,9/3/2017 12:02,2017-09-03T12:02:00,,Return to Owner,Intact Male,30.74110201,-97.51026036,678.3573413,Mr Big,,
640.0,5 months,A762680,Dog,Pit Bull Mix,Brown Brindle/White,2017-06-24,12/20/2017 21:13,2017-12-20T21:13:00,,Adoption,Neutered Male,30.40983484,-97.25768314,25.69771825,*Benny,,
641.0,13 years,A665244,Dog,Miniature Poodle Mix,Brown,2000-10-15,10/15/2013 17:23,2013-10-15T17:23:00,Suffering,Euthanasia,Neutered Male,30.37434155,-97.36552154,678.3891865,Latte,,
642.0,4 years,A755418,Dog,Bulldog,Brown/White,2013-08-03,8/13/2017 12:41,2017-08-13T12:41:00,,Return to Owner,Intact Male,30.35821877,-97.49733996,210.2183532,Sonny,,
643.0,7 years,A688425,Dog,Chihuahua Shorthair Mix,Black,2007-09-23,9/24/2014 16:49,2014-09-24T16:49:00,,Adoption,Neutered Male,30.65378957,-97.29590869,365.5286706,Jingles,,
644.0,1 year,A669526,Other,Bat Mix,Brown,2012-12-21,12/22/2013 9:20,2013-12-22T09:20:00,Rabies Risk,Euthanasia,Unknown,30.43337845,-97.61137629,52.34126984,,,
645.0,1 year,A758197,Dog,Yorkshire Terrier/Pomeranian,Red,2016-09-12,9/17/2017 17:04,2017-09-17T17:04:00,,Adoption,Spayed Female,30.59575131,-97.27711367,52.95873016,Bella,,
646.0,2 years,A701554,Dog,American Staffordshire Terrier/Australian Cattle Dog,Black/White,2013-05-01,1/18/2016 12:22,2016-01-18T12:22:00,Partner,Transfer,Spayed Female,30.2880282,-97.24560241,141.7878968,Kahlua,,
647.0,11 months,A655329,Dog,Jack Russell Terrier Mix,White/Tan,2012-11-30,11/15/2013 16:24,2013-11-15T16:24:00,Partner,Transfer,Neutered Male,30.35790756,-97.58567051,50.09761905,*Frisco,,
648.0,3 years,A726005,Dog,Boston Terrier Mix,Black/White,2013-05-05,5/5/2016 11:37,2016-05-05T11:37:00,,Return to Owner,Neutered Male,30.34219702,-97.32819085,156.6405754,Ace,,
649.0,2 years,A731987,Dog,Labrador Retriever Mix,Black/Brown,2014-07-30,8/3/2016 19:06,2016-08-03T19:06:00,,Return to Owner,Spayed Female,30.38444006,-97.38760009,105.1136905,Karma,,
650.0,2 years,A695706,Cat,Domestic Shorthair Mix,Black/White,2013-01-20,1/21/2015 9:00,2015-01-21T09:00:00,SCRP,Transfer,Unknown,30.39946851,-97.7331137,104.4821429,,,
651.0,6 years,A644301,Dog,Chihuahua Shorthair Mix,Black,2007-12-23,11/17/2014 11:20,2014-11-17T11:20:00,,Return to Owner,Neutered Male,30.28380186,-97.53522185,360.2103175,Cloy,,
652.0,1 weeks,A752193,Other,Opossum Mix,White/Gray,2017-06-10,6/19/2017 16:15,2017-06-19T16:15:00,Suffering,Euthanasia,Unknown,30.36174335,-97.27095702,1.382440476,,,
653.0,2 months,A669834,Dog,German Shepherd Mix,Black/Cream,2013-10-21,12/28/2013 14:06,2013-12-28T14:06:00,Partner,Transfer,Intact Female,30.63447517,-97.6054313,9.798214286,,,
654.0,2 years,A716628,Cat,Domestic Longhair Mix,Brown Tabby,2013-11-22,11/27/2015 15:00,2015-11-27T15:00:00,,Return to Owner,Spayed Female,30.76362454,-97.539463,105.0892857,Cabbage,,
655.0,2 years,A706201,Cat,Siamese Mix,Seal Point,2013-06-26,6/26/2015 13:01,2015-06-26T13:01:00,Rabies Risk,Euthanasia,Intact Male,30.31535346,-97.45890598,104.3631944,,,
656.0,1 year,A751270,Dog,Doberman Pinsch Mix,Black/Brown,2016-06-06,6/28/2017 17:51,2017-06-28T17:51:00,,Adoption,Neutered Male,30.37239045,-97.65127107,55.39196429,Bruce,,
657.0,1 year,A724769,Cat,Domestic Shorthair Mix,Calico,2015-04-21,4/30/2016 15:00,2016-04-30T15:00:00,,Adoption,Spayed Female,30.67003934,-97.36002774,53.66071429,*Toula,,
658.0,1 month,A735963,Cat,Domestic Medium Hair Mix,Black/White,2016-09-02,10/13/2016 0:00,2016-10-13T00:00:00,Partner,Transfer,Intact Male,30.57110475,-97.63547457,5.857142857,*Norris,,
659.0,1 year,A666763,Dog,Chihuahua Shorthair,Chocolate/Tan,2012-05-06,11/22/2013 11:33,2013-11-22T11:33:00,Partner,Transfer,Spayed Female,30.51013552,-97.54456402,80.78303571,*Cocoa,,
660.0,12 years,A703429,Dog,Labrador Retriever/Beagle,Brown/White,2005-05-25,11/1/2017 16:02,2017-11-01T16:02:00,,Return to Owner,Intact Male,30.48192837,-97.27315644,649.0954365,Duke,,
661.0,2 years,A681187,Dog,Pit Bull Mix,Black Brindle/White,2012-06-13,7/27/2014 11:18,2014-07-27T11:18:00,Partner,Transfer,Neutered Male,30.47051989,-97.49030832,110.6386905,*Dalton,,
662.0,10 years,A701979,Dog,Labrador Retriever Mix,Tan,2004-11-07,9/26/2015 13:37,2015-09-26T13:37:00,Foster,Adoption,Spayed Female,30.70561633,-97.28162076,567.9381944,Winnie,,
663.0,4 years,A675521,Cat,Domestic Shorthair Mix,Cream Tabby,2010-03-28,4/1/2014 14:39,2014-04-01T14:39:00,,Return to Owner,Neutered Male,30.32524662,-97.57157166,209.3729167,Dismiss,,
664.0,3 months,A705090,Dog,Miniature Schnauzer Mix,Black,2015-02-13,6/13/2015 12:30,2015-06-13T12:30:00,,Return to Owner,Intact Female,30.54286656,-97.72202169,17.2172619,Stormy,,
665.0,2 years,A702963,Cat,Domestic Shorthair Mix,Blue Tabby/White,2013-05-19,5/20/2015 9:00,2015-05-20T09:00:00,SCRP,Transfer,Unknown,30.32069636,-97.34341105,104.4821429,,,
666.0,2 years,A737423,Cat,Domestic Shorthair Mix,Black/White,2014-10-27,11/7/2016 17:00,2016-11-07T17:00:00,,Return to Owner,Intact Female,30.72743661,-97.71277975,106.1011905,Mint,,
667.0,5 months,A763704,Dog,German Shepherd Mix,Black/Cream,2017-07-14,12/19/2017 19:01,2017-12-19T19:01:00,,Adoption,Spayed Female,30.44099424,-97.37551629,22.68462302,Ophelia,,
668.0,1 year,A699664,Other,Bat,Brown,2014-03-31,3/31/2015 14:53,2015-03-31T14:53:00,Rabies Risk,Euthanasia,Unknown,30.43209634,-97.428582,52.23144841,,,
669.0,3 years,A672396,Dog,Basset Hound Mix,White/Red,2013-01-09,9/26/2016 0:00,2016-09-26T00:00:00,Partner,Transfer,Spayed Female,30.59298947,-97.48000628,193.7142857,Layla,,
670.0,1 year,A695539,Cat,Domestic Shorthair Mix,Brown Tabby/White,2014-01-17,1/18/2015 9:00,2015-01-18T09:00:00,SCRP,Transfer,Intact Male,30.64883594,-97.24626617,52.33928571,,,
671.0,17 years,A547803,Dog,Cocker Spaniel,White/Brown,1996-10-15,10/15/2013 13:29,2013-10-15T13:29:00,Suffering,Euthanasia,Spayed Female,30.67772499,-97.29550409,887.0802579,Sheba,,
672.0,9 months,A736038,Dog,Rat Terrier Mix,Black/Tan,2015-12-09,10/3/2016 17:33,2016-10-03T17:33:00,,Return to Owner,Neutered Male,30.4983739,-97.6314322,42.81875,Tank,,
673.0,0 years,A755172,Dog,Chihuahua Shorthair Mix,White/Black,2017-07-30,7/30/2017 16:51,2017-07-30T16:51:00,Partner,Transfer,Intact Male,30.64035518,-97.30265494,0.100297619,,,
674.0,1 year,A729819,Cat,Domestic Shorthair Mix,Brown Tabby,2015-06-24,6/25/2016 9:00,2016-06-25T09:00:00,SCRP,Transfer,Intact Female,30.31051538,-97.38886821,52.48214286,,,
675.0,2 years,A755091,Dog,Yorkshire Terrier Mix,Tan,2015-07-29,7/29/2017 19:46,2017-07-29T19:46:00,,Return to Owner,Intact Male,30.31349665,-97.3115568,104.5462302,Butters,,
676.0,1 month,A704906,Cat,Domestic Shorthair Mix,Black,2015-05-10,6/20/2015 12:28,2015-06-20T12:28:00,In Kennel,Died,Intact Female,30.74303282,-97.5494595,5.931349206,*Smokey,,
677.0,3 years,A749514,Cat,Domestic Shorthair Mix,Black,2014-03-19,5/26/2017 11:18,2017-05-26T11:18:00,,Return to Owner,Neutered Male,30.35338795,-97.39103769,166.3529762,Indy,,
678.0,4 years,A745232,Other,Bat Mix,Brown,2013-03-15,3/15/2017 10:07,2017-03-15T10:07:00,Rabies Risk,Euthanasia,Unknown,30.29659347,-97.41558925,208.774504,,,
679.0,2 weeks,A711076,Cat,Domestic Shorthair Mix,Black,2015-08-17,9/3/2015 14:24,2015-09-03T14:24:00,Partner,Transfer,Intact Female,30.74641521,-97.57598363,2.514285714,*Janet,,
680.0,8 months,A759400,Dog,Staffordshire/Labrador Retriever,White/Black,2017-02-01,10/6/2017 14:17,2017-10-06T14:17:00,Partner,Transfer,Neutered Male,30.72932843,-97.42836898,35.37073413,*Goose,,
681.0,2 months,A759316,Cat,Domestic Shorthair Mix,White/Cream,2017-09-16,11/29/2017 8:47,2017-11-29T08:47:00,Foster,Adoption,Neutered Male,30.52550209,-97.47268206,10.62371032,*Willie,,
682.0,6 years,A677838,Cat,Domestic Shorthair Mix,Calico,2008-04-29,7/22/2014 13:23,2014-07-22T13:23:00,Foster,Adoption,Spayed Female,30.42266356,-97.40021051,325.0796627,Bella,,
683.0,6 years,A588404,Dog,Chihuahua Shorthair,Tan/Tan,2009-12-28,7/28/2016 15:12,2016-07-28T15:12:00,Partner,Transfer,Neutered Male,30.33064915,-97.64318892,343.5190476,Campion,,
684.0,4 months,A706348,Cat,Domestic Shorthair Mix,Brown Tabby,2015-02-27,7/1/2015 16:46,2015-07-01T16:46:00,,Adoption,Spayed Female,30.73946812,-97.2862287,17.8140873,,,
685.0,1 year,A709515,Cat,Domestic Shorthair Mix,Brown Tabby,2014-08-10,10/8/2015 13:52,2015-10-08T13:52:00,,Return to Owner,Spayed Female,30.70307299,-97.59822222,60.65396825,,,
686.0,1 year,A740771,Dog,Labrador Retriever Mix,Yellow,2015-12-22,7/21/2017 13:02,2017-07-21T13:02:00,,Adoption,Neutered Male,30.42300809,-97.57318442,82.50615079,*Edmund,,
687.0,6 months,A722540,Cat,Domestic Shorthair Mix,Calico,2015-09-18,3/29/2016 19:07,2016-03-29T19:07:00,SCRP,Transfer,Intact Female,30.27256196,-97.37546998,27.68521825,,,
688.0,5 years,A666498,Cat,Domestic Longhair Mix,Orange Tabby,2008-11-02,11/30/2013 13:10,2013-11-30T13:10:00,,Adoption,Neutered Male,30.47458734,-97.44000147,264.9355159,Butters,,
689.0,3 weeks,A725540,Cat,Domestic Shorthair Mix,Brown Tabby/White,2016-04-08,5/2/2016 13:32,2016-05-02T13:32:00,Partner,Transfer,Intact Male,30.31133672,-97.45595583,3.509126984,*Tiny,,
690.0,5 years,A757532,Cat,Siamese Mix,Cream/Blue Point,2012-09-03,9/24/2017 17:12,2017-09-24T17:12:00,,Adoption,Neutered Male,30.53603591,-97.47751908,263.9595238,Gustavo,,
691.0,2 months,A726250,Cat,Domestic Shorthair Mix,Calico,2016-04-12,6/28/2016 11:50,2016-06-28T11:50:00,,Adoption,Spayed Female,30.57250293,-97.49881007,11.07043651,*Oblina,,
692.0,2 months,A748678,Cat,Domestic Shorthair Mix,Brown Tabby/White,2017-04-05,6/17/2017 14:56,2017-06-17T14:56:00,Foster,Adoption,Spayed Female,30.57337686,-97.38899799,10.51746032,*Maeve,,
693.0,10 years,A734701,Dog,Maltese Mix,White,2006-09-11,9/21/2016 0:00,2016-09-21T00:00:00,Partner,Transfer,Neutered Male,30.42007716,-97.55846971,523.2857143,*Snow,,
694.0,2 years,A714760,Cat,Domestic Medium Hair Mix,Brown Tabby/White,2013-10-27,10/28/2015 9:00,2015-10-28T09:00:00,SCRP,Transfer,Spayed Female,30.56168778,-97.40121051,104.4821429,Aria,,
695.0,2 years,A726967,Dog,Jack Russell Terrier Mix,White/Brown,2014-05-17,5/17/2016 18:18,2016-05-17T18:18:00,,Return to Owner,Spayed Female,30.43018073,-97.6558486,104.5375,Sugar,,
696.0,1 year,A758294,Dog,Pit Bull,Brown Brindle/White,2016-09-13,10/10/2017 19:45,2017-10-10T19:45:00,Partner,Transfer,Intact Female,30.62313686,-97.46590252,56.11755952,*Darcie,,
697.0,2 years,A717547,Dog,American Bulldog Mix,White/Brown Brindle,2013-12-10,8/3/2016 11:54,2016-08-03T11:54:00,Foster,Adoption,Neutered Male,30.66239503,-97.43344058,138.2136905,Dexter,,
698.0,3 weeks,A716529,Cat,Domestic Shorthair Mix,Blue,2015-10-29,11/20/2015 15:49,2015-11-20T15:49:00,Partner,Transfer,Intact Female,30.74634395,-97.32238906,3.237003968,,,
699.0,5 months,A709048,Dog,Labrador Retriever Mix,Black/White,2015-02-08,8/8/2015 17:58,2015-08-08T17:58:00,,Adoption,Intact Female,30.43815923,-97.51687615,25.9640873,*Libby,,
700.0,9 years,A680832,Cat,Domestic Longhair Mix,White/Black,2005-06-08,6/12/2014 14:49,2014-06-12T14:49:00,Partner,Transfer,Spayed Female,30.71092118,-97.54027575,470.2310516,Katy,,
701.0,3 weeks,A747515,Cat,Domestic Shorthair Mix,Orange Tabby,2017-03-29,4/20/2017 19:05,2017-04-20T19:05:00,Partner,Transfer,Intact Female,30.69481596,-97.34114947,3.256448413,,,
702.0,1 month,A760396,Cat,Domestic Shorthair Mix,White/Brown Tabby,2017-09-25,11/6/2017 17:48,2017-11-06T17:48:00,Partner,Transfer,Intact Female,30.3066652,-97.52586626,6.105952381,,,
703.0,1 year,A735218,Dog,Wire Hair Fox Terrier/Dachshund,Black/White,2015-09-20,9/24/2016 17:28,2016-09-24T17:28:00,,Return to Owner,Intact Female,30.57037062,-97.43799613,52.96111111,Alexa,,
704.0,3 weeks,A760180,Cat,Domestic Shorthair Mix,Black/White,2017-09-22,10/15/2017 12:37,2017-10-15T12:37:00,Partner,Transfer,Intact Male,30.41521385,-97.40154443,3.360813492,,,
705.0,1 year,A713180,Cat,Domestic Shorthair Mix,Black/White,2014-01-01,10/7/2015 12:41,2015-10-07T12:41:00,Partner,Transfer,Neutered Male,30.34284302,-97.28655201,92.07549603,Theodore,,
706.0,4 years,A682524,Dog,Doberman Pinsch/Australian Cattle Dog,Tan/Gray,2010-06-29,7/2/2014 14:16,2014-07-02T14:16:00,,Return to Owner,Neutered Male,30.74125436,-97.57886829,209.2277778,Rio,,
707.0,1 year,A682809,Dog,Siberian Husky Mix,Black/White,2013-07-03,7/7/2014 17:55,2014-07-07T17:55:00,,Adoption,Spayed Female,30.39296627,-97.58632897,52.82093254,,,
708.0,1 year,A715126,Dog,Rhod Ridgeback Mix,Brown,2015-07-01,10/23/2016 14:29,2016-10-23T14:29:00,,Adoption,Neutered Male,30.44141763,-97.71508183,68.65763889,Sampson,,
709.0,9 months,A699789,Dog,Pbgv Mix,White/Blue,2014-07-02,4/2/2015 17:27,2015-04-02T17:27:00,Partner,Transfer,Spayed Female,30.29217683,-97.67873845,39.24672619,Crystal,,
710.0,11 years,A686208,Cat,Domestic Shorthair Mix,Brown Tabby,2003-08-18,9/7/2014 18:59,2014-09-07T18:59:00,,Adoption,Neutered Male,30.7606403,-97.61118569,576.9701389,Jaycup,,
711.0,1 year,A700984,Cat,Domestic Medium Hair Mix,Torbie,2014-04-22,5/25/2015 15:42,2015-05-25T15:42:00,Suffering,Euthanasia,Spayed Female,30.67507043,-97.34659053,56.95059524,Minnie,,
712.0,1 month,A710335,Cat,Domestic Longhair Mix,Blue,2015-07-06,9/5/2015 8:45,2015-09-05T08:45:00,In Kennel,Died,Intact Male,30.36844171,-97.60827814,8.766369048,*Rebbie,,
713.0,6 years,A678887,Dog,Siberian Husky Mix,Black/White,2011-05-13,9/28/2017 0:00,2017-09-28T00:00:00,Partner,Transfer,Intact Male,30.6671992,-97.41915458,332.8571429,Jax,,
714.0,2 months,A725000,Cat,Domestic Medium Hair Mix,Black,2016-02-24,4/29/2016 16:13,2016-04-29T16:13:00,,Adoption,Neutered Male,30.36674843,-97.66492942,9.382242063,,,
715.0,4 years,A664841,Dog,Queensland Heeler Mix,Black/White,2009-10-09,10/13/2013 17:18,2013-10-13T17:18:00,,Adoption,Neutered Male,30.38416981,-97.48662998,209.3886905,Rusty,,
716.0,1 month,A708059,Cat,Domestic Shorthair Mix,Black/White,2015-06-07,7/25/2015 12:53,2015-07-25T12:53:00,Partner,Transfer,Intact Female,30.59072949,-97.44432297,6.933829365,,,
717.0,2 months,A667593,Dog,Australian Cattle Dog Mix,Red Merle/Black,2013-09-20,11/22/2013 18:34,2013-11-22T18:34:00,,Adoption,Spayed Female,30.56415638,-97.50122256,9.110515873,Kaya,,
718.0,5 days,A704820,Other,Bat,Red,2015-06-05,6/10/2015 8:09,2015-06-10T08:09:00,Rabies Risk,Euthanasia,Unknown,30.63860441,-97.53808063,0.762797619,,,
719.0,6 years,A744195,Dog,Jack Russell Terrier Mix,White/Black,2011-02-25,3/1/2017 18:52,2017-03-01T18:52:00,,Adoption,Neutered Male,30.73415946,-97.50206698,313.8265873,Jack,,
720.0,1 year,A673496,Cat,Domestic Shorthair Mix,Blue Tabby/White,2013-02-25,3/3/2014 15:36,2014-03-03T15:36:00,Partner,Transfer,Spayed Female,30.66127927,-97.49204362,53.09285714,,,
721.0,7 months,A725530,Dog,Pit Bull Mix,Brown Brindle/White,2015-10-30,6/9/2016 14:50,2016-06-09T14:50:00,,Adoption,Neutered Male,30.30552551,-97.37139626,31.94543651,King,,
722.0,2 years,A749607,Dog,Labrador Retriever Mix,Black,2015-05-17,5/29/2017 15:07,2017-05-29T15:07:00,,Adoption,Neutered Male,30.62603633,-97.44351834,106.2328373,Maverick,,
723.0,10 months,A720531,Cat,Domestic Shorthair Mix,Black/White,2015-04-11,2/21/2016 15:48,2016-02-21T15:48:00,,Adoption,Neutered Male,30.41956629,-97.70430427,45.23690476,*Patrick,,
724.0,4 months,A675568,Dog,Chihuahua Shorthair Mix,Brown/White,2013-11-18,4/3/2014 17:53,2014-04-03T17:53:00,,Adoption,Neutered Male,30.70810643,-97.34992684,19.53501984,Buddy,,
725.0,8 months,A763178,Dog,Chihuahua Shorthair Mix,Sable/White,2017-04-04,12/6/2017 16:09,2017-12-06T16:09:00,,Adoption,Spayed Female,30.4613686,-97.38178582,35.2389881,Lilly,,
726.0,2 months,A700104,Dog,Belgian Malinois Mix,Blue/Yellow Brindle,2015-01-24,4/12/2015 17:12,2015-04-12T17:12:00,,Adoption,Spayed Female,30.58539925,-97.65107754,11.2452381,,,
727.0,1 year,A760439,Dog,Labrador Retriever Mix,Brown Brindle,2016-10-18,1/5/2018 19:09,2018-01-05T19:09:00,,Adoption,Neutered Male,30.32658253,-97.37439177,63.54255952,*Mars,,
728.0,3 months,A753627,Cat,Domestic Shorthair Mix,Black,2017-06-17,9/17/2017 17:53,2017-09-17T17:53:00,,Adoption,Neutered Male,30.49421026,-97.50721747,13.24930556,*Paddy,,
729.0,4 years,A743907,Dog,Chihuahua Shorthair Mix,Black/Tan,2013-02-24,2/24/2017 17:03,2017-02-24T17:03:00,,Adoption,Neutered Male,30.5205661,-97.60955628,208.8157738,*Artemis,,
730.0,2 years,A720411,Cat,Domestic Shorthair Mix,Black,2013-08-09,2/13/2016 14:15,2016-02-13T14:15:00,,Return to Owner,Neutered Male,30.66812176,-97.25381451,131.2276786,Leonard,,
731.0,5 years,A713461,Dog,Labrador Retriever Mix,Chocolate,2010-10-07,12/12/2015 0:00,2015-12-12T00:00:00,Partner,Transfer,Spayed Female,30.39065143,-97.60127217,270.2857143,*Mary,,
732.0,2 years,A749782,Dog,Labrador Retriever Mix,Tan/White,2015-05-19,7/25/2017 14:59,2017-07-25T14:59:00,,Return to Owner,Intact Female,30.61383106,-97.57521649,114.0891865,*Catalina,,
733.0,2 weeks,A749502,Cat,Domestic Shorthair Mix,Blue Tabby,2017-04-30,5/15/2017 19:18,2017-05-15T19:18:00,Partner,Transfer,Unknown,30.62558023,-97.29199618,2.257738095,,,
734.0,2 years,A667779,Dog,Pit Bull/Pug,White/Black,2011-11-22,12/23/2013 12:50,2013-12-23T12:50:00,,Adoption,Spayed Female,30.58037857,-97.64816768,108.9335317,Dottie,,
735.0,4 years,A754963,Dog,Shih Tzu Mix,Tan/Black,2013-07-27,7/28/2017 17:06,2017-07-28T17:06:00,Partner,Transfer,Intact Female,30.35809065,-97.31255851,208.9589286,Tootsie,,
736.0,6 months,A753276,Cat,Domestic Shorthair Mix,Black,2016-12-04,7/4/2017 13:33,2017-07-04T13:33:00,,Return to Owner,Neutered Male,30.53269444,-97.68618257,30.36636905,Chopin,,
737.0,2 months,A694472,Cat,Domestic Shorthair Mix,Brown Tabby,2014-12-26,3/26/2015 7:36,2015-03-26T07:36:00,Foster,Adoption,Spayed Female,30.65008384,-97.60509027,12.90238095,*Thing 3,,
738.0,2 months,A727427,Cat,Domestic Shorthair Mix,Black,2016-04-26,7/9/2016 17:26,2016-07-09T17:26:00,Foster,Adoption,Neutered Male,30.33520052,-97.72880473,10.67519841,*Baxter,,
739.0,3 months,A730891,Cat,Domestic Medium Hair Mix,Orange Tabby,2016-03-28,7/15/2016 18:26,2016-07-15T18:26:00,,Adoption,Neutered Male,30.3968652,-97.52549991,15.68115079,Crush,,
740.0,10 years,A564617,Dog,Akita Mix,Brown/Black,2005-01-11,7/20/2015 15:09,2015-07-20T15:09:00,Partner,Transfer,Spayed Female,30.64900376,-97.55000721,548.9473214,Bella,,
741.0,4 months,A700918,Dog,Chihuahua Shorthair/Dachshund,Brown Brindle,2014-11-29,4/21/2015 15:16,2015-04-21T15:16:00,,Return to Owner,Neutered Male,30.43680119,-97.67518218,20.51944444,Stephon,,
742.0,1 year,A736089,Dog,Chihuahua Shorthair/Rat Terrier,Tricolor,2015-10-03,10/10/2016 15:30,2016-10-10T15:30:00,,Adoption,Spayed Female,30.68519201,-97.52265041,53.37797619,*Ramona,,
743.0,1 year,A714551,Cat,Domestic Shorthair Mix,Black,2015-09-19,4/2/2017 16:13,2017-04-02T16:13:00,,Adoption,Neutered Male,30.64002377,-97.42653599,80.23938492,Squish,,
744.0,1 year,A686863,Other,Raccoon,Gray/Black,2013-08-28,8/28/2014 10:24,2014-08-28T10:24:00,Medical,Euthanasia,Unknown,30.57999578,-97.58173748,52.2047619,,,
745.0,1 year,A732802,Cat,Domestic Shorthair Mix,Black,2016-06-25,8/14/2017 19:15,2017-08-14T19:15:00,,Adoption,Neutered Male,30.72498587,-97.30428851,59.40029762,*Radar,,
746.0,1 year,A718805,Other,Bat Mix,Brown,2015-01-07,1/7/2016 15:44,2016-01-07T15:44:00,Rabies Risk,Euthanasia,Unknown,30.52174999,-97.68628165,52.23650794,,,
747.0,1 year,A689658,Dog,Miniature Poodle Mix,Gray,2013-10-07,10/11/2014 19:06,2014-10-11T19:06:00,,Adoption,Spayed Female,30.67542028,-97.60582002,52.82797619,,,
748.0,2 years,A752657,Dog,Tibetan Spaniel Mix,Red,2015-06-25,6/29/2017 16:10,2017-06-29T16:10:00,,Adoption,Spayed Female,30.52502079,-97.62979524,105.0962302,Bella,,
749.0,3 years,A684115,Cat,Domestic Shorthair Mix,Cream Tabby/White,2011-07-19,8/11/2014 15:17,2014-08-11T15:17:00,Partner,Transfer,Neutered Male,30.46726785,-97.57643073,159.9481151,*Snowcream,,
750.0,6 months,A700807,Other,Bat,Brown,2014-10-19,4/20/2015 10:16,2015-04-20T10:16:00,Rabies Risk,Euthanasia,Unknown,30.36051568,-97.47403369,26.20396825,,,
751.0,2 months,A664185,Cat,Domestic Shorthair Mix,Black,2013-08-12,11/9/2013 15:32,2013-11-09T15:32:00,,Adoption,Neutered Male,30.33820126,-97.36432696,12.80674603,Sparky,,
752.0,2 years,A689279,Dog,Rat Terrier Mix,White/Brown,2013-04-01,8/5/2015 16:29,2015-08-05T16:29:00,,Return to Owner,Spayed Female,30.30481259,-97.57504118,122.3838294,Wren,,
753.0,2 weeks,A751930,Cat,Domestic Shorthair Mix,Blue,2017-05-31,6/17/2017 14:58,2017-06-17T14:58:00,Partner,Transfer,Intact Female,30.29073495,-97.65525279,2.51765873,,,
754.0,2 days,A721164,Cat,Domestic Shorthair Mix,Black/White,2016-02-20,2/22/2016 15:36,2016-02-22T15:36:00,Partner,Transfer,Unknown,30.48002996,-97.29734343,0.378571429,,,
755.0,5 days,A731853,Cat,Domestic Shorthair Mix,Black/White,2016-07-23,7/28/2016 14:42,2016-07-28T14:42:00,Partner,Transfer,Unknown,30.28389484,-97.27374272,0.801785714,,,
756.0,5 years,A742105,Dog,American Eskimo/Alaskan Husky,White,2012-01-14,1/15/2017 12:34,2017-01-15T12:34:00,,Return to Owner,Spayed Female,30.63772223,-97.50579237,261.2176587,Sky,,
757.0,2 weeks,A757053,Cat,Domestic Shorthair Mix,Black,2017-08-14,8/29/2017 0:00,2017-08-29T00:00:00,Partner,Transfer,Intact Male,30.337649,-97.3324937,2.142857143,,,
758.0,12 years,A682982,Dog,Miniature Schnauzer/Miniature Poodle,Gray,2002-08-09,9/6/2014 14:44,2014-09-06T14:44:00,Foster,Adoption,Spayed Female,30.56520296,-97.35434945,630.2305556,*Eleanor,,
759.0,8 years,A555413,Dog,Dachshund Mix,Brown,2007-05-18,6/4/2015 16:46,2015-06-04T16:46:00,,Return to Owner,Neutered Male,30.70917407,-97.49542301,419.9569444,Peewee,,
760.0,2 years,A679473,Dog,Labrador Retriever Mix,Yellow,2012-05-21,5/23/2014 15:18,2014-05-23T15:18:00,,Return to Owner,Neutered Male,30.39770858,-97.61312862,104.6625,Thor,,
761.0,4 years,A679583,Cat,Domestic Shorthair Mix,Tortie,2010-05-23,5/29/2014 19:08,2014-05-29T19:08:00,SCRP,Transfer,Intact Female,30.63573723,-97.60147528,209.6853175,Fanny,,
762.0,2 years,A741404,Dog,Pit Bull Mix,Blue/White,2015-01-01,1/3/2017 18:10,2017-01-03T18:10:00,,Return to Owner,Neutered Male,30.76263751,-97.53234777,104.8224206,Squishy,,
763.0,1 year,A693856,Dog,Pit Bull Mix,Black/Tan,2013-12-15,12/18/2014 18:45,2014-12-18T18:45:00,,Return to Owner,Neutered Male,30.31855756,-97.54448288,52.68303571,Jizzle,,
764.0,1 year,A758011,Other,Guinea Pig,White/Brown,2016-09-10,9/14/2017 15:26,2017-09-14T15:26:00,Partner,Transfer,Unknown,30.43456255,-97.58503347,52.80615079,,,
765.0,5 days,A746936,Dog,Chihuahua Shorthair Mix,Brown/White,2017-04-06,4/11/2017 18:06,2017-04-11T18:06:00,Partner,Transfer,Intact Male,30.61571492,-97.62492784,0.82202381,,,
766.0,9 years,A756945,Dog,Border Collie Mix,Tricolor/Black,2008-08-28,9/8/2017 11:56,2017-09-08T11:56:00,,Return to Owner,Spayed Female,30.44113157,-97.48707425,471.2138889,Pepper,,
767.0,1 month,A727029,Cat,Domestic Shorthair Mix,Black Tabby,2016-04-17,6/1/2016 1:00,2016-06-01T01:00:00,Suffering,Euthanasia,Intact Male,30.59480023,-97.43128194,6.43452381,*Charlie,,
768.0,2 years,A736148,Dog,Chihuahua Shorthair Mix,Tan/White,2014-03-28,10/7/2016 18:14,2016-10-07T18:14:00,,Return to Owner,Spayed Female,30.48838308,-97.69686094,132.1085317,Cinnabon,,
769.0,3 months,A731419,Cat,Domestic Longhair Mix,Black/White,2016-07-07,10/21/2016 11:24,2016-10-21T11:24:00,Foster,Adoption,Neutered Male,30.72449113,-97.52717757,15.21071429,*Migas,,
770.0,10 months,A684921,Dog,Irish Terrier/Labrador Retriever,Brown/White,2013-09-30,8/6/2014 15:27,2014-08-06T15:27:00,,Adoption,Spayed Female,30.42538991,-97.41820683,44.37767857,,,
771.0,2 months,A706705,Dog,Anatol Shepherd Mix,Tan/White,2015-05-02,7/6/2015 19:08,2015-07-06T19:08:00,,Adoption,Spayed Female,30.48414526,-97.55987838,9.399603175,Hunter,,
772.0,4 years,A684222,Dog,Pit Bull Mix,Brown/White,2011-07-21,1/13/2016 15:02,2016-01-13T15:02:00,,Return to Owner,Intact Male,30.68401111,-97.26351836,233.946627,Brownie,,
773.0,6 months,A676510,Dog,Pit Bull Mix,Black/White,2013-10-11,4/16/2014 17:05,2014-04-16T17:05:00,Partner,Transfer,Intact Male,30.7476238,-97.639939,26.81597222,,,
774.0,10 months,A714989,Other,Netherlnd Dwarf Mix,Gray,2014-12-29,10/30/2015 17:08,2015-10-30T17:08:00,Partner,Transfer,Unknown,30.45143022,-97.7324568,43.6734127,Timmy,,
775.0,2 years,A668213,Dog,Miniature Poodle Mix,White,2011-11-30,12/8/2013 14:30,2013-12-08T14:30:00,Partner,Transfer,Spayed Female,30.64825154,-97.5601866,105.6577381,Camilla,,
776.0,2 years,A760532,Dog,Catahoula Mix,Blue Merle,2015-10-19,11/26/2017 16:54,2017-11-26T16:54:00,,Adoption,Spayed Female,30.58413865,-97.38182954,109.9577381,Luna,,
777.0,2 years,A733880,Cat,Domestic Shorthair Mix,Brown Tabby,2014-08-28,8/29/2016 9:00,2016-08-29T09:00:00,SCRP,Transfer,Spayed Female,30.29273992,-97.59855802,104.625,,,
778.0,1 year,A735500,Cat,Domestic Shorthair Mix,Brown Tabby/White,2015-03-29,12/19/2016 11:55,2016-12-19T11:55:00,,Adoption,Spayed Female,30.72440649,-97.56301103,90.21378968,Susie,,
779.0,1 year,A667977,Other,Bat Mix,Gray,2012-11-25,11/25/2013 19:51,2013-11-25T19:51:00,,Disposal,Unknown,30.60289719,-97.52323265,52.2610119,,,
780.0,2 years,A705299,Dog,Pit Bull Mix,Blue/White,2013-06-15,8/9/2015 13:07,2015-08-09T13:07:00,,Adoption,Neutered Male,30.35785758,-97.70343141,112.2209325,Dexter,,
781.0,11 years,A468181,Dog,Boxer/Pit Bull,Tan/White,2005-10-17,12/27/2016 9:19,2016-12-27T09:19:00,,Return to Owner,Neutered Male,30.50321712,-97.71976716,584.1983135,Marley,,
782.0,2 years,A708081,Cat,Domestic Shorthair Mix,Blue Tabby/White,2013-01-22,8/6/2015 18:27,2015-08-06T18:27:00,,Adoption,Neutered Male,30.76007096,-97.38172886,132.3955357,Nickels,,
783.0,6 months,A734987,Dog,Catahoula Mix,Brown Merle,2016-03-16,9/20/2016 17:29,2016-09-20T17:29:00,,Adoption,Spayed Female,30.54538955,-97.6567287,26.96121032,,,
784.0,10 months,A730406,Dog,Manchester Terrier Mix,Tricolor,2015-09-04,7/11/2016 18:04,2016-07-11T18:04:00,,Adoption,Spayed Female,30.39836108,-97.58774491,44.53611111,*Bert,,
785.0,3 years,A747310,Cat,Domestic Shorthair Mix,Orange Tabby/White,2014-04-18,4/26/2017 13:41,2017-04-26T13:41:00,,Adoption,Neutered Male,30.7649056,-97.61373878,157.7957341,Mikey,,
786.0,15 years,A700009,Dog,Yorkshire Terrier Mix,Silver/Tan,2000-04-09,4/10/2015 15:47,2015-04-10T15:47:00,Partner,Transfer,Intact Female,30.33825649,-97.57098682,782.8082341,,,
787.0,4 years,A638342,Dog,Staffordshire Mix,Black/White,2012-04-29,6/10/2016 11:14,2016-06-10T11:14:00,,Return to Owner,Neutered Male,30.46419538,-97.36271911,214.7811508,*Kirby,,
788.0,1 month,A726500,Cat,Domestic Medium Hair Mix,Blue Tabby,2016-03-16,5/16/2016 18:53,2016-05-16T18:53:00,,Adoption,Neutered Male,30.43518808,-97.30533566,8.826686508,Scooter,,
789.0,4 months,A716844,Cat,Domestic Shorthair Mix,Blue,2015-07-26,11/30/2015 17:57,2015-11-30T17:57:00,,Adoption,Neutered Male,30.59865931,-97.43247455,18.24970238,Shadow,,
790.0,6 months,A729083,Cat,Domestic Shorthair Mix,Brown Tabby/White,2015-12-13,6/19/2016 19:12,2016-06-19T19:12:00,Partner,Transfer,Spayed Female,30.63343958,-97.43061273,27.11428571,,,
791.0,2 weeks,A674637,Cat,Domestic Shorthair Mix,Brown Tabby,2014-03-01,3/16/2014 14:37,2014-03-16T14:37:00,Partner,Transfer,Intact Male,30.45446962,-97.34767414,2.229861111,,,
792.0,3 years,A687505,Dog,Chihuahua Shorthair Mix,Black,2012-09-05,11/30/2015 17:15,2015-11-30T17:15:00,,Return to Owner,Spayed Female,30.57597973,-97.66943734,168.8169643,Lucky,,
793.0,5 months,A664436,Cat,Domestic Shorthair Mix,Black/White,2013-05-03,10/3/2013 15:33,2013-10-03T15:33:00,SCRP,Transfer,Intact Male,30.46344441,-97.39192016,21.94970238,,,
794.0,2 weeks,A699872,Cat,Domestic Shorthair Mix,Blue,2015-03-19,4/3/2015 16:46,2015-04-03T16:46:00,Partner,Transfer,Intact Female,30.64937386,-97.55223332,2.24265873,,,
795.0,3 months,A700694,Cat,Domestic Shorthair Mix,Blue Tabby,2015-03-18,6/20/2015 12:36,2015-06-20T12:36:00,Foster,Adoption,Spayed Female,30.74737173,-97.66247416,13.50357143,*Ashes,,
796.0,8 years,A721744,Cat,Domestic Medium Hair Mix,Tortie,2008-03-03,3/5/2016 17:37,2016-03-05T17:37:00,,Adoption,Spayed Female,30.42373806,-97.46712613,417.8191468,Muchacha,,
797.0,2 years,A750191,Dog,Pit Bull Mix,White,2015-05-24,11/24/2017 14:57,2017-11-24T14:57:00,,Adoption,Spayed Female,30.63094851,-97.63956528,130.8032738,*Sheba,,
798.0,3 years,A699754,Dog,Chihuahua Shorthair Mix,White/Chocolate,2012-04-03,4/6/2015 17:51,2015-04-06T17:51:00,,Adoption,Neutered Male,30.3743586,-97.41266389,156.9633929,,,
799.0,2 months,A706447,Cat,Domestic Shorthair Mix,Brown Tabby,2015-05-07,7/30/2015 19:12,2015-07-30T19:12:00,,Adoption,Intact Female,30.63496037,-97.25566183,12.11428571,Luna,,
800.0,1 year,A665551,Cat,Domestic Shorthair Mix,Black/White,2012-10-19,12/12/2013 13:11,2013-12-12T13:11:00,Partner,Transfer,Spayed Female,30.75693337,-97.45989868,59.93561508,*Aggie,,
801.0,6 years,A682221,Dog,Great Pyrenees Mix,White,2008-06-25,8/3/2014 19:00,2014-08-03T19:00:00,,Adoption,Neutered Male,30.65125448,-97.40324879,318.6845238,Geo,,
802.0,4 months,A755664,Cat,Domestic Shorthair Mix,Black,2017-04-07,8/11/2017 13:39,2017-08-11T13:39:00,Partner,Transfer,Unknown,30.73761927,-97.47935421,18.08125,,,
803.0,6 months,A725679,Cat,Domestic Shorthair Mix,Calico,2016-04-01,10/24/2016 18:38,2016-10-24T18:38:00,Foster,Adoption,Spayed Female,30.65624397,-97.45608292,29.53948413,*Maddie,,
804.0,3 months,A741110,Cat,Domestic Shorthair Mix,Brown Tabby,2016-11-13,3/13/2017 17:04,2017-03-13T17:04:00,Foster,Adoption,Spayed Female,30.67518783,-97.61769805,17.24444444,*Emma,,
805.0,3 months,A718285,Dog,Chihuahua Shorthair Mix,Yellow,2015-09-26,1/2/2016 17:28,2016-01-02T17:28:00,,Return to Owner,Neutered Male,30.4249576,-97.38871146,14.10396825,Biscuit,,
806.0,3 years,A681270,Dog,Cairn Terrier/Yorkshire Terrier,Brown Brindle,2011-06-14,6/19/2014 14:44,2014-06-19T14:44:00,Partner,Transfer,Spayed Female,30.63131605,-97.71614816,157.3734127,*Samba,,
807.0,9 months,A619084,Dog,Labrador Retriever Mix,Black,2014-09-09,6/10/2015 13:30,2015-06-10T13:30:00,,Return to Owner,Neutered Male,30.66127952,-97.31426083,39.22321429,Dude,,
808.0,3 years,A678367,Cat,Angora Mix,Calico,2011-05-08,8/12/2014 13:39,2014-08-12T13:39:00,Partner,Transfer,Spayed Female,30.39301517,-97.6657086,170.3669643,Daisy,,
809.0,3 months,A694981,Dog,Labrador Retriever Mix,Black/White,2014-10-07,1/12/2015 13:16,2015-01-12T13:16:00,,Adoption,Spayed Female,30.45116389,-97.54708231,13.93611111,,,
810.0,6 years,A615920,Dog,American Staffordshire Terrier Mix,Blue/White,2010-06-14,4/4/2017 10:05,2017-04-04T10:05:00,,Return to Owner,Spayed Female,30.4955688,-97.37222013,355.202877,Bluebelle,,
811.0,1 year,A724642,Dog,Pit Bull Mix,Blue,2015-04-19,4/20/2016 16:17,2016-04-20T16:17:00,,Return to Owner,Intact Male,30.57770696,-97.33758259,52.52549603,Chief,,
812.0,3 months,A753595,Other,Raccoon,Gray,2017-04-08,7/9/2017 14:56,2017-07-09T14:56:00,Suffering,Euthanasia,Unknown,30.45175875,-97.67790384,13.23174603,,,
813.0,3 months,A679990,Cat,Domestic Longhair,Black,2014-04-13,7/28/2014 18:41,2014-07-28T18:41:00,,Adoption,Neutered Male,30.50809051,-97.42592424,15.25406746,Chui,,
814.0,3 years,A673840,Other,Bat Mix,Brown,2011-03-03,3/3/2014 16:54,2014-03-03T16:54:00,,Euthanasia,Unknown,30.56398967,-97.6560865,156.6720238,,,
815.0,1 month,A745111,Cat,Domestic Medium Hair Mix,Black,2017-02-13,3/21/2017 13:27,2017-03-21T13:27:00,In Foster,Died,Intact Female,30.47384777,-97.28698176,5.222916667,*Midnight,,
816.0,2 years,A750925,Dog,Pit Bull Mix,Blue,2015-06-02,6/2/2017 15:34,2017-06-02T15:34:00,Partner,Transfer,Intact Male,30.51693122,-97.58053027,104.5212302,,,
817.0,3 years,A699262,Dog,Staffordshire Mix,White/Black,2012-03-24,11/21/2015 13:47,2015-11-21T13:47:00,,Adoption,Spayed Female,30.57184663,-97.64943509,191.0820437,Mika,,
818.0,6 years,A623561,Dog,Pit Bull Mix,Blue/White,2009-04-03,4/28/2015 17:33,2015-04-28T17:33:00,,Return to Owner,Neutered Male,30.51053579,-97.28783429,316.6758929,Marley,,
819.0,2 years,A740785,Cat,Domestic Shorthair Mix,Black/White,2014-12-22,12/31/2016 16:12,2016-12-31T16:12:00,,Adoption,Spayed Female,30.67198554,-97.33389618,105.8107143,Purl,,
820.0,3 years,A713464,Dog,Maltese Mix,Black/White,2012-10-07,10/12/2015 17:27,2015-10-12T17:27:00,,Adoption,Spayed Female,30.28926377,-97.33714753,157.2467262,,,
821.0,3 years,A712304,Other,Bat Mix,Brown,2012-09-21,9/22/2015 8:12,2015-09-22T08:12:00,Rabies Risk,Euthanasia,Unknown,30.45245997,-97.47512097,156.6202381,,,
822.0,3 weeks,A753672,Dog,Beagle Mix,Brown,2017-06-18,7/11/2017 11:52,2017-07-11T11:52:00,Partner,Transfer,Intact Female,30.46546889,-97.73585267,3.356349206,,,
823.0,2 years,A677627,Cat,Domestic Shorthair Mix,Brown Tabby/White,2014-03-22,9/24/2016 13:28,2016-09-24T13:28:00,Partner,Transfer,Neutered Male,30.61077099,-97.26863168,131.0801587,*Charlie,,
824.0,5 years,A666559,Cat,Domestic Shorthair Mix,Black/White,2008-11-04,12/20/2013 14:24,2013-12-20T14:24:00,,Adoption,Intact Female,30.39165932,-97.39098131,267.5142857,*Shelby,,
825.0,4 months,A739233,Dog,Labrador Retriever Mix,Tan/Brown,2016-07-29,12/10/2016 17:58,2016-12-10T17:58:00,,Return to Owner,Neutered Male,30.32771257,-97.64375561,19.24980159,Timo,,
826.0,6 years,A700825,Dog,Shih Tzu Mix,Gray/White,2009-04-20,4/21/2015 12:01,2015-04-21T12:01:00,Partner,Transfer,Neutered Male,30.66872013,-97.46746032,313.2143849,Rocky,,
827.0,1 year,A701323,Cat,Domestic Shorthair Mix,Black,2014-04-27,4/28/2015 11:10,2015-04-28T11:10:00,,Return to Owner,Spayed Female,30.38807758,-97.64585956,52.35218254,Sheba,,
828.0,2 months,A703770,Cat,Domestic Shorthair Mix,Brown Tabby,2015-04-28,7/19/2015 19:48,2015-07-19T19:48:00,Foster,Adoption,Spayed Female,30.28693483,-97.64344939,11.83214286,*Mia,,
829.0,10 months,A719736,Dog,Pit Bull Mix,Blue/White,2015-03-26,1/30/2016 15:10,2016-01-30T15:10:00,,Return to Owner,Intact Male,30.67599535,-97.3813215,44.37599206,Bevo,,
830.0,19 years,A725915,Cat,Domestic Shorthair Mix,Black,1997-05-03,5/5/2016 12:22,2016-05-05T12:22:00,Suffering,Euthanasia,Neutered Male,30.44516134,-97.72659362,991.7878968,Snagglepuss,,
831.0,1 month,A704496,Dog,Labrador Retriever/Plott Hound,Black/White,2015-04-28,6/5/2015 16:04,2015-06-05T16:04:00,Partner,Transfer,Intact Male,30.29320475,-97.54388433,5.524206349,,,
832.0,4 months,A710130,Cat,Domestic Shorthair Mix,Black,2015-06-18,11/11/2015 19:17,2015-11-11T19:17:00,,Adoption,Neutered Male,30.64712097,-97.46582907,20.9719246,Tango,,
833.0,6 months,A680421,Dog,German Shepherd Mix,Tan,2013-12-02,6/29/2014 18:54,2014-06-29T18:54:00,,Adoption,Spayed Female,30.5850105,-97.51167068,29.96964286,*Dori,,
834.0,5 months,A758114,Cat,Domestic Shorthair Mix,Brown Tabby,2017-04-12,9/16/2017 22:04,2017-09-16T22:04:00,,Adoption,Spayed Female,30.70741804,-97.52714667,22.55992063,*Libby,,
835.0,8 months,A696413,Cat,Domestic Shorthair Mix,Cream Tabby,2014-06-04,2/5/2015 9:00,2015-02-05T09:00:00,SCRP,Transfer,Neutered Male,30.67892309,-97.42830532,35.19642857,Tony,,
836.0,2 months,A761473,Cat,Siamese Mix,Lynx Point,2017-10-08,12/15/2017 7:47,2017-12-15T07:47:00,Foster,Adoption,Neutered Male,30.39547622,-97.57213209,9.760615079,,,
837.0,2 years,A735889,Dog,Pit Bull Mix,White/Black,2014-10-01,10/2/2016 13:08,2016-10-02T13:08:00,,Return to Owner,Intact Male,30.76446179,-97.70687458,104.6496032,,,
838.0,3 weeks,A729076,Cat,Domestic Medium Hair Mix,Black,2016-05-22,6/13/2016 14:07,2016-06-13T14:07:00,Partner,Transfer,Unknown,30.37228761,-97.62485072,3.226884921,,,
839.0,6 years,A756670,Dog,Pomeranian/Cocker Spaniel,Red,2011-08-23,8/24/2017 13:01,2017-08-24T13:01:00,Partner,Transfer,Neutered Male,30.51433061,-97.39820329,313.3631944,Cooper,,
840.0,1 year,A726104,Bird,Grackle Mix,Black,2015-05-06,5/6/2016 13:39,2016-05-06T13:39:00,Suffering,Euthanasia,Unknown,30.56176897,-97.69365798,52.36696429,,,
841.0,2 years,A712909,Cat,Domestic Shorthair Mix,Orange Tabby,2013-09-29,9/30/2015 9:00,2015-09-30T09:00:00,SCRP,Transfer,Intact Male,30.74867606,-97.62633904,104.4821429,,,
842.0,6 years,A736590,Dog,Jack Russell Terrier Mix,White/Brown,2010-01-30,11/5/2016 13:53,2016-11-05T13:53:00,,Adoption,Neutered Male,30.46625907,-97.54835129,353.0826389,Buddy,,
843.0,1 month,A680409,Cat,Siamese Mix,Flame Point,2014-05-02,6/9/2014 15:50,2014-06-09T15:50:00,Partner,Transfer,Intact Female,30.30423023,-97.36017905,5.52281746,Lark,,
844.0,3 months,A754142,Cat,Domestic Shorthair Mix,Black/White,2017-05-01,8/9/2017 13:02,2017-08-09T13:02:00,Partner,Transfer,Intact Male,30.33590979,-97.57574536,14.36329365,*Gogo,,
845.0,1 year,A672005,Dog,Labrador Retriever/Pointer,Chocolate/White,2013-02-02,2/7/2014 15:00,2014-02-07T15:00:00,Partner,Transfer,Intact Female,30.73394915,-97.65088082,52.94642857,Hazel,,
846.0,2 years,A716891,Dog,Pit Bull Mix,Brown/White,2013-11-27,11/27/2015 16:55,2015-11-27T16:55:00,,Return to Owner,Spayed Female,30.39866758,-97.29542456,104.3864087,Nala,,
847.0,3 years,A757628,Dog,Basset Hound Mix,Tan,2014-09-04,9/15/2017 14:24,2017-09-15T14:24:00,Partner,Transfer,Intact Male,30.41013114,-97.57464067,158.2285714,128,,
848.0,5 days,A746786,Cat,Domestic Shorthair Mix,Brown Tabby,2017-04-04,4/9/2017 16:41,2017-04-09T16:41:00,Partner,Transfer,Intact Female,30.61234584,-97.66571437,0.81359127,,,
849.0,12 years,A671526,Dog,Labrador Retriever Mix,Yellow,2002-01-26,2/1/2014 18:30,2014-02-01T18:30:00,,Adoption,Spayed Female,30.68145431,-97.26239953,627.110119,Ethal,,
850.0,1 day,A700344,Cat,Domestic Shorthair Mix,Brown Tabby,2015-04-11,4/12/2015 13:41,2015-04-12T13:41:00,Partner,Transfer,Unknown,30.34454377,-97.68848804,0.224305556,,,
851.0,2 weeks,A758605,Cat,American Shorthair Mix,Brown Tabby/Black,2017-09-05,9/19/2017 18:37,2017-09-19T18:37:00,Partner,Transfer,Intact Female,30.57645027,-97.25701792,2.110813492,,,
852.0,3 months,A735834,Dog,Pit Bull Mix,Blue/White,2016-06-30,10/4/2016 19:00,2016-10-04T19:00:00,,Adoption,Neutered Male,30.60311318,-97.40734018,13.82738095,,,
853.0,1 year,A742653,Dog,Yorkshire Terrier Mix,Brown/Black,2016-01-25,1/25/2017 16:51,2017-01-25T16:51:00,,Return to Owner,Spayed Female,30.40579897,-97.67128291,52.3860119,Lilly,,
854.0,1 year,A757808,Dog,Pit Bull Mix,Blue,2016-09-07,12/27/2017 18:39,2017-12-27T18:39:00,,Return to Owner,Intact Male,30.35609559,-97.51640672,68.1110119,Peter,,
855.0,8 months,A748855,Cat,Domestic Shorthair Mix,Blue/White,2017-03-23,12/15/2017 7:51,2017-12-15T07:51:00,Foster,Adoption,Neutered Male,30.55167239,-97.60068323,38.18958333,,,
856.0,6 months,A757584,Dog,Labrador Retriever Mix,Tan/White,2017-03-04,9/9/2017 14:12,2017-09-09T14:12:00,,Rto-Adopt,Spayed Female,30.42925114,-97.70016414,27.08452381,Paloma,,
857.0,2 months,A668177,Cat,Domestic Shorthair Mix,Blue Tabby,2013-11-09,1/19/2014 17:02,2014-01-19T17:02:00,Offsite,Adoption,Neutered Male,30.76365437,-97.7181046,10.24424603,Dash,,
858.0,7 months,A732519,Dog,Boxer Mix,Brown/White,2016-07-03,2/12/2017 16:58,2017-02-12T16:58:00,,Adoption,Neutered Male,30.32820883,-97.69024377,32.10099206,Max,,
859.0,2 years,A754724,Bird,Hawk,Brown/White,2015-07-23,7/23/2017 15:53,2017-07-23T15:53:00,Medical,Euthanasia,Unknown,30.60778441,-97.57696554,104.5231151,,,
860.0,6 years,A752353,Dog,Bichon Frise Mix,White,2010-12-21,6/25/2017 12:42,2017-06-25T12:42:00,,Return to Owner,Neutered Male,30.41917204,-97.31070593,339.789881,Gunner,,
861.0,2 months,A727033,Dog,Labrador Retriever Mix,White/White,2016-03-02,5/20/2016 17:40,2016-05-20T17:40:00,,Return to Owner,Spayed Female,30.45313146,-97.59987293,11.39087302,Mona,,
862.0,13 years,A544916,Dog,Pit Bull,Blue,2001-05-29,2/19/2015 15:04,2015-02-19T15:04:00,Suffering,Euthanasia,Intact Male,30.67648415,-97.36070986,716.3753968,Blue,,
863.0,2 years,A755213,Dog,Pit Bull Mix,Blue/White,2015-07-31,10/8/2017 13:06,2017-10-08T13:06:00,,Adoption,Spayed Female,30.34222586,-97.52968778,114.3636905,Jinx,,
864.0,6 years,A755577,Dog,Rat Terrier Mix,Black/Gray,2011-08-05,8/10/2017 0:00,2017-08-10T00:00:00,Partner,Transfer,Neutered Male,30.37875192,-97.65426823,313.8571429,Peanut,,
865.0,5 years,A730713,Dog,Great Pyrenees Mix,White,2011-07-16,7/18/2016 19:05,2016-07-18T19:05:00,,Adoption,Neutered Male,30.28014067,-97.72770317,261.3993056,*Kip,,
866.0,2 years,A688785,Dog,American Bulldog Mix,Brown/White,2012-09-23,9/30/2014 8:16,2014-09-30T08:16:00,Aggressive,Euthanasia,Intact Male,30.41900076,-97.66404709,105.3349206,,,
867.0,2 months,A714071,Cat,Domestic Shorthair Mix,Calico/White,2015-09-17,12/16/2015 11:28,2015-12-16T11:28:00,Foster,Adoption,Spayed Female,30.66862956,-97.55903367,12.92539683,*Earth,,
868.0,5 months,A759517,Dog,Chihuahua Shorthair Mix,Brown/White,2017-05-03,10/6/2017 17:55,2017-10-06T17:55:00,,Adoption,Spayed Female,30.51459548,-97.46745358,22.39236111,Kya,,
869.0,2 years,A672587,Cat,Domestic Shorthair/British Shorthair,Torbie,2012-02-13,2/14/2014 14:21,2014-02-14T14:21:00,SCRP,Transfer,Intact Female,30.74676855,-97.42777094,104.6568452,,,
870.0,2 years,A765393,Dog,Cardigan Welsh Corgi,Tricolor,2016-01-19,1/19/2018 14:32,2018-01-19T14:32:00,,Return to Owner,Intact Male,30.52375038,-97.4065795,104.5150794,Pete,,
871.0,1 year,A684839,Cat,Domestic Shorthair Mix,Brown Tabby/White,2013-07-29,7/30/2014 9:00,2014-07-30T09:00:00,SCRP,Transfer,Intact Female,30.7632932,-97.53959349,52.33928571,,,
872.0,1 year,A710454,Other,Raccoon,Gray/Black,2014-08-23,8/25/2015 10:27,2015-08-25T10:27:00,Rabies Risk,Euthanasia,Unknown,30.48246458,-97.69553082,52.49077381,,,
873.0,1 year,A733732,Cat,Domestic Medium Hair Mix,Black,2015-08-26,2/2/2017 0:00,2017-02-02T00:00:00,Partner,Transfer,Spayed Female,30.50062352,-97.70110281,75.14285714,*Berenice,,
874.0,1 month,A680536,Cat,Domestic Shorthair Mix,Blue Tabby/White,2014-05-20,7/12/2014 13:56,2014-07-12T13:56:00,,Adoption,Intact Female,30.28367855,-97.25283153,7.654365079,Lilly,,
875.0,4 months,A755410,Cat,Domestic Shorthair Mix,Blue/White,2017-04-03,8/13/2017 17:51,2017-08-13T17:51:00,,Adoption,Spayed Female,30.34811748,-97.57930602,18.96339286,*Judy,,
876.0,2 months,A710541,Cat,Domestic Shorthair Mix,Blue/White,2015-08-14,10/17/2015 14:43,2015-10-17T14:43:00,,Adoption,Neutered Male,30.29143886,-97.24844027,9.230456349,*Alex,,
877.0,2 months,A752995,Dog,Labrador Retriever/Basset Hound,Black,2017-04-15,7/3/2017 17:37,2017-07-03T17:37:00,,Adoption,Neutered Male,30.56683409,-97.51597296,11.3905754,,,
878.0,2 months,A733873,Dog,Dalmatian Mix,Black/White,2016-06-16,9/1/2016 17:17,2016-09-01T17:17:00,,Adoption,Spayed Female,30.53302397,-97.63206321,11.10287698,,,
879.0,10 months,A685631,Cat,Domestic Shorthair Mix,Black/White,2013-10-10,8/11/2014 9:00,2014-08-11T09:00:00,SCRP,Transfer,Intact Male,30.57842465,-97.65208904,43.625,,,
880.0,6 years,A593537,Dog,Labrador Retriever Mix,Black,2009-02-13,3/4/2015 18:14,2015-03-04T18:14:00,,Return to Owner,Spayed Female,30.52468662,-97.37340852,315.8228175,Chacha,,
881.0,2 years,A762861,Dog,Great Pyrenees Mix,Cream,2015-11-28,12/10/2017 15:00,2017-12-10T15:00:00,,Adoption,Spayed Female,30.29058423,-97.38259049,106.2321429,*Snow,,
882.0,4 weeks,A744032,Cat,Domestic Shorthair Mix,White,2017-01-22,2/22/2017 13:58,2017-02-22T13:58:00,Partner,Transfer,Intact Male,30.50377116,-97.5777837,4.511706349,,,
883.0,7 years,A731668,Dog,Australian Cattle Dog Mix,Tan/White,2009-06-12,7/27/2016 11:45,2016-07-27T11:45:00,,Return to Owner,Neutered Male,30.68582727,-97.60677608,371.7842262,Harry Hound,,
884.0,3 years,A653765,Dog,Border Collie Mix,White/Black,2010-05-10,3/14/2014 17:53,2014-03-14T17:53:00,,Return to Owner,Neutered Male,30.63318923,-97.61705697,200.677877,Max,,
885.0,10 years,A716871,Cat,Domestic Longhair Mix,Tortie,2005-12-02,1/29/2016 11:50,2016-01-29T11:50:00,,Adoption,Spayed Female,30.72119008,-97.41484882,530.0704365,Tori,,
886.0,2 years,A736489,Dog,Labrador Retriever Mix,Black/White,2014-10-11,10/23/2016 16:23,2016-10-23T16:23:00,,Adoption,Neutered Male,30.6092267,-97.68158716,106.240377,*Leon,,
887.0,1 year,A751491,Cat,Domestic Shorthair Mix,Torbie,2016-06-08,6/12/2017 0:00,2017-06-12T00:00:00,Snr,Transfer,Spayed Female,30.63016477,-97.39228033,52.71428571,,,
888.0,8 years,A673693,Cat,Domestic Medium Hair Mix,White,2006-02-28,2/28/2014 17:02,2014-02-28T17:02:00,Suffering,Euthanasia,Intact Female,30.67316438,-97.70541838,417.5299603,,,
889.0,4 years,A750351,Dog,Chihuahua Shorthair Mix,Tricolor,2013-05-26,5/31/2017 12:18,2017-05-31T12:18:00,Partner,Transfer,Neutered Male,30.34805573,-97.51965651,209.5017857,,,
890.0,1 year,A709622,Other,Lionhead,Black,2014-08-11,8/11/2015 15:29,2015-08-11T15:29:00,Partner,Transfer,Intact Male,30.67681617,-97.51171058,52.23501984,,,
891.0,1 year,A761409,Dog,Pit Bull Mix,Blue/White,2015-11-04,4/14/2017 18:17,2017-04-14T18:17:00,,Adoption,Neutered Male,30.74667273,-97.61473771,75.39454365,Buster,,
892.0,4 months,A697260,Dog,Labrador Retriever Mix,Chocolate/White,2014-10-20,2/20/2015 19:06,2015-02-20T19:06:00,Partner,Transfer,Intact Male,30.5469577,-97.62601487,17.68511905,,,
893.0,8 years,A405494,Dog,Siberian Husky Mix,Black/Cream,2005-08-13,5/20/2014 11:44,2014-05-20T11:44:00,,Return to Owner,Spayed Female,30.42779036,-97.38401532,457.4984127,Kaila,,
894.0,6 months,A704254,Other,Bat,Brown,2014-12-02,6/3/2015 11:21,2015-06-03T11:21:00,,Died,Unknown,30.43617238,-97.25266252,26.21041667,,,
895.0,1 week,A726765,Cat,Domestic Shorthair Mix,Brown Tabby/White,2016-05-07,5/14/2016 17:07,2016-05-14T17:07:00,Partner,Transfer,Unknown,30.29558283,-97.45216777,1.101884921,,,
896.0,1 year,A749325,Dog,Pit Bull Mix,Brown,2016-05-13,5/17/2017 17:18,2017-05-17T17:18:00,,Adoption,Spayed Female,30.32032524,-97.53207521,52.8172619,Gisele,,
897.0,4 years,A754193,Dog,Yorkshire Terrier Mix,Tan,2013-07-17,7/17/2017 0:00,2017-07-17T00:00:00,Partner,Transfer,Unknown,30.5477391,-97.30935938,208.7142857,,,
898.0,1 year,A675222,Cat,Domestic Shorthair Mix,Black,2013-03-25,3/26/2014 15:55,2014-03-26T15:55:00,SCRP,Transfer,Intact Female,30.42520633,-97.32755581,52.38045635,,,
899.0,1 year,A734652,Cat,Domestic Medium Hair Mix,White/Orange,2015-09-10,9/13/2016 12:36,2016-09-13T12:36:00,Partner,Transfer,Intact Male,30.27132126,-97.27539847,52.78928571,Ricky,,
900.0,2 years,A674816,Dog,Pit Bull/Boxer,Brown Brindle,2013-07-18,5/13/2016 14:49,2016-05-13T14:49:00,,Return to Owner,Neutered Male,30.40494724,-97.37702209,147.2310516,Bruce,,
901.0,1 year,A727844,Dog,Beagle Mix,Tricolor,2015-05-26,5/29/2016 14:34,2016-05-29T14:34:00,,Adoption,Spayed Female,30.61642077,-97.33951853,52.80099206,Daisy,,
902.0,1 year,A664814,Dog,Chihuahua Shorthair/Rat Terrier,White/Brown,2012-10-09,12/17/2013 16:40,2013-12-17T16:40:00,,Adoption,Spayed Female,30.31560656,-97.32880379,62.09920635,,,
903.0,3 years,A712212,Cat,Domestic Shorthair Mix,White/Brown Tabby,2012-09-19,10/5/2015 18:13,2015-10-05T18:13:00,,Adoption,Neutered Male,30.29820537,-97.58780345,158.8227183,Luna,,
904.0,3 months,A717928,Cat,Domestic Shorthair Mix,Calico,2015-09-17,12/22/2015 13:49,2015-12-22T13:49:00,,Adoption,Intact Female,30.27313646,-97.43895083,13.79652778,Marley,,
905.0,2 years,A751904,Cat,Domestic Shorthair Mix,Black,2015-06-15,8/19/2017 12:03,2017-08-19T12:03:00,,Adoption,Spayed Female,30.6094777,-97.40212881,113.7860119,Shasta,,
906.0,1 year,A715357,Dog,Labrador Retriever/Pembroke Welsh Corgi,Black,2014-11-04,11/8/2015 0:00,2015-11-08T00:00:00,Partner,Transfer,Intact Female,30.39378945,-97.29084081,52.71428571,*Roxy,,
907.0,14 years,A665959,Dog,Siberian Husky Mix,Black/White,1998-12-27,10/29/2013 11:32,2013-10-29T11:32:00,,Return to Owner,Spayed Female,30.54913574,-97.57433043,774.3543651,*Moomoo,,
908.0,1 year,A688239,Cat,Domestic Shorthair Mix,Blue,2013-09-16,9/18/2014 9:00,2014-09-18T09:00:00,SCRP,Transfer,Intact Male,30.58149303,-97.54377224,52.48214286,,,
909.0,2 months,A752332,Dog,Australian Shepherd Mix,Brown/White,2017-04-06,6/25/2017 17:32,2017-06-25T17:32:00,,Adoption,Spayed Female,30.73605442,-97.48678606,11.53293651,,,
910.0,2 months,A741279,Cat,Domestic Medium Hair Mix,Black/White,2016-10-30,1/3/2017 12:00,2017-01-03T12:00:00,,Adoption,Intact Female,30.50445726,-97.53180044,9.357142857,Nora,,
911.0,2 months,A717255,Dog,Border Collie Mix,Brown Brindle/White,2015-10-04,12/7/2015 15:59,2015-12-07T15:59:00,,Adoption,Neutered Male,30.52102431,-97.55729499,9.237996032,Ohana,,
912.0,6 months,A713683,Dog,Australian Cattle Dog Mix,Blue Tick,2015-04-26,11/2/2015 18:47,2015-11-02T18:47:00,Foster,Adoption,Neutered Male,30.48529568,-97.25392406,27.2546627,Garth,,
913.0,1 year,A693854,Other,New Zealand Wht Mix,White,2013-12-15,12/24/2014 15:18,2014-12-24T15:18:00,Partner,Transfer,Intact Male,30.52564368,-97.26221364,53.51964286,,,
914.0,2 years,A701536,Other,Bat Mix,Brown,2013-05-01,5/1/2015 11:57,2015-05-01T11:57:00,Rabies Risk,Euthanasia,Unknown,30.45543364,-97.5491811,104.3568452,,,
915.0,4 years,A699175,Dog,Boerboel Mix,Tan/White,2011-03-23,4/30/2015 16:41,2015-04-30T16:41:00,Aggressive,Euthanasia,Neutered Male,30.32774527,-97.70162351,214.2421627,Mojo,,
916.0,5 years,A743288,Dog,Cairn Terrier Mix,Tan,2012-02-07,2/11/2017 13:41,2017-02-11T13:41:00,Partner,Transfer,Intact Female,30.59882805,-97.34663475,261.652877,,,
917.0,10 years,A748451,Dog,Boxer Mix,Brown/White,2007-05-03,5/15/2017 12:53,2017-05-15T12:53:00,,Adoption,Spayed Female,30.55026045,-97.51658388,523.6481151,*Magpie,,
918.0,1 year,A743477,Cat,Domestic Shorthair Mix,Black/White,2016-02-11,2/12/2017 9:00,2017-02-12T09:00:00,SCRP,Transfer,Intact Male,30.4288671,-97.32730202,52.48214286,,,
919.0,4 months,A714347,Dog,Basset Hound Mix,Tricolor,2015-06-07,10/31/2015 12:50,2015-10-31T12:50:00,,Adoption,Neutered Male,30.29810002,-97.72099974,20.93353175,Dexter,,
920.0,12 years,A656471,Dog,Boxer Mix,Apricot,2001-06-15,1/25/2014 16:10,2014-01-25T16:10:00,Foster,Adoption,Neutered Male,30.57057198,-97.48802913,658.2390873,Sirius,,
921.0,2 months,A747200,Cat,Domestic Shorthair Mix,Cream/White,2017-04-01,6/30/2017 12:15,2017-06-30T12:15:00,,Adoption,Neutered Male,30.47713506,-97.61642922,12.93005952,*Toffeekins,,
922.0,1 year,A729322,Dog,Cairn Terrier Mix,Black/White,2015-06-16,6/21/2016 15:59,2016-06-21T15:59:00,Partner,Transfer,Intact Male,30.39415793,-97.38903694,53.09513889,*Parker,,
923.0,1 year,A699258,Other,Bat,Black/Brown,2014-03-24,3/24/2015 17:28,2015-03-24T17:28:00,Rabies Risk,Euthanasia,Unknown,30.61749655,-97.55929526,52.2468254,,,
924.0,9 months,A652270,Dog,Rhod Ridgeback Mix,Brown,2013-02-22,12/19/2013 11:35,2013-12-19T11:35:00,Partner,Transfer,Spayed Female,30.69683663,-97.48604614,42.92609127,Lila,,
925.0,1 year,A702450,Dog,Black Mouth Cur Mix,Tan/White,2014-05-13,5/17/2015 16:51,2015-05-17T16:51:00,,Return to Owner,Spayed Female,30.31861932,-97.72299353,52.81458333,Jamie,,
926.0,2 months,A734284,Cat,Domestic Medium Hair Mix,Brown Tabby,2016-07-28,10/21/2016 8:08,2016-10-21T08:08:00,Foster,Adoption,Spayed Female,30.55875721,-97.59875197,12.19126984,*Rebbie J.,,
927.0,2 months,A669185,Dog,Labrador Retriever Mix,Tan/White,2013-10-16,12/18/2013 18:27,2013-12-18T18:27:00,,Adoption,Spayed Female,30.51913797,-97.32276685,9.109821429,,,
928.0,1 year,A683208,Cat,Domestic Shorthair Mix,Blue Tabby/White,2013-07-08,7/21/2014 10:40,2014-07-21T10:40:00,Partner,Transfer,Spayed Female,30.31393797,-97.27419436,54.06349206,X,,
929.0,6 years,A683245,Cat,Domestic Shorthair Mix,Cream Tabby,2008-07-09,7/24/2014 12:47,2014-07-24T12:47:00,Partner,Transfer,Neutered Male,30.66095087,-97.73052131,315.2189484,X,,
930.0,5 years,A721607,Dog,Beagle Mix,Tricolor,2011-03-01,3/2/2016 17:58,2016-03-02T17:58:00,Partner,Transfer,Neutered Male,30.39858402,-97.38735189,261.2498016,Dwight,,
931.0,2 months,A664661,Cat,Domestic Shorthair Mix,Black/White,2013-08-07,10/13/2013 17:04,2013-10-13T17:04:00,,Adoption,Spayed Female,30.51615732,-97.31841571,9.673015873,Lily,,
932.0,3 years,A666882,Dog,Great Pyrenees Mix,White,2010-11-08,12/1/2013 18:09,2013-12-01T18:09:00,,Adoption,Neutered Male,30.48219225,-97.66171877,159.9651786,Zeus,,
933.0,14 years,A691324,Dog,Labrador Retriever Mix,Black/White,2000-11-03,1/17/2015 20:42,2015-01-17T20:42:00,Offsite,Adoption,Neutered Male,30.74401581,-97.64873604,741.2660714,Dante,,
934.0,6 months,A734241,Other,Rabbit Sh Mix,Sable/Brown,2016-03-03,9/10/2016 13:15,2016-09-10T13:15:00,In Kennel,Died,Intact Female,30.3717012,-97.63267201,27.36458333,,,
935.0,2 years,A762687,Dog,Black/Tan Hound Mix,Brown/White,2015-11-24,12/30/2017 13:08,2017-12-30T13:08:00,,Adoption,Neutered Male,30.70428255,-97.62647386,109.6496032,*Ajax,,
936.0,2 months,A742492,Dog,Pointer Mix,White/Black,2016-12-22,2/24/2017 8:13,2017-02-24T08:13:00,Foster,Adoption,Neutered Male,30.3803218,-97.34897535,9.191765873,,,
937.0,13 years,A686210,Cat,Pixiebob Shorthair Mix,Brown Tabby,2001-08-18,6/13/2015 14:08,2015-06-13T14:08:00,Foster,Adoption,Spayed Female,30.42637131,-97.47538123,721.084127,Kya,,
938.0,1 year,A721019,Dog,English Coonhound,Black/Brown,2015-02-19,11/26/2016 18:50,2016-11-26T18:50:00,,Adoption,Spayed Female,30.52171683,-97.30689006,92.39781746,*Ziggy,,
939.0,6 months,A685260,Dog,Pointer/Border Collie,Black/White,2014-02-17,8/30/2014 13:33,2014-08-30T13:33:00,,Adoption,Spayed Female,30.40536433,-97.3618006,27.79494048,Sweetie,,
940.0,9 months,A696485,Dog,Blue Lacy Mix,Blue/White,2014-05-05,2/12/2015 14:42,2015-02-12T14:42:00,,Adoption,Spayed Female,30.43034282,-97.43455616,40.51607143,*Imelda,,
941.0,2 months,A668533,Dog,Australian Shepherd Mix,Tricolor,2013-10-04,12/6/2013 16:34,2013-12-06T16:34:00,Partner,Transfer,Intact Female,30.66225658,-97.67508486,9.098611111,*Faith,,
942.0,13 years,A651860,Dog,Labrador Retriever/Vizsla,Tan,2003-04-16,4/20/2016 11:38,2016-04-20T11:38:00,,Return to Owner,Neutered Male,30.34111213,-97.45554932,679.069246,Chase,,
943.0,1 year,A732284,Other,Bat,Black/Brown,2015-08-05,8/5/2016 13:15,2016-08-05T13:15:00,Rabies Risk,Euthanasia,Unknown,30.63465008,-97.70315059,52.36458333,,,
944.0,3 years,A668209,Dog,Yorkshire Terrier/Chihuahua Longhair,Gray/Black,2010-11-29,12/11/2013 12:14,2013-12-11T12:14:00,Partner,Transfer,Intact Female,30.38122792,-97.67270586,158.3585317,Cindi Lou,,
945.0,1 month,A748820,Cat,Domestic Shorthair Mix,Brown Tabby/White,2017-04-04,6/2/2017 17:55,2017-06-02T17:55:00,Foster,Adoption,Spayed Female,30.48338289,-97.64255049,8.535218254,Izzy,,
946.0,8 years,A725593,Cat,Domestic Shorthair Mix,Blue Tabby/White,2008-04-30,5/6/2016 13:58,2016-05-06T13:58:00,,Adoption,Neutered Male,30.74240515,-97.46616327,418.3688492,Dooley,,
947.0,6 months,A704718,Cat,Domestic Shorthair Mix,White/Black,2015-05-08,11/25/2015 7:29,2015-11-25T07:29:00,Foster,Adoption,Neutered Male,30.49160787,-97.54414634,28.75882937,*Paulie,,
948.0,1 year,A704398,Other,Lop-English Mix,Silver,2014-06-04,6/22/2015 18:33,2015-06-22T18:33:00,Partner,Transfer,Intact Male,30.52719184,-97.54861705,54.82470238,,,
949.0,5 months,A706697,Cat,Domestic Shorthair Mix,Orange Tabby,2015-04-10,9/19/2015 19:02,2015-09-19T19:02:00,,Adoption,Neutered Male,30.40682036,-97.71991369,23.25615079,*Toby,,
950.0,2 months,A749615,Dog,Labrador Retriever Mix,Tricolor,2017-05-16,8/2/2017 11:59,2017-08-02T11:59:00,Foster,Adoption,Neutered Male,30.70852473,-97.54171213,11.21418651,*Frankie,,
951.0,2 years,A669859,Dog,Pit Bull Mix,Red/White,2011-12-28,1/8/2014 16:10,2014-01-08T16:10:00,Behavior,Euthanasia,Intact Male,30.30688104,-97.40802549,106.0962302,*Mack,,
952.0,1 year,A727627,Dog,Pit Bull Mix,Brown Brindle/White,2015-05-23,5/26/2016 17:13,2016-05-26T17:13:00,,Return to Owner,Neutered Male,30.45998533,-97.64430015,52.81676587,Cesar,,
953.0,1 month,A690192,Dog,Plott Hound Mix,Black,2014-08-31,10/16/2014 16:55,2014-10-16T16:55:00,Partner,Transfer,Intact Male,30.49835061,-97.35689425,6.672123016,,,
954.0,1 year,A687108,Dog,Boxer,Brown Brindle/White,2013-10-01,10/26/2014 12:28,2014-10-26T12:28:00,,Return to Owner,Intact Male,30.61729308,-97.26085652,55.78849206,Jace,,
955.0,1 year,A624126,Dog,Pit Bull Mix,Blue Tiger/White,2012-01-28,11/19/2013 12:26,2013-11-19T12:26:00,,Return to Owner,Neutered Male,30.42549481,-97.55937597,94.50257937,Blue,,
956.0,1 year,A686300,Dog,Pit Bull Mix,White/Chocolate,2013-02-20,8/21/2014 18:05,2014-08-21T18:05:00,,Return to Owner,Neutered Male,30.5801046,-97.49869668,78.25049603,Titus,,
957.0,2 months,A706331,Cat,Domestic Shorthair Mix,Black,2015-06-05,8/29/2015 14:37,2015-08-29T14:37:00,Offsite,Adoption,Neutered Male,30.34207603,-97.56748745,12.22986111,*Peter,,
958.0,2 years,A671064,Cat,Domestic Medium Hair Mix,Black,2012-01-17,6/23/2014 20:20,2014-06-23T20:20:00,Foster,Adoption,Spayed Female,30.39249954,-97.45547087,126.9781746,*Marie,,
959.0,5 years,A701495,Dog,Pit Bull Mix,Blue/White,2010-04-30,12/19/2015 10:01,2015-12-19T10:01:00,Foster,Adoption,Spayed Female,30.26954665,-97.69985131,294.2024802,Bella,,
960.0,1 month,A689177,Dog,Golden Retriever Mix,Brown,2014-08-30,10/22/2014 15:56,2014-10-22T15:56:00,Foster,Adoption,Neutered Male,30.58857154,-97.46655312,7.666269841,,,
961.0,2 years,A746658,Dog,Akita Mix,Red,2014-10-06,4/30/2017 16:37,2017-04-30T16:37:00,,Adoption,Neutered Male,30.33631569,-97.28157252,133.9560516,Henry,,
962.0,7 years,A693120,Dog,Golden Retriever Mix,Gold,2007-12-02,12/4/2014 18:51,2014-12-04T18:51:00,Partner,Transfer,Neutered Male,30.55310274,-97.4993115,365.683631,Rex,,
963.0,1 month,A755178,Dog,Labrador Retriever Mix,Black/White,2017-05-30,7/30/2017 16:07,2017-07-30T16:07:00,Partner,Transfer,Intact Male,30.75763616,-97.63543574,8.810218254,,,
964.0,5 months,A760903,Cat,Domestic Shorthair Mix,Black,2017-05-25,11/7/2017 18:28,2017-11-07T18:28:00,,Adoption,Neutered Male,30.64550344,-97.34880858,23.82420635,*Donnie,,
965.0,1 year,A718864,Dog,Pit Bull Mix,Brown Brindle,2015-01-08,2/7/2016 15:13,2016-02-07T15:13:00,,Adoption,Spayed Female,30.45850505,-97.36401797,56.51914683,*Wilma,,
966.0,3 years,A746625,Dog,Pit Bull Mix,Blue,2014-04-05,1/10/2018 15:27,2018-01-10T15:27:00,,Return to Owner,Intact Male,30.45924879,-97.62234939,196.6633929,Blue,,
967.0,8 months,A695911,Dog,Labrador Retriever Mix,Black/White,2014-05-25,1/31/2015 13:46,2015-01-31T13:46:00,,Adoption,Neutered Male,30.58302626,-97.37348518,35.9390873,Jordy,,
968.0,4 months,A681455,Dog,Labrador Retriever Mix,Brown/White,2014-02-16,6/22/2014 17:47,2014-06-22T17:47:00,,Adoption,Spayed Female,30.38651266,-97.43785857,18.10585317,,,
969.0,2 months,A665655,Cat,Domestic Shorthair Mix,Brown Tabby,2013-08-21,10/23/2013 17:30,2013-10-23T17:30:00,Partner,Transfer,Intact Female,30.45956035,-97.71748752,9.104166667,,,
970.0,5 months,A709069,Cat,Domestic Shorthair Mix,Black/White,2015-03-04,8/16/2015 18:15,2015-08-16T18:15:00,,Adoption,Neutered Male,30.45241566,-97.71826134,23.68005952,Leo,,
971.0,1 year,A714128,Cat,Domestic Shorthair Mix,Orange Tabby,2014-10-18,10/19/2015 9:00,2015-10-19T09:00:00,SCRP,Transfer,Intact Male,30.5763316,-97.67468463,52.33928571,,,
972.0,1 year,A675161,Other,Bat Mix,Black/Brown,2013-03-24,3/24/2014 15:35,2014-03-24T15:35:00,Rabies Risk,Euthanasia,Unknown,30.70808985,-97.55385316,52.23561508,,,
973.0,3 weeks,A686113,Dog,Australian Kelpie Mix,Sable,2014-07-25,8/20/2014 14:06,2014-08-20T14:06:00,Partner,Transfer,Intact Male,30.51609184,-97.46348799,3.798214286,,,
974.0,1 year,A691586,Dog,Pit Bull Mix,Tan/White,2013-05-07,12/24/2014 17:33,2014-12-24T17:33:00,Partner,Transfer,Spayed Female,30.39254451,-97.46391449,85.24732143,*Cassidy,,
975.0,4 months,A756819,Cat,Domestic Shorthair Mix,Orange Tabby,2017-04-25,8/31/2017 18:49,2017-08-31T18:49:00,,Adoption,Neutered Male,30.4179158,-97.63604605,18.39771825,*Nashville,,
976.0,2 years,A714811,Cat,Domestic Shorthair Mix,Black/White,2013-10-28,10/29/2015 9:00,2015-10-29T09:00:00,SCRP,Transfer,Intact Male,30.44654586,-97.63061552,104.4821429,,,
977.0,1 year,A742656,Other,Raccoon,Brown/Black,2016-01-25,1/26/2017 8:48,2017-01-26T08:48:00,Rabies Risk,Euthanasia,Unknown,30.47602204,-97.2748374,52.48095238,,,
978.0,10 months,A683712,Dog,Dachshund Wirehair/Chihuahua Longhair,Gray/White,2013-09-14,7/21/2014 13:07,2014-07-21T13:07:00,Partner,Transfer,Spayed Female,30.33650254,-97.27534442,44.36378968,,,
979.0,4 months,A755997,Cat,Domestic Shorthair Mix,Black/White,2017-07-23,12/10/2017 18:24,2017-12-10T18:24:00,,Adoption,Neutered Male,30.59800863,-97.51057257,20.10952381,Luke,,
980.0,1 year,A761372,Cat,Domestic Shorthair Mix,Orange Tabby/White,2016-11-03,11/19/2017 14:33,2017-11-19T14:33:00,,Adoption,Spayed Female,30.55963962,-97.49544468,54.51517857,*Marmalade,,
981.0,3 years,A762370,Bird,Muscovy,Black/White,2014-11-19,11/22/2017 10:51,2017-11-22T10:51:00,Partner,Transfer,Unknown,30.44221852,-97.58416364,157.0645833,,,
982.0,1 week,A745166,Cat,Domestic Shorthair Mix,Black,2017-03-06,3/13/2017 18:11,2017-03-13T18:11:00,Partner,Transfer,Intact Female,30.4270712,-97.72788545,1.108234127,,,
983.0,5 months,A696218,Cat,Domestic Shorthair Mix,Black,2014-08-31,2/6/2015 16:50,2015-02-06T16:50:00,,Adoption,Neutered Male,30.39675399,-97.52263395,22.81448413,Mo,,
984.0,1 year,A676786,Dog,Chihuahua Shorthair Mix,White/Brown,2013-04-15,4/20/2014 18:34,2014-04-20T18:34:00,,Adoption,Spayed Female,30.40675779,-97.73082125,52.96765873,Tuzi,,
985.0,2 months,A690731,Cat,Balinese Mix,Chocolate Point/White,2014-08-25,10/31/2014 12:20,2014-10-31T12:20:00,,Adoption,Intact Male,30.55535563,-97.45788543,9.64484127,Jinx,,
986.0,1 year,A699457,Other,Bat Mix,Brown,2014-03-27,3/28/2015 8:40,2015-03-28T08:40:00,Rabies Risk,Euthanasia,Unknown,30.76538117,-97.72298209,52.33730159,,,
987.0,5 months,A763984,Dog,Chihuahua Shorthair Mix,Black/White,2017-07-23,12/23/2017 16:16,2017-12-23T16:16:00,,Adoption,Spayed Female,30.66219725,-97.51587671,21.95396825,,,
988.0,1 year,A686960,Dog,Mastiff Mix,Tan/Black,2013-03-03,9/1/2014 18:17,2014-09-01T18:17:00,,Return to Owner,Neutered Male,30.57038913,-97.63642958,78.25168651,Tonka,,
989.0,1 year,A758342,Other,Bat,Brown,2016-09-14,9/14/2017 17:21,2017-09-14T17:21:00,Rabies Risk,Euthanasia,Unknown,30.54682319,-97.47949133,52.24613095,,,
990.0,7 months,A707005,Dog,Golden Retriever/Border Collie,Gold/Cream,2014-12-09,7/12/2015 17:37,2015-07-12T17:37:00,,Adoption,Neutered Male,30.32871992,-97.53846138,30.81914683,*Jake,,
991.0,2 months,A711467,Cat,Domestic Shorthair Mix,Black,2015-07-23,10/10/2015 14:52,2015-10-10T14:52:00,Foster,Adoption,Neutered Male,30.27055648,-97.66901885,11.37420635,*Peanut,,
992.0,7 years,A691889,Dog,Labrador Retriever Mix,Black,2007-11-11,11/18/2014 17:56,2014-11-18T17:56:00,,Adoption,Spayed Female,30.54806196,-97.30310624,366.3924603,*Molly,,
993.0,1 year,A736818,Dog,Australian Cattle Dog,Red Tick/Tan,2015-10-17,11/10/2016 16:08,2016-11-10T16:08:00,,Adoption,Neutered Male,30.34547909,-97.53867584,55.81031746,*Cisco,,
994.0,2 months,A741267,Dog,Labrador Retriever Mix,Black/White,2016-10-30,1/5/2017 17:31,2017-01-05T17:31:00,,Adoption,Spayed Female,30.35704201,-97.71843279,9.675694444,,,
995.0,1 year,A692511,Dog,Pit Bull Mix,Tan/White,2013-11-21,1/8/2015 18:06,2015-01-08T18:06:00,,Return to Owner,Spayed Female,30.57092281,-97.7369848,59.1077381,Ella,,
996.0,11 months,A755281,Cat,Domestic Shorthair Mix,Blue Tabby/White,2017-01-01,12/27/2017 15:42,2017-12-27T15:42:00,,Adoption,Neutered Male,30.76153028,-97.46421737,51.52202381,Haku,,
997.0,2 years,A718203,Dog,Labrador Retriever Mix,Black,2013-12-23,4/12/2016 14:40,2016-04-12T14:40:00,,Adoption,Spayed Female,30.70617383,-97.36597396,120.2301587,Crissy,,
998.0,1 year,A733531,Cat,Domestic Shorthair Mix,Orange Tabby/White,2015-08-23,9/22/2016 16:01,2016-09-22T16:01:00,Partner,Transfer,Spayed Female,30.34890815,-97.41972798,56.66676587,*Ellis,,
999.0,13 years,A707937,Dog,Chihuahua Shorthair Mix,Black/Brown,2002-07-20,7/25/2015 11:31,2015-07-25T11:31:00,,Adoption,Neutered Male,30.6260542,-97.69737902,679.0685516,Blackie,,
1000.0,1 year,A751510,Cat,Domestic Shorthair Mix,Blue/White,2016-06-09,6/27/2017 18:13,2017-06-27T18:13:00,,Return to Owner,Neutered Male,30.41181727,-97.68328107,54.82271825,Sammy,,
1001.0,5 months,A733863,Dog,Rat Terrier Mix,Tricolor,2016-04-13,10/4/2016 9:43,2016-10-04T09:43:00,In Kennel,Died,Neutered Male,30.65807838,-97.72861493,24.91498016,Dobby,,
1002.0,1 year,A688409,Other,Opossum Mix,Gray/Pink,2013-09-19,9/19/2014 11:58,2014-09-19T11:58:00,Rabies Risk,Euthanasia,Unknown,30.40205143,-97.30953421,52.2140873,,,
1003.0,4 years,A715268,Dog,Pit Bull Mix,Tan/White,2011-11-03,12/14/2015 20:10,2015-12-14T20:10:00,Partner,Transfer,Intact Female,30.72643461,-97.40444351,214.6914683,*Cece,,
1004.0,4 months,A741961,Cat,Domestic Shorthair Mix,Brown Tabby/White,2016-10-03,2/4/2017 14:28,2017-02-04T14:28:00,Foster,Adoption,Spayed Female,30.53802253,-97.66727181,17.80039683,*Chanel,,
1005.0,2 months,A681938,Cat,Domestic Shorthair Mix,Torbie,2014-05-06,7/7/2014 13:22,2014-07-07T13:22:00,Suffering,Euthanasia,Intact Female,30.67268505,-97.31733803,8.936706349,*Martha,,
1006.0,3 months,A715339,Cat,Domestic Shorthair Mix,Brown Tabby,2015-10-13,1/16/2016 14:17,2016-01-16T14:17:00,Foster,Adoption,Spayed Female,30.27823823,-97.49523401,13.65644841,,,
1007.0,2 years,A753426,Cat,Domestic Shorthair Mix,White,2015-07-06,7/10/2017 18:10,2017-07-10T18:10:00,Snr,Transfer,Spayed Female,30.30904141,-97.62075279,105.1081349,,,
1008.0,16 years,A745857,Dog,Pekingese Mix,Brown/White,2001-03-26,3/26/2017 13:20,2017-03-26T13:20:00,,Return to Owner,Intact Female,30.29130217,-97.26149179,834.9365079,Lucy,,
1009.0,3 months,A734461,Cat,Domestic Medium Hair Mix,Black,2016-06-06,9/10/2016 15:55,2016-09-10T15:55:00,,Adoption,Neutered Male,30.47631429,-97.44248215,13.80902778,Baghera,,
1010.0,2 months,A705516,Cat,Domestic Shorthair Mix,Blue/White,2015-04-03,6/24/2015 12:23,2015-06-24T12:23:00,Partner,Transfer,Spayed Female,30.39655422,-97.2602516,11.78799603,*Leila,,
1011.0,1 year,A642946,Cat,Domestic Shorthair Mix,Brown Tabby/White,2012-07-17,12/29/2013 12:24,2013-12-29T12:24:00,,Adoption,Spayed Female,30.38109887,-97.35410145,75.78809524,Zooey,,
1012.0,3 years,A676126,Dog,Labrador Retriever Mix,Black,2011-04-05,5/10/2014 11:17,2014-05-10T11:17:00,,Adoption,Spayed Female,30.61642973,-97.56277588,161.6385913,*Jelly Bean,,
1013.0,1 year,A702189,Cat,Domestic Shorthair Mix,Brown Tabby,2014-05-10,5/23/2015 16:00,2015-05-23T16:00:00,,Adoption,Spayed Female,30.46185112,-97.47080306,54.0952381,Kylie,,
1014.0,1 year,A733405,Dog,Catahoula/Staffordshire,Brown Brindle/White,2015-08-21,8/31/2016 15:36,2016-08-31T15:36:00,,Adoption,Intact Female,30.68427545,-97.72740152,53.80714286,Iris,,
1015.0,2 months,A758511,Cat,Domestic Medium Hair Mix,Blue/White,2017-08-27,11/15/2017 16:30,2017-11-15T16:30:00,Foster,Adoption,Neutered Male,30.48778607,-97.57893408,11.52678571,*Kiblet,,
1016.0,2 years,A722108,Dog,Pit Bull Mix,Brown Brindle/White,2014-09-11,11/18/2016 13:21,2016-11-18T13:21:00,,Return to Owner,Neutered Male,30.57975164,-97.33019787,114.2223214,*Mack,,
1017.0,10 years,A718977,Dog,Catahoula Mix,Brown,2006-01-10,9/1/2016 11:46,2016-09-01T11:46:00,Foster,Adoption,Spayed Female,30.41923109,-97.4818778,555.355754,Bella,,
1018.0,2 months,A742491,Dog,Pointer Mix,White/Black,2016-12-22,2/24/2017 11:08,2017-02-24T11:08:00,Foster,Adoption,Neutered Male,30.27526481,-97.58378579,9.209126984,*Ponce,,
1019.0,2 months,A667809,Dog,German Shepherd Mix,Brown/Black,2013-09-23,11/30/2013 17:37,2013-11-30T17:37:00,,Adoption,Spayed Female,30.53933273,-97.68925159,9.819146825,Lily,,
1020.0,8 years,A672357,Dog,Carolina Dog Mix,Red,2006-02-08,3/29/2014 14:39,2014-03-29T14:39:00,,Adoption,Spayed Female,30.59850038,-97.64784104,424.5157738,Princess,,
1021.0,2 years,A679467,Dog,Siberian Husky Mix,Black/Brown,2011-12-21,5/29/2014 15:32,2014-05-29T15:32:00,,Adoption,Spayed Female,30.70712061,-97.39077382,127.2353175,Asia,,
1022.0,3 days,A721726,Cat,Domestic Shorthair Mix,Black/White,2016-02-29,3/3/2016 13:18,2016-03-03T13:18:00,Partner,Transfer,Intact Male,30.60122104,-97.33546398,0.507738095,,,
1023.0,2 months,A710350,Dog,Border Collie Mix,Black,2015-06-22,8/26/2015 18:41,2015-08-26T18:41:00,,Adoption,Neutered Male,30.40455622,-97.50984937,9.396924603,Oso,,
1024.0,1 year,A704877,Cat,Domestic Shorthair Mix,Brown Tabby/White,2014-06-10,6/11/2015 7:59,2015-06-11T07:59:00,Suffering,Euthanasia,Intact Male,30.6352467,-97.4645698,52.33323413,,,
1025.0,2 years,A764175,Dog,Siberian Husky Mix,Red/White,2015-12-23,12/29/2017 15:20,2017-12-29T15:20:00,,Return to Owner,Neutered Male,30.54014737,-97.71108361,105.3769841,Moonie,,
1026.0,1 month,A713368,Cat,Domestic Shorthair Mix,Blue,2015-10-01,11/13/2015 11:54,2015-11-13T11:54:00,Partner,Transfer,Intact Male,30.49492144,-97.31567884,6.213690476,,,
1027.0,3 years,A687107,Dog,Rhod Ridgeback/Pit Bull,Red/Brown,2013-12-01,10/4/2017 17:57,2017-10-04T17:57:00,,Return to Owner,Neutered Male,30.71731941,-97.69668304,200.5354167,Montopolis,,
1028.0,2 years,A669680,Dog,Plott Hound Mix,Brown Brindle/White,2011-12-24,3/28/2014 12:27,2014-03-28T12:27:00,,Return to Owner,Neutered Male,30.43250419,-97.53417966,117.93125,Nino,,
1029.0,7 months,A691064,Cat,Domestic Shorthair Mix,Torbie,2014-03-01,10/30/2014 9:00,2014-10-30T09:00:00,SCRP,Transfer,Intact Female,30.33862669,-97.39132498,34.76785714,,,
1030.0,3 months,A721480,Dog,Pit Bull Mix,Red,2015-11-09,3/3/2016 0:00,2016-03-03T00:00:00,Partner,Transfer,Intact Female,30.44449023,-97.54728394,16.42857143,,,
1031.0,4 weeks,A678765,Dog,Black Mouth Cur Mix,Tan,2014-04-13,5/13/2014 15:19,2014-05-13T15:19:00,Partner,Transfer,Intact Male,30.55616224,-97.7235155,4.376884921,,,
1032.0,6 months,A729159,Other,Opossum,Gray,2015-12-14,6/14/2016 12:03,2016-06-14T12:03:00,Medical,Euthanasia,Unknown,30.6993113,-97.71941631,26.21458333,,,
1033.0,11 months,A734251,Other,Hotot Mix,White/Black,2016-01-03,12/12/2016 12:19,2016-12-12T12:19:00,,Adoption,Spayed Female,30.7456053,-97.38429986,49.21617063,*Marilyn Bun,,
1034.0,5 months,A719465,Dog,Pug Mix,Cream/Black,2015-08-24,1/25/2016 17:11,2016-01-25T17:11:00,,Adoption,Spayed Female,30.69843813,-97.41068972,22.10228175,Hazel,,
1035.0,6 months,A728040,Dog,Plott Hound Mix,Chocolate/White,2015-11-30,6/4/2016 15:45,2016-06-04T15:45:00,,Adoption,Neutered Male,30.64370584,-97.52075547,26.80803571,Nikola,,
1036.0,2 months,A747956,Dog,Chihuahua Shorthair Mix,Tan,2017-02-20,4/28/2017 18:58,2017-04-28T18:58:00,,Adoption,Spayed Female,30.687813,-97.66539163,9.684325397,Princess Ana,,
1037.0,3 months,A741271,Dog,Border Collie Mix,Black/White,2016-11-30,3/7/2017 9:17,2017-03-07T09:17:00,Foster,Adoption,Spayed Female,30.48887294,-97.25294386,13.91240079,*Sassy,,
1038.0,2 months,A678892,Cat,Domestic Shorthair Mix,Silver Tabby,2014-04-13,7/4/2014 15:45,2014-07-04T15:45:00,,Adoption,Spayed Female,30.73396788,-97.50422595,11.80803571,*Winnie,,
1039.0,8 months,A725275,Dog,Rhod Ridgeback Mix,Red,2015-08-27,4/27/2016 19:13,2016-04-27T19:13:00,,Return to Owner,Neutered Male,30.44180012,-97.54882884,34.97152778,Rudolph,,
1040.0,1 year,A740490,Other,Rabbit Lh Mix,Black,2015-12-18,12/18/2016 14:32,2016-12-18T14:32:00,Partner,Transfer,Intact Male,30.48867656,-97.50058136,52.37222222,Hero Boy,,
1041.0,6 months,A673487,Other,Bat Mix,Brown,2013-08-24,2/25/2014 9:00,2014-02-25T09:00:00,Rabies Risk,Euthanasia,Unknown,30.6710414,-97.73282836,26.48214286,,,
1042.0,2 years,A668598,Dog,Rottweiler Mix,Black/White,2013-10-14,12/28/2015 11:20,2015-12-28T11:20:00,,Return to Owner,Neutered Male,30.60823329,-97.62864137,115.0674603,Sprinkles,,
1043.0,2 months,A750436,Cat,Domestic Shorthair Mix,Blue/White,2017-04-05,6/16/2017 18:15,2017-06-16T18:15:00,Foster,Adoption,Spayed Female,30.33046719,-97.54649618,10.39434524,*Royal,,
1044.0,1 month,A665240,Dog,Australian Kelpie Mix,Sable/White,2013-09-08,10/15/2013 16:11,2013-10-15T16:11:00,Partner,Transfer,Intact Female,30.70202884,-97.67562048,5.382043651,,,
1045.0,2 years,A696127,Dog,Pit Bull Mix,Tan,2013-01-30,2/7/2015 14:36,2015-02-07T14:36:00,,Return to Owner,Neutered Male,30.48045834,-97.28936631,105.5154762,Charlie,,
1046.0,1 year,A747591,Cat,Domestic Longhair Mix,Brown Tabby,2016-04-21,4/25/2017 9:27,2017-04-25T09:27:00,Snr,Transfer,Neutered Male,30.36920961,-97.62347334,52.77053571,,,
1047.0,1 year,A699974,Dog,Boxer Mix,Brown Brindle,2014-03-05,4/20/2015 17:42,2015-04-20T17:42:00,Aggressive,Euthanasia,Neutered Male,30.4495535,-97.4260715,58.81964286,Caine,,
1048.0,1 weeks,A738833,Cat,Domestic Shorthair Mix,Gray/White,2016-11-13,11/22/2016 12:11,2016-11-22T12:11:00,Partner,Transfer,Unknown,30.3622308,-97.27621638,1.358234127,,,
1049.0,8 years,A706115,Dog,Rat Terrier Mix,White/Tricolor,2007-06-25,7/5/2015 16:44,2015-07-05T16:44:00,,Adoption,Spayed Female,30.66124669,-97.61718362,418.956746,*Louise,,
1050.0,3 weeks,A681259,Cat,Domestic Shorthair Mix,Black/White,2014-05-23,6/14/2014 12:45,2014-06-14T12:45:00,Partner,Transfer,Intact Male,30.33750876,-97.63471249,3.21875,,,
1051.0,2 years,A693910,Dog,Boxer,Tan,2012-12-16,1/7/2015 13:26,2015-01-07T13:26:00,,Adoption,Spayed Female,30.37091265,-97.67525781,107.5085317,*Kyra,,
1052.0,4 years,A636714,Dog,Siberian Husky Mix,Sable/White,2010-01-02,1/5/2014 18:03,2014-01-05T18:03:00,,Adoption,Neutered Male,30.38267405,-97.25476565,209.2502976,Blue,,
1053.0,2 years,A696222,Cat,Domestic Shorthair Mix,Brown Tabby,2013-01-31,2/1/2015 9:00,2015-02-01T09:00:00,SCRP,Transfer,Intact Male,30.58006274,-97.68801043,104.4821429,,,
1054.0,5 months,A708890,Cat,Domestic Shorthair Mix,Black/White,2015-06-17,12/10/2015 11:47,2015-12-10T11:47:00,Foster,Adoption,Neutered Male,30.34391069,-97.67595832,25.21299603,*Obsidian,,
1055.0,8 years,A565938,Dog,Chihuahua Shorthair Mix,Tan,2009-02-02,12/21/2017 15:54,2017-12-21T15:54:00,Partner,Transfer,Neutered Male,30.62770512,-97.55112982,463.5232143,Scooby,,
1056.0,5 years,A744093,Dog,German Shepherd Mix,Black/Brown,2012-02-23,3/6/2017 11:25,2017-03-06T11:25:00,,Return to Owner,Neutered Male,30.33368407,-97.73134996,262.6393849,Dumbo,,
1057.0,7 months,A663845,Dog,Pit Bull Mix,White/Tan,2013-02-24,10/7/2013 13:11,2013-10-07T13:11:00,Partner,Transfer,Neutered Male,30.32781322,-97.61251903,32.22132937,Bullet,,
1058.0,1 year,A743515,Dog,Jack Russell Terrier/Chihuahua Shorthair,Tan/White,2015-12-11,2/12/2017 12:16,2017-02-12T12:16:00,,Adoption,Neutered Male,30.40563577,-97.38877323,61.35873016,Riley,,
1059.0,1 year,A741351,Dog,Pit Bull Mix,White,2015-12-31,6/4/2017 15:28,2017-06-04T15:28:00,,Return to Owner,Intact Male,30.74676615,-97.67181085,74.52063492,Toby,,
1060.0,3 years,A750942,Dog,Pit Bull Mix,Brown Brindle/White,2014-06-02,6/8/2017 13:12,2017-06-08T13:12:00,,Rto-Adopt,Neutered Male,30.52882515,-97.70628669,157.5071429,Tank,,
1061.0,10 months,A741380,Dog,Labrador Retriever Mix,Brown,2016-03-01,1/7/2017 11:39,2017-01-07T11:39:00,,Return to Owner,Neutered Male,30.40588044,-97.28888528,44.64077381,Bingo,,
1062.0,2 months,A735445,Dog,Rottweiler Mix,Black/Tan,2016-07-08,9/23/2016 16:37,2016-09-23T16:37:00,Suffering,Euthanasia,Intact Female,30.58981601,-97.41943584,11.09890873,,,
1063.0,5 months,A706880,Dog,Labrador Retriever Mix,Brown,2015-02-04,7/15/2015 15:25,2015-07-15T15:25:00,Partner,Transfer,Neutered Male,30.65319207,-97.63919324,23.09176587,*Aldo,,
1064.0,2 weeks,A700932,Cat,Domestic Medium Hair Mix,Black,2015-04-06,4/21/2015 14:37,2015-04-21T14:37:00,Partner,Transfer,Unknown,30.55601995,-97.45913863,2.229861111,,,
1065.0,2 months,A705754,Cat,Domestic Shorthair Mix,Orange Tabby/White,2015-04-20,7/4/2015 10:30,2015-07-04T10:30:00,Partner,Transfer,Neutered Male,30.58872943,-97.28159358,10.77678571,*Javier,,
1066.0,3 months,A661698,Cat,Domestic Shorthair Mix,Brown Tabby,2013-07-16,10/20/2013 12:27,2013-10-20T12:27:00,Partner,Transfer,Neutered Male,30.32040385,-97.46266691,13.78839286,,,
1067.0,2 years,A736506,Dog,Pit Bull Mix,Blue,2014-10-11,11/25/2016 16:32,2016-11-25T16:32:00,,Adoption,Spayed Female,30.626042,-97.43614203,110.9555556,*Coraline,,
1068.0,1 year,A698894,Dog,Manchester Terrier/Chihuahua Shorthair,Chocolate/Tan,2014-03-19,3/26/2015 19:03,2015-03-26T19:03:00,,Adoption,Neutered Male,30.58108158,-97.41613353,53.25625,Chris,,
1069.0,1 week,A752774,Cat,Domestic Shorthair Mix,Black,2017-06-20,6/27/2017 17:39,2017-06-27T17:39:00,Partner,Transfer,Intact Male,30.59514276,-97.4032631,1.105059524,,,
1070.0,2 months,A699469,Dog,Labrador Retriever Mix,Black/White,2015-01-12,4/3/2015 16:52,2015-04-03T16:52:00,Partner,Transfer,Spayed Female,30.3427964,-97.48042168,11.6718254,*Fallon,,
1071.0,2 years,A730305,Dog,Great Pyrenees Mix,White,2014-07-01,7/5/2016 14:32,2016-07-05T14:32:00,Partner,Transfer,Intact Male,30.47339207,-97.32055414,105.0865079,*Bach,,
1072.0,6 months,A733673,Dog,Pointer,White/Brown,2016-02-25,8/29/2016 16:54,2016-08-29T16:54:00,,Adoption,Spayed Female,30.54342713,-97.62769612,26.67202381,,,
1073.0,3 months,A708832,Cat,Domestic Shorthair Mix,Blue/White,2015-07-30,11/11/2015 13:47,2015-11-11T13:47:00,Foster,Adoption,Neutered Male,30.69657982,-97.71648317,14.93918651,,,
1074.0,1 year,A667027,Cat,Siamese Mix,Flame Point,2012-11-11,11/21/2013 15:17,2013-11-21T15:17:00,Partner,Transfer,Neutered Male,30.57977925,-97.46396621,53.66240079,*Casper,,
1075.0,2 years,A754139,Dog,Pit Bull Mix,Brown/White,2015-07-16,8/19/2017 12:00,2017-08-19T12:00:00,,Adoption,Spayed Female,30.53899722,-97.32548431,109.3571429,*Heidi,,
1076.0,3 years,A671133,Dog,American Bulldog Mix,White/Brown Brindle,2012-07-19,6/14/2016 9:08,2016-06-14T09:08:00,Foster,Adoption,Neutered Male,30.64048407,-97.58936664,203.7686508,Chuck,,
1077.0,1 week,A756949,Cat,Domestic Shorthair Mix,Brown Tabby/White,2017-08-21,8/28/2017 17:21,2017-08-28T17:21:00,Partner,Transfer,Intact Male,30.37872906,-97.38368166,1.10327381,,,
1078.0,6 years,A710771,Dog,Chihuahua Shorthair Mix,Brown,2009-08-28,8/28/2015 17:23,2015-08-28T17:23:00,,Return to Owner,Spayed Female,30.70871776,-97.73880824,313.1034722,Kelli,,
1079.0,2 months,A716369,Dog,Boxer Mix,Brown Brindle/White,2015-10-18,1/7/2016 17:09,2016-01-07T17:09:00,Foster,Adoption,Neutered Male,30.56467787,-97.62629823,11.6735119,*Copper,,
1080.0,1 year,A706181,Dog,Pit Bull Mix,Brown/White,2014-06-26,7/6/2015 18:22,2015-07-06T18:22:00,,Return to Owner,Spayed Female,30.60468447,-97.28171822,53.68075397,Lola,,
1081.0,1 month,A726476,Dog,Catahoula/Plott Hound,Black/White,2016-05-11,7/6/2016 18:02,2016-07-06T18:02:00,Foster,Adoption,Spayed Female,30.75969781,-97.38324854,8.10734127,*Newton,,
1082.0,2 weeks,A756504,Dog,Bernese Mountain Dog Mix,Sable/White,2017-08-06,8/21/2017 12:20,2017-08-21T12:20:00,Partner,Transfer,Intact Female,30.33359893,-97.73403141,2.216269841,,,
1083.0,2 years,A734194,Dog,Rat Terrier Mix,White/Brown,2014-09-03,9/10/2016 17:08,2016-09-10T17:08:00,,Adoption,Neutered Male,30.74678896,-97.52293624,105.5305556,*Pringles,,
1084.0,2 years,A753985,Other,Bat Mix,Black,2015-07-13,7/14/2017 7:47,2017-07-14T07:47:00,Rabies Risk,Euthanasia,Unknown,30.56373368,-97.24740321,104.6177579,,,
1085.0,1 year,A673924,Other,Bat Mix,Black/Brown,2013-03-04,3/4/2014 16:49,2014-03-04T16:49:00,,Disposal,Unknown,30.53916965,-97.45608825,52.24295635,,,
1086.0,2 years,A754921,Dog,Pit Bull Mix,Black Tiger,2015-07-26,7/27/2017 16:31,2017-07-27T16:31:00,,Return to Owner,Intact Female,30.31604436,-97.67990218,104.6697421,Princess,,
1087.0,10 years,A707089,Dog,Chihuahua Shorthair Mix,Black/Brown,2005-07-07,7/11/2015 12:32,2015-07-11T12:32:00,Partner,Transfer,Intact Male,30.30487369,-97.53444451,522.3603175,Pancho,,
1088.0,2 months,A683330,Cat,Domestic Shorthair Mix,Black Tabby,2014-04-24,7/15/2014 16:59,2014-07-15T16:59:00,,Adoption,Neutered Male,30.57300996,-97.63830554,11.81537698,,,
1089.0,2 years,A679230,Dog,Pit Bull Mix,White/Yellow,2014-03-06,2/20/2017 0:00,2017-02-20T00:00:00,Partner,Transfer,Neutered Male,30.75143944,-97.50875075,154.5714286,Cooper,,
1090.0,3 years,A736959,Other,Skunk Mix,Black/White,2013-10-20,10/20/2016 11:34,2016-10-20T11:34:00,Rabies Risk,Euthanasia,Unknown,30.57884495,-97.47950785,156.6402778,,,
1091.0,1 year,A742905,Cat,Siamese Mix,Flame Point,2016-01-30,2/11/2017 15:41,2017-02-11T15:41:00,,Adoption,Spayed Female,30.52790451,-97.61879501,54.09335317,*Topaz,,
1092.0,10 months,A734796,Dog,Pit Bull Mix,Blue/White,2015-11-13,9/20/2016 18:06,2016-09-20T18:06:00,,Adoption,Neutered Male,30.49628393,-97.65778656,44.67916667,*Hans,,
1093.0,6 months,A665006,Dog,Border Collie Mix,White/Brown,2013-03-28,10/19/2013 15:59,2013-10-19T15:59:00,,Adoption,Spayed Female,30.45386876,-97.60265566,29.38085317,Sasha,,
1094.0,1 year,A693659,Dog,Labrador Retriever Mix,Black/White,2013-06-12,3/1/2015 18:57,2015-03-01T18:57:00,,Adoption,Spayed Female,30.67273973,-97.44901002,89.68422619,*Lika,,
1095.0,2 months,A680919,Cat,Domestic Shorthair Mix,Cream Tabby,2014-04-09,6/10/2014 16:44,2014-06-10T16:44:00,Partner,Transfer,Intact Male,30.6295805,-97.67051346,8.956746032,,,
1096.0,2 months,A692962,Dog,Chihuahua Shorthair Mix,Gold/White,2014-09-14,11/29/2014 14:55,2014-11-29T14:55:00,Partner,Transfer,Intact Male,30.41371764,-97.53909277,10.94593254,,,
1097.0,3 weeks,A705340,Cat,Domestic Shorthair Mix,Brown Tabby,2015-05-25,6/17/2015 12:27,2015-06-17T12:27:00,Partner,Transfer,Intact Female,30.6299917,-97.32393519,3.359821429,,,
1098.0,2 years,A764715,Dog,Chihuahua Shorthair Mix,Tan,2016-01-04,1/4/2018 17:39,2018-01-04T17:39:00,,Return to Owner,Spayed Female,30.67273715,-97.5222095,104.533631,Elsa,,
1099.0,2 years,A680047,Other,Opossum,Gray/White,2012-05-29,5/29/2014 11:49,2014-05-29T11:49:00,Suffering,Euthanasia,Intact Male,30.62499469,-97.32064661,104.3560516,,,
1100.0,2 years,A714760,Cat,Domestic Medium Hair Mix,Brown Tabby/White,2013-10-27,9/3/2016 15:54,2016-09-03T15:54:00,,Adoption,Spayed Female,30.57291653,-97.55595673,148.9517857,Aria,,
1101.0,1 year,A727292,Dog,Pit Bull Mix,Brown,2015-05-20,5/22/2016 12:36,2016-05-22T12:36:00,Partner,Transfer,Intact Female,30.28634621,-97.60739747,52.64642857,,,
1102.0,3 years,A736954,Dog,Labrador Retriever Mix,Tan,2013-10-20,11/18/2016 17:29,2016-11-18T17:29:00,,Adoption,Spayed Female,30.48577618,-97.26172496,160.8183532,Holly,,
1103.0,7 years,A738749,Dog,German Shepherd,Brown/Black,2009-11-20,11/25/2016 14:09,2016-11-25T14:09:00,,Adoption,Spayed Female,30.60895401,-97.3166651,366.0842262,Camelia,656174071f442de352558622,
1104.0,3 years,A722061,Dog,Miniature Schnauzer/Miniature Poodle,Black,2013-03-10,3/14/2016 12:21,2016-03-14T12:21:00,Partner,Transfer,Intact Female,30.40193913,-97.48859828,157.216369,Berta,,
1105.0,1 year,A745902,Dog,Pit Bull Mix,Blue/White,2016-04-26,10/4/2017 12:33,2017-10-04T12:33:00,,Return to Owner,Neutered Male,30.61775847,-97.73246145,75.21755952,Chief,,
1106.0,11 years,A672751,Dog,Australian Shepherd Mix,Black/Brown Merle,2003-02-16,3/1/2014 11:33,2014-03-01T11:33:00,Partner,Transfer,Neutered Male,30.61004859,-97.31748587,575.9258929,*Simon,,
1107.0,2 weeks,A699022,Dog,Chihuahua Shorthair Mix,Brown,2015-03-05,3/22/2015 13:03,2015-03-22T13:03:00,Partner,Transfer,Intact Female,30.72410235,-97.61761706,2.50625,Estelle,,
1108.0,3 months,A726433,Cat,Domestic Shorthair Mix,White/Brown Tabby,2016-04-03,7/9/2016 20:34,2016-07-09T20:34:00,Foster,Adoption,Neutered Male,30.68741269,-97.33263987,13.97956349,*Doug,,
1109.0,2 months,A761761,Dog,Cairn Terrier Mix,Black/White,2017-11-02,1/11/2018 9:01,2018-01-11T09:01:00,Foster,Adoption,Neutered Male,30.33150528,-97.62928728,10.05367063,,,
1110.0,3 years,A682926,Dog,Chihuahua Shorthair Mix,Tan/White,2011-07-05,7/7/2014 17:19,2014-07-07T17:19:00,,Return to Owner,Neutered Male,30.36849376,-97.42222039,156.9602183,Chicho,,
1111.0,1 year,A715813,Dog,Black/Tan Hound,Black/Tan,2014-11-10,3/15/2016 18:28,2016-03-15T18:28:00,,Return to Owner,Spayed Female,30.5216482,-97.30625783,70.25277778,Lola,,
1112.0,1 year,A718925,Other,Hotot Mix,White/Black,2015-01-09,3/8/2016 19:01,2016-03-08T19:01:00,,Adoption,Spayed Female,30.45548379,-97.48761587,60.68462302,Foo Foo,,
1113.0,1 year,A664230,Dog,Whippet Mix,Black,2012-04-30,10/7/2013 13:13,2013-10-07T13:13:00,Partner,Transfer,Spayed Female,30.53041385,-97.40204505,75.07867063,Arya,,
1114.0,5 months,A736023,Dog,Siberian Husky,Red/White,2016-05-06,10/11/2016 13:04,2016-10-11T13:04:00,,Return to Owner,Spayed Female,30.29151143,-97.70848197,22.64920635,Benson,,
1115.0,1 month,A704218,Dog,Chihuahua Shorthair Mix,Brown/White,2015-06-01,7/26/2015 18:28,2015-07-26T18:28:00,Foster,Adoption,Spayed Female,30.46471987,-97.58470221,7.967063492,*Sansa,,
1116.0,2 months,A702225,Cat,Domestic Shorthair Mix,Orange Tabby,2015-04-19,7/1/2015 12:07,2015-07-01T12:07:00,Foster,Adoption,Neutered Male,30.66650426,-97.73962335,10.50069444,*Edmund,,
1117.0,10 months,A682203,Dog,Chihuahua Shorthair Mix,Black/Brown,2013-08-25,6/29/2014 17:58,2014-06-29T17:58:00,,Adoption,Neutered Male,30.44737696,-97.44134447,44.10694444,,,
1118.0,2 weeks,A756720,Cat,Domestic Shorthair Mix,Brown Tabby,2017-08-09,8/24/2017 17:45,2017-08-24T17:45:00,Partner,Transfer,Intact Female,30.51773132,-97.46420881,2.248511905,,,
1119.0,6 months,A697444,Other,Bat Mix,Brown,2014-08-23,2/24/2015 8:44,2015-02-24T08:44:00,Rabies Risk,Euthanasia,Unknown,30.6011564,-97.43871038,26.48055556,,,
1120.0,1 year,A718621,Cat,Domestic Shorthair Mix,Tortie,2015-01-03,1/11/2016 18:05,2016-01-11T18:05:00,,Adoption,Spayed Female,30.42515082,-97.55054796,53.39335317,*Cleopatra,,
1121.0,1 year,A757158,Dog,Labrador Retriever Mix,White/Black,2016-08-30,8/31/2017 14:12,2017-08-31T14:12:00,,Return to Owner,Intact Female,30.55721617,-97.53632243,52.3702381,Pirata,,
1122.0,3 months,A760379,Cat,Domestic Shorthair Mix,Black/White,2017-09-08,12/16/2017 14:43,2017-12-16T14:43:00,,Adoption,Neutered Male,30.48171959,-97.40151294,14.23045635,*Skully,,
1123.0,1 year,A673501,Dog,Chihuahua Shorthair Mix,Brown,2013-02-25,2/25/2014 16:39,2014-02-25T16:39:00,Suffering,Euthanasia,Spayed Female,30.67320592,-97.70027272,52.24196429,Cassandra,,
1124.0,6 months,A704897,Dog,Australian Shepherd/German Shepherd,Tricolor,2014-12-10,6/15/2015 15:18,2015-06-15T15:18:00,,Adoption,Spayed Female,30.54427423,-97.4194554,26.80535714,,,
1125.0,2 years,A668199,Dog,Pit Bull Mix,Black/White,2011-11-29,1/23/2014 15:36,2014-01-23T15:36:00,,Adoption,Neutered Male,30.7024355,-97.70225367,112.3785714,*Sam,,
1126.0,1 year,A723338,Dog,Pit Bull Mix,Blue/White,2015-03-30,4/15/2016 17:41,2016-04-15T17:41:00,,Adoption,Neutered Male,30.73975883,-97.42212557,54.67668651,*Carter,,
1127.0,3 months,A765050,Cat,Domestic Longhair Mix,Calico,2017-10-12,1/13/2018 18:16,2018-01-13T18:16:00,,Adoption,Spayed Female,30.64803084,-97.63689911,13.39444444,*Rosie,,
1128.0,10 months,A731765,Dog,Labrador Retriever,Black/White,2015-09-27,8/1/2016 19:14,2016-08-01T19:14:00,,Adoption,Neutered Male,30.69050125,-97.34020735,44.25734127,,656174071f442de352558621,
1129.0,6 months,A729381,Dog,Maltese Mix,White,2016-01-17,8/8/2016 12:58,2016-08-08T12:58:00,,Return to Owner,Neutered Male,30.42975411,-97.52953413,29.22003968,Tijeras,,
1130.0,3 months,A728069,Dog,German Shepherd Mix,Black/White,2016-02-03,6/3/2016 17:04,2016-06-03T17:04:00,,Adoption,Neutered Male,30.30251627,-97.73557947,17.38730159,*Chase,,
1131.0,1 year,A674292,Dog,Pit Bull Mix,Red,2013-03-10,3/12/2014 17:31,2014-03-12T17:31:00,,Return to Owner,Neutered Male,30.61316638,-97.62319725,52.5328373,Dallas,,
1132.0,6 years,A717892,Dog,Chihuahua Shorthair Mix,Black/Brown,2009-12-22,12/22/2015 17:38,2015-12-22T17:38:00,,Adoption,Neutered Male,30.35126105,-97.28573945,313.1049603,Paco,,
1133.0,4 years,A711096,Dog,American Staffordshire Terrier Mix,Blue/White,2013-09-01,9/3/2017 17:49,2017-09-03T17:49:00,,Adoption,Spayed Female,30.73412143,-97.24522671,209.1060516,Schatzi,,
1134.0,2 years,A711247,Cat,Domestic Shorthair Mix,Tortie,2013-09-04,9/5/2015 9:00,2015-09-05T09:00:00,SCRP,Transfer,Intact Female,30.66097964,-97.63911577,104.4821429,,,
1135.0,3 years,A667968,Cat,Domestic Shorthair Mix,Orange Tabby/White,2010-11-25,12/18/2013 13:17,2013-12-18T13:17:00,,Adoption,Neutered Male,30.32438747,-97.62559674,159.9362103,*Tabo,,
1136.0,6 months,A666544,Dog,Chihuahua Shorthair/Dachshund,Red Merle/White,2013-05-06,11/9/2013 13:21,2013-11-09T13:21:00,,Adoption,Spayed Female,30.68893859,-97.30018521,26.79375,,,
1137.0,1 year,A688032,Dog,Border Collie Mix,White/Brown,2013-09-13,9/28/2014 16:25,2014-09-28T16:25:00,,Adoption,Neutered Male,30.71681402,-97.73920623,54.38343254,Denali,,
1138.0,1 year,A733316,Dog,Pit Bull Mix,Red/White,2015-08-20,12/22/2016 16:58,2016-12-22T16:58:00,Partner,Transfer,Neutered Male,30.69442048,-97.26038067,70.10099206,*Mitchell,,
1139.0,2 months,A701154,Dog,Dachshund/Manchester Terrier,Brown/White,2015-04-20,6/28/2015 17:41,2015-06-28T17:41:00,,Adoption,Neutered Male,30.71672372,-97.54367491,9.962400794,Chester,,
1140.0,14 years,A661599,Dog,Miniature Pinscher Mix,Black,2000-08-22,9/28/2014 17:39,2014-09-28T17:39:00,,Return to Owner,Neutered Male,30.4464501,-97.52534904,735.8193452,Toby,,
1141.0,4 years,A633943,Dog,Miniature Pinscher Mix,Brown,2009-08-03,2/7/2014 18:28,2014-02-07T18:28:00,,Adoption,Neutered Male,30.3721862,-97.69474174,235.6813492,Chalky,,
1142.0,5 years,A696989,Dog,Labrador Retriever/Pit Bull,Red/Black,2010-02-16,2/27/2015 13:01,2015-02-27T13:01:00,,Return to Owner,Neutered Male,30.39572101,-97.25543368,262.5060516,Toby,,
1143.0,3 years,A705768,Cat,Domestic Shorthair Mix,Tortie,2012-06-21,6/22/2015 9:00,2015-06-22T09:00:00,SCRP,Transfer,Intact Female,30.29859568,-97.57650308,156.625,,,
1144.0,3 months,A762023,Cat,Domestic Shorthair Mix,Black/White,2017-09-13,12/21/2017 13:27,2017-12-21T13:27:00,Partner,Transfer,Neutered Male,30.61671212,-97.38911121,14.22291667,*Uno Momento,,
1145.0,1 year,A713544,Dog,Pit Bull Mix,Black/White,2014-04-08,10/18/2015 15:03,2015-10-18T15:03:00,,Adoption,Spayed Female,30.75042662,-97.3592176,79.80386905,*Libby,,
1146.0,6 months,A691739,Cat,Domestic Shorthair Mix,Orange Tabby/White,2014-05-09,11/10/2014 18:49,2014-11-10T18:49:00,,Adoption,Neutered Male,30.35916573,-97.2856359,26.5405754,Oliver,,
1147.0,7 months,A733848,Dog,Labrador Retriever Mix,Chocolate,2016-01-28,8/28/2016 17:57,2016-08-28T17:57:00,,Return to Owner,Intact Male,30.32497425,-97.28844045,30.53541667,Zeus,,
1148.0,3 months,A666518,Dog,American Pit Bull Terrier Mix,Brown/White,2013-08-02,11/7/2013 12:53,2013-11-07T12:53:00,Partner,Transfer,Spayed Female,30.62997889,-97.37493558,13.93382937,,,
1149.0,3 years,A724479,Dog,Chihuahua Shorthair Mix,Tan/White,2013-04-18,4/19/2016 18:53,2016-04-19T18:53:00,,Return to Owner,Intact Male,30.31945772,-97.46457222,156.8266865,Rocky,,
1150.0,8 months,A664707,Dog,Border Collie Mix,Black/White,2013-02-07,10/17/2013 17:45,2013-10-17T17:45:00,,Adoption,Spayed Female,30.4613568,-97.54763987,36.10565476,Stevie,,
1151.0,6 months,A719031,Dog,Miniature Schnauzer/Miniature Poodle,Gray/Tan,2015-07-11,1/18/2016 17:30,2016-01-18T17:30:00,,Adoption,Neutered Male,30.49393891,-97.47977022,27.38988095,Rufus,,
1152.0,2 years,A692521,Dog,Pit Bull Mix,Fawn/White,2013-11-21,12/14/2015 9:04,2015-12-14T09:04:00,,Adoption,Neutered Male,30.3792584,-97.38579926,107.6253968,Coby,,
1153.0,10 years,A631963,Dog,Patterdale Terr Mix,Brown/Tan,2004-07-10,11/23/2014 16:19,2014-11-23T16:19:00,,Return to Owner,Spayed Female,30.59194326,-97.29327237,541.2399802,Ragzee,,
1154.0,5 years,A753227,Dog,Pekingese,Buff/White,2012-07-03,7/3/2017 15:05,2017-07-03T15:05:00,Partner,Transfer,Intact Female,30.62668863,-97.70051123,260.9469246,,,
1155.0,1 year,A710007,Cat,Domestic Shorthair Mix,Black,2014-08-15,8/16/2015 9:00,2015-08-16T09:00:00,SCRP,Transfer,Intact Male,30.37311241,-97.47358367,52.33928571,,,
1156.0,1 month,A709299,Cat,Domestic Shorthair Mix,Black,2015-06-30,8/11/2015 0:00,2015-08-11T00:00:00,Partner,Transfer,Intact Male,30.37553471,-97.56079569,6,*Jon,,
1157.0,5 months,A734248,Other,Rabbit Sh Mix,White/Black,2016-07-03,12/11/2016 17:37,2016-12-11T17:37:00,,Adoption,Spayed Female,30.64513268,-97.66920929,23.10486111,*Cappucino,,
1158.0,2 months,A692960,Dog,Chihuahua Shorthair Mix,Cream/White,2014-09-14,11/29/2014 14:54,2014-11-29T14:54:00,Partner,Transfer,Intact Female,30.27952539,-97.29438588,10.94583333,,,
1159.0,1 year,A720820,Cat,Domestic Shorthair Mix,Brown Tabby,2015-02-15,2/22/2016 15:56,2016-02-22T15:56:00,SCRP,Transfer,Intact Female,30.62410948,-97.44820519,53.23769841,,,
1160.0,3 years,A671704,Dog,Pit Bull/Boxer,Black/White,2012-01-29,5/27/2015 17:55,2015-05-27T17:55:00,,Return to Owner,Spayed Female,30.57576428,-97.3811356,173.5352183,Chloe,,
1161.0,4 years,A669082,Dog,Boxer,Brown/Black,2009-12-14,1/15/2014 15:39,2014-01-15T15:39:00,,Adoption,Neutered Male,30.47257385,-97.40653536,213.378869,*Hayes,,
1162.0,5 months,A743183,Dog,Soft Coated Wheaten Terrier Mix,Sable/Cream,2016-09-05,2/6/2017 11:51,2017-02-06T11:51:00,,Return to Owner,Intact Male,30.42810591,-97.26961563,22.07053571,Rocko,,
1163.0,1 year,A716199,Cat,Domestic Shorthair Mix,Black,2015-09-24,12/31/2016 9:46,2016-12-31T09:46:00,Foster,Adoption,Neutered Male,30.3112941,-97.68324478,66.34384921,Kingston,,
1164.0,1 week,A759642,Cat,American Shorthair Mix,Brown Tabby/White,2017-09-28,10/5/2017 0:00,2017-10-05T00:00:00,Partner,Transfer,Unknown,30.34744979,-97.27480538,1,,,
1165.0,7 months,A688064,Dog,Catahoula Mix,Chocolate/White,2014-01-30,9/14/2014 15:55,2014-09-14T15:55:00,,Return to Owner,Intact Male,30.48990248,-97.26697764,32.52331349,Blue,,
1166.0,7 years,A762194,Dog,Chihuahua Shorthair Mix,Brown,2010-11-16,11/16/2017 12:47,2017-11-16T12:47:00,,Return to Owner,Neutered Male,30.60255066,-97.36337412,365.3618056,Rajito,,
1167.0,1 year,A720529,Dog,Great Pyrenees Mix,Cream/White,2015-04-01,6/10/2016 17:27,2016-06-10T17:27:00,Partner,Transfer,Spayed Female,30.72573474,-97.57530483,62.38958333,Estrella,,
1168.0,9 years,A721414,Dog,Shih Tzu Mix,Gray,2007-02-26,3/1/2016 14:41,2016-03-01T14:41:00,Partner,Transfer,Spayed Female,30.32780603,-97.65486506,470.2302579,,,
1169.0,3 years,A708455,Other,Opossum Mix,Gray/Pink,2012-07-28,7/29/2015 12:11,2015-07-29T12:11:00,Suffering,Euthanasia,Unknown,30.32967832,-97.24598014,156.6439484,,,
1170.0,3 months,A751404,Cat,Domestic Shorthair Mix,Blue Tabby/White,2017-03-07,6/23/2017 17:09,2017-06-23T17:09:00,,Adoption,Spayed Female,30.54899647,-97.26914986,15.53065476,*Gabriella,,
1171.0,3 months,A693173,Cat,Domestic Shorthair Mix,Brown Tabby/White,2014-09-18,12/28/2014 16:38,2014-12-28T16:38:00,,Adoption,Spayed Female,30.4848351,-97.56153228,14.52757937,Yuki,,
1172.0,11 months,A763987,Dog,Siberian Husky,White/Brown,2017-01-19,1/4/2018 18:55,2018-01-04T18:55:00,,Return to Owner,Neutered Male,30.34274843,-97.2925359,50.11259921,Jack,,
1173.0,2 months,A675864,Cat,Domestic Shorthair Mix,Black,2014-02-24,5/5/2014 15:13,2014-05-05T15:13:00,Partner,Transfer,Neutered Male,30.44997261,-97.2821928,10.0905754,Tormund,,
1174.0,2 years,A674915,Cat,Domestic Shorthair Mix,Brown Tabby/White,2012-03-20,3/20/2014 16:32,2014-03-20T16:32:00,SCRP,Transfer,Intact Female,30.36965957,-97.33061791,104.384127,,,
1175.0,2 years,A703624,Dog,Pit Bull Mix,White/Brown,2013-05-27,4/12/2016 18:55,2016-04-12T18:55:00,,Return to Owner,Neutered Male,30.35823718,-97.62673772,150.2554563,Rex,,
1176.0,2 months,A756049,Cat,American Shorthair Mix,Black/White,2017-07-13,9/16/2017 14:51,2017-09-16T14:51:00,Offsite,Adoption,Spayed Female,30.63317236,-97.45561049,9.374107143,*Mochi,,
1177.0,2 years,A748850,Dog,Chihuahua Shorthair Mix,Brown/White,2015-05-07,5/8/2017 11:56,2017-05-08T11:56:00,,Return to Owner,Intact Male,30.31748263,-97.41919967,104.6424603,Friend,,
1178.0,1 month,A683772,Cat,Domestic Shorthair Mix,Blue,2014-05-24,7/24/2014 20:03,2014-07-24T20:03:00,,Adoption,Spayed Female,30.67684199,-97.42602781,8.833630952,Vesper,,
1179.0,4 weeks,A683732,Cat,Domestic Shorthair Mix,Blue,2014-06-23,7/25/2014 16:48,2014-07-25T16:48:00,Partner,Transfer,Intact Male,30.4500563,-97.31296492,4.671428571,,,
1180.0,1 year,A746727,Bird,Parakeet,Blue/Black,2016-04-08,4/12/2017 14:20,2017-04-12T14:20:00,,Adoption,Unknown,30.41089405,-97.42994428,52.79960317,,,
1181.0,3 years,A704775,Cat,Domestic Shorthair Mix,Black/White,2012-06-09,6/9/2015 9:48,2015-06-09T09:48:00,Suffering,Euthanasia,Intact Male,30.64516349,-97.36804844,156.4869048,,,
1182.0,2 weeks,A685162,Cat,Domestic Shorthair Mix,White/Black,2014-07-27,8/10/2014 16:35,2014-08-10T16:35:00,Partner,Transfer,Unknown,30.2862903,-97.73228434,2.098710317,*Maple,,
1183.0,3 years,A739084,Dog,German Shepherd Mix,Sable,2013-11-27,1/24/2017 19:16,2017-01-24T19:16:00,Partner,Transfer,Neutered Male,30.71850842,-97.69688212,164.9718254,*Franklin,,
1184.0,1 year,A745133,Dog,Chihuahua Shorthair Mix,Tan,2016-03-13,3/24/2017 12:02,2017-03-24T12:02:00,Partner,Transfer,Neutered Male,30.73886105,-97.59445353,53.7859127,*Magic,,
1185.0,2 years,A707771,Dog,English Bulldog Mix,White,2013-07-17,7/21/2015 17:57,2015-07-21T17:57:00,,Adoption,Spayed Female,30.65660395,-97.42442342,104.9639881,,,
1186.0,2 years,A683713,Cat,Domestic Shorthair Mix,Blue/White,2012-07-14,7/25/2014 15:48,2014-07-25T15:48:00,,Return to Owner,Neutered Male,30.364224,-97.28705218,105.9511905,Harvey,,
1187.0,2 years,A678616,Dog,Miniature Schnauzer Mix,Black,2012-05-10,5/17/2014 11:20,2014-05-17T11:20:00,,Return to Owner,Neutered Male,30.32552955,-97.59921356,105.3531746,Chavez,,
1188.0,1 year,A725523,Cat,Domestic Shorthair Mix,Black,2015-04-30,7/4/2016 11:39,2016-07-04T11:39:00,,Adoption,Spayed Female,30.30434873,-97.42430272,61.64077381,*Liza,,
1189.0,1 year,A713092,Dog,Great Pyrenees Mix,White,2014-10-02,10/2/2015 14:42,2015-10-02T14:42:00,,Return to Owner,Intact Male,30.40686297,-97.34419348,52.23035714,Justice,,
1190.0,1 month,A700479,Dog,Labrador Retriever,Brown/White,2015-03-03,5/3/2015 19:41,2015-05-03T19:41:00,Offsite,Adoption,Spayed Female,30.29411633,-97.67601758,8.831448413,Quinn,656174071f442de352558621,
1191.0,4 years,A669293,Dog,Newfoundland/Labrador Retriever,Black/Brown,2009-12-18,12/23/2013 16:49,2013-12-23T16:49:00,,Adoption,Spayed Female,30.6825073,-97.70543171,209.5286706,*Mini Mouse,,
1192.0,7 years,A674318,Dog,Dachshund Mix,Brown,2007-03-11,3/15/2014 19:06,2014-03-15T19:06:00,Partner,Transfer,Neutered Male,30.69448149,-97.2873613,365.9708333,,,
1193.0,4 months,A710979,Cat,Domestic Shorthair Mix,Brown Tabby,2015-05-01,9/1/2015 9:00,2015-09-01T09:00:00,SCRP,Transfer,Intact Male,30.7647895,-97.71132696,17.625,,,
1194.0,1 month,A756473,Dog,Labrador Retriever/Doberman Pinsch,Tan,2017-06-28,8/24/2017 18:54,2017-08-24T18:54:00,,Adoption,Spayed Female,30.71246927,-97.53664467,8.255357143,,,
1195.0,1 year,A739400,Dog,Chihuahua Shorthair Mix,Tan/Black,2015-12-02,12/6/2016 17:15,2016-12-06T17:15:00,,Adoption,Spayed Female,30.42888285,-97.69831911,52.95982143,,,
1196.0,3 years,A725712,Dog,Pit Bull Mix,Tan/White,2013-05-02,8/8/2016 18:29,2016-08-08T18:29:00,,Adoption,Neutered Male,30.47596398,-97.37729196,170.6814484,Jax (Obi),,
1197.0,1 year,A742470,Dog,Labrador Retriever Mix,Black,2016-01-22,1/22/2017 15:59,2017-01-22T15:59:00,,Return to Owner,Spayed Female,30.30180857,-97.47588017,52.38085317,Saydi,,
1198.0,2 months,A705883,Cat,Domestic Shorthair Mix,Blue,2015-04-22,6/24/2015 12:52,2015-06-24T12:52:00,In Surgery,Died,Neutered Male,30.39448927,-97.3897709,9.076587302,,,
1199.0,2 months,A699354,Dog,Australian Shepherd Mix,Tricolor,2015-01-26,3/30/2015 17:16,2015-03-30T17:16:00,,Adoption,Spayed Female,30.35419139,-97.37599288,9.102777778,Nica,,
1200.0,4 months,A730620,Cat,Domestic Shorthair Mix,Calico,2016-05-18,9/24/2016 16:01,2016-09-24T16:01:00,Partner,Transfer,Spayed Female,30.66644724,-97.46008887,18.52390873,*Lorna,,
1201.0,3 years,A721048,Dog,Catahoula Mix,Blue Merle/White,2013-02-20,4/13/2016 16:57,2016-04-13T16:57:00,,Adoption,Neutered Male,30.68414839,-97.24626161,164.1008929,*Henry,,
1202.0,5 years,A563400,Cat,Domestic Shorthair Mix,Orange Tabby,2008-09-22,2/26/2014 18:52,2014-02-26T18:52:00,,Return to Owner,Neutered Male,30.40364493,-97.68919459,283.3980159,Heater,,
1203.0,2 months,A695917,Dog,Chihuahua Shorthair/Dachshund,Black/White,2014-11-30,1/31/2015 11:36,2015-01-31T11:36:00,,Adoption,Spayed Female,30.75335084,-97.62298629,8.926190476,Indiana,,
1204.0,2 months,A707629,Dog,Labrador Retriever Mix,Black/White,2015-04-30,7/24/2015 18:01,2015-07-24T18:01:00,,Adoption,Neutered Male,30.36220043,-97.58015871,12.25009921,Zeus,,
1205.0,1 year,A733070,Other,Bat Mix,Brown,2015-08-16,8/17/2016 8:09,2016-08-17T08:09:00,Rabies Risk,Euthanasia,Unknown,30.73074219,-97.42561202,52.47708333,,,
1206.0,2 years,A716060,Dog,American Eskimo Mix,Cream,2013-11-13,11/19/2015 16:07,2015-11-19T16:07:00,,Adoption,Neutered Male,30.37252134,-97.26332869,105.2387897,*Sprite,,
1207.0,3 weeks,A688599,Cat,Domestic Shorthair Mix,Tortie,2014-08-30,9/21/2014 13:21,2014-09-21T13:21:00,Partner,Transfer,Intact Female,30.28095545,-97.30651955,3.222321429,,,
1208.0,4 weeks,A673750,Other,Bat,Brown/Black,2014-02-01,3/1/2014 17:25,2014-03-01T17:25:00,Rabies Risk,Euthanasia,Unknown,30.70327831,-97.49862843,4.103670635,,,
1209.0,6 years,A658628,Dog,Labrador Retriever/Smooth Fox Terrier,Brown/White,2010-07-12,4/28/2017 16:26,2017-04-28T16:26:00,,Adoption,Neutered Male,30.45035939,-97.2672867,354.669246,Oso,,
1210.0,2 months,A729012,Cat,Domestic Shorthair Mix,Blue,2016-04-12,6/29/2016 16:03,2016-06-29T16:03:00,,Adoption,Neutered Male,30.44365304,-97.30581666,11.23839286,,,
1211.0,4 weeks,A708567,Cat,Domestic Shorthair Mix,Black/White,2015-06-30,8/2/2015 13:22,2015-08-02T13:22:00,Partner,Transfer,Intact Male,30.4906349,-97.42015505,4.793849206,*Jack,,
1212.0,2 years,A607074,Dog,Pointer/Pit Bull,White/Brown,2011-05-23,10/27/2013 9:27,2013-10-27T09:27:00,Aggressive,Euthanasia,Spayed Female,30.36870654,-97.56269358,126.9133929,Nala,,
1213.0,2 years,A690493,Dog,Chihuahua Shorthair Mix,Yellow/White,2012-10-21,10/26/2014 13:00,2014-10-26T13:00:00,Partner,Transfer,Spayed Female,30.73003692,-97.70158444,105.077381,,,
1214.0,2 months,A664336,Cat,Domestic Shorthair Mix,Calico,2013-07-17,10/8/2013 18:44,2013-10-08T18:44:00,,Adoption,Spayed Female,30.47752708,-97.6797882,11.96865079,,,
1215.0,2 months,A719782,Dog,Border Collie,Chocolate/White,2015-11-14,1/29/2016 16:50,2016-01-29T16:50:00,,Adoption,Neutered Male,30.6362251,-97.73879522,10.95734127,Max,,
1216.0,6 years,A618657,Dog,Pit Bull Mix,Tan/White,2008-01-17,12/20/2014 19:00,2014-12-20T19:00:00,,Adoption,Neutered Male,30.60775877,-97.3206238,361.3988095,Rodney,,
1217.0,2 years,A696205,Cat,Domestic Shorthair Mix,Black,2013-01-31,2/11/2015 17:05,2015-02-11T17:05:00,,Adoption,Spayed Female,30.69177856,-97.70824061,105.9588294,Roo,,
1218.0,3 years,A734710,Bird,Chicken Mix,Gray/Tan,2013-09-11,9/11/2016 14:29,2016-09-11T14:29:00,Suffering,Euthanasia,Intact Female,30.34955017,-97.41460548,156.6576389,Tammy Wynett,,
1219.0,2 years,A720243,Dog,Pit Bull Mix,Brown Brindle/White,2014-02-05,5/17/2016 19:28,2016-05-17T19:28:00,,Adoption,Neutered Male,30.48593961,-97.72560037,118.9730159,Bobe,,
1220.0,1 year,A742314,Dog,Labrador Retriever/Beagle,Black,2015-11-19,1/22/2017 15:39,2017-01-22T15:39:00,,Adoption,Neutered Male,30.3556032,-97.61210139,61.52172619,Bearry,,
1221.0,2 months,A750047,Cat,Domestic Shorthair Mix,Orange Tabby,2017-05-02,7/18/2017 13:58,2017-07-18T13:58:00,Foster,Adoption,Neutered Male,30.59439871,-97.29968683,11.08313492,*Tostada,,
1222.0,5 years,A761611,Cat,Domestic Shorthair Mix,Brown Tabby,2012-11-07,11/11/2017 13:23,2017-11-11T13:23:00,Snr,Transfer,Intact Female,30.73858091,-97.31919194,261.5082341,,,
1223.0,2 months,A685989,Cat,Domestic Shorthair Mix,Black,2014-06-19,9/8/2014 19:42,2014-09-08T19:42:00,,Adoption,Spayed Female,30.55650349,-97.6956237,11.68869048,,,
1224.0,6 years,A759537,Cat,Domestic Shorthair Mix,Brown Tabby/White,2011-10-03,10/4/2017 14:48,2017-10-04T14:48:00,,Return to Owner,Neutered Male,30.60496937,-97.26260555,313.3738095,,,
1225.0,8 months,A753015,Cat,Domestic Shorthair Mix,White/Black,2016-10-30,7/4/2017 10:57,2017-07-04T10:57:00,Snr,Transfer,Intact Male,30.72045266,-97.30804709,35.35089286,,,
1226.0,6 months,A674348,Cat,Domestic Shorthair Mix,Calico,2013-09-11,3/13/2014 14:21,2014-03-13T14:21:00,SCRP,Transfer,Intact Female,30.52372499,-97.24854739,26.22827381,,,
1227.0,2 years,A744141,Dog,Great Dane/Labrador Retriever,Black/White,2015-02-23,2/26/2017 14:55,2017-02-26T14:55:00,,Adoption,Neutered Male,30.48308638,-97.2896876,104.9459325,*Timber,,
1228.0,5 years,A613961,Dog,Miniature Poodle,White,2011-07-15,8/11/2016 15:50,2016-08-11T15:50:00,,Adoption,Neutered Male,30.37169643,-97.73474712,264.9513889,Rufus,,
1229.0,6 months,A690521,Other,Bat Mix,Brown,2014-04-21,10/21/2014 19:01,2014-10-21T19:01:00,,Euthanasia,Unknown,30.73954459,-97.34519057,26.25605159,,,
1230.0,5 months,A700379,Other,Bat,Brown,2014-10-12,4/12/2015 18:36,2015-04-12T18:36:00,Rabies Risk,Euthanasia,Unknown,30.35785465,-97.31571059,26.11071429,,,
1231.0,2 years,A753517,Dog,Chihuahua Shorthair Mix,Tan,2015-07-07,7/8/2017 12:42,2017-07-08T12:42:00,,Return to Owner,Intact Female,30.5965618,-97.37147902,104.6470238,Kiwi,,
1232.0,1 year,A680989,Dog,Chihuahua Shorthair Mix,Brown/Tan,2013-06-11,7/16/2014 8:19,2014-07-16T08:19:00,Foster,Adoption,Intact Female,30.51229267,-97.39185635,57.19236111,Ginger,,
1233.0,7 months,A722362,Dog,German Shepherd/Labrador Retriever,Tan/White,2015-08-25,3/25/2016 12:11,2016-03-25T12:11:00,,Return to Owner,Intact Male,30.52883188,-97.64076473,30.50109127,Brisket,,
1234.0,3 weeks,A704072,Cat,Domestic Shorthair Mix,Blue/White,2015-05-08,6/1/2015 13:46,2015-06-01T13:46:00,Partner,Transfer,Intact Male,30.30398624,-97.56466867,3.510515873,,,
1235.0,1 year,A684898,Cat,Domestic Shorthair Mix,Blue Tabby,2013-07-30,8/6/2014 13:18,2014-08-06T13:18:00,,Adoption,Spayed Female,30.76645832,-97.48261062,53.22202381,*Izy,,
1236.0,2 weeks,A710467,Cat,Domestic Shorthair Mix,Tortie,2015-08-08,8/23/2015 15:20,2015-08-23T15:20:00,Partner,Transfer,Unknown,30.7136279,-97.67141606,2.234126984,,,
1237.0,3 weeks,A684622,Cat,Domestic Shorthair Mix,Black,2014-07-04,7/26/2014 14:10,2014-07-26T14:10:00,Partner,Transfer,Intact Male,30.47330024,-97.50470243,3.22718254,,,
1238.0,6 months,A734079,Cat,Maine Coon Mix,Brown Tabby,2016-03-01,9/11/2016 17:02,2016-09-11T17:02:00,,Adoption,Spayed Female,30.57571459,-97.29067188,27.8156746,Sassy,,
1239.0,4 months,A692246,Cat,Domestic Shorthair Mix,Black,2014-08-02,12/4/2014 12:25,2014-12-04T12:25:00,Partner,Transfer,Spayed Female,30.70422524,-97.37564469,17.78819444,Alexis,,
1240.0,7 months,A675303,Dog,Pit Bull Mix,Blue,2013-08-26,4/1/2014 12:27,2014-04-01T12:27:00,,Adoption,Neutered Male,30.47584909,-97.27688225,31.21696429,,,
1241.0,2 months,A704754,Cat,Domestic Shorthair Mix,Black,2015-05-01,7/18/2015 15:37,2015-07-18T15:37:00,Foster,Adoption,Neutered Male,30.60840604,-97.68021833,11.23581349,Arthur,,
1242.0,8 years,A705391,Dog,Cocker Spaniel Mix,Black/White,2007-06-19,6/28/2015 13:41,2015-06-28T13:41:00,,Adoption,Neutered Male,30.47409318,-97.70825648,418.7957341,,,
1243.0,3 months,A711823,Cat,Domestic Shorthair Mix,Orange Tabby,2015-08-08,11/10/2015 14:18,2015-11-10T14:18:00,Foster,Adoption,Neutered Male,30.54285879,-97.26094287,13.51369048,*Beau,,
1244.0,8 years,A681547,Dog,Brittany Mix,White/Red,2006-06-18,6/18/2014 14:49,2014-06-18T14:49:00,,Return to Owner,Intact Male,30.35931481,-97.26269286,417.5167659,Roscoe,,
1245.0,2 months,A741464,Cat,Domestic Shorthair Mix,Brown Tabby,2016-11-02,1/7/2017 18:10,2017-01-07T18:10:00,,Adoption,Spayed Female,30.49576078,-97.32928734,9.536706349,,,
1246.0,1 year,A708396,Dog,Pit Bull Mix,Black/White,2014-07-27,8/9/2015 12:42,2015-08-09T12:42:00,,Adoption,Intact Female,30.35868839,-97.43660315,54.07559524,Camshaft,,
1247.0,2 months,A757230,Dog,Beagle Mix,Brown/White,2017-06-19,9/4/2017 17:03,2017-09-04T17:03:00,,Adoption,Neutered Male,30.3708664,-97.44928109,11.1014881,,,
1248.0,5 years,A681181,Dog,Pit Bull Mix,Brown,2009-06-13,6/24/2014 17:39,2014-06-24T17:39:00,,Return to Owner,Neutered Male,30.58696334,-97.43507408,262.533631,Lucky,,
1249.0,1 year,A739187,Dog,Miniature Poodle Mix,White,2015-11-29,12/4/2016 18:31,2016-12-04T18:31:00,,Adoption,Neutered Male,30.63348966,-97.46929795,53.11021825,,,
1250.0,7 years,A698462,Dog,Labrador Retriever Mix,Yellow/White,2008-03-12,3/15/2015 17:52,2015-03-15T17:52:00,,Return to Owner,Intact Male,30.61974687,-97.60275144,365.6777778,Rex,,
1251.0,2 years,A674381,Dog,German Shepherd/Pit Bull,Brown,2012-03-12,3/14/2014 18:40,2014-03-14T18:40:00,,Return to Owner,Neutered Male,30.66879636,-97.70985017,104.6825397,Ruilo,,
1252.0,2 months,A711392,Dog,English Foxhound,Buff,2015-07-06,9/8/2015 15:31,2015-09-08T15:31:00,Partner,Transfer,Intact Female,30.41987002,-97.38595017,9.235218254,*Molly,,
1253.0,5 months,A734223,Other,Rabbit Sh Mix,Black,2016-07-03,12/11/2016 17:37,2016-12-11T17:37:00,,Adoption,Spayed Female,30.65206245,-97.33853225,23.10486111,*Espresso,,
1254.0,3 years,A686256,Dog,German Shepherd Mix,Sable,2011-08-19,9/5/2014 17:20,2014-09-05T17:20:00,,Adoption,Neutered Male,30.76272147,-97.32155314,159.1031746,*Oscar,,
1255.0,2 months,A758896,Dog,Labrador Retriever Mix,Brown/White,2017-07-23,9/29/2017 4:25,2017-09-29T04:25:00,,Adoption,Neutered Male,30.51247952,-97.32441192,9.740575397,Pumpkin,,
1256.0,1 year,A681280,Other,Bat,Orange,2013-06-14,6/14/2014 15:00,2014-06-14T15:00:00,Rabies Risk,Euthanasia,Unknown,30.40988278,-97.54479708,52.23214286,,,
1257.0,4 months,A671210,Other,Skunk Mix,Black/White,2013-09-21,1/21/2014 10:18,2014-01-21T10:18:00,Rabies Risk,Euthanasia,Unknown,30.74067424,-97.27462514,17.48988095,,,
1258.0,2 years,A675064,Dog,Pit Bull Mix,Tan/White,2012-03-22,8/2/2014 14:39,2014-08-02T14:39:00,Partner,Transfer,Spayed Female,30.6453934,-97.6661263,123.3729167,*Zoe,,
1259.0,2 years,A703505,Cat,Domestic Shorthair Mix,Brown Tabby,2013-05-25,5/25/2015 15:26,2015-05-25T15:26:00,Suffering,Euthanasia,Intact Male,30.37129184,-97.39365133,104.3775794,,,
1260.0,9 years,A704004,Dog,Anatol Shepherd Mix,White/Tan,2006-06-06,6/6/2015 13:17,2015-06-06T13:17:00,,Return to Owner,Neutered Male,30.43468495,-97.64311463,469.650496,Jack,,
1261.0,1 year,A689919,Cat,Domestic Shorthair Mix,Black,2013-10-11,10/12/2014 9:00,2014-10-12T09:00:00,SCRP,Transfer,Unknown,30.38476772,-97.374915,52.33928571,,,
1262.0,1 month,A751603,Cat,Snowshoe Mix,Lilac Point/White,2017-04-25,6/25/2017 15:50,2017-06-25T15:50:00,Partner,Transfer,Intact Female,30.73386158,-97.51728568,8.808531746,,,
1263.0,5 months,A699447,Other,Bat Mix,Gray,2014-09-27,3/27/2015 0:00,2015-03-27T00:00:00,,Died,Unknown,30.51262498,-97.45881539,25.85714286,,,
1264.0,1 year,A752602,Dog,Yorkshire Terrier Mix,White,2016-06-24,6/26/2017 17:42,2017-06-26T17:42:00,,Return to Owner,Intact Male,30.34884088,-97.33443727,52.53392857,Chavito,,
1265.0,4 years,A635818,Dog,Dachshund Mix,Black/Tan,2009-08-28,3/4/2014 13:36,2014-03-04T13:36:00,,Return to Owner,Neutered Male,30.67963256,-97.57388694,235.652381,Oscar,,
1266.0,2 years,A750378,Other,Lionhead Mix,Gray/Black,2015-05-26,6/29/2017 11:58,2017-06-29T11:58:00,,Adoption,Spayed Female,30.55675814,-97.36478182,109.3569444,*Anise,,
1267.0,1 year,A737824,Other,Snake Mix,Brown/Black,2015-11-05,11/11/2016 18:35,2016-11-11T18:35:00,,Return to Owner,Unknown,30.47182178,-97.41840703,53.25347222,Kaa,,
1268.0,5 years,A730477,Dog,Labrador Retriever/Labrador Retriever,Brown,2011-07-05,7/20/2016 17:59,2016-07-20T17:59:00,,Return to Owner,Neutered Male,30.53128297,-97.42417027,263.2499008,Justice,,
1269.0,1 year,A738936,Dog,Pit Bull Mix,White/Tan,2015-11-23,3/22/2017 15:26,2017-03-22T15:26:00,,Adoption,Spayed Female,30.44202538,-97.31551942,69.37757937,Isabella Eve,,
1270.0,8 years,A697131,Dog,Boxer,Tan,2007-02-19,4/28/2015 14:23,2015-04-28T14:23:00,,Adoption,Spayed Female,30.47262612,-97.28407235,427.2284722,Charlotte,,
1271.0,1 year,A736910,Cat,Domestic Shorthair Mix,Orange Tabby/White,2015-10-19,10/31/2016 0:00,2016-10-31T00:00:00,Partner,Transfer,Spayed Female,30.31029187,-97.64969267,54,,,
1272.0,5 months,A747433,Dog,Labrador Retriever Mix,Cream,2016-11-04,4/23/2017 18:34,2017-04-23T18:34:00,,Adoption,Spayed Female,30.75442117,-97.59797084,24.39623016,,,
1273.0,2 months,A737258,Dog,Labrador Retriever Mix,Black/White,2016-08-24,10/29/2016 14:13,2016-10-29T14:13:00,,Adoption,Spayed Female,30.3015327,-97.54714192,9.513194444,Maggie,,
1274.0,6 years,A745760,Dog,Dachshund Mix,Brown/White,2011-03-23,8/23/2017 18:42,2017-08-23T18:42:00,,Adoption,Neutered Male,30.60983181,-97.50830628,335.1113095,Spike,,
1275.0,5 years,A707269,Cat,Domestic Shorthair Mix,Brown Tabby,2010-07-10,7/10/2015 18:39,2015-07-10T18:39:00,Suffering,Euthanasia,Unknown,30.48215169,-97.54204288,260.9681548,,,
1276.0,4 weeks,A702737,Cat,Snowshoe Mix,Blue Point/White,2015-04-17,5/18/2015 16:39,2015-05-18T16:39:00,Partner,Transfer,Intact Male,30.67620831,-97.68020189,4.527678571,Baylee,,
1277.0,6 months,A693027,Cat,Domestic Shorthair Mix,Brown Tabby/White,2014-05-30,12/1/2014 9:00,2014-12-01T09:00:00,SCRP,Transfer,Intact Female,30.41912478,-97.42469333,26.48214286,,,
1278.0,6 months,A687186,Other,Bat Mix,Brown,2014-03-01,9/2/2014 10:11,2014-09-02T10:11:00,,Disposal,Unknown,30.34977854,-97.28816643,26.48918651,,,
1279.0,4 years,A621534,Dog,Staffordshire Mix,Blue/White,2010-09-08,12/4/2014 14:14,2014-12-04T14:14:00,,Return to Owner,Spayed Female,30.66828903,-97.68370759,221.2275794,Diamond,,
1280.0,2 months,A719873,Cat,Domestic Shorthair Mix,Blue/White,2016-01-08,4/2/2016 17:14,2016-04-02T17:14:00,Foster,Adoption,Neutered Male,30.73328218,-97.40171931,12.24543651,,,
1281.0,2 years,A690234,Dog,Chihuahua Shorthair/Dachshund,Chocolate/Tan,2013-11-17,5/23/2016 17:30,2016-05-23T17:30:00,,Return to Owner,Neutered Male,30.42497495,-97.36102292,131.2470238,Hershey,,
1282.0,10 years,A736652,Cat,Domestic Shorthair Mix,Calico,2006-10-14,10/22/2016 17:00,2016-10-22T17:00:00,,Adoption,Spayed Female,30.4971849,-97.55931944,523.1011905,Little Bit,,
1283.0,1 month,A693798,Dog,Labrador Retriever Mix,Brown/White,2014-12-13,2/7/2015 19:08,2015-02-07T19:08:00,,Adoption,Neutered Male,30.37267572,-97.388246,8.113888889,Jupiter,,
1284.0,1 month,A713460,Dog,German Shepherd Mix,Black/Brown,2015-08-23,10/11/2015 14:56,2015-10-11T14:56:00,Partner,Transfer,Intact Male,30.54111312,-97.56752894,7.088888889,,,
1285.0,2 months,A751540,Cat,Domestic Medium Hair Mix,Black,2017-04-09,6/18/2017 14:55,2017-06-18T14:55:00,,Adoption,Neutered Male,30.54303566,-97.34095504,10.08878968,Dracula,,
1286.0,3 years,A755680,Other,Bat Mix,Brown,2014-08-07,8/7/2017 13:55,2017-08-07T13:55:00,Rabies Risk,Euthanasia,Unknown,30.41868537,-97.28344545,156.6542659,,,
1287.0,5 years,A706894,Dog,Chihuahua Shorthair Mix,Black/Tan,2010-07-05,7/10/2015 16:53,2015-07-10T16:53:00,,Adoption,Spayed Female,30.66343563,-97.64761097,261.6719246,Fargo,,
1288.0,1 year,A714548,Dog,Yorkshire Terrier Mix,Black/Red,2014-08-25,10/27/2015 18:12,2015-10-27T18:12:00,,Return to Owner,Intact Male,30.4731371,-97.72879289,61.25119048,Willie,,
1289.0,8 years,A574020,Dog,Smooth Fox Terrier Mix,Tricolor,2005-05-19,10/26/2013 17:27,2013-10-26T17:27:00,,Adoption,Neutered Male,30.29593017,-97.38495947,440.3895833,Petey,,
1290.0,6 months,A686906,Other,Rabbit Sh Mix,Black,2014-02-28,8/31/2014 11:40,2014-08-31T11:40:00,Partner,Transfer,Unknown,30.75476502,-97.46447092,26.35515873,,,
1291.0,5 months,A749254,Dog,Labrador Retriever Mix,Yellow,2016-12-12,5/16/2017 17:23,2017-05-16T17:23:00,,Adoption,Spayed Female,30.58735958,-97.39830063,22.24632937,Penny,,
1292.0,1 year,A690021,Cat,Domestic Shorthair,Blue/White,2013-11-13,2/24/2015 8:55,2015-02-24T08:55:00,Foster,Adoption,Neutered Male,30.40194244,-97.42902131,66.91021825,Cody,,
1293.0,1 year,A719925,Dog,Labrador Retriever Mix,Brown,2015-01-30,2/14/2016 14:11,2016-02-14T14:11:00,,Adoption,Spayed Female,30.33026826,-97.40875851,54.37013889,*Teacup,,
1294.0,2 weeks,A679445,Cat,Domestic Shorthair Mix,Calico,2014-05-06,5/21/2014 13:48,2014-05-21T13:48:00,Partner,Transfer,Intact Female,30.3907503,-97.38622263,2.225,,,
1295.0,3 years,A763898,Dog,Pit Bull Mix,White/Brown,2014-04-29,12/25/2017 12:12,2017-12-25T12:12:00,,Return to Owner,Neutered Male,30.32997083,-97.50569826,190.9297619,Cane,,
1296.0,10 years,A688085,Dog,Miniature Poodle Mix,White,2004-09-14,9/14/2014 16:06,2014-09-14T16:06:00,,Return to Owner,Spayed Female,30.33024861,-97.57294595,521.810119,Gina,,
1297.0,3 months,A731155,Cat,Domestic Shorthair Mix,Black/White,2016-05-15,9/7/2016 18:13,2016-09-07T18:13:00,,Adoption,Neutered Male,30.55566589,-97.30761721,16.53700397,*James,,
1298.0,2 months,A691973,Cat,Domestic Shorthair Mix,Gray Tabby/White,2014-08-29,11/17/2014 17:17,2014-11-17T17:17:00,,Adoption,Spayed Female,30.51185288,-97.61292064,11.53144841,*Gracie Lou,,
1299.0,2 days,A700443,Cat,Domestic Shorthair Mix,Black/White,2015-04-11,4/13/2015 19:07,2015-04-13T19:07:00,Partner,Transfer,Intact Female,30.49746116,-97.5801601,0.399503968,,,
1300.0,3 years,A667113,Cat,Domestic Shorthair Mix,Black/White,2010-11-12,11/14/2013 18:33,2013-11-14T18:33:00,,Return to Owner,Neutered Male,30.41229354,-97.60749338,156.9675595,Simon,,
1301.0,3 years,A703902,Dog,Miniature Schnauzer,Silver,2012-05-30,6/5/2015 12:29,2015-06-05T12:29:00,Partner,Transfer,Neutered Male,30.75929566,-97.64016853,157.3600198,*Rufus,,
1302.0,1 year,A693985,Dog,Basenji/Jack Russell Terrier,White/Brown,2013-12-18,12/22/2014 16:54,2014-12-22T16:54:00,,Adoption,Neutered Male,30.63408091,-97.34028676,52.81488095,Max,,
1303.0,2 months,A664265,Cat,Domestic Shorthair Mix,Brown Tabby,2013-07-17,10/12/2013 18:20,2013-10-12T18:20:00,,Adoption,Neutered Male,30.57501292,-97.61790446,12.53769841,*Dixon,,
1304.0,7 years,A500002,Dog,Labrador Retriever/Boxer,Black/White,2007-06-16,7/12/2014 15:10,2014-07-12T15:10:00,Aggressive,Euthanasia,Intact Male,30.31811968,-97.69677203,369.0902778,Bruce Lee,,
1305.0,1 year,A660074,Dog,American Bulldog Mix,White/Tan,2012-02-05,12/16/2013 14:28,2013-12-16T14:28:00,Partner,Transfer,Neutered Male,30.71709355,-97.26274994,97.22896825,Hank,,
1306.0,2 months,A690968,Cat,Himalayan Mix,Tortie Point,2014-09-28,12/12/2014 8:36,2014-12-12T08:36:00,Foster,Adoption,Spayed Female,30.34396446,-97.58294916,10.76547619,*Eleanor,,
1307.0,14 years,A731922,Dog,Toy Poodle Mix,Silver/Gray,2002-07-29,8/3/2016 15:35,2016-08-03T15:35:00,Suffering,Euthanasia,Intact Female,30.54341044,-97.33096737,731.3784722,,,
1308.0,4 months,A714186,Cat,Domestic Shorthair Mix,Orange Tabby,2015-07-04,11/16/2015 18:48,2015-11-16T18:48:00,,Adoption,Neutered Male,30.32143377,-97.30635614,19.39761905,Fergus,,
1309.0,1 month,A733209,Cat,Domestic Shorthair Mix,Orange Tabby,2016-07-11,8/19/2016 9:04,2016-08-19T09:04:00,Partner,Transfer,Unknown,30.7586448,-97.31713413,5.625396825,,,
1310.0,1 year,A724377,Cat,Domestic Shorthair Mix,Black,2015-04-16,5/9/2016 13:30,2016-05-09T13:30:00,,Return to Owner,Spayed Female,30.31667019,-97.27950956,55.65178571,*Flo,,
1311.0,12 years,A743987,Cat,Domestic Medium Hair Mix,Black/White,2005-02-21,2/23/2017 13:11,2017-02-23T13:11:00,Partner,Transfer,Spayed Female,30.43425188,-97.38281031,626.5070437,Elvis,,
1312.0,3 years,A691935,Dog,Pit Bull Mix,Brown/White,2011-11-12,12/9/2014 13:09,2014-12-09T13:09:00,Partner,Transfer,Neutered Male,30.71987385,-97.68031024,160.5068452,Bruno,,
1313.0,2 years,A698832,Dog,Labrador Retriever Mix,Brown,2012-10-18,3/25/2015 13:07,2015-03-25T13:07:00,,Return to Owner,Spayed Female,30.75322145,-97.53365798,126.9352183,Stella,,
1314.0,5 years,A568123,Dog,Chihuahua Shorthair Mix,Black/Tan,2009-12-29,8/26/2015 11:39,2015-08-26T11:39:00,,Return to Owner,Neutered Male,30.59420463,-97.57084378,295.2122024,Miley,,
1315.0,1 year,A715897,Cat,Domestic Shorthair Mix,Brown Tabby/White,2014-05-12,11/15/2015 18:50,2015-11-15T18:50:00,SCRP,Transfer,Intact Male,30.52386107,-97.31624517,78.96924603,,,
1316.0,2 months,A708470,Cat,Domestic Shorthair Mix,Orange Tabby,2015-05-13,8/1/2015 17:15,2015-08-01T17:15:00,,Adoption,Neutered Male,30.57494447,-97.40936016,11.53125,Butter,,
1317.0,3 weeks,A711088,Cat,Domestic Shorthair Mix,White/Black,2015-08-10,9/1/2015 18:43,2015-09-01T18:43:00,Partner,Transfer,Intact Female,30.49609862,-97.57321968,3.254265873,,,
1318.0,8 months,A746463,Dog,Basset Hound Mix,White/Tan,2017-01-27,10/7/2017 19:16,2017-10-07T19:16:00,,Adoption,Neutered Male,30.4265018,-97.63291226,36.25753968,Spots,,
1319.0,2 years,A713868,Cat,Domestic Shorthair Mix,Brown Tabby/White,2013-10-14,11/4/2015 10:36,2015-11-04T10:36:00,Partner,Transfer,Spayed Female,30.41376549,-97.71940581,107.3488095,Miss,,
1320.0,2 months,A729378,Cat,Domestic Shorthair Mix,Calico,2016-05-17,8/11/2016 11:25,2016-08-11T11:25:00,Foster,Adoption,Spayed Female,30.42476054,-97.37888678,12.35367063,*Daisy,,
1321.0,2 months,A756985,Cat,Domestic Shorthair Mix,Black,2017-06-28,9/1/2017 14:37,2017-09-01T14:37:00,Partner,Transfer,Intact Male,30.682264,-97.41810562,9.372718254,*Delroy,,
1322.0,3 months,A662278,Cat,Domestic Shorthair Mix,Black,2013-08-01,11/4/2013 18:35,2013-11-04T18:35:00,Foster,Adoption,Spayed Female,30.35887242,-97.34076428,13.68204365,*Honeybear,,
1323.0,2 years,A736394,Dog,Pit Bull Mix,Tan/White,2014-10-10,1/20/2017 15:31,2017-01-20T15:31:00,Foster,Adoption,Neutered Male,30.3632796,-97.38261536,119.0923611,*Dozer,,
1324.0,3 years,A710013,Cat,Domestic Shorthair Mix,White/Gray,2012-08-16,8/17/2015 9:00,2015-08-17T09:00:00,SCRP,Transfer,Neutered Male,30.59655669,-97.51811117,156.625,*Loverboy,,
1325.0,1 year,A741329,Dog,Bull Terrier,White/Black,2015-12-31,3/22/2017 13:42,2017-03-22T13:42:00,Partner,Transfer,Neutered Male,30.64781866,-97.64964909,63.93869048,Spot,,
1326.0,3 months,A710957,Cat,Domestic Shorthair Mix,Black,2015-07-15,10/26/2015 17:08,2015-10-26T17:08:00,,Adoption,Neutered Male,30.3587338,-97.49679599,14.81626984,Bruce,,
1327.0,2 months,A714375,Cat,Domestic Medium Hair Mix,Orange Tabby,2015-09-22,12/12/2015 18:03,2015-12-12T18:03:00,Foster,Adoption,Neutered Male,30.47505113,-97.46994324,11.67886905,*Luke,,
1328.0,1 year,A663921,Dog,Labrador Retriever/German Shepherd,Black,2012-09-26,10/11/2013 12:01,2013-10-11T12:01:00,Partner,Transfer,Spayed Female,30.54395384,-97.50144893,54.35724206,*Collins,,
1329.0,3 years,A660611,Dog,Pit Bull Mix,Black/White,2010-08-09,10/9/2013 16:04,2013-10-09T16:04:00,,Adoption,Spayed Female,30.54654087,-97.40741873,165.3813492,*Cookie,,
1330.0,1 year,A672154,Other,Raccoon Mix,Black/Brown,2013-02-05,2/5/2014 11:45,2014-02-05T11:45:00,Suffering,Euthanasia,Unknown,30.68857836,-97.46667518,52.21279762,,,
1331.0,2 years,A721823,Dog,Labrador Retriever Mix,Black,2014-03-05,3/5/2016 11:43,2016-03-05T11:43:00,,Return to Owner,Neutered Male,30.44152015,-97.28444987,104.4983135,Charlie,,
1332.0,2 months,A750076,Cat,Domestic Shorthair Mix,White/Black,2017-03-23,5/27/2017 13:35,2017-05-27T13:35:00,,Adoption,Intact Male,30.60656042,-97.44053626,9.36656746,,,
1333.0,3 months,A731468,Cat,Domestic Shorthair Mix,Black,2016-04-22,8/13/2016 12:27,2016-08-13T12:27:00,Partner,Transfer,Neutered Male,30.29769926,-97.30217312,16.21696429,*Geronimo,,
1334.0,1 weeks,A753445,Cat,Domestic Shorthair Mix,Brown Tabby,2017-06-26,7/6/2017 15:40,2017-07-06T15:40:00,Partner,Transfer,Intact Female,30.63263734,-97.47511364,1.521825397,,,
1335.0,2 months,A682886,Dog,Labrador Retriever/Pit Bull,Black/White,2014-04-20,7/8/2014 17:49,2014-07-08T17:49:00,,Adoption,Neutered Male,30.65660476,-97.63237145,11.39176587,Tyson,,
1336.0,1 year,A710862,Cat,Domestic Shorthair Mix,Brown Tabby,2014-08-29,9/1/2015 15:52,2015-09-01T15:52:00,Partner,Transfer,Neutered Male,30.33784733,-97.70700026,52.66587302,Clyde,,
1337.0,1 month,A690850,Dog,Irish Setter/Pit Bull,Black,2014-09-12,10/27/2014 14:04,2014-10-27T14:04:00,Partner,Transfer,Intact Male,30.45053694,-97.28365773,6.512301587,Blackie,,
1338.0,2 years,A704740,Dog,Norfolk Terrier Mix,Tan,2013-06-08,7/24/2015 14:11,2015-07-24T14:11:00,,Return to Owner,Neutered Male,30.37180708,-97.5479845,110.9415675,Benji,,
1339.0,6 months,A700690,Dog,Labrador Retriever/Great Dane,Black/White,2014-10-18,4/26/2015 12:17,2015-04-26T12:17:00,,Adoption,Spayed Female,30.61162064,-97.51199533,27.21597222,Lucy,,
1340.0,1 year,A759424,Dog,Labrador Retriever Mix,Black,2016-10-01,10/2/2017 16:25,2017-10-02T16:25:00,Partner,Transfer,Intact Male,30.57346856,-97.34049929,52.38343254,Charlie,,
1341.0,1 month,A754825,Cat,Domestic Shorthair Mix,Black,2017-05-31,7/31/2017 18:52,2017-07-31T18:52:00,,Adoption,Intact Male,30.55500892,-97.35683279,8.826587302,Jon Snow,,
1342.0,3 years,A722914,Cat,Domestic Shorthair Mix,Black,2013-03-24,3/25/2016 14:55,2016-03-25T14:55:00,,Return to Owner,Neutered Male,30.58265341,-97.40142352,156.8030754,Ninja,,
1343.0,2 weeks,A713942,Cat,Domestic Shorthair Mix,Black/White,2015-09-30,10/16/2015 16:11,2015-10-16T16:11:00,Partner,Transfer,Intact Female,30.40270963,-97.46577643,2.382043651,,,
1344.0,3 months,A732192,Cat,Domestic Shorthair Mix,Brown Tabby,2016-07-09,10/11/2016 9:11,2016-10-11T09:11:00,Foster,Adoption,Spayed Female,30.3944159,-97.71117547,13.48323413,*Becky,,
1345.0,2 months,A667325,Cat,Domestic Shorthair Mix,Black,2013-09-05,11/22/2013 17:16,2013-11-22T17:16:00,SCRP,Transfer,Intact Female,30.64004649,-97.60736088,11.24563492,*Nikki,,
1346.0,1 year,A731692,Dog,Staffordshire Mix,Black/White,2015-07-26,1/28/2017 16:36,2017-01-28T16:36:00,,Adoption,Spayed Female,30.5633017,-97.46137527,78.95595238,Maddie,,
1347.0,3 months,A682147,Dog,Pit Bull Mix,Black/White,2014-03-24,6/28/2014 17:07,2014-06-28T17:07:00,,Adoption,Spayed Female,30.29590026,-97.29023336,13.81617063,Lady,,
1348.0,2 years,A704508,Cat,Domestic Shorthair Mix,Blue,2013-06-05,6/6/2015 10:33,2015-06-06T10:33:00,Suffering,Euthanasia,Intact Male,30.58211348,-97.32578234,104.491369,,,
1349.0,7 years,A681769,Dog,American Pit Bull Terrier Mix,White,2008-06-20,12/6/2015 16:26,2015-12-06T16:26:00,,Adoption,Spayed Female,30.3437009,-97.55329476,389.3835317,Pixie,,
1350.0,2 months,A683412,Cat,Siamese Mix,Flame Point,2014-05-10,7/14/2014 12:35,2014-07-14T12:35:00,,Adoption,Intact Male,30.44250871,-97.47286842,9.360615079,Olaf,,
1351.0,1 year,A724199,Dog,German Shepherd Mix,Sable,2014-10-13,4/19/2016 16:22,2016-04-19T16:22:00,,Adoption,Neutered Male,30.54955511,-97.70797526,79.24027778,*Rolf,,
1352.0,3 months,A728401,Cat,Domestic Shorthair Mix,Brown Tabby,2016-02-03,6/3/2016 18:56,2016-06-03T18:56:00,Suffering,Euthanasia,Intact Female,30.35579938,-97.61879441,17.3984127,,,
1353.0,6 months,A696672,Other,Raccoon Mix,Brown,2014-08-09,2/10/2015 8:18,2015-02-10T08:18:00,Rabies Risk,Euthanasia,Unknown,30.34096635,-97.66564812,26.47797619,,,
1354.0,2 months,A731425,Dog,German Shepherd Mix,Brown/Black,2016-05-22,7/26/2016 17:00,2016-07-26T17:00:00,,Adoption,Spayed Female,30.50156144,-97.36772342,9.386904762,Ashley,,
1355.0,1 year,A662736,Cat,Domestic Medium Hair Mix,Black/White,2012-09-08,4/17/2014 14:19,2014-04-17T14:19:00,SCRP,Transfer,Spayed Female,30.43228025,-97.67367256,83.79950397,,,
1356.0,4 months,A700897,Dog,Anatol Shepherd/Border Collie,Black/Cream,2014-12-06,4/25/2015 17:35,2015-04-25T17:35:00,,Adoption,Neutered Male,30.41860581,-97.60449392,20.1046627,Donnatelo,,
1357.0,2 weeks,A756910,Cat,Domestic Shorthair Mix,Black,2017-08-13,8/27/2017 17:24,2017-08-27T17:24:00,Partner,Transfer,Intact Male,30.69696319,-97.39371768,2.103571429,,,
1358.0,5 years,A682593,Dog,Beagle,Brown/White,2009-06-30,7/16/2014 17:33,2014-07-16T17:33:00,,Return to Owner,Neutered Male,30.58428727,-97.68840749,263.2473214,Pinto,,
1359.0,1 year,A739669,Cat,Domestic Shorthair Mix,Tortie,2015-12-05,12/23/2016 19:12,2016-12-23T19:12:00,,Adoption,Spayed Female,30.52329728,-97.68220819,54.97142857,*Peach,,
1360.0,3 years,A691606,Dog,Pit Bull Mix,Brown Brindle/White,2011-11-07,11/12/2014 16:44,2014-11-12T16:44:00,,Return to Owner,Intact Male,30.74013315,-97.32210343,157.3853175,Wolverine,,
1361.0,5 years,A687306,Dog,Pit Bull Mix,Black/White,2009-09-03,2/12/2015 9:07,2015-02-12T09:07:00,Foster,Adoption,Spayed Female,30.68628189,-97.37217994,284.0542659,*Sienna,,
1362.0,4 years,A742154,Dog,Chihuahua Shorthair Mix,Brown/White,2013-01-16,1/20/2017 17:22,2017-01-20T17:22:00,,Adoption,Neutered Male,30.30959402,-97.41261571,209.3890873,Merlin,,
1363.0,2 years,A691732,Dog,Catahoula Mix,Tan/White,2012-11-08,12/4/2014 17:22,2014-12-04T17:22:00,Partner,Transfer,Neutered Male,30.68342306,-97.69128009,108.103373,Copper,,
1364.0,5 months,A760132,Dog,German Shepherd,Black/Brown,2017-03-13,9/4/2017 12:11,2017-09-04T12:11:00,,Return to Owner,Neutered Male,30.63604347,-97.42035364,25.07251984,Zeus,656174071f442de352558622,
1365.0,1 year,A757115,Other,Opossum,Gray,2016-08-30,8/30/2017 11:51,2017-08-30T11:51:00,Medical,Euthanasia,Unknown,30.73525042,-97.34605205,52.21339286,,,
1366.0,1 month,A750586,Cat,Domestic Shorthair Mix,Brown Tabby/White,2017-04-20,6/1/2017 0:00,2017-06-01T00:00:00,Partner,Transfer,Intact Male,30.31908114,-97.31752498,6,*Joel,,
1367.0,1 year,A765046,Dog,Pit Bull Mix,Brown Brindle/White,2016-07-12,1/18/2018 17:11,2018-01-18T17:11:00,Partner,Transfer,Intact Male,30.68662316,-97.47802499,79.38799603,*Leon,,
1368.0,3 years,A731653,Dog,Chihuahua Longhair/Cardigan Welsh Corgi,Tan/White,2013-07-25,2/28/2017 16:23,2017-02-28T16:23:00,Partner,Transfer,Spayed Female,30.68873977,-97.60057347,187.8118056,Nellie,,
1369.0,2 years,A660814,Dog,Pit Bull Mix,Black/White,2011-08-12,1/10/2014 11:34,2014-01-10T11:34:00,Partner,Transfer,Spayed Female,30.64981613,-97.67488265,126.0688492,*Baby Girl,,
1370.0,1 year,A696652,Dog,Great Pyrenees/Labrador Retriever,Cream,2014-11-24,5/1/2016 17:59,2016-05-01T17:59:00,,Return to Owner,Neutered Male,30.28965989,-97.66641712,74.96418651,Archie,,
1371.0,5 months,A691842,Dog,Pit Bull Mix,Brown/White,2014-06-10,11/10/2014 16:36,2014-11-10T16:36:00,Suffering,Euthanasia,Intact Male,30.32122118,-97.59956741,21.95595238,,,
1372.0,6 months,A752542,Cat,Domestic Shorthair Mix,Black,2016-12-23,6/27/2017 0:00,2017-06-27T00:00:00,Snr,Transfer,Spayed Female,30.45179692,-97.72525977,26.57142857,,,
1373.0,2 years,A721200,Dog,Chihuahua Shorthair Mix,Tan/White,2015-02-23,12/9/2017 19:09,2017-12-09T19:09:00,,Adoption,Neutered Male,30.53466297,-97.62702047,145.8282738,*Finn,,
1374.0,1 year,A722435,Dog,Chihuahua Shorthair Mix,White/Tan,2014-09-16,4/17/2016 15:50,2016-04-17T15:50:00,,Adoption,Neutered Male,30.42270198,-97.48796437,82.80853175,Creed,,
1375.0,1 year,A721784,Other,Rabbit Sh Mix,Black/Tan,2015-03-04,3/8/2016 0:00,2016-03-08T00:00:00,Partner,Transfer,Intact Male,30.34840619,-97.38843502,52.85714286,,,
1376.0,2 weeks,A702266,Other,Raccoon Mix,Black/Gray,2015-04-26,5/11/2015 15:37,2015-05-11T15:37:00,Rabies Risk,Euthanasia,Unknown,30.64238554,-97.24355193,2.235813492,,,
1377.0,5 years,A760733,Dog,Chihuahua Longhair Mix,Tan/White,2012-10-25,11/3/2017 16:18,2017-11-03T16:18:00,Partner,Transfer,Spayed Female,30.60027443,-97.56595642,262.239881,Sweetie,,
1378.0,2 months,A712755,Cat,Domestic Medium Hair Mix,Calico,2015-08-27,11/21/2015 13:00,2015-11-21T13:00:00,,Adoption,Spayed Female,30.66378154,-97.27100253,12.36309524,*Sadie,,
1379.0,1 year,A666570,Dog,Pit Bull Mix,Brown/White,2012-05-06,11/7/2013 16:53,2013-11-07T16:53:00,,Return to Owner,Neutered Male,30.39591952,-97.6023255,78.6719246,Willie,,
1380.0,5 years,A764375,Dog,Labrador Retriever Mix,Black/White,2012-12-28,1/9/2018 16:41,2018-01-09T16:41:00,,Return to Owner,Neutered Male,30.65010703,-97.67155894,262.6707341,Westley,,
1381.0,8 years,A721261,Dog,Lhasa Apso Mix,Tricolor,2008-02-24,2/24/2016 13:50,2016-02-24T13:50:00,Partner,Transfer,Spayed Female,30.64904578,-97.26046208,417.5109127,Muffy,,
1382.0,2 months,A708873,Cat,Domestic Shorthair Mix,Blue Tabby,2015-06-01,8/16/2015 18:53,2015-08-16T18:53:00,,Adoption,Neutered Male,30.60008639,-97.5876957,10.96954365,*Admiral,,
1383.0,2 months,A749373,Dog,Australian Terrier Mix,Brown/White,2017-02-27,5/14/2017 12:49,2017-05-14T12:49:00,,Return to Owner,Neutered Male,30.35339217,-97.56515352,10.93343254,Zeus,,
1384.0,10 months,A724319,Dog,Beagle Mix,Buff/White,2015-06-15,4/19/2016 19:45,2016-04-19T19:45:00,,Adoption,Neutered Male,30.5243417,-97.45841046,44.26041667,,,
1385.0,5 years,A723131,Dog,Boxer/Catahoula,Brown Brindle/White,2011-03-27,4/9/2016 13:37,2016-04-09T13:37:00,,Adoption,Neutered Male,30.70754541,-97.72580865,262.9381944,*Grady,,
1386.0,1 month,A667424,Dog,German Shepherd Mix,Black/Tan,2013-10-01,11/19/2013 18:59,2013-11-19T18:59:00,Partner,Transfer,Intact Male,30.67077169,-97.55034591,7.112996032,,,
1387.0,5 years,A740569,Dog,Pit Bull Mix,White,2011-12-19,12/30/2016 13:43,2016-12-30T13:43:00,,Return to Owner,Spayed Female,30.3016299,-97.28005204,262.6530754,Miley,,
1388.0,11 years,A726411,Dog,Labrador Retriever/Chow Chow,Brown,2005-05-10,5/17/2016 16:05,2016-05-17T16:05:00,Partner,Transfer,Neutered Male,30.40833616,-97.35800552,575.0957341,Pepper,,
1389.0,1 year,A749961,Dog,Pit Bull Mix,Brown,2016-05-21,5/22/2017 12:36,2017-05-22T12:36:00,,Return to Owner,Intact Male,30.68661807,-97.40026465,52.36071429,Disel,,
1390.0,9 years,A737969,Dog,Chihuahua Shorthair Mix,Black/White,2007-11-07,1/18/2017 8:38,2017-01-18T08:38:00,Foster,Adoption,Spayed Female,30.35964997,-97.67908975,480.0513889,Sheena,,
1391.0,2 years,A695218,Dog,Chihuahua Shorthair Mix,Brown/White,2013-01-11,1/15/2015 17:46,2015-01-15T17:46:00,,Adoption,Neutered Male,30.34498349,-97.62164645,104.9628968,Nalu,,
1392.0,2 years,A750652,Dog,Pit Bull Mix,Red/White,2015-05-30,6/6/2017 11:24,2017-06-06T11:24:00,Partner,Transfer,Spayed Female,30.71616293,-97.63222367,105.4964286,Pancake,,
1393.0,1 year,A700724,Dog,Chihuahua Shorthair/Rat Terrier,Chocolate/Tan,2014-04-18,4/19/2015 17:32,2015-04-19T17:32:00,,Return to Owner,Spayed Female,30.47771364,-97.4861718,52.39007937,Jellybean,,
1394.0,7 years,A684179,Dog,Pomeranian Mix,Tan,2007-07-20,7/21/2014 17:15,2014-07-21T17:15:00,,Return to Owner,Neutered Male,30.30121098,-97.52765734,365.53125,Tod,,
1395.0,1 year,A717550,Dog,Miniature Poodle Mix,White,2014-12-10,12/17/2015 16:57,2015-12-17T16:57:00,,Adoption,Spayed Female,30.48368416,-97.45902883,53.24375,Isabel,,
1396.0,10 years,A498720,Dog,Rat Terrier,Tricolor,2006-07-30,7/29/2016 13:25,2016-07-29T13:25:00,Foster,Adoption,Spayed Female,30.49445119,-97.41114544,521.7941468,*Mitzi,,
1397.0,2 years,A724249,Dog,Chihuahua Shorthair Mix,Black/Tan,2014-04-14,5/5/2016 18:22,2016-05-05T18:22:00,,Adoption,Neutered Male,30.52314688,-97.73932622,107.5378968,*Marty,,
1398.0,5 months,A750519,Dog,Labrador Retriever Mix,Black,2017-01-28,7/8/2017 18:28,2017-07-08T18:28:00,,Adoption,Spayed Female,30.6233463,-97.73443394,23.10992063,*Raven,,
1399.0,4 weeks,A732894,Cat,Domestic Shorthair Mix,Orange Tabby,2016-07-14,8/15/2016 16:27,2016-08-15T16:27:00,Partner,Transfer,Intact Male,30.54388677,-97.26850875,4.669345238,,,
1400.0,1 year,A734821,Dog,Black Mouth Cur Mix,Tan/White,2015-09-13,9/25/2016 14:24,2016-09-25T14:24:00,Partner,Transfer,Intact Female,30.35436019,-97.62375053,54.08571429,*Sadie,,
1401.0,1 year,A689914,Cat,Domestic Shorthair Mix,White,2013-10-11,10/12/2014 9:00,2014-10-12T09:00:00,SCRP,Transfer,Intact Male,30.32220769,-97.29356125,52.33928571,,,
1402.0,3 years,A712133,Dog,Chinese Sharpei Mix,White/Brown,2012-09-21,9/24/2015 18:27,2015-09-24T18:27:00,,Adoption,Spayed Female,30.44652568,-97.51287607,156.9669643,*Molly,,
1403.0,7 years,A765086,Dog,English Bulldog,Fawn/White,2011-01-12,1/24/2018 16:14,2018-01-24T16:14:00,,Adoption,Spayed Female,30.62783023,-97.27352709,367.096627,Audrey,,
1404.0,10 months,A762649,Dog,Labrador Retriever Mix,Black/White,2017-01-22,11/25/2017 15:34,2017-11-25T15:34:00,,Adoption,Spayed Female,30.40999952,-97.46560629,43.94980159,Blue,,
1405.0,4 years,A674182,Dog,Labrador Retriever Mix,Brown,2010-03-08,3/16/2014 11:57,2014-03-16T11:57:00,,Return to Owner,Neutered Male,30.69521392,-97.55787298,209.9282738,Gordo,,
1406.0,2 years,A738439,Cat,Domestic Shorthair Mix,Black/White,2014-11-15,11/15/2016 16:08,2016-11-15T16:08:00,,Return to Owner,Neutered Male,30.45135146,-97.50919629,104.5246032,Tips,,
1407.0,1 year,A702782,Dog,Lhasa Apso/Pbgv,Black/Tan,2014-05-17,5/20/2015 11:57,2015-05-20T11:57:00,Partner,Transfer,Intact Male,30.41905284,-97.37426972,52.64255952,,,
1408.0,6 months,A724899,Dog,Rat Terrier Mix,Tan/White,2015-10-22,4/26/2016 18:36,2016-04-26T18:36:00,,Adoption,Neutered Male,30.54873001,-97.31927453,26.825,,,
1409.0,9 years,A683044,Dog,Chihuahua Longhair Mix,Brown Brindle/White,2005-07-07,7/7/2014 13:03,2014-07-07T13:03:00,,Return to Owner,Neutered Male,30.55347425,-97.2479719,469.6491071,Saki,,
1410.0,5 years,A715843,Dog,Labrador Retriever Mix,Brown,2010-11-11,11/23/2015 17:44,2015-11-23T17:44:00,,Adoption,Neutered Male,30.71035109,-97.24358438,262.6769841,Gabe,,
1411.0,3 months,A703165,Cat,Domestic Shorthair Mix,Brown Tabby,2015-04-14,7/19/2015 19:30,2015-07-19T19:30:00,Foster,Adoption,Spayed Female,30.62584794,-97.3267573,13.83035714,,,
1412.0,2 years,A616271,Dog,German Shepherd Mix,Red,2011-10-06,4/16/2014 12:50,2014-04-16T12:50:00,Partner,Transfer,Spayed Female,30.29593358,-97.69839584,131.9335317,*Franziska,,
1413.0,3 years,A689954,Dog,Beagle Mix,Sable,2011-10-11,10/21/2014 16:23,2014-10-21T16:23:00,Partner,Transfer,Spayed Female,30.33168327,-97.58417635,158.0975198,*Sophie,,
1414.0,2 months,A725562,Cat,Domestic Shorthair Mix,Black Tabby,2016-04-25,7/2/2016 17:12,2016-07-02T17:12:00,,Adoption,Spayed Female,30.66647694,-97.68513184,9.816666667,,,
1415.0,3 years,A691542,Dog,Pit Bull Mix,Blue,2011-11-06,1/29/2015 17:48,2015-01-29T17:48:00,,Adoption,Neutered Male,30.55242217,-97.69822673,168.677381,Axel,,
1416.0,2 years,A703262,Other,Skunk Mix,Black/White,2013-05-22,5/24/2015 10:59,2015-05-24T10:59:00,Rabies Risk,Euthanasia,Unknown,30.49386547,-97.61802571,104.6368056,,,
1417.0,5 months,A721922,Other,Raccoon Mix,Brown,2015-09-07,3/7/2016 13:43,2016-03-07T13:43:00,Rabies Risk,Euthanasia,Unknown,30.72088094,-97.24938103,26.08164683,,,
1418.0,10 months,A756044,Dog,Labrador Retriever Mix,Brown/Brown,2016-10-13,8/17/2017 0:00,2017-08-17T00:00:00,Partner,Transfer,Intact Male,30.29466133,-97.37351517,44,*Milan,,
1419.0,8 years,A621244,Cat,Maine Coon Mix,Orange Tabby,2009-03-03,1/2/2018 11:31,2018-01-02T11:31:00,,Return to Owner,Spayed Female,30.70722038,-97.47320335,461.0685516,,,
1420.0,9 years,A717094,Dog,German Shepherd/Labrador Retriever,Black/Brown,2006-12-02,12/2/2015 12:02,2015-12-02T12:02:00,Suffering,Euthanasia,Spayed Female,30.29488615,-97.62229168,469.6430556,Cookie,,
1421.0,7 years,A710417,Dog,Chihuahua Shorthair Mix,White,2008-08-30,9/12/2015 11:56,2015-09-12T11:56:00,,Adoption,Neutered Male,30.5541828,-97.45830339,367.0710317,Skipper,,
1422.0,3 years,A689316,Cat,Domestic Shorthair Mix,Black,2011-10-02,10/11/2014 12:04,2014-10-11T12:04:00,,Adoption,Neutered Male,30.56702456,-97.33809014,157.9289683,*Willie,,
1423.0,2 months,A749101,Cat,Domestic Shorthair Mix,Black,2017-04-18,7/1/2017 19:15,2017-07-01T19:15:00,Foster,Adoption,Spayed Female,30.50061973,-97.53094203,10.6860119,*Mary Kate,,
1424.0,2 months,A665416,Dog,Cairn Terrier Mix,Tan,2013-08-06,10/21/2013 19:10,2013-10-21T19:10:00,,Adoption,Spayed Female,30.55341765,-97.38085324,10.97123016,,,
1425.0,1 year,A674021,Other,Bat Mix,Brown/Black,2013-03-06,3/6/2014 11:06,2014-03-06T11:06:00,Rabies Risk,Euthanasia,Unknown,30.30466086,-97.74096368,52.20892857,,,
1426.0,2 years,A752196,Cat,American Shorthair Mix,Brown Tabby,2015-06-19,6/21/2017 13:40,2017-06-21T13:40:00,Partner,Transfer,Intact Female,30.70541124,-97.28973564,104.7956349,,,
1427.0,2 months,A738137,Dog,Chihuahua Shorthair Mix,White/Tan,2016-08-26,11/14/2016 17:24,2016-11-14T17:24:00,,Adoption,Spayed Female,30.63863843,-97.39595269,11.53214286,,,
1428.0,2 months,A757581,Cat,Domestic Medium Hair Mix,Blue/White,2017-07-20,10/15/2017 12:56,2017-10-15T12:56:00,In Kennel,Died,Intact Male,30.43976527,-97.46585516,12.50555556,,,
1429.0,16 years,A702724,Dog,Basenji Mix,Tan/White,1999-05-18,5/18/2015 11:20,2015-05-18T11:20:00,,Return to Owner,Spayed Female,30.75609833,-97.60906182,834.9246032,Quennie,,
1430.0,4 years,A706652,Cat,Domestic Shorthair Mix,Black,2011-07-01,7/17/2015 14:18,2015-07-17T14:18:00,Partner,Transfer,Spayed Female,30.53267873,-97.43980369,211.085119,Midnight,,
1431.0,2 years,A715003,Cat,Domestic Shorthair Mix,Blue/White,2013-10-29,9/24/2016 16:27,2016-09-24T16:27:00,,Adoption,Spayed Female,30.43269677,-97.57881305,151.6693452,Marley,,
1432.0,6 months,A721021,Cat,Domestic Shorthair Mix,Torbie,2015-08-19,3/8/2016 18:42,2016-03-08T18:42:00,,Adoption,Spayed Female,30.71013579,-97.47981076,28.96845238,Cat,,
1433.0,1 day,A689235,Dog,Labrador Retriever Mix,Black/White,2014-10-01,10/2/2014 14:36,2014-10-02T14:36:00,Partner,Transfer,Unknown,30.27380384,-97.5288286,0.229761905,,,
1434.0,2 months,A729522,Dog,Labrador Retriever Mix,Black,2016-04-05,6/23/2016 17:37,2016-06-23T17:37:00,,Adoption,Neutered Male,30.33413975,-97.29799984,11.3905754,,,
1435.0,1 year,A688839,Cat,Domestic Medium Hair Mix,Black/White,2013-09-24,10/13/2014 19:22,2014-10-13T19:22:00,,Adoption,Neutered Male,30.53380162,-97.29422281,54.97242063,*Wilson,,
1436.0,8 years,A666306,Dog,Chihuahua Longhair Mix,White/Brown,2005-10-30,11/29/2013 16:08,2013-11-29T16:08:00,Partner,Transfer,Spayed Female,30.51355943,-97.58657989,421.8103175,*Pearl,,
1437.0,3 years,A674379,Dog,German Shepherd Mix,Tan/Black,2011-03-12,3/15/2014 16:54,2014-03-15T16:54:00,,Return to Owner,Intact Female,30.59730835,-97.41882702,157.1005952,July,,
1438.0,2 years,A706081,Dog,Australian Shepherd Mix,Brown Brindle,2013-06-24,6/24/2015 19:17,2015-06-24T19:17:00,,Return to Owner,Neutered Male,30.28793986,-97.51015874,104.400496,Diamond,,
1439.0,7 years,A717878,Dog,Labrador Retriever Mix,Brown,2008-12-17,2/28/2016 16:20,2016-02-28T16:20:00,,Adoption,Neutered Male,30.35158061,-97.56187886,375.6686508,Jax,,
1440.0,2 months,A744778,Dog,Chihuahua Shorthair Mix,Red,2016-12-23,3/12/2017 17:03,2017-03-12T17:03:00,,Adoption,Neutered Male,30.55753175,-97.2925261,11.38720238,,,
1441.0,13 years,A762393,Dog,Australian Cattle Dog Mix,Black/White,2004-11-19,11/25/2017 15:27,2017-11-25T15:27:00,,Adoption,Neutered Male,30.72539207,-97.73329533,679.2348214,Buster,,
1442.0,1 year,A699705,Other,Bat,Black/Brown,2014-04-01,4/1/2015 13:17,2015-04-01T13:17:00,Rabies Risk,Euthanasia,Unknown,30.62214769,-97.39339767,52.2219246,,,
1443.0,13 years,A714315,Cat,Russian Blue Mix,Blue,2002-01-01,11/4/2015 12:26,2015-11-04T12:26:00,,Adoption,Neutered Male,30.36219918,-97.66498578,722.2168651,*Kojak,,
1444.0,4 years,A679232,Cat,Domestic Shorthair Mix,Orange Tabby,2010-05-17,5/19/2014 14:12,2014-05-19T14:12:00,,Return to Owner,Neutered Male,30.6973735,-97.29968398,209.0845238,Simba,,
1445.0,2 weeks,A702255,Cat,Domestic Shorthair Mix,Black,2015-04-26,5/12/2015 13:36,2015-05-12T13:36:00,Partner,Transfer,Intact Female,30.71869621,-97.2731272,2.366666667,,,
1446.0,1 year,A741302,Dog,Labrador Retriever Mix,Black,2015-11-02,1/3/2017 18:47,2017-01-03T18:47:00,,Adoption,Neutered Male,30.64339058,-97.26170787,61.2546627,Titan,,
1447.0,1 year,A706409,Dog,Pit Bull Mix,Black/White,2013-12-28,7/8/2015 18:49,2015-07-08T18:49:00,,Adoption,Spayed Female,30.26971886,-97.34399982,79.68343254,Shadow,,
1448.0,2 years,A685366,Dog,Chihuahua Shorthair Mix,Buff/White,2012-08-06,9/14/2014 14:58,2014-09-14T14:58:00,Partner,Transfer,Neutered Male,30.57426664,-97.38639522,109.9462302,*Davie,,
1449.0,8 years,A715701,Cat,Domestic Shorthair Mix,Brown Tabby/White,2007-11-08,11/8/2015 15:50,2015-11-08T15:50:00,Suffering,Euthanasia,Spayed Female,30.62742171,-97.71942679,417.5228175,,,
1450.0,2 months,A667383,Dog,Pit Bull Mix,White/Tan,2013-09-02,11/23/2013 15:09,2013-11-23T15:09:00,,Adoption,Neutered Male,30.28056572,-97.37125573,11.80446429,Olympus,,
1451.0,2 years,A745180,Dog,Pit Bull Mix,White/Brown Brindle,2015-03-14,3/19/2017 11:46,2017-03-19T11:46:00,,Return to Owner,Intact Male,30.52951184,-97.56630987,105.2128968,Seven,,
1452.0,2 months,A726988,Cat,Domestic Shorthair Mix,Blue,2016-04-20,6/27/2016 17:54,2016-06-27T17:54:00,Foster,Adoption,Neutered Male,30.42575075,-97.69169879,9.820833333,*Puff,,
1453.0,2 years,A731198,Dog,Chihuahua Shorthair Mix,Brown,2014-07-18,7/28/2016 16:53,2016-07-28T16:53:00,,Return to Owner,Spayed Female,30.38139731,-97.70852854,105.9576389,Nana,,
1454.0,2 months,A759389,Cat,Domestic Shorthair Mix,Black/White,2017-07-27,10/6/2017 14:22,2017-10-06T14:22:00,Partner,Transfer,Intact Female,30.47957965,-97.35465241,10.22837302,,,
1455.0,3 years,A729985,Dog,Plott Hound Mix,White/Brown,2013-02-26,6/27/2016 12:29,2016-06-27T12:29:00,,Return to Owner,Spayed Female,30.62106314,-97.60362847,173.9314484,Estrella,,
1456.0,9 years,A717409,Cat,Domestic Medium Hair Mix,Black/White,2006-12-07,1/28/2016 21:00,2016-01-28T21:00:00,In Foster,Died,Spayed Female,30.71735321,-97.2948192,477.125,*Emmy,,
1457.0,8 years,A725675,Dog,Miniature Pinscher Mix,Black/Brown,2008-05-01,5/8/2016 15:56,2016-05-08T15:56:00,,Adoption,Spayed Female,30.6897296,-97.73270068,418.5234127,Maya,,
1458.0,4 months,A713812,Cat,Domestic Shorthair Mix,Orange Tabby,2015-09-25,1/27/2016 18:48,2016-01-27T18:48:00,Foster,Adoption,Neutered Male,30.70496525,-97.25688781,17.82619048,*Leo,,
1459.0,2 weeks,A687645,Cat,Domestic Shorthair Mix,Brown Tabby,2014-08-24,9/8/2014 16:41,2014-09-08T16:41:00,Partner,Transfer,Intact Male,30.32290552,-97.72453426,2.242162698,,,
1460.0,1 weeks,A738531,Cat,Domestic Shorthair Mix,Black Tabby,2016-11-07,11/17/2016 12:30,2016-11-17T12:30:00,Partner,Transfer,Unknown,30.64518884,-97.26543258,1.50297619,,,
1461.0,4 years,A687185,Dog,Chihuahua Shorthair Mix,Brown/White,2010-09-02,9/9/2014 18:40,2014-09-09T18:40:00,,Adoption,Spayed Female,30.55191441,-97.51767821,209.8253968,*Pepsi,,
1462.0,6 months,A669366,Dog,Parson Russell Terrier Mix,White/Tan,2013-06-19,12/29/2013 13:44,2013-12-29T13:44:00,,Adoption,Neutered Male,30.58767383,-97.46140379,27.6531746,,,
1463.0,3 months,A671505,Cat,Russian Blue Mix,Blue,2013-12-03,3/20/2014 16:01,2014-03-20T16:01:00,,Adoption,Neutered Male,30.48740926,-97.25803845,15.38105159,*Rasputin,,
1464.0,1 month,A696151,Dog,Dachshund Mix,Black/Brown,2014-12-31,2/24/2015 17:17,2015-02-24T17:17:00,Foster,Adoption,Neutered Male,30.70834194,-97.34782082,7.960019841,Sully,,
1465.0,5 years,A697359,Dog,Miniature Poodle Mix,White,2010-02-22,2/25/2015 17:01,2015-02-25T17:01:00,,Return to Owner,Spayed Female,30.72996839,-97.4406544,261.387004,Poppy,,
1466.0,1 weeks,A705155,Dog,American Staffordshire Terrier,Tricolor,2015-06-11,6/19/2015 13:44,2015-06-19T13:44:00,Partner,Transfer,Intact Male,30.46409339,-97.44366681,1.224603175,,,
1467.0,3 years,A706412,Other,Raccoon,Black/Gray,2012-06-28,6/28/2015 16:15,2015-06-28T16:15:00,Medical,Euthanasia,Intact Female,30.73117597,-97.52763926,156.5252976,,,
1468.0,4 years,A723832,Dog,Australian Cattle Dog Mix,Blue Merle,2012-04-07,4/11/2016 18:33,2016-04-11T18:33:00,,Return to Owner,Intact Male,30.68133924,-97.55556557,209.396131,Buck,,
1469.0,2 years,A729826,Dog,Miniature Poodle Mix,White,2014-06-24,7/4/2016 13:05,2016-07-04T13:05:00,,Return to Owner,Intact Male,30.34972522,-97.30750226,105.9350198,Snow,,
1470.0,5 years,A720585,Dog,Chow Chow Mix,Red,2011-02-12,2/14/2016 16:56,2016-02-14T16:56:00,,Adoption,Neutered Male,30.35454137,-97.7324346,261.2436508,Dog,,
1471.0,5 days,A706507,Cat,Domestic Shorthair Mix,Black,2015-06-25,6/30/2015 0:00,2015-06-30T00:00:00,In Kennel,Died,Unknown,30.49586279,-97.4937223,0.714285714,,,
1472.0,3 years,A665943,Cat,Siamese Mix,Lynx Point,2010-10-24,11/6/2013 15:19,2013-11-06T15:19:00,,Return to Owner,Neutered Male,30.42518292,-97.27454413,158.5197421,Twin,,
1473.0,4 months,A763215,Cat,Domestic Shorthair Mix,Blue Cream,2017-08-11,12/15/2017 18:08,2017-12-15T18:08:00,,Adoption,Spayed Female,30.69584458,-97.31370375,18.10793651,Honey,,
1474.0,1 year,A749996,Cat,Domestic Medium Hair Mix,Brown Tabby,2016-05-22,5/26/2017 18:58,2017-05-26T18:58:00,Snr,Transfer,Spayed Female,30.73625468,-97.71336006,52.82718254,,,
1475.0,2 years,A752261,Cat,Domestic Shorthair Mix,Cream Tabby,2015-06-20,6/28/2017 14:32,2017-06-28T14:32:00,Partner,Transfer,Intact Female,30.38917641,-97.34304846,105.6579365,*Tina,,
1476.0,1 year,A719756,Dog,Shih Tzu Mix,White/Black,2015-03-27,11/15/2016 16:58,2016-11-15T16:58:00,,Return to Owner,Neutered Male,30.66551021,-97.54072512,85.67242063,Fluffy,,
1477.0,13 years,A755390,Dog,Chow Chow Mix,Gold,2004-08-02,8/13/2017 14:55,2017-08-13T14:55:00,,Return to Owner,Neutered Male,30.63489825,-97.57169204,679.9459325,Marley,,
1478.0,6 months,A687696,Other,Bat Mix,Brown,2014-03-08,9/9/2014 9:03,2014-09-09T09:03:00,,Disposal,Unknown,30.55926817,-97.562324,26.48244048,,,
1479.0,4 years,A700088,Dog,Labrador Retriever Mix,Black/White,2010-05-08,4/18/2015 12:16,2015-04-18T12:16:00,,Return to Owner,Neutered Male,30.39595863,-97.47458773,258.0730159,Chubbs,,
1480.0,4 years,A721371,Dog,Labrador Retriever Mix,Chocolate/Tan,2012-02-25,2/25/2016 18:12,2016-02-25T18:12:00,,Return to Owner,Neutered Male,30.48839823,-97.53764206,208.822619,Georgo,,
1481.0,6 years,A719321,Cat,Domestic Shorthair Mix,Torbie,2010-01-17,1/24/2016 17:47,2016-01-24T17:47:00,,Adoption,Spayed Female,30.45765437,-97.55366143,314.1058532,Kaya,,
1482.0,3 years,A683507,Dog,Cairn Terrier Mix,Buff,2011-07-11,7/15/2014 17:26,2014-07-15T17:26:00,,Adoption,Spayed Female,30.71523721,-97.45160454,157.246627,,,
1483.0,2 months,A664503,Cat,Domestic Shorthair Mix,Black/White,2013-07-20,10/10/2013 18:17,2013-10-10T18:17:00,,Adoption,Neutered Male,30.47234334,-97.26591803,11.82311508,,,
1484.0,7 years,A700756,Dog,Bichon Frise Mix,White,2008-05-01,10/10/2015 12:20,2015-10-10T12:20:00,,Adoption,Spayed Female,30.39184765,-97.33845218,388.359127,Maya,,
1485.0,2 months,A665225,Dog,Pug Mix,Brown/Black,2013-07-31,10/19/2013 17:53,2013-10-19T17:53:00,,Adoption,Spayed Female,30.63539415,-97.3466364,11.53501984,,,
1486.0,3 months,A679133,Dog,Pit Bull Mix,Brown Brindle/White,2014-01-16,5/16/2014 19:32,2014-05-16T19:32:00,Partner,Transfer,Intact Female,30.71041773,-97.31200549,17.25912698,,,
1487.0,2 months,A682746,Cat,Domestic Shorthair Mix,Blue Tabby,2014-05-02,7/7/2014 12:26,2014-07-07T12:26:00,Partner,Transfer,Intact Female,30.73667752,-97.47940274,9.502579365,,,
1488.0,2 months,A680264,Dog,German Shepherd,Black/Tan,2014-03-16,5/31/2014 16:31,2014-05-31T16:31:00,Partner,Transfer,Intact Female,30.47619126,-97.36950163,10.95545635,,656174071f442de352558622,
1489.0,2 months,A680967,Cat,Domestic Shorthair Mix,Orange Tabby/White,2014-06-03,8/5/2014 17:00,2014-08-05T17:00:00,,Adoption,Neutered Male,30.42273522,-97.64110216,9.101190476,*Bandit,,
1490.0,3 months,A664241,Dog,Pit Bull Mix,Brown Brindle/White,2013-08-01,11/1/2013 18:38,2013-11-01T18:38:00,,Adoption,Spayed Female,30.4605209,-97.6910182,13.25376984,Fina,,
1491.0,2 years,A738741,Cat,Domestic Shorthair Mix,Blue,2014-11-20,11/21/2016 9:00,2016-11-21T09:00:00,SCRP,Transfer,Neutered Male,30.45749985,-97.34248977,104.625,,,
1492.0,17 years,A698600,Cat,Siamese Mix,Lynx Point,1998-03-14,7/18/2015 13:02,2015-07-18T13:02:00,Partner,Transfer,Spayed Female,30.32152042,-97.41144616,905.0775794,Nuts,,
1493.0,1 year,A739386,Cat,Domestic Longhair Mix,Brown Tabby/White,2015-12-01,12/2/2016 9:00,2016-12-02T09:00:00,SCRP,Transfer,Spayed Female,30.70709345,-97.55097097,52.48214286,,,
1494.0,3 months,A684660,Cat,Domestic Shorthair Mix,Torbie,2014-04-26,7/27/2014 9:00,2014-07-27T09:00:00,SCRP,Transfer,Intact Female,30.37860409,-97.61232475,13.19642857,,,
1495.0,2 months,A752378,Cat,Domestic Shorthair Mix,Calico,2017-05-15,7/22/2017 10:05,2017-07-22T10:05:00,Foster,Adoption,Spayed Female,30.35795223,-97.56087238,9.774305556,*Luna,,
1496.0,2 years,A745663,Dog,Australian Shepherd Mix,Tricolor,2015-03-21,3/21/2017 19:29,2017-03-21T19:29:00,,Return to Owner,Intact Male,30.56196476,-97.6192041,104.5445437,Law,,
1497.0,3 years,A743813,Dog,Labrador Retriever Mix,Black,2013-08-17,2/22/2017 17:15,2017-02-22T17:15:00,,Adoption,Neutered Male,30.33956251,-97.29584767,183.6741071,*Sullivan,,
1498.0,1 month,A750054,Cat,Domestic Shorthair Mix,Brown Tabby,2017-04-23,6/6/2017 0:00,2017-06-06T00:00:00,Partner,Transfer,Intact Male,30.71170969,-97.29245636,6.285714286,*George,,
1499.0,3 years,A665619,Dog,Chihuahua Shorthair Mix,Black/Tan,2012-10-22,12/24/2015 15:15,2015-12-24T15:15:00,,Return to Owner,Neutered Male,30.39363125,-97.68582337,165.5193452,Chico,,
1500.0,3 weeks,A676611,Cat,Domestic Shorthair Mix,Orange Tabby,2014-03-21,4/12/2014 16:48,2014-04-12T16:48:00,Partner,Transfer,Intact Male,30.4160073,-97.65046771,3.242857143,,,
1501.0,2 years,A754757,Dog,Tibetan Spaniel Mix,Black/White,2015-07-09,7/26/2017 17:20,2017-07-26T17:20:00,,Adoption,Neutered Male,30.50281112,-97.35878424,106.9603175,Gremlin,,
1502.0,2 years,A755953,Dog,Pit Bull Mix,Brown Brindle,2015-08-11,10/9/2017 17:58,2017-10-09T17:58:00,,Adoption,Spayed Female,30.55924507,-97.47378715,112.9640873,*Micki,,
1503.0,3 weeks,A680151,Cat,Domestic Longhair Mix,Brown Tabby/White,2014-05-08,5/30/2014 14:37,2014-05-30T14:37:00,Partner,Transfer,Intact Female,30.30932013,-97.44482137,3.229861111,,,
1504.0,10 years,A572587,Dog,German Shepherd Mix,Black/Tan,2005-05-06,3/9/2016 18:27,2016-03-09T18:27:00,,Return to Owner,Neutered Male,30.3934313,-97.33077435,565.8241071,Ranger,,
1505.0,1 year,A758487,Other,Bat,Brown,2016-09-17,9/18/2017 9:28,2017-09-18T09:28:00,Rabies Risk,Euthanasia,Unknown,30.693026,-97.24941742,52.34206349,,,
1506.0,3 months,A733191,Cat,Domestic Shorthair Mix,Black,2016-08-11,11/15/2016 9:40,2016-11-15T09:40:00,Foster,Adoption,Neutered Male,30.60240506,-97.69131732,13.7718254,*Lunar,,
1507.0,2 months,A758109,Cat,American Shorthair Mix,Brown Tabby,2017-09-14,11/28/2017 17:16,2017-11-28T17:16:00,,Adoption,Neutered Male,30.64489796,-97.44947615,10.81706349,,,
1508.0,1 year,A721943,Dog,German Shepherd Mix,Black/Tan,2015-03-07,3/16/2016 14:18,2016-03-16T14:18:00,,Adoption,Spayed Female,30.30290815,-97.64219341,53.65654762,*Brunhilde,,
1509.0,3 months,A722861,Dog,Labrador Retriever Mix,White/Brown,2015-12-23,3/28/2016 13:35,2016-03-28T13:35:00,,Adoption,Neutered Male,30.33181349,-97.5253291,13.79513889,*Azul,,
1510.0,2 years,A763120,Other,Belgian Hare,Gray/Gray,2015-12-03,1/14/2018 15:41,2018-01-14T15:41:00,,Adoption,Spayed Female,30.33927207,-97.47612553,110.5219246,*Arya,,
1511.0,2 months,A680549,Dog,Great Pyrenees Mix,Cream,2014-04-04,6/10/2014 14:32,2014-06-10T14:32:00,Partner,Transfer,Intact Male,30.49083537,-97.70988907,9.657936508,Hershey,,
1512.0,2 years,A678285,Dog,Chihuahua Shorthair/Cairn Terrier,Tan,2012-05-06,7/2/2014 12:12,2014-07-02T12:12:00,,Adoption,Spayed Female,30.69553916,-97.41937403,112.5011905,Mia,,
1513.0,1 year,A704237,Dog,Miniature Poodle Mix,White,2014-06-02,6/4/2015 15:06,2015-06-04T15:06:00,In Kennel,Died,Intact Male,30.47719927,-97.38245974,52.51845238,,,
1514.0,6 years,A727997,Dog,Pit Bull Mix,Red/White,2010-05-17,6/3/2016 17:14,2016-06-03T17:14:00,,Return to Owner,Neutered Male,30.44262689,-97.57601713,315.6740079,Cappuccino,,
1515.0,1 year,A702061,Other,Bat,Brown,2014-05-08,5/8/2015 15:59,2015-05-08T15:59:00,Rabies Risk,Euthanasia,Unknown,30.41704603,-97.45577131,52.23799603,,,
1516.0,2 months,A683671,Cat,Domestic Longhair Mix,Orange Tabby/White,2014-06-06,8/24/2014 17:20,2014-08-24T17:20:00,,Adoption,Spayed Female,30.35957953,-97.30557517,11.38888889,*Pumpkin,,
1517.0,1 year,A671638,Dog,Dutch Shepherd/Boxer,Brown Brindle/White,2013-01-28,4/27/2014 18:06,2014-04-27T18:06:00,Partner,Transfer,Spayed Female,30.28949132,-97.48597066,64.96488095,*Hopscotch,,
1518.0,11 months,A695189,Dog,Border Collie/German Shepherd,Black/White,2014-09-10,8/11/2015 17:49,2015-08-11T17:49:00,,Return to Owner,Neutered Male,30.53372038,-97.45455274,47.96319444,Gunner,,
1519.0,2 months,A684595,Cat,Domestic Shorthair Mix,White/Black Smoke,2014-05-10,8/2/2014 12:43,2014-08-02T12:43:00,,Adoption,Spayed Female,30.74902293,-97.68143423,12.07569444,,,
1520.0,4 years,A693065,Cat,Domestic Medium Hair Mix,Torbie,2010-12-01,12/1/2014 16:36,2014-12-01T16:36:00,,Return to Owner,Spayed Female,30.58285961,-97.5286631,208.8130952,Zulma,,
1521.0,1 month,A762257,Dog,Labrador Retriever/Australian Cattle Dog,Black/White,2017-10-02,11/17/2017 19:21,2017-11-17T19:21:00,Partner,Transfer,Intact Male,30.61107254,-97.65385378,6.686607143,,,
1522.0,2 months,A684044,Cat,Domestic Shorthair Mix,Brown Tabby,2014-05-11,7/22/2014 16:57,2014-07-22T16:57:00,,Adoption,Neutered Male,30.60987386,-97.44199343,10.38660714,,,
1523.0,2 years,A701957,Dog,Pit Bull Mix,White,2013-05-06,5/6/2015 19:21,2015-05-06T19:21:00,Suffering,Euthanasia,Spayed Female,30.45716675,-97.5888885,104.4008929,Sugar,,
1524.0,5 years,A690820,Dog,Pit Bull Mix,Red,2009-10-26,11/4/2014 14:55,2014-11-04T14:55:00,Aggressive,Euthanasia,Spayed Female,30.41644295,-97.24400336,262.2316468,Honey,,
1525.0,1 year,A741451,Dog,Manchester Terrier Mix,Black/Brown Brindle,2016-01-02,1/7/2017 19:14,2017-01-07T19:14:00,,Adoption,Neutered Male,30.53484051,-97.63302732,53.11448413,,,
1526.0,2 months,A734395,Dog,Pit Bull Mix,Buff/White,2016-07-06,9/6/2016 18:22,2016-09-06T18:22:00,,Return to Owner,Intact Male,30.70756854,-97.42008314,8.966468254,King,,
1527.0,10 years,A328422,Dog,Parson Russell Terrier Mix,White/Black,2003-04-13,3/17/2014 11:55,2014-03-17T11:55:00,,Return to Owner,Neutered Male,30.31990297,-97.31108424,570.2137897,Cru,,
1528.0,1 year,A737900,Dog,Labrador Retriever Mix,Black,2015-11-06,11/26/2016 11:46,2016-11-26T11:46:00,Partner,Transfer,Neutered Male,30.32699771,-97.6655209,55.21289683,*Dr. Pepper,,
1529.0,8 months,A675331,Cat,Domestic Shorthair Mix,Calico,2013-06-26,3/26/2014 15:51,2014-03-26T15:51:00,SCRP,Transfer,Intact Female,30.73385932,-97.56223241,39.09434524,,,
1530.0,1 year,A670328,Cat,Domestic Medium Hair Mix,White/Brown,2012-07-06,1/6/2014 9:52,2014-01-06T09:52:00,Suffering,Euthanasia,Neutered Male,30.48051393,-97.73338035,78.48730159,,,
1531.0,9 months,A667795,Dog,Pit Bull Mix,White/Black,2013-02-22,12/16/2013 19:17,2013-12-16T19:17:00,,Adoption,Neutered Male,30.42275161,-97.41711005,42.54335317,*Blue,,
1532.0,4 years,A698319,Dog,Silky Terrier Mix,Silver/Tan,2011-03-09,3/13/2015 17:14,2015-03-13T17:14:00,,Adoption,Spayed Female,30.44153228,-97.34145362,209.3882937,Nik-O,,
1533.0,7 months,A718121,Dog,Boston Terrier/Dachshund,Brown Brindle/White,2015-05-21,12/24/2015 13:36,2015-12-24T13:36:00,,Adoption,Neutered Male,30.562366,-97.44184816,31.08095238,Kava,,
1534.0,1 year,A737815,Dog,Labrador Retriever/Basset Hound,Tan/White,2015-11-04,12/11/2016 16:20,2016-12-11T16:20:00,,Adoption,Neutered Male,30.67894914,-97.24507546,57.66865079,Jayco,,
1535.0,2 months,A710364,Cat,Domestic Shorthair Mix,Blue Tabby,2015-06-07,8/29/2015 16:22,2015-08-29T16:22:00,,Adoption,Neutered Male,30.67273384,-97.55354709,11.95456349,*Reuben,,
1536.0,4 months,A709855,Cat,Domestic Longhair Mix,Cream Tabby,2015-04-13,8/16/2015 18:46,2015-08-16T18:46:00,,Adoption,Intact Male,30.30416231,-97.53248155,17.96884921,Gryffindor,,
1537.0,5 months,A686577,Other,Bat Mix,Gray,2014-02-23,8/24/2014 9:25,2014-08-24T09:25:00,,Disposal,Unknown,30.659905,-97.30671978,26.05605159,,,
1538.0,8 months,A699969,Dog,German Shepherd/German Shepherd,Tan/White,2014-09-05,5/15/2015 16:45,2015-05-15T16:45:00,Partner,Transfer,Spayed Female,30.7025047,-97.55139127,36.09970238,*Mari,,
1539.0,1 year,A751519,Dog,Pit Bull Mix,White/Blue,2016-06-09,6/27/2017 15:44,2017-06-27T15:44:00,Partner,Transfer,Intact Male,30.60761628,-97.74080028,54.80793651,*Monticello,,
1540.0,3 months,A745466,Dog,Labrador Retriever Mix,Black,2016-12-18,3/20/2017 19:32,2017-03-20T19:32:00,,Return to Owner,Intact Male,30.62233166,-97.3343356,13.25912698,Pablo,,
1541.0,2 years,A743624,Dog,German Shepherd,Red/White,2015-02-13,2/14/2017 0:00,2017-02-14T00:00:00,Partner,Transfer,Neutered Male,30.28966945,-97.46506728,104.5714286,Gavin,656174071f442de352558622,
1542.0,2 years,A705677,Dog,Dogo Argentino Mix,White,2013-06-20,11/3/2015 13:12,2015-11-03T13:12:00,Partner,Transfer,Neutered Male,30.53174742,-97.30157818,123.7928571,*Luigi,,
1543.0,10 years,A755502,Dog,Labrador Retriever Mix,Black,2007-08-05,8/5/2017 13:01,2017-08-05T13:01:00,,Return to Owner,Intact Female,30.51203486,-97.74179864,521.934623,Molly,,
1544.0,2 years,A746092,Dog,Rottweiler,Black/Tan,2015-03-28,4/1/2017 13:45,2017-04-01T13:45:00,Partner,Transfer,Neutered Male,30.46120968,-97.72889589,105.0818452,Nibbles,,
1545.0,1 year,A723132,Other,Opossum,Gray,2015-03-27,3/27/2016 12:22,2016-03-27T12:22:00,Suffering,Euthanasia,Unknown,30.61833641,-97.32800522,52.3593254,,,
1546.0,13 years,A711960,Dog,Catahoula Mix,Black/White,2002-09-14,9/16/2015 12:23,2015-09-16T12:23:00,Partner,Transfer,Neutered Male,30.62733353,-97.44031589,678.6451389,,,
1547.0,1 year,A737991,Dog,German Shepherd Mix,Brown,2015-11-10,11/26/2016 18:10,2016-11-26T18:10:00,,Adoption,Spayed Female,30.29621645,-97.2445349,54.67956349,*Nora,,
1548.0,2 years,A732715,Other,Bat Mix,Brown,2014-08-12,8/12/2016 18:32,2016-08-12T18:32:00,Rabies Risk,Euthanasia,Unknown,30.66855963,-97.38108532,104.5388889,,,
1549.0,3 months,A731554,Cat,Domestic Shorthair Mix,Black,2016-05-08,8/13/2016 12:27,2016-08-13T12:27:00,Partner,Transfer,Neutered Male,30.45175157,-97.72729419,13.93125,Buddy,,
1550.0,3 years,A668846,Dog,Labrador Retriever Mix,Black,2010-12-10,4/16/2014 18:37,2014-04-16T18:37:00,,Return to Owner,Neutered Male,30.44557564,-97.26442254,174.8250992,Max,,
1551.0,1 year,A721641,Cat,Domestic Shorthair Mix,Torbie/White,2015-03-01,6/1/2016 13:54,2016-06-01T13:54:00,Foster,Adoption,Spayed Female,30.55681633,-97.27689924,65.51130952,*Aurelia,,
1552.0,8 months,A673432,Cat,Domestic Shorthair Mix,Brown Tabby/White,2013-06-24,3/2/2014 15:53,2014-03-02T15:53:00,Partner,Transfer,Spayed Female,30.54759342,-97.38425455,35.95168651,*Lucinda,,
1553.0,5 months,A710949,Cat,Domestic Shorthair Mix,Black,2015-03-15,9/10/2015 13:52,2015-09-10T13:52:00,,Adoption,Neutered Male,30.50783914,-97.47882404,25.65396825,*Bart,,
1554.0,1 month,A763350,Dog,Australian Shepherd Mix,Tricolor,2017-10-24,12/9/2017 11:22,2017-12-09T11:22:00,Partner,Transfer,Intact Male,30.74534553,-97.64263927,6.639087302,,,
1555.0,5 years,A687740,Cat,Domestic Shorthair Mix,Calico,2009-09-09,9/14/2014 13:15,2014-09-14T13:15:00,,Adoption,Spayed Female,30.42247183,-97.3296011,261.6502976,Marlyin,,
1556.0,10 years,A741355,Dog,Labrador Retriever Mix,Black,2007-01-02,1/2/2017 11:57,2017-01-02T11:57:00,,Return to Owner,Neutered Male,30.59133645,-97.68940481,521.9282738,Zeppo,,
1557.0,1 month,A675583,Dog,Pit Bull Mix,Brown/White,2014-02-23,4/3/2014 13:22,2014-04-03T13:22:00,Partner,Transfer,Intact Male,30.41703474,-97.41547429,5.650992063,,,
1558.0,2 years,A708697,Dog,Boxer Mix,Brown Brindle/White,2013-07-30,9/24/2015 14:06,2015-09-24T14:06:00,,Adoption,Spayed Female,30.43235295,-97.6330896,112.3696429,*Ashleigh,,
1559.0,5 months,A720412,Dog,German Shepherd Mix,Brown/Black,2015-09-09,3/9/2016 12:21,2016-03-09T12:21:00,,Adoption,Spayed Female,30.32810075,-97.32426185,26.0735119,*Ferlata,,
1560.0,2 years,A671390,Cat,Bengal Mix,Brown Tabby/Black,2012-01-23,2/3/2014 18:40,2014-02-03T18:40:00,,Return to Owner,Spayed Female,30.38822375,-97.63163189,106.1111111,Bodi,,
1561.0,7 years,A742324,Dog,Beagle Mix,Yellow,2010-01-24,1/29/2017 16:19,2017-01-29T16:19:00,Offsite,Adoption,Neutered Male,30.72126767,-97.35792044,366.097123,*Larry,,
1562.0,1 year,A746881,Other,Skunk,Black/White,2016-04-10,4/10/2017 16:46,2017-04-10T16:46:00,Rabies Risk,Euthanasia,Unknown,30.61969094,-97.74099065,52.24265873,,,
1563.0,2 years,A747436,Dog,Black Mouth Cur,Tan/Black,2014-10-19,4/19/2017 16:48,2017-04-19T16:48:00,,Return to Owner,Neutered Male,30.64329988,-97.24993543,130.5285714,Jed,,
1564.0,11 months,A764123,Cat,Domestic Shorthair Mix,Brown Tabby,2017-01-22,12/27/2017 18:25,2017-12-27T18:25:00,,Adoption,Neutered Male,30.74638075,-97.71031367,48.53819444,Esteban,,
1565.0,4 weeks,A701628,Cat,Domestic Shorthair Mix,Brown Tabby,2015-04-02,5/2/2015 15:12,2015-05-02T15:12:00,Partner,Transfer,Intact Male,30.55349227,-97.41063658,4.376190476,,,
1566.0,4 years,A672679,Dog,Labrador Retriever/Boxer,Black/White,2011-02-14,7/9/2015 15:01,2015-07-09T15:01:00,,Adoption,Spayed Female,30.76511176,-97.71631382,229.5179563,Mellie,,
1567.0,11 years,A584327,Dog,Chihuahua Shorthair Mix,Buff/White,2005-09-18,10/24/2016 17:34,2016-10-24T17:34:00,,Return to Owner,Neutered Male,30.44582803,-97.38222077,579.2474206,Dosh,,
1568.0,2 months,A714600,Cat,Domestic Shorthair Mix,Blue Tabby/White,2015-08-27,11/15/2015 16:59,2015-11-15T16:59:00,,Adoption,Neutered Male,30.32750978,-97.62546133,11.5296627,James Bond,,
1569.0,3 weeks,A701926,Cat,Domestic Shorthair Mix,Brown Tabby,2015-04-14,5/7/2015 14:47,2015-05-07T14:47:00,Partner,Transfer,Intact Male,30.51082916,-97.67168243,3.373710317,,,
1570.0,3 years,A747950,Dog,Siberian Husky Mix,White/Gray,2014-04-27,4/27/2017 16:19,2017-04-27T16:19:00,,Return to Owner,Neutered Male,30.74227633,-97.60776439,156.6685516,Asher,,
1571.0,11 months,A710928,Dog,Labrador Retriever Mix,Tan/White,2014-09-30,9/21/2015 18:39,2015-09-21T18:39:00,,Adoption,Neutered Male,30.60496698,-97.65012599,50.96815476,*Henry,,
1572.0,2 weeks,A708073,Cat,Domestic Shorthair Mix,Blue/White,2015-07-07,7/22/2015 14:17,2015-07-22T14:17:00,Partner,Transfer,Intact Male,30.27121653,-97.58537568,2.227876984,,,
1573.0,2 months,A687478,Dog,Chihuahua Shorthair Mix,Blue/Tan,2014-07-05,9/6/2014 17:03,2014-09-06T17:03:00,,Return to Owner,Spayed Female,30.31429421,-97.66964968,9.101488095,,,
1574.0,4 months,A728444,Cat,Domestic Shorthair Mix,Black,2016-02-04,7/4/2016 12:28,2016-07-04T12:28:00,,Adoption,Neutered Male,30.56128944,-97.53836384,21.64563492,,,
1575.0,2 years,A713381,Cat,Domestic Shorthair Mix,Brown Tabby/White,2015-07-22,9/20/2017 12:47,2017-09-20T12:47:00,,Adoption,Neutered Male,30.74891245,-97.24672437,113.0760913,,,
1576.0,2 years,A666957,Dog,Doberman Pinsch,Black/Tan,2011-11-10,11/16/2013 18:12,2013-11-16T18:12:00,,Adoption,Neutered Male,30.69184385,-97.26315529,105.3940476,Leroy,,
1577.0,2 months,A676659,Cat,Domestic Longhair Mix,Blue Tabby/White,2014-03-02,5/27/2014 11:42,2014-05-27T11:42:00,,Adoption,Spayed Female,30.41012579,-97.72837942,12.35535714,*Ginger,,
1578.0,1 year,A735625,Dog,Chihuahua Shorthair Mix,Tan/White,2015-09-26,10/8/2016 17:40,2016-10-08T17:40:00,,Adoption,Spayed Female,30.27122672,-97.28150119,54.10515873,*Lucy,,
1579.0,2 years,A719574,Dog,Pit Bull Mix,Fawn/White,2014-01-22,3/23/2016 9:09,2016-03-23T09:09:00,Foster,Adoption,Spayed Female,30.27728229,-97.35985534,113.0544643,*Abby,,
1580.0,1 month,A681396,Cat,Domestic Shorthair Mix,Brown Tabby/White,2014-05-09,6/30/2014 10:51,2014-06-30T10:51:00,Partner,Transfer,Intact Female,30.74486197,-97.39697007,7.493154762,*Joy,,
1581.0,7 months,A741176,Cat,Domestic Shorthair Mix,Orange Tabby/White,2016-05-29,1/3/2017 17:53,2017-01-03T17:53:00,,Adoption,Neutered Male,30.57461043,-97.3606388,31.3921627,,,
1582.0,1 year,A695985,Dog,Pit Bull Mix,Brown/White,2014-01-26,2/7/2015 16:14,2015-02-07T16:14:00,,Adoption,Spayed Female,30.43463871,-97.34697882,53.95376984,Macy,,
1583.0,1 year,A763333,Cat,American Shorthair Mix,Gray Tabby/Black,2016-12-07,12/13/2017 17:11,2017-12-13T17:11:00,Snr,Transfer,Intact Male,30.7034568,-97.72292252,53.10228175,Micho,,
1584.0,1 year,A739559,Cat,Domestic Shorthair Mix,Lynx Point,2015-12-04,12/4/2016 16:07,2016-12-04T16:07:00,Suffering,Euthanasia,Intact Female,30.32750851,-97.57767815,52.38164683,,,
1585.0,10 months,A721361,Cat,Domestic Medium Hair Mix,Calico,2015-05-25,3/27/2016 15:33,2016-03-27T15:33:00,,Adoption,Spayed Female,30.66031182,-97.45806078,43.94970238,Leia,,
1586.0,3 months,A699719,Dog,Schnauzer Giant Mix,Black,2015-01-17,4/19/2015 17:52,2015-04-19T17:52:00,Partner,Transfer,Neutered Male,30.46269381,-97.48059486,13.24920635,Gus,,
1587.0,6 years,A721783,Dog,Miniature Schnauzer Mix,Black/Gray,2010-03-04,3/8/2016 11:54,2016-03-08T11:54:00,,Return to Owner,Spayed Female,30.32890462,-97.31966105,313.785119,Bella,,
1588.0,3 months,A679229,Dog,Chihuahua Shorthair Mix,White/Black,2014-02-02,5/17/2014 18:39,2014-05-17T18:39:00,Partner,Transfer,Intact Female,30.31737014,-97.26827643,14.96815476,,,
1589.0,12 years,A721264,Dog,Chihuahua Shorthair Mix,White/Brown,2004-02-24,3/6/2016 0:00,2016-03-06T00:00:00,Partner,Transfer,Neutered Male,30.48444777,-97.49910681,627.7142857,Pickle,,
1590.0,8 years,A516705,Dog,Basenji,Black/White,2007-12-20,10/25/2016 11:14,2016-10-25T11:14:00,,Return to Owner,Neutered Male,30.33495353,-97.65995496,461.7811508,Jake,,
1591.0,4 years,A669065,Dog,Chihuahua Shorthair Mix,Black/Tan,2009-12-14,12/18/2013 18:17,2013-12-18T18:17:00,,Adoption,Spayed Female,30.37969011,-97.36066019,209.3945437,Zahrah,,
1592.0,1 month,A678092,Cat,Domestic Shorthair Mix,White/Orange Tabby,2014-04-07,6/5/2014 17:12,2014-06-05T17:12:00,,Adoption,Spayed Female,30.47781072,-97.26573868,8.530952381,,,
1593.0,2 months,A729111,Cat,Domestic Shorthair Mix,Brown Tabby/White,2016-05-19,8/3/2016 11:45,2016-08-03T11:45:00,,Adoption,Neutered Male,30.4803321,-97.55619916,10.92708333,Leo,,
1594.0,2 months,A759009,Dog,Yorkshire Terrier Mix,Black,2017-08-17,10/18/2017 9:03,2017-10-18T09:03:00,Foster,Adoption,Neutered Male,30.51172604,-97.63451957,8.911011905,*Lancelot,,
1595.0,1 month,A752278,Cat,Domestic Shorthair Mix,Orange Tabby,2017-05-05,7/1/2017 18:07,2017-07-01T18:07:00,Foster,Adoption,Neutered Male,30.67938743,-97.56800659,8.250694444,,,
1596.0,8 months,A762416,Cat,Domestic Shorthair Mix,Black/White,2017-03-20,11/20/2017 16:02,2017-11-20T16:02:00,,Return to Owner,Intact Male,30.67987963,-97.39160158,35.09543651,Luigi,,
1597.0,5 months,A730259,Dog,German Shepherd Mix,Black/Brown,2016-01-01,7/1/2016 13:37,2016-07-01T13:37:00,,Return to Owner,Intact Female,30.67008127,-97.71817678,26.08105159,Princess,,
1598.0,3 years,A655397,Cat,Domestic Shorthair Mix,Black,2013-04-24,6/28/2016 11:48,2016-06-28T11:48:00,,Adoption,Neutered Male,30.61298051,-97.59834341,165.927381,Notte,,
1599.0,2 years,A700434,Cat,Domestic Shorthair Mix,Black,2013-04-13,4/14/2015 9:00,2015-04-14T09:00:00,SCRP,Transfer,Unknown,30.27892183,-97.66418625,104.4821429,,,
1600.0,8 years,A449703,Cat,Siamese Mix,Seal Point,2006-07-11,2/4/2015 18:43,2015-02-04T18:43:00,,Adoption,Spayed Female,30.3395004,-97.28500523,447.2542659,Monkey,,
1601.0,3 years,A673208,Dog,Boxer,White,2013-02-20,5/22/2016 15:29,2016-05-22T15:29:00,,Adoption,Spayed Female,30.37536215,-97.3211959,169.6635913,Cataleya,,
1602.0,1 year,A732820,Cat,Domestic Shorthair Mix,Black/White,2015-08-13,9/20/2016 13:30,2016-09-20T13:30:00,Partner,Transfer,Spayed Female,30.47119872,-97.54271043,57.79464286,*Syrah,,
1603.0,2 years,A674605,Dog,Pug/Chihuahua Shorthair,Black,2012-03-15,3/24/2014 13:31,2014-03-24T13:31:00,Partner,Transfer,Neutered Male,30.3824768,-97.33161858,105.6518849,*Albus,,
1604.0,1 year,A670630,Dog,Miniature Pinscher Mix,Black/Tan,2013-01-11,2/6/2014 16:15,2014-02-06T16:15:00,,Adoption,Neutered Male,30.43198577,-97.45360136,55.95386905,Sampson,,
1605.0,3 months,A763332,Cat,Domestic Shorthair Mix,Orange Tabby,2017-09-11,12/12/2017 18:35,2017-12-12T18:35:00,,Adoption,Neutered Male,30.50935481,-97.36738295,13.25347222,,,
1606.0,3 weeks,A689268,Cat,Domestic Shorthair Mix,Black/White,2014-09-09,10/1/2014 15:19,2014-10-01T15:19:00,Partner,Transfer,Intact Male,30.27772722,-97.29458108,3.234027778,,,
1607.0,1 year,A752919,Cat,Domestic Shorthair Mix,Black,2016-06-29,7/3/2017 15:41,2017-07-03T15:41:00,Partner,Transfer,Spayed Female,30.33901186,-97.38877172,52.80763889,,,
1608.0,1 month,A748988,Dog,Labrador Retriever Mix,Black/Tan,2017-04-02,5/9/2017 16:03,2017-05-09T16:03:00,Partner,Transfer,Intact Female,30.58358667,-97.68552778,5.38125,,,
1609.0,3 months,A751813,Cat,Domestic Shorthair Mix,Brown Tabby/White,2017-05-06,8/17/2017 11:39,2017-08-17T11:39:00,Foster,Adoption,Neutered Male,30.52179617,-97.65616023,14.78363095,,,
1610.0,6 months,A709064,Cat,Domestic Shorthair Mix,Brown Tabby/White,2015-05-20,11/25/2015 16:51,2015-11-25T16:51:00,,Adoption,Neutered Male,30.57717331,-97.38581354,27.10029762,Marley,,
1611.0,3 weeks,A712028,Cat,Domestic Shorthair Mix,Brown Tabby/White,2015-08-24,9/16/2015 10:45,2015-09-16T10:45:00,Partner,Transfer,Intact Male,30.69548828,-97.52640023,3.349702381,,,
1612.0,2 years,A715875,Dog,Labrador Retriever Mix,White/Brown,2015-09-11,1/19/2018 11:32,2018-01-19T11:32:00,,Adoption,Neutered Male,30.37927799,-97.41341958,123.0686508,Max,,
1613.0,4 months,A710244,Dog,Manchester Terrier/Dachshund,Tricolor,2015-04-20,8/28/2015 17:58,2015-08-28T17:58:00,,Adoption,Neutered Male,30.57443409,-97.34513176,18.67837302,Cohen,,
1614.0,6 years,A680937,Dog,Australian Cattle Dog Mix,Blue Merle,2008-06-10,6/23/2014 12:51,2014-06-23T12:51:00,,Adoption,Neutered Male,30.51124721,-97.36773232,314.933631,*Hank,,
1615.0,2 years,A733801,Dog,Pit Bull Mix,Brown Brindle/White,2014-08-27,11/21/2016 16:11,2016-11-21T16:11:00,Partner,Transfer,Neutered Male,30.72889912,-97.56524862,116.8106151,Guapo,,
1616.0,5 years,A714032,Cat,Domestic Shorthair Mix,Blue,2010-10-17,10/24/2015 13:33,2015-10-24T13:33:00,Partner,Transfer,Spayed Female,30.58911918,-97.35561169,261.9377976,*Olivia,,
1617.0,3 years,A760001,Dog,Siberian Husky Mix,Black/White,2014-10-11,10/13/2017 17:12,2017-10-13T17:12:00,,Return to Owner,Intact Male,30.44715372,-97.26160043,156.9595238,Toby,,
1618.0,8 months,A737739,Cat,Domestic Shorthair Mix,Black,2016-08-27,5/15/2017 0:00,2017-05-15T00:00:00,Partner,Transfer,Neutered Male,30.4065525,-97.43669519,37.28571429,Troy,,
1619.0,5 years,A720500,Dog,Cairn Terrier Mix,Black/Gray,2011-02-10,2/19/2016 18:49,2016-02-19T18:49:00,,Adoption,Spayed Female,30.74895714,-97.41518633,262.2548611,*Tina,,
1620.0,3 years,A677264,Dog,Jack Russell Terrier Mix,White/Brown,2011-04-24,4/24/2014 11:44,2014-04-24T11:44:00,,Return to Owner,Spayed Female,30.66301592,-97.34884634,156.6412698,Biscuit,,
1621.0,2 months,A732373,Cat,Domestic Medium Hair Mix,Black/White,2016-07-06,9/9/2016 8:44,2016-09-09T08:44:00,In Foster,Died,Intact Male,30.52494265,-97.50580011,9.337698413,*Gideon,,
1622.0,4 weeks,A758431,Cat,Domestic Shorthair Mix,Gray Tabby,2017-08-16,9/16/2017 0:00,2017-09-16T00:00:00,Partner,Transfer,Intact Female,30.75143506,-97.73336314,4.428571429,,,
1623.0,2 years,A696517,Cat,Siamese Mix,Lynx Point,2013-02-06,2/6/2015 14:57,2015-02-06T14:57:00,Suffering,Euthanasia,Intact Male,30.30357478,-97.58491397,104.3747024,,,
1624.0,1 year,A738558,Dog,Pit Bull Mix,White/Tan,2015-11-17,5/24/2017 17:24,2017-05-24T17:24:00,,Return to Owner,Intact Female,30.49505789,-97.64299152,79.24642857,Marley,,
1625.0,1 year,A685994,Dog,Dachshund Mix,Brown,2013-08-15,8/16/2014 13:08,2014-08-16T13:08:00,,Return to Owner,Intact Male,30.39332028,-97.30209203,52.36388889,Rosco,,
1626.0,2 years,A707892,Cat,Domestic Shorthair Mix,White/Tan,2013-07-19,8/18/2015 16:49,2015-08-18T16:49:00,,Return to Owner,Neutered Male,30.69178018,-97.25165645,108.6715278,Booboo,,
1627.0,5 years,A739105,Dog,Miniature Poodle Mix,Gray,2011-11-28,12/2/2016 14:11,2016-12-02T14:11:00,,Adoption,Spayed Female,30.67763303,-97.27551557,261.6558532,,,
1628.0,9 months,A740471,Dog,Labrador Retriever Mix,Tan/White,2016-03-17,12/23/2016 17:13,2016-12-23T17:13:00,,Adoption,Intact Female,30.7569243,-97.73925492,40.2453373,Mika,,
1629.0,3 years,A703985,Dog,American Bulldog Mix,Tan/White,2012-05-31,7/25/2015 13:01,2015-07-25T13:01:00,Partner,Transfer,Neutered Male,30.56485201,-97.46413977,164.3631944,Simba,,
1630.0,2 months,A704537,Dog,Labrador Retriever Mix,Black/White,2015-04-06,6/17/2015 17:29,2015-06-17T17:29:00,,Adoption,Neutered Male,30.52135927,-97.24308967,10.38978175,*Morty,,
1631.0,2 years,A716864,Cat,Domestic Shorthair Mix,Cream Tabby/White,2013-11-27,12/2/2015 15:21,2015-12-02T15:21:00,,Adoption,Spayed Female,30.45517953,-97.30880813,105.091369,Halo,,
1632.0,2 years,A761552,Other,Bat Mix,Black,2015-11-06,11/6/2017 18:02,2017-11-06T18:02:00,Rabies Risk,Euthanasia,Unknown,30.65273667,-97.24324231,104.5359127,,,
1633.0,4 years,A718926,Dog,German Shepherd Mix,Tricolor,2012-01-09,1/10/2016 17:03,2016-01-10T17:03:00,,Return to Owner,Neutered Male,30.50366434,-97.26319521,208.958631,Gunner,,
1634.0,2 years,A667170,Dog,Cardigan Welsh Corgi/Chihuahua Shorthair,Red/White,2011-11-13,11/17/2013 18:01,2013-11-17T18:01:00,,Return to Owner,Neutered Male,30.46362954,-97.48650854,105.1072421,Chewy,,
1635.0,3 months,A735611,Cat,Domestic Shorthair Mix,Blue/White,2016-06-30,10/2/2016 12:17,2016-10-02T12:17:00,,Adoption,Spayed Female,30.38954592,-97.69771855,13.50168651,*Juliette,,
1636.0,2 years,A721862,Dog,Labrador Retriever Mix,Black,2014-03-06,8/17/2016 12:27,2016-08-17T12:27:00,Foster,Adoption,Neutered Male,30.52809004,-97.4216171,127.93125,*Moose,,
1637.0,2 years,A729384,Dog,Staffordshire Mix,Blue/Brown,2014-06-17,7/16/2016 16:27,2016-07-16T16:27:00,,Adoption,Spayed Female,30.66948921,-97.32630573,108.6693452,Minnie,,
1638.0,2 years,A672652,Dog,Chihuahua Shorthair Mix,Brown,2012-02-14,2/19/2014 13:11,2014-02-19T13:11:00,,Adoption,Neutered Male,30.746648,-97.4062449,105.2213294,,,
1639.0,3 months,A743167,Dog,Pit Bull Mix,Black/White,2016-12-05,3/20/2017 18:17,2017-03-20T18:17:00,,Adoption,Neutered Male,30.52574584,-97.34563078,15.10882937,Rocky,,
1640.0,1 year,A719764,Dog,Staffordshire Mix,Brown Brindle,2015-01-27,2/4/2016 13:34,2016-02-04T13:34:00,,Adoption,Neutered Male,30.39384544,-97.31032366,53.36646825,*Hector,,
1641.0,5 years,A720866,Dog,Pit Bull Mix,Blue/White,2011-06-09,7/25/2016 15:13,2016-07-25T15:13:00,,Adoption,Neutered Male,30.73311325,-97.39356338,267.662004,*Titus,,
1642.0,5 years,A675600,Dog,Beagle Mix,Tricolor,2009-03-29,3/31/2014 19:01,2014-03-31T19:01:00,,Return to Owner,Spayed Female,30.41085418,-97.53784457,261.2560516,Lucy,,
1643.0,4 years,A675232,Cat,Domestic Shorthair Mix,Tortie/Blue Cream,2010-03-25,4/6/2014 18:48,2014-04-06T18:48:00,,Adoption,Spayed Female,30.73922131,-97.58009541,210.5404762,Melinda,,
1644.0,1 year,A706471,Dog,Labrador Retriever Mix,Black,2014-06-29,7/13/2015 17:57,2015-07-13T17:57:00,,Adoption,Spayed Female,30.70476618,-97.46097221,54.24970238,Starla,,
1645.0,5 months,A743375,Cat,Domestic Shorthair Mix,Blue/White,2016-09-09,2/10/2017 12:18,2017-02-10T12:18:00,Partner,Transfer,Intact Male,30.48702699,-97.33225926,22.07321429,,,
1646.0,1 year,A697002,Cat,Domestic Shorthair Mix,Orange Tabby/White,2014-02-16,3/3/2015 16:43,2015-03-03T16:43:00,Partner,Transfer,Spayed Female,30.58508085,-97.72981103,54.38521825,Lucinda,,
1647.0,6 years,A586033,Dog,Beagle/Labrador Retriever,White,2010-01-02,3/6/2016 17:56,2016-03-06T17:56:00,,Adoption,Neutered Male,30.44812644,-97.44942272,322.2496032,Moose,,
1648.0,7 years,A745860,Dog,Australian Shepherd Mix,Tricolor,2009-11-23,3/25/2017 15:37,2017-03-25T15:37:00,,Return to Owner,Intact Male,30.66029719,-97.56897397,382.8072421,Bodo,,
1649.0,5 years,A750548,Dog,Labrador Retriever Mix,Black/White,2012-05-28,6/10/2017 15:30,2017-06-10T15:30:00,,Adoption,Spayed Female,30.51462315,-97.24534089,262.8065476,Bella,,
1650.0,8 months,A694130,Dog,Chihuahua Longhair Mix,Black/Brown,2014-09-20,6/20/2015 0:00,2015-06-20T00:00:00,Partner,Transfer,Intact Male,30.48359515,-97.24567746,39,Snoopy,,
1651.0,1 year,A743076,Other,English Spot Mix,White/Black,2016-02-03,3/1/2017 18:38,2017-03-01T18:38:00,,Adoption,Neutered Male,30.54034046,-97.48849519,56.1109127,*Gus,,
1652.0,2 months,A686416,Dog,Labrador Retriever/Great Dane,Black/White,2014-06-15,8/30/2014 17:16,2014-08-30T17:16:00,,Adoption,Spayed Female,30.69028081,-97.60328072,10.95992063,Lady,,
1653.0,1 month,A706223,Cat,Domestic Longhair Mix,White,2015-05-19,6/27/2015 12:05,2015-06-27T12:05:00,Partner,Transfer,Intact Female,30.66151195,-97.35217861,5.643353175,,,
1654.0,1 year,A669663,Dog,Chihuahua Shorthair Mix,Chocolate/White,2012-12-24,12/29/2013 17:51,2013-12-29T17:51:00,,Adoption,Spayed Female,30.66483554,-97.25066974,52.96339286,Roxy,,
1655.0,2 weeks,A707870,Cat,Domestic Shorthair Mix,Brown Tabby/White,2015-07-04,7/19/2015 14:25,2015-07-19T14:25:00,Partner,Transfer,Unknown,30.31544735,-97.69690156,2.228670635,,,
1656.0,1 year,A757566,Dog,Rottweiler Mix,Black/Tan,2016-09-03,10/3/2017 14:09,2017-10-03T14:09:00,Partner,Transfer,Intact Female,30.40946599,-97.50540102,56.51279762,86,,
1657.0,10 months,A674925,Dog,Jack Russell Terrier Mix,Tan/White,2013-07-20,6/16/2014 15:44,2014-06-16T15:44:00,,Adoption,Spayed Female,30.31786225,-97.63259214,47.37936508,*Nelly,,
1658.0,1 year,A713138,Cat,Domestic Shorthair Mix,Tortie/Brown,2014-10-03,10/7/2015 14:23,2015-10-07T14:23:00,Partner,Transfer,Spayed Female,30.39005333,-97.36968011,52.79990079,*Tullia,,
1659.0,8 months,A692355,Cat,Domestic Shorthair Mix,Torbie,2014-03-18,11/25/2014 18:40,2014-11-25T18:40:00,SCRP,Transfer,Intact Female,30.42800661,-97.40737483,36.11111111,,,
1660.0,1 year,A755049,Dog,Pit Bull Mix,Black,2016-07-28,8/14/2017 16:10,2017-08-14T16:10:00,Partner,Transfer,Intact Male,30.6248827,-97.49887212,54.66765873,*Kingsley,,
1661.0,7 years,A688590,Cat,Domestic Shorthair Mix,Brown Tabby,2007-09-22,11/9/2014 12:59,2014-11-09T12:59:00,,Adoption,Spayed Female,30.59383613,-97.73210264,372.2201389,*Gus,,
1662.0,9 months,A759480,Dog,Chihuahua Shorthair Mix,Black/Black,2017-01-02,10/3/2017 15:04,2017-10-03T15:04:00,Partner,Transfer,Intact Female,30.60258833,-97.39197964,39.23253968,,,
1663.0,2 months,A723891,Dog,Australian Shepherd Mix,White,2016-03-30,6/15/2016 11:27,2016-06-15T11:27:00,Foster,Adoption,Spayed Female,30.44159481,-97.30877667,11.06815476,,,
1664.0,2 months,A666854,Cat,Domestic Shorthair Mix,Brown Tabby/White,2013-09-17,11/26/2013 16:05,2013-11-26T16:05:00,Medical,Euthanasia,Intact Male,30.5512676,-97.5147927,10.09573413,*Julian,,
1665.0,5 years,A750881,Dog,Chihuahua Shorthair Mix,Brown,2012-06-01,6/2/2017 12:59,2017-06-02T12:59:00,,Return to Owner,Neutered Male,30.58504186,-97.70615812,261.0772817,Happy,,
1666.0,8 years,A736369,Cat,Domestic Shorthair Mix,Brown Tabby,2008-10-09,10/9/2016 15:19,2016-10-09T15:19:00,In Kennel,Died,Intact Male,30.53121352,-97.69336398,417.5197421,,,
1667.0,1 month,A721405,Dog,Anatol Shepherd Mix,Tricolor,2016-01-11,3/8/2016 19:07,2016-03-08T19:07:00,Foster,Adoption,Neutered Male,30.66219245,-97.71771892,8.256646825,,,
1668.0,1 year,A726367,Cat,Domestic Medium Hair Mix,White/Black,2015-05-10,7/4/2016 14:03,2016-07-04T14:03:00,,Adoption,Spayed Female,30.63325749,-97.36999123,60.2264881,*Sophie,,
1669.0,2 years,A733575,Dog,Vizsla Mix,Red/White,2015-08-23,12/15/2017 11:36,2017-12-15T11:36:00,,Adoption,Spayed Female,30.41532569,-97.27002377,120.7833333,Nova,,
1670.0,5 years,A685929,Other,Bat Mix,Brown,2009-08-14,8/14/2014 15:10,2014-08-14T15:10:00,,Euthanasia,Unknown,30.31328666,-97.65800964,260.9474206,,,
1671.0,3 years,A737348,Dog,Chihuahua Shorthair Mix,Tan/White,2013-10-26,10/30/2016 18:36,2016-10-30T18:36:00,,Adoption,Spayed Female,30.71061545,-97.49982227,157.2535714,,,
1672.0,2 years,A692402,Dog,Pit Bull Mix,Tan,2012-11-19,11/27/2014 13:55,2014-11-27T13:55:00,Partner,Transfer,Spayed Female,30.57377219,-97.29707809,105.5114087,Brownie,,
1673.0,3 years,A755201,Cat,Domestic Shorthair Mix,White,2014-07-31,8/6/2017 17:35,2017-08-06T17:35:00,,Adoption,Neutered Male,30.65801961,-97.2940549,157.5332341,*Mogwai,,
1674.0,3 months,A751569,Cat,Domestic Shorthair Mix,Black,2017-02-22,6/19/2017 17:34,2017-06-19T17:34:00,,Adoption,Intact Female,30.5013763,-97.49315174,16.81884921,Ebzy,,
1675.0,5 months,A677098,Cat,Domestic Shorthair Mix,Black,2014-03-25,9/11/2014 14:22,2014-09-11T14:22:00,Foster,Adoption,Intact Female,30.64652153,-97.72740697,24.37123016,*Mickey,,
1676.0,5 months,A745933,Other,Bat,Brown,2016-09-26,3/26/2017 16:14,2017-03-26T16:14:00,Rabies Risk,Euthanasia,Unknown,30.70876314,-97.32948706,25.95376984,,,
1677.0,4 weeks,A759181,Cat,Domestic Shorthair Mix,Black/White,2017-08-28,9/28/2017 0:00,2017-09-28T00:00:00,Partner,Transfer,Intact Male,30.33080661,-97.54910987,4.428571429,,,
1678.0,4 months,A706983,Cat,Domestic Shorthair Mix,Brown Tabby/White,2015-03-06,7/20/2015 14:56,2015-07-20T14:56:00,Partner,Transfer,Spayed Female,30.36113878,-97.73321884,19.51746032,*Mini,,
1679.0,1 year,A672243,Cat,Domestic Shorthair Mix,Gray,2013-02-06,2/6/2014 13:30,2014-02-06T13:30:00,Suffering,Euthanasia,Intact Male,30.60228704,-97.28388749,52.22321429,,,
1680.0,5 months,A756123,Dog,Whippet Mix,White/Tan,2017-03-14,8/19/2017 10:42,2017-08-19T10:42:00,,Adoption,Neutered Male,30.48351214,-97.65361846,22.63511905,Bird,,
1681.0,6 years,A578341,Dog,Pekingese Mix,White,2010-03-02,11/28/2016 17:13,2016-11-28T17:13:00,,Adoption,Neutered Male,30.35993643,-97.63283448,351.959623,Lucas,,
1682.0,7 months,A694129,Dog,Chihuahua Shorthair Mix,Brown,2014-05-14,12/20/2014 17:53,2014-12-20T17:53:00,,Return to Owner,Neutered Male,30.43827715,-97.5330417,31.53501984,Bear,,
1683.0,2 months,A747412,Cat,Domestic Shorthair Mix,Tortie,2017-02-04,4/21/2017 15:17,2017-04-21T15:17:00,,Adoption,Spayed Female,30.65601802,-97.66597922,10.94811508,,,
1684.0,1 year,A737867,Dog,Cavalier Span/Chihuahua Longhair,Chocolate/White,2015-11-05,11/9/2016 18:59,2016-11-09T18:59:00,,Adoption,Spayed Female,30.4441059,-97.39268822,52.97013889,,,
1685.0,1 month,A689391,Cat,Domestic Shorthair Mix,Black/White,2014-08-09,10/7/2014 11:07,2014-10-07T11:07:00,Suffering,Euthanasia,Intact Male,30.76674126,-97.58254826,8.494742063,,,
1686.0,2 months,A679385,Dog,German Shepherd Mix,Brown/Black,2014-02-28,5/28/2014 19:42,2014-05-28T19:42:00,,Return to Owner,Spayed Female,30.28769458,-97.58337422,12.83154762,Layla,,
1687.0,1 year,A667361,Dog,Pit Bull Mix,Brown/White,2012-11-16,8/19/2014 14:38,2014-08-19T14:38:00,,Adoption,Neutered Male,30.40081484,-97.28658175,91.65853175,*Grizz,,
1688.0,1 year,A755587,Cat,Domestic Shorthair Mix,Brown Tabby,2016-08-05,8/11/2017 13:40,2017-08-11T13:40:00,Snr,Transfer,Intact Male,30.74344962,-97.4710728,53.08134921,,,
1689.0,1 year,A694917,Dog,Labrador Retriever Mix,Black/White,2014-01-06,2/2/2015 14:41,2015-02-02T14:41:00,Partner,Transfer,Neutered Male,30.67811141,-97.26313462,56.08740079,*Alphonse,,
1690.0,2 years,A740161,Dog,Yorkshire Terrier Mix,Tan/Silver,2014-12-12,12/14/2016 14:39,2016-12-14T14:39:00,,Return to Owner,Neutered Male,30.6945122,-97.44169852,104.8014881,Rocko,,
1691.0,3 weeks,A711884,Cat,Domestic Shorthair Mix,Black,2015-08-22,9/13/2015 12:20,2015-09-13T12:20:00,Partner,Transfer,Intact Male,30.7061623,-97.40339689,3.216269841,,,
1692.0,6 years,A728099,Cat,Domestic Shorthair Mix,Torbie,2010-05-30,6/15/2016 15:24,2016-06-15T15:24:00,Partner,Transfer,Intact Female,30.65850902,-97.62069471,315.5202381,*Tulipe,,
1693.0,8 months,A677171,Cat,Domestic Shorthair Mix,Orange Tabby,2013-08-21,5/11/2014 17:49,2014-05-11T17:49:00,,Adoption,Neutered Male,30.60482288,-97.71593206,37.67748016,Cuddles,,
1694.0,1 year,A757636,Dog,Pit Bull Mix,Brown Brindle,2016-09-04,9/15/2017 14:25,2017-09-15T14:25:00,Partner,Transfer,Intact Male,30.74898958,-97.70445625,53.80009921,130,,
1695.0,2 months,A749213,Cat,Domestic Shorthair Mix,Black/White,2017-04-17,7/1/2017 16:44,2017-07-01T16:44:00,Foster,Adoption,Neutered Male,30.62877814,-97.25974784,10.81388889,,,
1696.0,2 weeks,A752406,Cat,Domestic Medium Hair Mix,Brown Tabby,2017-06-04,6/22/2017 12:09,2017-06-22T12:09:00,Partner,Transfer,Intact Female,30.4658953,-97.74197959,2.64375,,,
1697.0,3 weeks,A703333,Cat,Domestic Shorthair Mix,Black,2015-05-01,5/23/2015 15:41,2015-05-23T15:41:00,Partner,Transfer,Unknown,30.29607777,-97.58035126,3.236210317,,,
1698.0,2 years,A742283,Dog,Collie Rough Mix,Tan/White,2015-01-18,3/12/2017 12:48,2017-03-12T12:48:00,,Adoption,Spayed Female,30.43927724,-97.50114197,112.0761905,Luna,,
1699.0,3 years,A720288,Dog,Pit Bull Mix,White/Brown,2013-02-06,2/8/2016 18:02,2016-02-08T18:02:00,,Return to Owner,Spayed Female,30.48444096,-97.24637689,156.821627,Yabba,,
1700.0,4 days,A700989,Cat,Domestic Shorthair Mix,Orange Tabby,2015-04-18,4/22/2015 14:55,2015-04-22T14:55:00,Partner,Transfer,Unknown,30.56926924,-97.26465474,0.660218254,,,
1701.0,4 weeks,A682847,Other,Bat,Brown,2014-06-03,7/3/2014 19:07,2014-07-03T19:07:00,Rabies Risk,Euthanasia,Unknown,30.27380308,-97.37016019,4.399503968,,,
1702.0,4 months,A742160,Other,Netherlnd Dwarf Mix,Black/White,2016-12-01,4/16/2017 18:41,2017-04-16T18:41:00,Offsite,Adoption,Neutered Male,30.58340256,-97.3773505,19.53978175,*Rhubarb,,
1703.0,1 year,A678524,Other,Raccoon Mix,Black/Gray,2013-05-09,5/9/2014 17:36,2014-05-09T17:36:00,Suffering,Euthanasia,Unknown,30.29008432,-97.37450038,52.24761905,,,
1704.0,3 months,A726199,Cat,Domestic Shorthair Mix,Orange Tabby/White,2016-03-20,6/22/2016 14:33,2016-06-22T14:33:00,Foster,Adoption,Neutered Male,30.64965032,-97.28022942,13.51517857,*Ronan,,
1705.0,1 month,A750587,Cat,Domestic Shorthair Mix,Brown Tabby/White,2017-04-20,6/1/2017 0:00,2017-06-01T00:00:00,Partner,Transfer,Intact Female,30.57517268,-97.65631948,6,*Julie,,
1706.0,10 years,A672606,Cat,Siamese Mix,Lynx Point,2004-02-16,2/16/2014 18:53,2014-02-16T18:53:00,,Return to Owner,Neutered Male,30.41225232,-97.65554558,521.9695437,Ian,,
1707.0,2 months,A685370,Dog,Labrador Retriever Mix,Black/White,2014-06-06,8/11/2014 18:30,2014-08-11T18:30:00,,Adoption,Neutered Male,30.56977811,-97.39701162,9.538690476,*Dixon,,
1708.0,7 months,A719238,Dog,Pointer Mix,White/Black,2015-11-30,7/28/2016 11:14,2016-07-28T11:14:00,Foster,Adoption,Spayed Female,30.65419222,-97.33405936,34.49543651,*Ziggy,,
1709.0,4 years,A601250,Dog,Labrador Retriever Mix,Black,2011-01-03,7/20/2015 16:15,2015-07-20T16:15:00,,Adoption,Spayed Female,30.3624563,-97.59864103,237.0967262,Charly,,
1710.0,2 years,A674035,Dog,Boston Terrier Mix,Black/White,2012-03-06,3/11/2014 15:38,2014-03-11T15:38:00,Partner,Transfer,Spayed Female,30.31929627,-97.41217146,105.0930556,*Alice,,
1711.0,1 month,A751972,Cat,Domestic Shorthair Mix,Brown/Black,2017-04-24,6/16/2017 12:41,2017-06-16T12:41:00,Suffering,Euthanasia,Intact Female,30.42243151,-97.56643451,7.646924603,,,
1712.0,5 years,A689028,Dog,Chihuahua Shorthair,Sable,2009-09-28,10/2/2014 18:07,2014-10-02T18:07:00,Partner,Transfer,Neutered Male,30.70122421,-97.40065778,261.5364087,Sparky,,
1713.0,1 year,A745794,Dog,Chihuahua Shorthair Mix,Cream,2016-03-24,3/29/2017 0:00,2017-03-29T00:00:00,Partner,Transfer,Spayed Female,30.56548794,-97.59824526,52.85714286,Blanca,,
1714.0,10 years,A727311,Dog,Rat Terrier Mix,White,2006-05-21,5/31/2016 11:37,2016-05-31T11:37:00,Partner,Transfer,Neutered Male,30.41675817,-97.56764033,523.3548611,*Quincy,,
1715.0,1 year,A697908,Dog,Miniature Poodle/English Cocker Spaniel,Cream,2014-03-03,3/7/2015 17:36,2015-03-07T17:36:00,,Adoption,Spayed Female,30.37835489,-97.72679641,52.81904762,,,
1716.0,5 months,A761441,Dog,Chihuahua Shorthair Mix,Black/Tricolor,2017-05-20,11/10/2017 16:41,2017-11-10T16:41:00,,Adoption,Neutered Male,30.31542301,-97.53842902,24.95644841,,,
1717.0,1 month,A688541,Cat,Domestic Shorthair Mix,Blue Tabby/White,2014-08-05,9/24/2014 14:58,2014-09-24T14:58:00,Partner,Transfer,Intact Female,30.73503294,-97.71734648,7.231944444,*Elaine,,
1718.0,3 months,A707537,Cat,Domestic Shorthair Mix,Calico,2015-04-14,7/18/2015 14:47,2015-07-18T14:47:00,,Adoption,Spayed Female,30.59325781,-97.56652438,13.6594246,*Olive,,
1719.0,1 year,A720958,Dog,Labrador Retriever Mix,Black,2015-02-18,2/27/2016 19:22,2016-02-27T19:22:00,,Adoption,Neutered Male,30.38913985,-97.52580631,53.54384921,*Sam,,
1720.0,8 months,A717012,Cat,Domestic Shorthair Mix,Black/White,2015-03-30,12/4/2015 19:43,2015-12-04T19:43:00,SCRP,Transfer,Spayed Female,30.27983933,-97.62544051,35.68878968,,,
1721.0,1 year,A744421,Dog,Staffordshire Mix,Brown/White,2016-02-28,4/1/2017 15:58,2017-04-01T15:58:00,,Adoption,Neutered Male,30.47392712,-97.30946892,56.95218254,*Bogie,,
1722.0,1 year,A744804,Cat,Siamese Mix,Seal Point,2015-09-08,3/9/2017 9:00,2017-03-09T09:00:00,SCRP,Transfer,Neutered Male,30.30743443,-97.67705245,78.33928571,*Otter,,
1723.0,5 years,A669457,Dog,Miniature Schnauzer/Miniature Poodle,Gray,2008-12-21,1/2/2014 12:05,2014-01-02T12:05:00,Partner,Transfer,Intact Female,30.39629927,-97.29988092,262.6433532,Nala,,
1724.0,8 years,A674495,Dog,Miniature Schnauzer,Gray/White,2006-03-14,3/15/2014 18:24,2014-03-15T18:24:00,,Return to Owner,Spayed Female,30.74579992,-97.60126282,417.6809524,Tinka,,
1725.0,2 months,A727312,Cat,Domestic Medium Hair Mix,Black/White,2016-04-21,7/9/2016 17:57,2016-07-09T17:57:00,Foster,Adoption,Neutered Male,30.3208095,-97.26230206,11.39255952,*Clyde,,
1726.0,5 years,A673113,Dog,Maltese,White,2009-02-19,3/16/2014 13:47,2014-03-16T13:47:00,,Adoption,Spayed Female,30.71958459,-97.38436718,264.5106151,Lizzie,,
1727.0,2 months,A679304,Dog,German Shepherd Mix,Brown/Black,2014-03-19,5/23/2014 18:58,2014-05-23T18:58:00,,Return to Owner,Spayed Female,30.68965873,-97.74196997,9.398611111,Sheila,,
1728.0,10 months,A696439,Dog,Labrador Retriever/Australian Cattle Dog,Cream/White,2014-04-04,2/11/2015 16:24,2015-02-11T16:24:00,Partner,Transfer,Neutered Male,30.52098161,-97.58401639,44.81190476,*Hector,,
1729.0,1 year,A748865,Cat,Domestic Shorthair Mix,Orange Tabby,2016-05-08,5/13/2017 13:31,2017-05-13T13:31:00,,Return to Owner,Intact Male,30.39166385,-97.34202249,52.93759921,Toby,,
1730.0,2 years,A742313,Dog,Pit Bull Mix,Blue/White,2015-01-19,1/29/2017 14:57,2017-01-29T14:57:00,,Adoption,Spayed Female,30.48873829,-97.54964814,105.946131,*Oona,,
1731.0,10 months,A720617,Dog,Pit Bull Mix,White/Brown,2015-04-12,2/21/2016 18:37,2016-02-21T18:37:00,,Adoption,Spayed Female,30.36728521,-97.36624058,45.11081349,Adeleine,,
1732.0,2 years,A762685,Cat,Domestic Shorthair Mix,Black/White,2015-11-24,12/21/2017 13:26,2017-12-21T13:26:00,Partner,Transfer,Neutered Male,30.60969302,-97.38837644,108.3656746,Nine,,
1733.0,4 months,A764931,Cat,Domestic Shorthair Mix,Brown Tabby,2017-09-09,1/10/2018 10:53,2018-01-10T10:53:00,Partner,Transfer,Intact Male,30.65108543,-97.54693203,17.63621032,,,
1734.0,2 years,A731346,Other,Bat Mix,Brown,2014-07-20,7/20/2016 18:51,2016-07-20T18:51:00,,Disposal,Intact Male,30.27182565,-97.67455194,104.5407738,,,
1735.0,2 years,A677887,Dog,Rat Terrier/Chihuahua Shorthair,Tricolor,2012-04-30,5/12/2014 19:06,2014-05-12T19:06:00,,Adoption,Spayed Female,30.2714327,-97.4837731,106.1136905,*Glenda,,
1736.0,3 weeks,A709314,Cat,Domestic Shorthair Mix,Brown Tabby,2015-07-21,8/11/2015 0:00,2015-08-11T00:00:00,Partner,Transfer,Intact Male,30.62054866,-97.58456665,3,,,
1737.0,4 weeks,A691545,Cat,Domestic Shorthair Mix,Cream,2014-10-09,11/9/2014 17:31,2014-11-09T17:31:00,Partner,Transfer,Intact Male,30.2742935,-97.72098736,4.532837302,*Maple,,
1738.0,2 weeks,A702208,Cat,Domestic Shorthair Mix,Black,2015-04-25,5/10/2015 19:31,2015-05-10T19:31:00,Partner,Transfer,Unknown,30.49297476,-97.7415155,2.259027778,,,
1739.0,1 year,A703500,Other,Bat,Brown,2014-05-25,5/25/2015 14:20,2015-05-25T14:20:00,Rabies Risk,Euthanasia,Unknown,30.621295,-97.36491862,52.2281746,,,
1740.0,5 months,A736516,Cat,Domestic Shorthair Mix,Brown Tabby/White,2016-08-28,2/24/2017 17:01,2017-02-24T17:01:00,Partner,Transfer,Neutered Male,30.45617471,-97.69069005,25.8155754,Blue,,
1741.0,1 year,A681857,Dog,Chihuahua Shorthair Mix,White/Tan,2013-06-21,6/26/2014 8:58,2014-06-26T08:58:00,Partner,Transfer,Spayed Female,30.54609908,-97.68106733,52.91051587,Tarva,,
1742.0,6 months,A666408,Dog,Chihuahua Shorthair Mix,White/Brown,2013-05-01,11/2/2013 11:27,2013-11-02T11:27:00,Partner,Transfer,Intact Male,30.40589577,-97.35907884,26.49672619,,,
1743.0,6 months,A710669,Dog,Labrador Retriever Mix,Black/White,2015-02-15,8/31/2015 17:10,2015-08-31T17:10:00,,Adoption,Spayed Female,30.53819184,-97.57970504,28.24503968,Koda,,
1744.0,2 months,A762323,Cat,Domestic Shorthair Mix,Brown Tabby,2017-10-12,12/24/2017 10:14,2017-12-24T10:14:00,,Adoption,Neutered Male,30.48992012,-97.48192054,10.48948413,*Luka,,
1745.0,10 years,A453083,Dog,Border Collie Mix,Chocolate/White,2005-11-13,1/12/2016 16:40,2016-01-12T16:40:00,,Return to Owner,Spayed Female,30.6444431,-97.45171797,530.3849206,Liz,,
1746.0,9 years,A726075,Dog,Labrador Retriever,Chocolate,2008-05-06,8/4/2017 9:53,2017-08-04T09:53:00,,Return to Owner,Neutered Male,30.35360139,-97.27810187,482.4874008,Henry,656174071f442de352558621,
1747.0,2 years,A700423,Dog,Boxer,Brown Brindle/White,2013-04-13,4/28/2015 15:39,2015-04-28T15:39:00,,Adoption,Neutered Male,30.30886265,-97.27328351,106.5217262,Tyson,,
1748.0,2 months,A679909,Cat,Domestic Medium Hair Mix,Torbie/White,2014-04-23,7/13/2014 18:57,2014-07-13T18:57:00,Foster,Adoption,Spayed Female,30.48329392,-97.68279807,11.68422619,*Milicent,,
1749.0,2 weeks,A711367,Cat,Domestic Shorthair Mix,Black/White,2015-08-21,9/5/2015 18:43,2015-09-05T18:43:00,Partner,Transfer,Unknown,30.33496738,-97.46872833,2.254265873,,,
1750.0,1 month,A753661,Cat,Domestic Shorthair Mix,White,2017-05-25,7/10/2017 17:45,2017-07-10T17:45:00,Suffering,Euthanasia,Intact Male,30.50603082,-97.32605712,6.677083333,,,
1751.0,4 months,A723319,Dog,Labrador Retriever Mix,Black/White,2015-11-14,4/3/2016 16:13,2016-04-03T16:13:00,,Adoption,Neutered Male,30.45022638,-97.69786753,20.23938492,Jam-It,,
1752.0,3 years,A718985,Dog,Toy Poodle Mix,Apricot,2012-07-10,1/15/2016 19:22,2016-01-15T19:22:00,,Adoption,Neutered Male,30.51520044,-97.38106591,183.5438492,,,
1753.0,6 years,A700832,Dog,Miniature Poodle Mix,White,2009-04-20,4/21/2015 12:59,2015-04-21T12:59:00,,Return to Owner,Spayed Female,30.5668129,-97.50594946,313.2201389,Sweetie,,
1754.0,1 year,A734458,Dog,Chihuahua Shorthair Mix,Brown/Tan,2015-09-06,9/15/2016 15:48,2016-09-15T15:48:00,Partner,Transfer,Intact Male,30.65003858,-97.24764812,53.66547619,*Hobie,,
1755.0,2 weeks,A729222,Dog,Pit Bull Mix,Blue/White,2016-06-02,6/22/2016 0:00,2016-06-22T00:00:00,,Return to Owner,Intact Female,30.4913856,-97.46475611,2.857142857,,,
1756.0,1 month,A687167,Dog,Patterdale Terr Mix,Black/White,2014-08-29,10/23/2014 18:38,2014-10-23T18:38:00,,Adoption,Spayed Female,30.58945496,-97.68586367,7.968055556,,,
1757.0,7 months,A742767,Dog,Labrador Retriever Mix,Black,2016-06-27,2/14/2017 15:20,2017-02-14T15:20:00,,Return to Owner,Intact Female,30.48697549,-97.42800172,33.23412698,Marley,,
1758.0,2 years,A689251,Dog,Pit Bull Mix,Blue/White,2012-10-01,10/2/2014 18:45,2014-10-02T18:45:00,,Return to Owner,Neutered Male,30.65595586,-97.27060599,104.5401786,Blue,,
1759.0,8 years,A686884,Dog,Miniature Schnauzer Mix,White,2006-08-28,9/7/2014 13:27,2014-09-07T13:27:00,,Return to Owner,Spayed Female,30.49867082,-97.73030853,418.9372024,Abby,,
1760.0,1 month,A703887,Cat,Domestic Shorthair Mix,Tortie,2015-05-08,6/13/2015 14:59,2015-06-13T14:59:00,Partner,Transfer,Intact Female,30.64899359,-97.52985065,5.232043651,*Dixie,,
1761.0,1 year,A673353,Dog,Chihuahua Shorthair Mix,Red,2013-02-22,2/27/2014 17:14,2014-02-27T17:14:00,,Return to Owner,Neutered Male,30.66670548,-97.71891931,52.95972222,Simon,,
1762.0,2 months,A751178,Cat,Domestic Shorthair Mix,Tortie,2017-04-24,7/1/2017 14:07,2017-07-01T14:07:00,Foster,Adoption,Spayed Female,30.30593874,-97.5295046,9.798313492,*Plum,,
1763.0,1 year,A732169,Dog,Cairn Terrier Mix,White,2015-08-03,8/9/2016 9:43,2016-08-09T09:43:00,Partner,Transfer,Spayed Female,30.55054184,-97.57921746,53.20069444,*Tulip,,
1764.0,13 years,A762050,Dog,Labrador Retriever Mix,Black/White,2004-11-14,11/14/2017 13:56,2017-11-14T13:56:00,,Return to Owner,Neutered Male,30.41680729,-97.30214633,678.3686508,Trooper,,
1765.0,3 years,A757370,Dog,German Shepherd Mix,Tricolor,2014-09-01,10/3/2017 13:28,2017-10-03T13:28:00,Partner,Transfer,Intact Male,30.29001196,-97.44210534,161.2230159,42,,
1766.0,2 years,A751482,Dog,Shih Tzu,White/Black,2015-06-08,6/12/2017 11:24,2017-06-12T11:24:00,Partner,Transfer,Spayed Female,30.55888638,-97.65183622,105.0678571,Piper,,
1767.0,3 years,A699224,Dog,American Bulldog Mix,Chocolate/White,2012-03-25,3/25/2015 18:00,2015-03-25T18:00:00,,Return to Owner,Neutered Male,30.55695735,-97.42155648,156.5357143,Gunner,,
1768.0,1 year,A762341,Cat,Snowshoe Mix,White/Tan,2016-11-18,11/23/2017 0:00,2017-11-23T00:00:00,Snr,Transfer,Neutered Male,30.71809489,-97.64820103,52.85714286,,,
1769.0,3 years,A611892,Dog,Jack Russell Terrier/Yorkshire Terrier,Tricolor,2011-05-13,5/29/2014 19:15,2014-05-29T19:15:00,,Adoption,Neutered Male,30.68106422,-97.3842452,158.9717262,Rufo,,
1770.0,1 year,A690804,Cat,Domestic Shorthair Mix,Orange Tabby,2013-10-26,10/27/2014 9:00,2014-10-27T09:00:00,SCRP,Transfer,Intact Male,30.70788695,-97.31696772,52.33928571,,,
1771.0,1 year,A760077,Dog,Black/Tan Hound Mix,Black/Tan,2016-10-12,10/21/2017 19:12,2017-10-21T19:12:00,,Adoption,Spayed Female,30.27177617,-97.67994196,53.54285714,Sky,,
1772.0,4 years,A688478,Dog,Shih Tzu Mix,Black/Gray,2010-09-19,9/30/2014 17:59,2014-09-30T17:59:00,,Return to Owner,Neutered Male,30.58377023,-97.67262479,210.3927579,Charlie,,
1773.0,8 months,A757897,Dog,Labrador Retriever Mix,Black,2017-01-08,10/2/2017 16:38,2017-10-02T16:38:00,Partner,Transfer,Spayed Female,30.43659174,-97.54171427,38.24186508,Pandora,,
1774.0,1 year,A720728,Bird,Chicken Mix,Black/Cream,2015-02-14,3/8/2016 14:24,2016-03-08T14:24:00,,Adoption,Intact Male,30.52168512,-97.65724091,55.51428571,Rooster 12,,
1775.0,5 years,A718236,Cat,Domestic Shorthair Mix,Calico,2010-12-26,1/5/2016 13:20,2016-01-05T13:20:00,Partner,Transfer,Spayed Female,30.45384739,-97.27476016,262.3650794,*Stevie,,
1776.0,4 years,A690878,Dog,German Shepherd Mix,Black/Brown,2010-04-27,10/29/2014 14:12,2014-10-29T14:12:00,,Adoption,Neutered Male,30.52160736,-97.46323167,235.227381,Iggy,,
1777.0,1 year,A698929,Dog,English Coonhound Mix,Tricolor,2013-09-19,3/20/2015 13:07,2015-03-20T13:07:00,,Return to Owner,Neutered Male,30.53123873,-97.54929242,78.22093254,Hans,,
1778.0,1 year,A669781,Dog,Labrador Retriever/Chow Chow,Yellow,2012-06-27,12/31/2013 16:42,2013-12-31T16:42:00,,Return to Owner,Neutered Male,30.53858471,-97.39318988,78.95654762,Cuatemo,,
1779.0,2 years,A691377,Dog,Chihuahua Shorthair Mix,Tan/Brown,2012-11-03,11/11/2014 12:02,2014-11-11T12:02:00,Partner,Transfer,Spayed Female,30.38873196,-97.59379633,105.5001984,*Sunshine,,
1780.0,1 year,A657774,Dog,Labrador Retriever Mix,Black/White,2012-06-02,10/9/2013 17:45,2013-10-09T17:45:00,,Return to Owner,Neutered Male,30.60247716,-97.50159246,70.67708333,Ottis,,
1781.0,1 month,A738289,Cat,Domestic Shorthair Mix,Brown Tabby/White,2016-10-12,12/3/2016 16:34,2016-12-03T16:34:00,,Adoption,Intact Male,30.72418098,-97.43055555,7.52718254,*Aden,,
1782.0,4 weeks,A759418,Cat,American Shorthair Mix,Brown Tabby,2017-09-01,10/2/2017 13:50,2017-10-02T13:50:00,Partner,Transfer,Intact Female,30.32450986,-97.63995446,4.510912698,,,
1783.0,2 months,A729267,Cat,Domestic Shorthair Mix,Calico,2016-04-15,6/27/2016 0:00,2016-06-27T00:00:00,Partner,Transfer,Spayed Female,30.27554544,-97.50970037,10.42857143,*Merry,,
1784.0,3 years,A715199,Cat,Domestic Shorthair Mix,Brown Tabby,2012-11-02,11/3/2015 9:00,2015-11-03T09:00:00,SCRP,Transfer,Neutered Male,30.72420279,-97.48274774,156.625,,,
1785.0,1 day,A675466,Cat,Domestic Shorthair Mix,White,2014-03-28,3/29/2014 15:33,2014-03-29T15:33:00,Partner,Transfer,Intact Male,30.76157091,-97.26265525,0.235416667,,,
1786.0,1 year,A676584,Dog,German Shepherd Mix,Sable/Tan,2013-04-12,4/16/2014 12:50,2014-04-16T12:50:00,Partner,Transfer,Neutered Male,30.30766767,-97.64321685,52.7906746,,,
1787.0,1 year,A721361,Cat,Domestic Medium Hair Mix,Calico,2015-05-25,9/26/2016 14:12,2016-09-26T14:12:00,Partner,Transfer,Spayed Female,30.52711521,-97.24875863,70.08452381,Leia,,
1788.0,10 years,A749452,Cat,Domestic Shorthair Mix,Black/White,2007-05-15,5/15/2017 11:36,2017-05-15T11:36:00,Suffering,Euthanasia,Neutered Male,30.31880765,-97.39603541,521.9261905,,,
1789.0,3 weeks,A704637,Cat,Domestic Shorthair Mix,Blue Tabby,2015-05-16,6/7/2015 13:23,2015-06-07T13:23:00,Partner,Transfer,Intact Male,30.47871817,-97.52328959,3.222519841,,,
1790.0,5 years,A626405,Dog,Great Dane Mix,White/Black,2008-05-06,10/30/2013 11:45,2013-10-30T11:45:00,,Return to Owner,Neutered Male,30.76174606,-97.33801402,286.2127976,Ziven,,
1791.0,1 year,A727714,Dog,Labrador Retriever Mix,Black,2015-05-25,6/7/2016 13:53,2016-06-07T13:53:00,,Adoption,Neutered Male,30.56805127,-97.52472611,54.22549603,*Sammy,,
1792.0,2 months,A724207,Cat,Domestic Shorthair Mix,Calico,2016-04-12,7/9/2016 16:04,2016-07-09T16:04:00,Foster,Adoption,Spayed Female,30.43438281,-97.47238399,12.66706349,*Cici,,
1793.0,8 months,A732264,Dog,Labrador Retriever Mix,Black,2015-12-04,8/17/2016 0:00,2016-08-17T00:00:00,,Adoption,Neutered Male,30.35981923,-97.32113557,36.71428571,King,,
1794.0,1 day,A678840,Cat,Domestic Shorthair Mix,Torbie,2014-05-12,5/13/2014 14:53,2014-05-13T14:53:00,Partner,Transfer,Intact Female,30.47491888,-97.49182894,0.231448413,,,
1795.0,1 year,A722897,Cat,Domestic Medium Hair,Black Smoke,2015-03-23,3/31/2016 13:01,2016-03-31T13:01:00,,Adoption,Spayed Female,30.51133777,-97.37461201,53.50605159,*Anastasia,,
1796.0,6 months,A738212,Dog,German Shepherd,Black/Brown,2016-05-11,11/13/2016 19:00,2016-11-13T19:00:00,Partner,Transfer,Spayed Female,30.44147973,-97.70293369,26.68452381,Karma,656174071f442de352558622,
1797.0,3 months,A666980,Cat,Domestic Shorthair Mix,Black/White,2013-08-26,12/23/2013 17:06,2013-12-23T17:06:00,,Adoption,Neutered Male,30.45872623,-97.26319225,17.10178571,*Donald,,
1798.0,3 months,A707167,Cat,Domestic Shorthair Mix,Blue Tabby,2015-05-08,8/23/2015 19:26,2015-08-23T19:26:00,,Adoption,Neutered Male,30.5520842,-97.26989852,15.40138889,*Yarrow,,
1799.0,1 year,A685100,Dog,Miniature Poodle Mix,Buff,2013-08-02,8/6/2014 18:33,2014-08-06T18:33:00,,Adoption,Spayed Female,30.73303944,-97.35816082,52.82470238,Abigail,,
1800.0,1 year,A742867,Dog,Chihuahua Shorthair Mix,Tan,2016-01-29,2/5/2017 11:40,2017-02-05T11:40:00,,Adoption,Spayed Female,30.27508708,-97.58918323,53.35515873,Star,,
1801.0,2 years,A712641,Dog,Chihuahua Shorthair Mix,Brown/White,2013-09-26,10/6/2015 16:44,2015-10-06T16:44:00,,Return to Owner,Spayed Female,30.33109836,-97.25145711,105.8138889,Lolita,,
1802.0,2 years,A663256,Other,Rabbit Sh Mix,White,2011-09-15,12/8/2013 13:27,2013-12-08T13:27:00,Partner,Transfer,Intact Male,30.59304535,-97.4471308,116.508631,* Henry,,
1803.0,12 years,A726391,Dog,Labrador Retriever Mix,Brown,2003-11-10,5/10/2016 14:29,2016-05-10T14:29:00,In Kennel,Died,Unknown,30.69021413,-97.71859212,652.2290675,Diamond,,
1804.0,2 months,A742448,Cat,Domestic Longhair Mix,Brown Tabby,2016-11-18,1/25/2017 14:25,2017-01-25T14:25:00,,Adoption,Spayed Female,30.73745421,-97.32583344,9.800099206,*Sassy,,
1805.0,3 years,A743983,Dog,Labrador Retriever Mix,White/Fawn,2014-02-20,5/7/2017 14:21,2017-05-07T14:21:00,,Adoption,Spayed Female,30.51471027,-97.41848825,167.5139881,*Leilani,,
1806.0,5 years,A679511,Dog,Pit Bull Mix,Blue/White,2009-05-24,5/31/2014 11:28,2014-05-31T11:28:00,,Return to Owner,Spayed Female,30.64536065,-97.385288,261.9253968,Mary Jane,,
1807.0,4 months,A709382,Cat,Domestic Shorthair Mix,Black,2015-04-08,8/9/2015 9:00,2015-08-09T09:00:00,SCRP,Transfer,Intact Male,30.4110124,-97.51868053,17.625,,,
1808.0,3 years,A723221,Dog,Labrador Retriever/Border Collie,Black/White,2013-03-28,3/29/2016 16:03,2016-03-29T16:03:00,,Return to Owner,Spayed Female,30.51248527,-97.27684475,156.8098214,Kate,,
1809.0,4 months,A743221,Dog,Australian Cattle Dog Mix,Cream/White,2016-10-06,2/11/2017 17:05,2017-02-11T17:05:00,,Adoption,Spayed Female,30.45099675,-97.61655063,18.38740079,,,
1810.0,2 years,A705111,Dog,Chihuahua Shorthair Mix,Brown/Black,2013-06-13,6/24/2015 15:25,2015-06-24T15:25:00,,Adoption,Spayed Female,30.49554316,-97.68977231,105.9489087,*Kiki,,
1811.0,1 year,A746386,Dog,Siberian Husky Mix,Black/White,2016-04-01,4/5/2017 12:40,2017-04-05T12:40:00,,Adoption,Spayed Female,30.70122704,-97.69921251,52.78968254,*Rye,,
1812.0,2 months,A715005,Cat,Domestic Shorthair Mix,Black,2015-08-29,11/17/2015 0:00,2015-11-17T00:00:00,Partner,Transfer,Spayed Female,30.56403792,-97.6910468,11.42857143,*Onyx,,
1813.0,5 months,A682343,Dog,Chihuahua Shorthair/Dachshund,Black/Tan,2014-02-28,8/15/2014 18:58,2014-08-15T18:58:00,Foster,Adoption,Spayed Female,30.49875801,-97.60651902,24.11289683,Lulu,,
1814.0,6 years,A738940,Cat,Domestic Longhair,Orange Tabby/White,2010-03-30,12/2/2016 14:01,2016-12-02T14:01:00,,Return to Owner,Neutered Male,30.4793097,-97.68096711,348.512004,Sherbert,,
1815.0,1 year,A737497,Cat,Domestic Shorthair Mix,Brown Tabby,2015-10-30,10/31/2016 13:56,2016-10-31T13:56:00,,Return to Owner,Spayed Female,30.4251695,-97.50525282,52.51150794,Coco,,
1816.0,3 months,A754517,Cat,Domestic Shorthair Mix,Brown Tabby/White,2017-05-06,8/11/2017 14:14,2017-08-11T14:14:00,Partner,Transfer,Intact Male,30.62423818,-97.48466578,13.94186508,,,
1817.0,1 year,A755901,Dog,Havanese,Cream,2016-08-10,8/14/2017 12:21,2017-08-14T12:21:00,Partner,Transfer,Intact Male,30.27050619,-97.54637137,52.78779762,,,
1818.0,2 years,A716156,Dog,Pointer/Border Collie,Black/White,2013-06-05,11/28/2015 17:06,2015-11-28T17:06:00,,Adoption,Neutered Male,30.36870593,-97.65374232,129.5303571,*Snapper,,
1819.0,1 year,A679980,Cat,Domestic Shorthair Mix,Black/White,2013-05-28,5/28/2014 8:00,2014-05-28T08:00:00,SCRP,Transfer,Neutered Male,30.64004474,-97.45335593,52.19047619,,,
1820.0,1 year,A752167,Dog,Labrador Retriever Mix,Black,2016-06-19,7/1/2017 13:45,2017-07-01T13:45:00,,Adoption,Neutered Male,30.31278056,-97.51772974,53.9389881,Pippen,,
1821.0,5 years,A701696,Dog,Jack Russell Terrier Mix,Brown/White,2010-05-03,10/6/2015 13:06,2015-10-06T13:06:00,Partner,Transfer,Spayed Female,30.59574241,-97.37361503,283.2208333,Hurricane,,
1822.0,10 years,A761286,Cat,Domestic Shorthair Mix,Orange Tabby/White,2007-11-02,1/21/2018 17:20,2018-01-21T17:20:00,,Adoption,Neutered Male,30.48712255,-97.67102695,533.3888889,Bob,,
1823.0,2 years,A682493,Cat,Domestic Shorthair Mix,Orange Tabby/White,2012-06-28,7/18/2014 11:23,2014-07-18T11:23:00,,Adoption,Neutered Male,30.52400049,-97.60397566,107.2106151,,,
1824.0,2 months,A732176,Dog,Chow Chow Mix,Tan,2016-06-03,8/7/2016 18:11,2016-08-07T18:11:00,,Adoption,Spayed Female,30.37345324,-97.63762141,9.393948413,,,
1825.0,3 months,A751687,Cat,Domestic Shorthair Mix,Black/White,2017-05-06,8/16/2017 0:00,2017-08-16T00:00:00,Partner,Transfer,Neutered Male,30.51620021,-97.56012445,14.57142857,*Wilson,,
1826.0,1 year,A721842,Dog,Pit Bull Mix,White/Brown,2015-03-05,5/30/2016 15:19,2016-05-30T15:19:00,,Adoption,Spayed Female,30.59881753,-97.61984153,64.66259921,*Helena,,
1827.0,4 years,A529956,Dog,Pit Bull Mix,White/Brown,2010-09-08,9/8/2014 13:41,2014-09-08T13:41:00,,Return to Owner,Spayed Female,30.6347243,-97.40294217,208.7957341,Coco,,
1828.0,3 years,A700396,Dog,Pit Bull Mix,Black/White,2012-04-13,12/8/2015 11:45,2015-12-08T11:45:00,,Return to Owner,Spayed Female,30.63097268,-97.73089846,190.641369,Calseta,,
1829.0,4 months,A673660,Dog,Australian Shepherd Mix,White/Black,2013-10-28,3/4/2014 18:46,2014-03-04T18:46:00,,Adoption,Spayed Female,30.29290766,-97.43863464,18.25456349,Loulou,,
1830.0,2 years,A670013,Dog,Catahoula/Alaskan Husky,Tan/White,2011-12-31,1/3/2014 11:05,2014-01-03T11:05:00,,Return to Owner,Spayed Female,30.54964299,-97.62617921,104.9231151,Bandit,,
1831.0,4 months,A744500,Dog,Labrador Retriever Mix,Black,2016-10-02,3/2/2017 15:26,2017-03-02T15:26:00,,Return to Owner,Intact Male,30.29389818,-97.40071526,21.66329365,,,
1832.0,4 months,A718359,Cat,Domestic Shorthair Mix,Blue,2015-08-28,1/8/2016 19:15,2016-01-08T19:15:00,SCRP,Transfer,Neutered Male,30.67644804,-97.35652342,19.11458333,,,
1833.0,3 months,A752730,Cat,Domestic Shorthair Mix,Blue,2017-05-15,9/5/2017 11:42,2017-09-05T11:42:00,Foster,Adoption,Intact Female,30.73223624,-97.46151827,16.2125,Yola,,
1834.0,2 years,A760982,Cat,Persian Mix,Orange Tabby,2015-10-27,10/31/2017 16:39,2017-10-31T16:39:00,,Adoption,Neutered Male,30.6365125,-97.47149975,105.0991071,,,
1835.0,7 months,A722352,Dog,Labrador Retriever Mix,Black/White,2015-08-15,4/2/2016 18:13,2016-04-02T18:13:00,,Adoption,Spayed Female,30.38704966,-97.415768,33.10843254,Zombie,,
1836.0,1 year,A722303,Cat,Domestic Shorthair Mix,Orange Tabby/White,2015-03-14,3/18/2016 16:53,2016-03-18T16:53:00,,Adoption,Neutered Male,30.30333141,-97.49054688,52.95763889,*Tarleton,,
1837.0,1 year,A697689,Dog,Flat Coat Retriever Mix,Black/Brown Brindle,2013-08-26,3/24/2015 11:44,2015-03-24T11:44:00,,Adoption,Neutered Male,30.49221475,-97.67424969,82.21269841,Reptar,,
1838.0,10 months,A690332,Dog,Pit Bull Mix,Tan/White,2013-12-18,10/26/2014 17:12,2014-10-26T17:12:00,,Adoption,Neutered Male,30.37118812,-97.30974011,44.67380952,Zeus,,
1839.0,1 month,A729624,Cat,Domestic Shorthair Mix,Brown Tabby/White,2016-05-25,7/21/2016 18:00,2016-07-21T18:00:00,,Adoption,Neutered Male,30.68239899,-97.41907665,8.25,*Baxter,,
1840.0,1 year,A720966,Dog,Border Collie,Blue Merle,2015-02-18,3/14/2016 13:46,2016-03-14T13:46:00,Partner,Transfer,Intact Female,30.62872188,-97.37152863,55.79623016,*Aspen,,
1841.0,4 months,A716035,Cat,Domestic Shorthair Mix,Brown Tabby/White,2015-07-29,11/29/2015 17:15,2015-11-29T17:15:00,,Adoption,Intact Male,30.46998038,-97.74048448,17.67410714,Starbucks,,
1842.0,1 year,A716633,Cat,Domestic Shorthair Mix,Tortie,2014-11-22,11/26/2015 20:20,2015-11-26T20:20:00,SCRP,Transfer,Intact Female,30.65052974,-97.59154036,52.83531746,,,
1843.0,1 year,A739663,Dog,Siberian Husky Mix,Black/White,2015-12-05,12/9/2016 17:47,2016-12-09T17:47:00,,Return to Owner,Neutered Male,30.58635321,-97.64609167,52.96299603,Rocky,,
1844.0,1 year,A682584,Dog,Chihuahua Shorthair Mix,Tan/White,2013-06-30,7/13/2014 16:48,2014-07-13T16:48:00,,Adoption,Neutered Male,30.57392794,-97.55202573,54.1,,,
1845.0,2 years,A673433,Dog,German Shepherd Mix,Sable,2012-02-24,3/18/2014 14:17,2014-03-18T14:17:00,,Adoption,Neutered Male,30.7491227,-97.25343404,107.6564484,Rocko,,
1846.0,2 months,A752199,Cat,Domestic Shorthair Mix,Calico/Brown,2017-04-19,6/28/2017 18:20,2017-06-28T18:20:00,,Adoption,Spayed Female,30.38821123,-97.43929927,10.10912698,,,
1847.0,12 years,A706917,Dog,German Shepherd Mix,Brown/Black,2003-07-05,7/7/2015 15:07,2015-07-07T15:07:00,,Return to Owner,Neutered Male,30.44254818,-97.7079191,626.5185516,Duke,,
1848.0,8 months,A674787,Dog,Jack Russell Terrier/Shih Tzu,Chocolate/Brown,2013-07-18,3/28/2014 18:18,2014-03-28T18:18:00,,Return to Owner,Neutered Male,30.65745063,-97.48020467,36.25178571,Hercules,,
1849.0,2 months,A760566,Cat,Domestic Medium Hair Mix,Tortie,2017-09-08,11/30/2017 13:56,2017-11-30T13:56:00,,Adoption,Intact Female,30.69919672,-97.24333038,11.94007937,*Lydia,,
1850.0,9 years,A742776,Dog,Dachshund,Black/Tan,2008-01-27,2/1/2017 13:09,2017-02-01T13:09:00,Partner,Transfer,Spayed Female,30.69240854,-97.33076413,470.5068452,*Franzi,,
1851.0,1 year,A764373,Dog,Alaskan Husky Mix,Black/White,2016-12-28,1/2/2018 16:37,2018-01-02T16:37:00,,Adoption,Neutered Male,30.4790155,-97.2867024,52.95605159,Max,,
1852.0,1 month,A692875,Cat,Domestic Shorthair Mix,Black/White,2014-10-24,12/23/2014 11:17,2014-12-23T11:17:00,,Adoption,Neutered Male,30.62634838,-97.28394083,8.63859127,*Rembrandt,,
1853.0,9 months,A714574,Cat,Domestic Shorthair Mix,Blue,2015-01-25,10/29/2015 19:46,2015-10-29T19:46:00,SCRP,Transfer,Intact Female,30.68261928,-97.47440001,39.6890873,*Robin,,
1854.0,1 year,A751051,Cat,Domestic Shorthair Mix,Brown Tabby/White,2016-06-03,6/4/2017 16:41,2017-06-04T16:41:00,Rabies Risk,Euthanasia,Unknown,30.64020428,-97.27678183,52.38501984,,,
1855.0,2 months,A755447,Cat,Domestic Shorthair Mix,Black/White,2017-06-03,8/18/2017 13:09,2017-08-18T13:09:00,Partner,Transfer,Intact Male,30.33256351,-97.62922707,10.93541667,*Mike,,
1856.0,6 months,A703475,Dog,Pit Bull Mix,White/Tan,2014-11-10,5/29/2015 15:33,2015-05-29T15:33:00,Partner,Transfer,Intact Female,30.60576756,-97.6780155,28.6639881,*Dotty,,
1857.0,6 years,A752655,Cat,Domestic Medium Hair Mix,Black,2011-06-28,7/12/2017 15:13,2017-07-12T15:13:00,Suffering,Euthanasia,Spayed Female,30.45465388,-97.4329884,315.2334325,*Patti,,
1858.0,2 months,A708485,Cat,Domestic Shorthair Mix,Tortie,2015-05-04,7/29/2015 9:00,2015-07-29T09:00:00,SCRP,Transfer,Spayed Female,30.44774309,-97.41750582,12.33928571,*Snickers,,
1859.0,4 months,A731757,Cat,Domestic Shorthair Mix,Black/Blue,2016-03-27,7/28/2016 9:00,2016-07-28T09:00:00,SCRP,Transfer,Neutered Male,30.38989236,-97.47048117,17.625,,,
1860.0,12 years,A668981,Cat,Domestic Shorthair Mix,Orange Tabby,2001-12-12,12/16/2013 13:05,2013-12-16T13:05:00,Suffering,Euthanasia,Intact Male,30.50606505,-97.6372879,626.7921627,Rudolph,,
1861.0,4 years,A697765,Dog,Chinese Sharpei Mix,Brown,2013-02-27,4/2/2017 14:20,2017-04-02T14:20:00,,Return to Owner,Spayed Female,30.70271719,-97.60735182,213.656746,Louise,,
1862.0,4 years,A694738,Dog,Boxer/Staffordshire,Brown Brindle/White,2012-01-03,2/28/2016 14:45,2016-02-28T14:45:00,,Return to Owner,Spayed Female,30.70609725,-97.37656678,216.8020833,Moxie,,
1863.0,1 year,A744598,Dog,Cairn Terrier Mix,Tan/White,2016-03-03,3/8/2017 19:21,2017-03-08T19:21:00,,Adoption,Neutered Male,30.67045056,-97.6802287,52.97232143,,,
1864.0,3 years,A657360,Dog,Chihuahua Shorthair Mix,Brown/White,2012-08-26,12/19/2015 17:58,2015-12-19T17:58:00,Partner,Transfer,Neutered Male,30.38033608,-97.60829546,172.9640873,Panzon,,
1865.0,2 years,A746471,Dog,Chihuahua Shorthair Mix,White/Tan,2014-10-03,4/3/2017 17:53,2017-04-03T17:53:00,,Return to Owner,Intact Male,30.7474779,-97.39466698,130.5350198,Lucky,,
1866.0,4 months,A681961,Cat,Domestic Shorthair Mix,Black,2014-04-30,9/11/2014 11:58,2014-09-11T11:58:00,Foster,Adoption,Spayed Female,30.48513691,-97.39607968,19.2140873,,,
1867.0,3 years,A670767,Dog,Chinese Sharpei Mix,Tan,2011-01-14,1/15/2014 17:15,2014-01-15T17:15:00,,Return to Owner,Neutered Male,30.72113164,-97.51893946,156.8169643,Chato,,
1868.0,6 months,A673364,Cat,Domestic Shorthair Mix,Brown Tabby/White,2013-08-22,2/22/2014 18:21,2014-02-22T18:21:00,,Return to Owner,Spayed Female,30.71173343,-97.53579623,26.39494048,Haley,,
1869.0,1 year,A741366,Dog,Norwich Terrier Mix,Tan,2015-12-31,1/5/2017 17:25,2017-01-05T17:25:00,,Adoption,Neutered Male,30.33043666,-97.53132249,53.10367063,,,
1870.0,10 years,A737266,Cat,Domestic Shorthair Mix,Orange Tabby,2006-10-25,10/25/2016 12:59,2016-10-25T12:59:00,Partner,Transfer,Neutered Male,30.55225531,-97.5529424,521.9344246,,,
1871.0,1 year,A693816,Dog,Rat Terrier Mix,Brown/White,2013-12-15,1/18/2015 20:03,2015-01-18T20:03:00,Offsite,Adoption,Neutered Male,30.65571161,-97.7037928,57.11934524,,,
1872.0,2 years,A715156,Other,Rat,Tan,2013-11-01,11/12/2015 13:39,2015-11-12T13:39:00,Partner,Transfer,Unknown,30.44740194,-97.3604392,105.9383929,,,
1873.0,1 year,A672549,Dog,Pit Bull Mix,Black/White,2013-02-12,2/24/2014 16:59,2014-02-24T16:59:00,,Adoption,Neutered Male,30.56002267,-97.44399229,53.95823413,Aries,,
1874.0,10 years,A666523,Dog,Chesa Bay Retr Mix,Brown,2003-11-02,11/13/2013 11:30,2013-11-13T11:30:00,Partner,Transfer,Neutered Male,30.32863392,-97.51628036,523.4970238,Archie,,
1875.0,2 years,A698837,Cat,Siamese Mix,Tortie Point,2015-03-12,1/15/2018 15:33,2018-01-15T15:33:00,Partner,Transfer,Spayed Female,30.69420837,-97.5629656,148.6639881,Nora,,
1876.0,3 months,A715320,Cat,Domestic Shorthair Mix,Tortie,2015-08-03,11/14/2015 12:17,2015-11-14T12:17:00,,Adoption,Spayed Female,30.4501269,-97.71147728,14.78740079,,,
1877.0,4 months,A682948,Cat,Domestic Medium Hair Mix,Black/White,2014-06-05,10/30/2014 18:45,2014-10-30T18:45:00,,Adoption,Spayed Female,30.40118527,-97.27579518,21.11160714,*Rain,,
1878.0,2 months,A670572,Cat,Domestic Shorthair Mix,White/Brown Tabby,2013-10-28,1/12/2014 17:54,2014-01-12T17:54:00,,Adoption,Spayed Female,30.59987236,-97.44011914,10.96369048,Echo,,
1879.0,2 days,A723593,Cat,Domestic Shorthair Mix,Tortie/Blue,2016-04-03,4/5/2016 15:23,2016-04-05T15:23:00,Partner,Transfer,Intact Female,30.41271068,-97.69750003,0.377281746,,,
1880.0,2 years,A682785,Dog,Australian Kelpie Mix,Black/Brown,2012-07-02,7/13/2014 13:42,2014-07-13T13:42:00,,Adoption,Spayed Female,30.55964976,-97.42257033,105.9386905,Lilly,,
1881.0,7 months,A709687,Dog,Labrador Retriever Mix,Black/White,2015-02-12,10/12/2015 12:17,2015-10-12T12:17:00,Partner,Transfer,Neutered Male,30.39884367,-97.71147647,34.64454365,*Rooney,,
1882.0,1 year,A690507,Cat,Domestic Shorthair Mix,Brown Tabby,2013-11-09,11/25/2014 18:33,2014-11-25T18:33:00,SCRP,Transfer,Intact Female,30.56712421,-97.73396092,54.5389881,,,
1883.0,4 weeks,A674080,Other,Bat,Brown/Black,2014-02-07,3/7/2014 10:46,2014-03-07T10:46:00,Rabies Risk,Euthanasia,Unknown,30.70221812,-97.72012467,4.064087302,,,
1884.0,4 years,A692797,Dog,Miniature Poodle Mix,White,2010-11-25,11/22/2015 13:51,2015-11-22T13:51:00,,Adoption,Spayed Female,30.48059566,-97.43904178,260.5110119,Suzze,,
1885.0,8 years,A693388,Dog,Parson Russell Terrier/Beagle,White/Brown,2006-12-10,3/15/2015 18:05,2015-03-15T18:05:00,,Adoption,Neutered Male,30.746583,-97.69451324,431.1076389,Cowboy,,
1886.0,4 years,A620883,Dog,Labrador Retriever Mix,Black,2010-02-26,11/4/2014 14:01,2014-11-04T14:01:00,,Adoption,Spayed Female,30.6480124,-97.40384716,244.6548611,Sadie,,
1887.0,1 year,A680184,Cat,Domestic Shorthair Mix,Brown Tabby,2013-05-30,6/13/2014 11:54,2014-06-13T11:54:00,,Adoption,Spayed Female,30.51789122,-97.32848355,54.21369048,Akasha,,
1888.0,1 year,A701864,Other,Opossum,Gray,2014-05-05,5/5/2015 15:33,2015-05-05T15:33:00,Rabies Risk,Euthanasia,Intact Female,30.7317359,-97.37511907,52.23541667,,,
1889.0,4 years,A676712,Dog,Maltese Mix,White,2010-04-14,4/15/2014 17:57,2014-04-15T17:57:00,,Return to Owner,Spayed Female,30.65515207,-97.43958653,208.9639881,Gala,,
1890.0,2 years,A688823,Cat,Domestic Shorthair Mix,Black Smoke/White,2014-08-25,8/27/2016 15:04,2016-08-27T15:04:00,Foster,Adoption,Neutered Male,30.27567416,-97.71120311,104.8039683,Kevin,,
1891.0,2 years,A701136,Dog,American Bulldog Mix,White/Blue,2013-04-24,4/24/2015 17:59,2015-04-24T17:59:00,,Return to Owner,Intact Male,30.58453994,-97.56195286,104.3927579,Mexico,,
1892.0,1 year,A692642,Dog,Chihuahua Shorthair,Tan/White,2013-11-23,8/27/2015 18:33,2015-08-27T18:33:00,,Return to Owner,Spayed Female,30.64596597,-97.57993788,91.82470238,Millie,,
1893.0,2 years,A739887,Dog,German Shepherd Mix,Tan/White,2014-12-08,12/13/2016 18:06,2016-12-13T18:06:00,,Adoption,Spayed Female,30.71696878,-97.66957561,105.2505952,,,
1894.0,3 years,A664363,Dog,Labrador Retriever/German Shepherd,White,2010-04-02,10/12/2013 18:50,2013-10-12T18:50:00,,Adoption,Spayed Female,30.3551174,-97.46355233,184.2549603,,,
1895.0,1 year,A707873,Dog,Queensland Heeler,Red Tick/White,2015-04-27,6/11/2016 13:34,2016-06-11T13:34:00,,Adoption,Spayed Female,30.35251383,-97.27331901,58.79503968,Missy,,
1896.0,4 months,A686093,Cat,Domestic Shorthair Mix,Brown Tabby/White,2014-04-07,8/23/2014 16:51,2014-08-23T16:51:00,Partner,Transfer,Spayed Female,30.34239291,-97.72800639,19.81458333,Mouse,,
1897.0,1 year,A668408,Cat,Domestic Shorthair Mix,Lynx Point/Gray Tabby,2012-12-03,12/16/2013 14:38,2013-12-16T14:38:00,SCRP,Transfer,Neutered Male,30.44336706,-97.67870772,54.08710317,Eberhart,,
1898.0,8 months,A759082,Dog,Great Pyrenees Mix,White,2017-01-26,9/27/2017 18:43,2017-09-27T18:43:00,,Return to Owner,Intact Female,30.30872895,-97.56748,34.96855159,,,
1899.0,10 years,A720044,Cat,Domestic Shorthair Mix,Brown Tabby,2006-02-01,2/1/2016 15:57,2016-02-01T15:57:00,,Return to Owner,Neutered Male,30.5376052,-97.42033529,521.8092262,Cat,,
1900.0,2 years,A760258,Dog,Miniature Poodle Mix,White/White,2015-10-15,10/19/2017 17:58,2017-10-19T17:58:00,Partner,Transfer,Spayed Female,30.36819153,-97.55965668,105.1069444,,,
1901.0,10 years,A705996,Dog,Toy Poodle Mix,Gray,2005-06-23,6/29/2015 12:19,2015-06-29T12:19:00,,Adoption,Spayed Female,30.66508498,-97.50748091,522.6447421,Betsy,,
1902.0,2 weeks,A701472,Cat,Domestic Shorthair Mix,Blue Tabby/White,2015-04-11,4/30/2015 12:52,2015-04-30T12:52:00,Partner,Transfer,Intact Female,30.56172678,-97.73689075,2.790873016,,,
1903.0,6 months,A735434,Cat,Domestic Shorthair,Brown Tabby,2016-03-23,10/16/2016 18:48,2016-10-16T18:48:00,,Adoption,Neutered Male,30.52491907,-97.34581787,29.68333333,*Dozer,,
1904.0,2 years,A751124,Cat,Domestic Shorthair Mix,Orange Tabby,2015-06-04,6/9/2017 18:28,2017-06-09T18:28:00,Snr,Transfer,Neutered Male,30.68853438,-97.41461586,105.2527778,,,
1905.0,4 years,A579608,Dog,Labrador Retriever Mix,Black/White,2010-06-09,7/21/2014 12:43,2014-07-21T12:43:00,,Return to Owner,Neutered Male,30.45516021,-97.72110951,214.7899802,Max,,
1906.0,1 year,A729530,Cat,Domestic Shorthair Mix,Brown Tabby,2015-06-19,6/26/2016 0:00,2016-06-26T00:00:00,Partner,Transfer,Intact Female,30.48829259,-97.30685021,53.28571429,*Tina,,
1907.0,4 weeks,A736154,Cat,Domestic Medium Hair Mix,Black,2016-09-05,10/5/2016 19:33,2016-10-05T19:33:00,Partner,Transfer,Intact Male,30.68802924,-97.70290792,4.402083333,,,
1908.0,3 years,A674306,Dog,Chihuahua Shorthair Mix,Black/White,2011-03-11,3/20/2014 14:27,2014-03-20T14:27:00,Partner,Transfer,Spayed Female,30.38733753,-97.73387772,157.9431548,*Blackbird,,
1909.0,3 years,A683812,Cat,Domestic Shorthair Mix,Black/White,2011-07-15,8/19/2014 11:39,2014-08-19T11:39:00,Partner,Transfer,Spayed Female,30.73623606,-97.41518903,161.6407738,Squishy,,
1910.0,4 weeks,A731581,Dog,Plott Hound Mix,Black,2016-07-24,8/25/2016 0:00,2016-08-25T00:00:00,Partner,Transfer,Intact Female,30.44629616,-97.70783628,4.571428571,,,
1911.0,1 year,A723017,Dog,Jack Russell Terrier Mix,White/Black,2015-03-25,4/6/2016 15:25,2016-04-06T15:25:00,,Adoption,Neutered Male,30.54020332,-97.48216811,54.09176587,*Spotz,,
1912.0,2 months,A753996,Dog,Jack Russell Terrier/Pembroke Welsh Corgi,Brown,2017-05-14,7/18/2017 17:09,2017-07-18T17:09:00,,Adoption,Spayed Female,30.4890566,-97.34411753,9.387797619,Ginger,,
1913.0,1 year,A706629,Cat,Domestic Shorthair Mix,Brown Tabby/White,2014-07-01,7/2/2015 9:00,2015-07-02T09:00:00,SCRP,Transfer,Intact Male,30.46021176,-97.43741118,52.33928571,,,
1914.0,5 months,A674706,Cat,Domestic Shorthair Mix,Brown Tabby,2013-09-17,3/18/2014 15:01,2014-03-18T15:01:00,SCRP,Transfer,Unknown,30.64363851,-97.5882983,26.08938492,,,
1915.0,6 months,A688877,Cat,Domestic Shorthair Mix,Tortie,2014-03-25,9/27/2014 9:00,2014-09-27T09:00:00,SCRP,Transfer,Intact Female,30.4422947,-97.67827408,26.625,,,
1916.0,1 year,A683331,Cat,Domestic Shorthair Mix,Blue Tabby,2013-07-09,7/21/2014 10:43,2014-07-21T10:43:00,Partner,Transfer,Spayed Female,30.32860984,-97.58087463,53.92093254,,,
1917.0,2 months,A756090,Cat,American Shorthair Mix,Black/White,2017-07-26,10/6/2017 16:46,2017-10-06T16:46:00,,Adoption,Spayed Female,30.46452715,-97.67561682,10.38551587,,,
1918.0,3 years,A698931,Dog,Bloodhound Mix,Red/Black,2012-03-19,3/20/2015 11:24,2015-03-20T11:24:00,,Return to Owner,Intact Male,30.36383138,-97.39301776,156.6392857,,,
1919.0,7 months,A664222,Dog,Chihuahua Shorthair/Dachshund,Black/Tan,2013-03-30,11/18/2013 14:59,2013-11-18T14:59:00,,Adoption,Spayed Female,30.36180986,-97.4165929,33.37490079,*Rosie,,
1920.0,1 year,A714688,Cat,Domestic Medium Hair Mix,Black/White,2014-10-27,10/27/2015 9:00,2015-10-27T09:00:00,SCRP,Transfer,Intact Female,30.44698917,-97.63182179,52.19642857,,,
1921.0,6 months,A761030,Bird,Chicken Mix,Brown,2017-04-27,10/31/2017 0:00,2017-10-31T00:00:00,Partner,Transfer,Intact Male,30.42275123,-97.6549002,26.71428571,Taffy,,
1922.0,1 year,A733720,Cat,Domestic Shorthair Mix,Brown Tabby,2015-08-26,8/26/2016 14:58,2016-08-26T14:58:00,Partner,Transfer,Intact Male,30.33254018,-97.28767228,52.37480159,,,
1923.0,3 years,A727670,Cat,Domestic Shorthair Mix,Blue/White,2013-05-24,8/20/2016 16:29,2016-08-20T16:29:00,,Adoption,Spayed Female,30.6234361,-97.28622987,169.2409722,Marley,,
1924.0,9 years,A703955,Dog,Golden Retriever Mix,Red,2006-05-31,6/2/2015 14:42,2015-06-02T14:42:00,,Return to Owner,Spayed Female,30.64069884,-97.71622505,469.9446429,Lady,,
1925.0,15 years,A664172,Cat,Maine Coon Mix,Brown Tabby,1998-09-30,10/3/2013 19:00,2013-10-03T19:00:00,,Return to Owner,Neutered Male,30.74623413,-97.66042105,783.2559524,Spider,,
1926.0,2 months,A710167,Cat,Domestic Shorthair Mix,Brown Tabby/White,2015-07-30,10/27/2015 12:12,2015-10-27T12:12:00,,Adoption,Neutered Male,30.61506647,-97.3607654,12.78690476,*Skeeter,,
1927.0,2 months,A712044,Dog,German Shepherd/Labrador Retriever,Red/Black,2015-07-16,9/22/2015 18:09,2015-09-22T18:09:00,,Adoption,Neutered Male,30.28745377,-97.33587601,9.822321429,*Owen,,
1928.0,2 months,A763110,Dog,Border Collie Mix,Black/White,2017-11-03,1/12/2018 17:06,2018-01-12T17:06:00,Foster,Adoption,Spayed Female,30.42103378,-97.44274387,10.10178571,,,
1929.0,3 years,A650104,Dog,Australian Kelpie Mix,Black/Tan,2010-03-24,10/15/2013 17:28,2013-10-15T17:28:00,Suffering,Euthanasia,Intact Female,30.34742491,-97.56879347,185.9611111,Katie,,
1930.0,2 years,A760069,Dog,Labrador Retriever Mix,Black/White,2015-10-12,10/21/2017 15:08,2017-10-21T15:08:00,,Adoption,Spayed Female,30.72719868,-97.50751932,105.8043651,Solar,,
1931.0,2 years,A741165,Dog,German Shepherd Mix,Brown/Black,2014-12-28,8/23/2017 8:53,2017-08-23T08:53:00,Foster,Adoption,Spayed Female,30.42557681,-97.49116285,138.4814484,Lucy,,
1932.0,2 months,A753075,Cat,Domestic Shorthair Mix,Black,2017-04-16,7/9/2017 18:17,2017-07-09T18:17:00,,Adoption,Spayed Female,30.59646164,-97.53553704,12.10882937,Nina Rae,,
1933.0,10 months,A710347,Dog,Labrador Retriever Mix,Black,2014-12-28,10/31/2015 15:21,2015-10-31T15:21:00,,Adoption,Spayed Female,30.47720675,-97.60190133,43.9485119,Lulu,,
1934.0,2 years,A647363,Dog,Labrador Retriever Mix,White/Red,2012-11-09,11/14/2014 14:09,2014-11-14T14:09:00,,Return to Owner,Spayed Female,30.34951741,-97.40937495,105.0842262,Daisy,,
1935.0,1 year,A673128,Dog,German Shepherd Mix,Black/Tan,2013-04-19,5/25/2014 16:53,2014-05-25T16:53:00,,Return to Owner,Spayed Female,30.53052322,-97.31027831,57.38621032,Star,,
1936.0,1 year,A686725,Dog,Pit Bull Mix,Blue/White,2013-08-25,8/29/2014 13:55,2014-08-29T13:55:00,,Return to Owner,Spayed Female,30.28973783,-97.28672177,52.79712302,Nala,,
1937.0,4 weeks,A684525,Other,Bat,Brown/Black,2014-06-24,7/25/2014 8:47,2014-07-25T08:47:00,,Disposal,Unknown,30.6271913,-97.72116319,4.480853175,,,
1938.0,3 months,A720396,Cat,Domestic Shorthair Mix,Brown Tabby/White,2016-02-08,5/13/2016 14:51,2016-05-13T14:51:00,Foster,Adoption,Spayed Female,30.50274401,-97.50344485,13.65982143,*Hunter,,
1939.0,3 years,A721317,Dog,Pit Bull Mix,Black,2013-02-24,5/21/2016 14:55,2016-05-21T14:55:00,Partner,Transfer,Spayed Female,30.62049373,-97.71306918,168.9459325,Sophie,,
1940.0,3 years,A697451,Dog,Miniature Schnauzer/Cairn Terrier,Gray/Black,2012-02-24,6/7/2015 17:59,2015-06-07T17:59:00,,Adoption,Spayed Female,30.73979503,-97.36768369,171.3927579,Clover,,
1941.0,7 years,A545772,Dog,Plott Hound/Mastiff,Brown Brindle,2007-06-06,12/15/2014 17:53,2014-12-15T17:53:00,Foster,Adoption,Neutered Male,30.64956024,-97.41032552,392.8207341,Kibbeh,,
1942.0,2 years,A749527,Dog,Border Collie Mix,White,2014-12-16,6/2/2017 15:34,2017-06-02T15:34:00,,Return to Owner,Spayed Female,30.38115601,-97.46250412,128.5212302,Arista,,
1943.0,2 weeks,A706246,Cat,Domestic Shorthair Mix,Black/White,2015-06-11,6/26/2015 17:13,2015-06-26T17:13:00,Partner,Transfer,Intact Male,30.59397915,-97.56538643,2.245337302,,,
1944.0,2 years,A760059,Cat,Domestic Shorthair Mix,Gray Tabby/White,2015-10-11,10/19/2017 16:10,2017-10-19T16:10:00,,Adoption,Spayed Female,30.33265979,-97.39949586,105.6676587,Kitty,,
1945.0,4 months,A754078,Cat,Domestic Shorthair Mix,Calico,2017-03-31,8/9/2017 18:59,2017-08-09T18:59:00,,Adoption,Spayed Female,30.32098235,-97.49012338,18.82728175,*Auri,,
1946.0,2 months,A729380,Cat,Domestic Shorthair Mix,Black Smoke,2016-05-17,8/11/2016 11:20,2016-08-11T11:20:00,Foster,Adoption,Neutered Male,30.52259436,-97.47403667,12.3531746,*Poppy,,
1947.0,2 years,A760490,Cat,Domestic Shorthair Mix,Brown Tabby/White,2015-10-19,10/31/2017 16:43,2017-10-31T16:43:00,,Adoption,Neutered Male,30.47163664,-97.74090515,106.2423611,*Scooter,,
1948.0,1 year,A699383,Dog,Australian Shepherd Mix,Red/White,2013-12-26,3/29/2015 16:06,2015-03-29T16:06:00,,Adoption,Spayed Female,30.4601985,-97.39104777,65.52440476,Taylor Daisy,,
1949.0,2 years,A757623,Dog,Boxer Mix,Black/White,2015-09-04,10/4/2017 17:32,2017-10-04T17:32:00,Partner,Transfer,Intact Female,30.28470446,-97.6814871,108.8186508,119,,
1950.0,1 year,A656444,Dog,Catahoula Mix,White/Tan,2012-10-14,2/13/2014 15:50,2014-02-13T15:50:00,Foster,Adoption,Spayed Female,30.65093836,-97.39257351,69.6656746,*Paige,,
1951.0,1 year,A701482,Cat,Domestic Longhair Mix,Brown Tabby,2014-04-30,6/23/2015 13:40,2015-06-23T13:40:00,Partner,Transfer,Spayed Female,30.4560226,-97.71702355,59.93849206,*Lavender,,
1952.0,2 months,A689337,Dog,Border Collie Mix,Chocolate/White,2014-07-26,10/6/2014 19:05,2014-10-06T19:05:00,,Adoption,Spayed Female,30.44722599,-97.47912254,10.39930556,*Eva,,
1953.0,3 years,A701772,Dog,German Shepherd Mix,Black/White,2012-05-04,5/27/2015 0:00,2015-05-27T00:00:00,Partner,Transfer,Spayed Female,30.65097813,-97.31927966,159.7142857,Dimond,,
1954.0,1 weeks,A702049,Cat,Domestic Shorthair Mix,Blue Tabby,2015-04-28,5/8/2015 14:59,2015-05-08T14:59:00,Partner,Transfer,Unknown,30.29014273,-97.63831015,1.517757937,,,
1955.0,8 months,A678897,Dog,Boxer/Pit Bull,Tan/White,2013-09-14,5/20/2014 17:36,2014-05-20T17:36:00,,Adoption,Neutered Male,30.63629476,-97.69318512,35.53333333,Polo,,
1956.0,2 months,A761419,Cat,Domestic Medium Hair Mix,Black,2017-09-04,11/17/2017 14:59,2017-11-17T14:59:00,,Adoption,Neutered Male,30.45744386,-97.71367208,10.66061508,,,
1957.0,1 year,A677747,Dog,Cairn Terrier,White,2012-12-28,5/3/2014 7:48,2014-05-03T07:48:00,Offsite,Adoption,Spayed Female,30.7319225,-97.2732842,70.18928571,,,
1958.0,1 year,A719251,Dog,Pit Bull Mix,White/Blue,2015-01-16,2/14/2016 13:26,2016-02-14T13:26:00,,Adoption,Spayed Female,30.54590081,-97.62629359,56.3656746,*Abigail,,
1959.0,2 years,A735301,Other,Opossum Mix,Gray/Black,2014-09-22,9/22/2016 9:30,2016-09-22T09:30:00,Suffering,Euthanasia,Unknown,30.27542175,-97.57578306,104.485119,,,
1960.0,3 years,A601748,Cat,Siamese Mix,Seal Point,2011-05-08,1/28/2015 11:36,2015-01-28T11:36:00,,Return to Owner,Neutered Male,30.64896899,-97.40713168,194.497619,Sam,,
1961.0,2 years,A688497,Cat,Domestic Shorthair Mix,Orange Tabby,2012-09-20,9/25/2014 19:19,2014-09-25T19:19:00,SCRP,Transfer,Intact Male,30.61679765,-97.53436047,105.1149802,,,
1962.0,2 years,A703933,Dog,German Shepherd Mix,Brown/Black,2013-05-30,5/31/2015 11:10,2015-05-31T11:10:00,,Return to Owner,Spayed Female,30.3266962,-97.60895314,104.4950397,Lucy,,
1963.0,1 year,A673558,Dog,St. Bernard Smooth Coat/Anatol Shepherd,White/Brown Brindle,2013-03-13,3/13/2014 18:24,2014-03-13T18:24:00,,Adoption,Neutered Male,30.65818685,-97.60863319,52.25238095,*Gus,,
1964.0,7 years,A669887,Dog,Plott Hound/Labrador Retriever,Black Brindle/Brown,2006-12-29,8/15/2014 14:08,2014-08-15T14:08:00,,Adoption,Spayed Female,30.57170411,-97.54923618,398.084127,*Lorna,,
1965.0,5 months,A732395,Dog,Manchester Terrier/Chihuahua Shorthair,Tricolor,2016-03-03,8/18/2016 17:40,2016-08-18T17:40:00,,Adoption,Neutered Male,30.47513942,-97.2931542,24.10515873,Sam,,
1966.0,3 weeks,A733167,Cat,Domestic Shorthair Mix,Orange Tabby/White,2016-07-27,8/18/2016 12:59,2016-08-18T12:59:00,Partner,Transfer,Unknown,30.3817738,-97.30221554,3.220138889,,,
1967.0,6 years,A679049,Dog,Labrador Retriever Mix,Yellow,2008-01-10,5/21/2014 14:41,2014-05-21T14:41:00,,Return to Owner,Neutered Male,30.73524826,-97.5601049,331.9445437,Pilot,,
1968.0,1 year,A740053,Cat,Domestic Shorthair Mix,Cream Tabby,2015-12-10,1/18/2017 14:03,2017-01-18T14:03:00,Partner,Transfer,Neutered Male,30.39314866,-97.25363585,57.94077381,*Oscar,,
1969.0,1 month,A683525,Cat,Domestic Medium Hair,Blue/White,2014-06-06,7/14/2014 15:23,2014-07-14T15:23:00,Partner,Transfer,Intact Male,30.71824656,-97.43880552,5.520138889,,,
1970.0,6 months,A738366,Other,Raccoon Mix,Gray/Black,2016-05-13,11/13/2016 17:51,2016-11-13T17:51:00,Rabies Risk,Euthanasia,Unknown,30.71425147,-97.65156849,26.39196429,,,
1971.0,1 year,A664310,Cat,Domestic Medium Hair Mix,Orange Tabby/White,2012-10-01,1/1/2014 14:57,2014-01-01T14:57:00,,Return to Owner,Neutered Male,30.68995244,-97.52233012,65.37470238,Chan,,
1972.0,3 weeks,A706012,Cat,Domestic Medium Hair Mix,Blue,2015-06-01,6/23/2015 17:17,2015-06-23T17:17:00,Partner,Transfer,Unknown,30.7549594,-97.62373023,3.245734127,,,
1973.0,1 day,A749739,Dog,Chihuahua Shorthair Mix,Black/White,2017-05-18,5/19/2017 10:20,2017-05-19T10:20:00,Partner,Transfer,Intact Male,30.52463278,-97.38624053,0.204365079,,,
1974.0,2 years,A752288,Dog,Australian Shepherd Mix,Black/White,2015-06-20,6/24/2017 17:26,2017-06-24T17:26:00,,Adoption,Spayed Female,30.73459171,-97.62970144,105.1037698,,,
1975.0,1 year,A747524,Dog,Border Terrier Mix,Black/Tan,2015-10-20,6/18/2017 15:10,2017-06-18T15:10:00,,Adoption,Spayed Female,30.28340987,-97.58329945,86.80456349,*Nanette,,
1976.0,3 years,A668632,Dog,German Shepherd/Labrador Retriever,Black,2010-12-06,12/6/2013 13:52,2013-12-06T13:52:00,Suffering,Euthanasia,Intact Female,30.48191538,-97.51108122,156.6539683,,,
1977.0,5 months,A706373,Dog,Golden Retriever/Whippet,Red/Gold,2015-01-13,7/2/2015 11:38,2015-07-02T11:38:00,Partner,Transfer,Intact Male,30.67629982,-97.58079596,24.35496032,Howie,,
1978.0,6 years,A746332,Dog,Chihuahua Shorthair Mix,Black/Tan,2011-03-31,3/31/2017 16:36,2017-03-31T16:36:00,,Return to Owner,Neutered Male,30.53346943,-97.42142468,313.2416667,Flaco,,
1979.0,7 months,A687711,Dog,Pointer Mix,Brown Brindle/White,2014-04-09,11/27/2014 13:55,2014-11-27T13:55:00,,Return to Owner,Neutered Male,30.50959479,-97.44337159,33.22569444,Zucchini,,
1980.0,2 years,A705846,Dog,Chihuahua Shorthair Mix,Red,2013-06-22,6/29/2015 14:04,2015-06-29T14:04:00,Partner,Transfer,Neutered Male,30.54465693,-97.33911252,105.3694444,Bee Bee,,
1981.0,6 months,A694601,Cat,Domestic Shorthair Mix,Black,2014-07-01,1/6/2015 18:37,2015-01-06T18:37:00,,Adoption,Neutered Male,30.71695227,-97.53068662,27.11081349,*Barnaby,,
1982.0,5 months,A761120,Dog,Pit Bull Mix,Black/White,2017-05-14,11/8/2017 9:47,2017-11-08T09:47:00,Partner,Transfer,Spayed Female,30.3407426,-97.70927293,25.48680556,*Brenna,,
1983.0,4 years,A698800,Dog,Siberian Husky Mix,Sable,2011-03-18,3/19/2015 12:45,2015-03-19T12:45:00,,Return to Owner,Spayed Female,30.64249563,-97.52309804,208.9330357,Emma,,
1984.0,2 months,A674712,Dog,Pug/Beagle,Brown/White,2013-12-17,3/18/2014 19:12,2014-03-18T19:12:00,,Adoption,Neutered Male,30.63339718,-97.38011833,13.11428571,,,
1985.0,1 year,A718617,Cat,Domestic Shorthair Mix,Torbie,2015-01-03,1/8/2016 18:59,2016-01-08T18:59:00,SCRP,Transfer,Spayed Female,30.46010428,-97.43446479,52.97013889,,,
1986.0,1 year,A721454,Dog,Miniature Schnauzer/Miniature Poodle,Black/Tan,2015-02-27,3/3/2016 15:45,2016-03-03T15:45:00,Partner,Transfer,Neutered Male,30.58784787,-97.29782409,52.95089286,,,
1987.0,2 years,A717694,Dog,Pointer Mix,White/Brown,2015-01-12,5/11/2017 13:24,2017-05-11T13:24:00,,Return to Owner,Neutered Male,30.35088069,-97.34534497,121.5083333,Scooby,,
1988.0,1 year,A762781,Dog,Labrador Retriever Mix,Black/White,2016-11-27,12/3/2017 13:09,2017-12-03T13:09:00,Partner,Transfer,Intact Female,30.28401112,-97.46005422,53.07827381,,,
1989.0,1 year,A756284,Dog,Yorkshire Terrier Mix,White/Tricolor,2016-08-17,8/21/2017 18:26,2017-08-21T18:26:00,,Adoption,Spayed Female,30.4580248,-97.45770669,52.82400794,,,
1990.0,1 weeks,A700580,Cat,Domestic Shorthair Mix,Black,2015-04-04,4/16/2015 15:08,2015-04-16T15:08:00,Partner,Transfer,Unknown,30.63496805,-97.24650447,1.804365079,,,
1991.0,1 year,A702644,Other,Squirrel,Gray,2014-05-16,5/16/2015 15:04,2015-05-16T15:04:00,Suffering,Euthanasia,Intact Male,30.64717251,-97.45605642,52.23253968,,,
1992.0,7 months,A756951,Cat,Domestic Shorthair Mix,Brown Tabby/White,2017-01-28,9/4/2017 17:42,2017-09-04T17:42:00,,Adoption,Spayed Female,30.69013936,-97.48180805,31.39107143,,,
1993.0,2 days,A752724,Cat,Domestic Shorthair Mix,Black,2017-06-24,6/26/2017 18:41,2017-06-26T18:41:00,Partner,Transfer,Intact Male,30.71954887,-97.25898296,0.396924603,,,
1994.0,3 months,A735138,Cat,Domestic Shorthair Mix,Torbie,2016-08-04,11/12/2016 10:21,2016-11-12T10:21:00,Foster,Adoption,Spayed Female,30.33950399,-97.50085265,14.34732143,*Sandy,,
1995.0,2 years,A741672,Dog,Dachshund Mix,Black/Brown,2015-01-06,2/17/2017 12:08,2017-02-17T12:08:00,,Return to Owner,Spayed Female,30.72034133,-97.42641361,110.5007937,Brownie,,
1996.0,7 years,A662156,Cat,Domestic Longhair Mix,White/Black,2006-08-30,4/1/2014 17:01,2014-04-01T17:01:00,,Adoption,Neutered Male,30.69619632,-97.53099237,395.9584325,Luno,,
1997.0,2 months,A714163,Dog,Chihuahua Shorthair Mix,Cream,2015-09-01,11/25/2015 14:57,2015-11-25T14:57:00,Foster,Adoption,Neutered Male,30.48934905,-97.6038424,12.23184524,*Ranger,,
1998.0,4 months,A669145,Dog,Chihuahua Longhair Mix,Tan/White,2013-07-31,12/19/2013 17:16,2013-12-19T17:16:00,,Adoption,Neutered Male,30.53435289,-97.39883837,20.24563492,Nevins,,
1999.0,4 years,A680138,Cat,Domestic Shorthair Mix,White/Black,2010-05-30,5/30/2014 8:00,2014-05-30T08:00:00,SCRP,Transfer,Intact Female,30.48044074,-97.52906718,208.7619048,,,
2000.0,6 days,A677774,Cat,Domestic Shorthair Mix,Orange Tabby,2014-04-23,4/29/2014 13:38,2014-04-29T13:38:00,Partner,Transfer,Intact Female,30.30667228,-97.25741561,0.938293651,,,
2001.0,4 years,A599155,Dog,Chihuahua Shorthair Mix,White/Brown,2010-04-28,3/28/2015 19:25,2015-03-28T19:25:00,Suffering,Euthanasia,Neutered Male,30.7283881,-97.45954755,256.5441468,Machete,,
2002.0,4 months,A752674,Dog,St. Bernard Rough Coat Mix,Tan/White,2017-02-14,7/15/2017 18:13,2017-07-15T18:13:00,,Adoption,Spayed Female,30.49738442,-97.35471957,21.67986111,Muneca,,
2003.0,2 months,A751117,Cat,Domestic Shorthair Mix,Black/White,2017-03-21,6/18/2017 15:48,2017-06-18T15:48:00,,Adoption,Spayed Female,30.56961757,-97.39557379,12.80833333,*Popsicle,,
2004.0,6 months,A741644,Dog,Australian Shepherd Mix,Tan,2016-07-05,1/8/2017 11:20,2017-01-08T11:20:00,,Adoption,Neutered Male,30.5505231,-97.5192629,26.78174603,Toby,,
2005.0,3 years,A755022,Dog,Great Pyrenees/Golden Retriever,Tan,2014-07-28,8/3/2017 19:22,2017-08-03T19:22:00,,Adoption,Neutered Male,30.4085781,-97.24611418,157.5438492,*Sam,,
2006.0,10 months,A681805,Dog,Jack Russell Terrier/Chihuahua Shorthair,Red/White,2013-09-20,7/29/2014 14:04,2014-07-29T14:04:00,Foster,Adoption,Neutered Male,30.35710074,-97.48481763,44.65515873,,,
2007.0,2 years,A747619,Dog,Shih Tzu Mix,White/Black,2015-04-22,4/26/2017 16:22,2017-04-26T16:22:00,,Adoption,Neutered Male,30.52107551,-97.70292457,105.0974206,Caster,,
2008.0,4 years,A694821,Dog,Rottweiler Mix,Black/Tan,2012-07-05,7/20/2016 11:13,2016-07-20T11:13:00,,Return to Owner,Neutered Male,30.67023707,-97.66177383,210.9239087,Rocko,,
2009.0,4 months,A686594,Dog,Catahoula/Labrador Retriever,Black/White,2014-04-24,8/31/2014 11:39,2014-08-31T11:39:00,Partner,Transfer,Intact Male,30.37095075,-97.42682054,18.49791667,,,
2010.0,5 years,A700214,Dog,Chihuahua Shorthair Mix,Tan/Black,2010-04-09,4/9/2015 19:21,2015-04-09T19:21:00,,Return to Owner,Spayed Female,30.64879039,-97.24723556,260.9723214,,,
2011.0,4 years,A622978,Dog,Pit Bull Mix,White/Black,2009-03-27,2/5/2014 14:52,2014-02-05T14:52:00,,Return to Owner,Spayed Female,30.50942354,-97.60350591,253.8027778,Sugar,,
2012.0,8 years,A734495,Dog,Chihuahua Shorthair Mix,Tan,2008-09-07,9/11/2016 14:23,2016-09-11T14:23:00,,Adoption,Neutered Male,30.72720565,-97.43511133,418.0856151,Morffi,,
2013.0,3 weeks,A678587,Cat,Domestic Shorthair Mix,Blue,2014-04-18,5/10/2014 17:44,2014-05-10T17:44:00,Partner,Transfer,Intact Female,30.62305989,-97.71331005,3.248412698,,,
2014.0,3 weeks,A686564,Cat,Domestic Shorthair Mix,Brown Tabby/White,2014-08-01,8/23/2014 16:37,2014-08-23T16:37:00,Partner,Transfer,Intact Female,30.60763611,-97.46255184,3.241765873,,,
2015.0,8 years,A567903,Dog,Pit Bull Mix,Brown/White,2009-03-05,3/17/2017 14:24,2017-03-17T14:24:00,Foster,Adoption,Spayed Female,30.72862563,-97.24383469,419.2285714,Spot,,
2016.0,1 year,A745140,Cat,Domestic Shorthair Mix,Blue,2016-03-13,3/14/2017 9:00,2017-03-14T09:00:00,SCRP,Transfer,Intact Female,30.38770187,-97.48961845,52.33928571,,,
2017.0,3 years,A672982,Dog,Pit Bull Mix,White/Red,2011-02-18,3/27/2014 13:52,2014-03-27T13:52:00,Aggressive,Euthanasia,Neutered Male,30.26856313,-97.32131089,161.9396825,King,,
2018.0,5 months,A710302,Dog,German Shepherd/Black/Tan Hound,Brown/Black,2015-02-21,8/22/2015 17:52,2015-08-22T17:52:00,,Return to Owner,Neutered Male,30.31162394,-97.31237445,26.10634921,Wesley,,
2019.0,1 year,A708000,Cat,Domestic Shorthair Mix,Black/White,2014-07-21,7/22/2015 9:00,2015-07-22T09:00:00,SCRP,Transfer,Unknown,30.56174729,-97.3598622,52.33928571,,,
2020.0,3 years,A763913,Cat,Domestic Shorthair Mix,Brown Tabby,2014-06-18,12/28/2017 14:37,2017-12-28T14:37:00,,Return to Owner,Spayed Female,30.40472968,-97.41675657,184.2298611,Lightning,,
2021.0,11 months,A666270,Dog,Pit Bull Mix,Tan/Black,2012-11-29,11/6/2013 16:42,2013-11-06T16:42:00,,Return to Owner,Neutered Male,30.32590593,-97.25980803,48.95654762,Viper,,
2022.0,13 years,A354753,Dog,Pit Bull,Brown Brindle/White,2003-07-13,4/22/2017 11:27,2017-04-22T11:27:00,,Return to Owner,Neutered Male,30.60641611,-97.42144094,718.9252976,Sammy,,
2023.0,5 months,A755038,Dog,English Pointer Mix,Chocolate/White,2017-02-28,7/31/2017 18:16,2017-07-31T18:16:00,,Adoption,Spayed Female,30.65597329,-97.4058126,21.96587302,Lucy,,
2024.0,6 months,A752603,Dog,Pit Bull Mix,Buff/White,2016-12-24,7/1/2017 11:21,2017-07-01T11:21:00,,Adoption,Spayed Female,30.6592391,-97.5929678,27.06755952,*Liberty,,
2025.0,1 year,A706283,Dog,Pit Bull Mix,Brown Brindle/White,2014-06-27,8/9/2015 18:24,2015-08-09T18:24:00,,Adoption,Neutered Male,30.75254089,-97.72385751,58.3952381,Jax,,
2026.0,3 years,A715623,Dog,Pit Bull Mix,Blue/White,2012-11-06,11/13/2015 17:59,2015-11-13T17:59:00,,Return to Owner,Intact Male,30.35488138,-97.58644485,157.5356151,Max,,
2027.0,5 years,A546081,Dog,Miniature Poodle,White,2008-06-09,2/23/2014 15:05,2014-02-23T15:05:00,,Adoption,Neutered Male,30.29910812,-97.31290703,297.9469246,Brayson,,
2028.0,4 years,A721120,Cat,Domestic Shorthair Mix,Brown Tabby,2012-02-21,3/3/2016 11:59,2016-03-03T11:59:00,,Adoption,Spayed Female,30.66983871,-97.46945871,210.3570437,*Rose,,
2029.0,1 month,A728122,Cat,Domestic Shorthair Mix,Orange Tabby,2016-05-01,6/8/2016 12:18,2016-06-08T12:18:00,Partner,Transfer,Intact Male,30.52455445,-97.3411152,5.501785714,*Mario B,,
2030.0,3 months,A747892,Cat,Siamese Mix,Lynx Point,2017-04-15,8/3/2017 17:52,2017-08-03T17:52:00,Foster,Adoption,Spayed Female,30.27153006,-97.5896151,15.82063492,,,
2031.0,2 years,A708917,Dog,American Bulldog/Basset Hound,Black/White,2013-08-02,9/17/2015 17:11,2015-09-17T17:11:00,,Adoption,Neutered Male,30.33474659,-97.44373072,110.9594246,*Dante,,
2032.0,2 years,A723641,Dog,Labrador Retriever Mix,Black,2014-04-04,4/17/2016 0:00,2016-04-17T00:00:00,Partner,Transfer,Neutered Male,30.56792283,-97.25494708,106.2857143,Walker,,
2033.0,6 months,A667635,Cat,Domestic Medium Hair Mix,Orange Tabby/White,2013-05-20,11/20/2013 17:52,2013-11-20T17:52:00,Suffering,Euthanasia,Unknown,30.69231424,-97.40622323,26.39206349,,,
2034.0,2 months,A707030,Dog,Collie Smooth Mix,White/Black,2015-05-06,7/13/2015 17:19,2015-07-13T17:19:00,,Adoption,Neutered Male,30.72208502,-97.27761004,9.817361111,,,
2035.0,3 years,A735145,Dog,Great Dane,Tan/White,2013-04-01,9/24/2016 14:34,2016-09-24T14:34:00,,Adoption,Spayed Female,30.36302054,-97.24493376,181.8009921,Brandy,,
2036.0,6 months,A664382,Dog,Labrador Retriever Mix,Chocolate,2013-04-02,10/7/2013 17:52,2013-10-07T17:52:00,,Adoption,Spayed Female,30.51270314,-97.44229291,26.96349206,Chewey,,
2037.0,1 year,A746028,Dog,Carolina Dog Mix,Tan/White,2016-03-28,4/6/2017 18:54,2017-04-06T18:54:00,,Adoption,Neutered Male,30.27822302,-97.49010133,53.54107143,*Spencer,,
2038.0,2 months,A741619,Dog,Labrador Retriever,White/Black,2016-10-21,1/9/2017 14:53,2017-01-09T14:53:00,,Adoption,Intact Male,30.48615617,-97.65069229,11.5171627,Maximus,656174071f442de352558621,
2039.0,2 years,A739293,Dog,Pit Bull Mix,Brown Brindle,2014-11-30,5/3/2017 18:42,2017-05-03T18:42:00,Partner,Transfer,Intact Female,30.66499062,-97.64573637,126.539881,Sheba,,
2040.0,10 years,A740492,Dog,Yorkshire Terrier,Silver/Black,2006-12-19,12/19/2016 17:27,2016-12-19T17:27:00,,Return to Owner,Intact Female,30.65294273,-97.34774174,521.9610119,Dixie,,
2041.0,2 years,A702745,Dog,Labrador Retriever Mix,Black,2013-05-22,5/22/2015 11:45,2015-05-22T11:45:00,,Return to Owner,Intact Female,30.7157942,-97.45236649,104.3556548,Abigail,,
2042.0,6 years,A705228,Dog,Pit Bull Mix,Brown Brindle/White,2011-06-15,11/26/2017 15:41,2017-11-26T15:41:00,,Adoption,Spayed Female,30.62215216,-97.26372614,336.6647817,Mamas,,
2043.0,4 months,A754030,Cat,Domestic Shorthair Mix,Brown Tabby/White,2017-06-22,10/30/2017 18:36,2017-10-30T18:36:00,,Adoption,Neutered Male,30.26918881,-97.24417013,18.68214286,*Jay,,
2044.0,8 months,A737244,Dog,Chihuahua Shorthair Mix,Tan,2016-02-24,10/28/2016 18:45,2016-10-28T18:45:00,,Adoption,Neutered Male,30.65475821,-97.60585991,35.39732143,Austin,,
2045.0,11 months,A748276,Dog,Pit Bull Mix,Blue/White,2016-06-22,5/27/2017 19:13,2017-05-27T19:13:00,,Adoption,Spayed Female,30.2965515,-97.33914379,48.54295635,Zumia,,
2046.0,9 years,A714391,Cat,Snowshoe Mix,Seal Point,2007-05-19,3/31/2017 14:15,2017-03-31T14:15:00,Foster,Adoption,Neutered Male,30.32492944,-97.32580973,514.9419643,Charlie,,
2047.0,2 years,A669064,Dog,Labrador Retriever/German Shepherd,Black/Brown,2011-12-13,12/27/2013 16:44,2013-12-27T16:44:00,,Adoption,Neutered Male,30.51269256,-97.52502095,106.5281746,,,
2048.0,6 years,A594497,Dog,Miniature Poodle Mix,White,2010-03-01,6/6/2016 16:25,2016-06-06T16:25:00,,Return to Owner,Spayed Female,30.69174179,-97.42164222,327.0977183,Chikis,,
2049.0,9 months,A729255,Dog,Chihuahua Shorthair Mix,White/Brown Brindle,2015-09-15,6/27/2016 18:03,2016-06-27T18:03:00,,Adoption,Spayed Female,30.32284378,-97.52161205,40.96458333,*Lucy,,
2050.0,3 years,A676895,Dog,Boerboel Mix,Tan/White,2011-04-16,5/26/2014 13:55,2014-05-26T13:55:00,,Adoption,Neutered Male,30.67358308,-97.33403156,162.3685516,*Dobie,,
2051.0,2 years,A725427,Dog,Shih Tzu/Toy Poodle,White/Black,2014-04-29,5/3/2016 17:28,2016-05-03T17:28:00,,Adoption,Neutered Male,30.36739609,-97.53383911,105.1039683,,,
2052.0,2 months,A720444,Dog,Pointer Mix,Black/White,2015-12-09,2/10/2016 18:33,2016-02-10T18:33:00,,Adoption,Neutered Male,30.35862871,-97.51917825,9.110416667,Aries,,
2053.0,1 month,A702828,Dog,Yorkshire Terrier Mix,White,2015-03-24,5/19/2015 18:07,2015-05-19T18:07:00,,Adoption,Neutered Male,30.6160605,-97.26259779,8.107837302,Polar Bear,,
2054.0,11 months,A664965,Dog,Australian Cattle Dog Mix,White/Tan,2013-04-11,3/21/2014 11:59,2014-03-21T11:59:00,,Return to Owner,Spayed Female,30.37392704,-97.74120471,49.21418651,Linda,,
2055.0,2 years,A724076,Dog,Labrador Retriever Mix,White/Tan,2014-04-11,11/2/2016 17:13,2016-11-02T17:13:00,,Return to Owner,Neutered Male,30.56498327,-97.45336637,133.8167659,Ghost,,
2056.0,1 year,A721107,Dog,Golden Retriever Mix,Red,2015-02-21,2/21/2016 15:27,2016-02-21T15:27:00,,Return to Owner,Spayed Female,30.34347052,-97.52557286,52.23482143,Bonnie,,
2057.0,9 years,A744830,Dog,Basset Hound Mix,Brown Brindle/Black,2008-03-08,3/20/2017 13:57,2017-03-20T13:57:00,,Euthanasia,Neutered Male,30.39160161,-97.24737682,471.36875,Edward Hyde,,
2058.0,3 months,A735136,Cat,Domestic Shorthair Mix,Black/White,2016-08-04,11/12/2016 10:27,2016-11-12T10:27:00,Foster,Adoption,Neutered Male,30.39491934,-97.46890426,14.34791667,*Danny,,
2059.0,3 years,A667251,Dog,Pit Bull,Black,2011-11-15,11/22/2014 18:13,2014-11-22T18:13:00,Aggressive,Euthanasia,Spayed Female,30.718875,-97.60887782,157.6798611,Delilah,,
2060.0,6 years,A713499,Dog,Labrador Retriever Mix,Tan,2009-10-07,10/11/2015 16:27,2015-10-11T16:27:00,,Adoption,Neutered Male,30.54756183,-97.38923021,313.6693452,Sammie,,
2061.0,3 months,A677594,Dog,Labrador Retriever Mix,Black/White,2013-12-26,4/26/2014 18:00,2014-04-26T18:00:00,Partner,Transfer,Intact Female,30.44260982,-97.48986248,17.39285714,,,
2062.0,1 year,A752253,Cat,Domestic Shorthair Mix,White,2016-06-20,1/20/2018 15:19,2018-01-20T15:19:00,Foster,Adoption,Spayed Female,30.7323312,-97.24983338,82.80545635,,,
2063.0,5 years,A689260,Dog,Shetland Sheepdog Mix,Black/Brown,2009-10-01,10/3/2014 15:23,2014-10-03T15:23:00,,Return to Owner,Neutered Male,30.60700018,-97.70526122,261.2344246,Gambit,,
2064.0,3 months,A703517,Cat,Domestic Shorthair Mix,Blue Tabby/White,2015-03-25,7/19/2015 13:16,2015-07-19T13:16:00,Foster,Adoption,Neutered Male,30.36629423,-97.54830867,16.65039683,*Bailey,,
2065.0,2 years,A753499,Dog,Australian Cattle Dog Mix,White/Tan,2015-07-07,7/15/2017 15:23,2017-07-15T15:23:00,,Adoption,Spayed Female,30.7494397,-97.65588857,105.662996,*Sasha,,
2066.0,4 months,A737528,Dog,Chihuahua Shorthair Mix,White/Red Merle,2016-07-01,11/4/2016 17:09,2016-11-04T17:09:00,,Adoption,Spayed Female,30.60273632,-97.69007609,18.10208333,Georgi,,
2067.0,5 years,A754359,Dog,Miniature Poodle Mix,White,2012-07-26,8/2/2017 16:14,2017-08-02T16:14:00,,Return to Owner,Intact Female,30.34168343,-97.56262623,261.9537698,Nana,,
2068.0,2 months,A726335,Dog,Great Pyrenees Mix,White,2016-03-29,6/17/2016 18:29,2016-06-17T18:29:00,Foster,Adoption,Spayed Female,30.36973497,-97.62657203,11.53859127,,,
2069.0,5 months,A703629,Dog,Labrador Retriever Mix,Black/White,2014-12-31,6/28/2015 15:52,2015-06-28T15:52:00,,Adoption,Neutered Male,30.55544635,-97.50489509,25.66587302,Gavin,,
2070.0,3 weeks,A753665,Dog,Beagle Mix,Brown,2017-06-18,7/11/2017 11:50,2017-07-11T11:50:00,Partner,Transfer,Intact Male,30.4254737,-97.33340003,3.356150794,,,
2071.0,1 year,A763032,Other,Squirrel Mix,Brown,2016-12-01,12/1/2017 17:42,2017-12-01T17:42:00,Suffering,Euthanasia,Unknown,30.65681375,-97.69844539,52.24821429,,,
2072.0,6 months,A743908,Dog,Beagle Mix,Black/Brown,2016-08-19,2/23/2017 21:37,2017-02-23T21:37:00,,Adoption,Spayed Female,30.58551637,-97.45383854,26.98581349,,,
2073.0,2 years,A672456,Dog,German Shorthair Pointer Mix,Black/Blue Merle,2011-08-10,2/21/2014 18:47,2014-02-21T18:47:00,Partner,Transfer,Neutered Male,30.33806257,-97.7360718,132.3975198,Dexter,,
2074.0,2 years,A672691,Dog,Labrador Retriever Mix,Tan,2012-02-15,7/14/2014 14:11,2014-07-14T14:11:00,,Adoption,Neutered Male,30.6440864,-97.52560524,125.7987103,Jeeves,,
2075.0,3 years,A673336,Dog,Labrador Retriever/Border Terrier,Black,2011-02-22,3/3/2014 15:52,2014-03-03T15:52:00,Partner,Transfer,Spayed Female,30.43295632,-97.66397017,157.9515873,Raven,,
2076.0,2 years,A672164,Dog,Yorkshire Terrier Mix,Gray/Tan,2012-02-05,2/14/2014 15:03,2014-02-14T15:03:00,Partner,Transfer,Spayed Female,30.30343825,-97.61267069,105.803869,*Molly,,
2077.0,1 year,A745826,Dog,Alaskan Husky Mix,White/White,2016-03-24,3/27/2017 16:28,2017-03-27T16:28:00,,Return to Owner,Intact Male,30.54684588,-97.43751692,52.66944444,Zeke,,
2078.0,2 years,A745501,Dog,Chihuahua Shorthair Mix,Tricolor,2015-03-18,3/24/2017 18:45,2017-03-24T18:45:00,,Adoption,Spayed Female,30.43000985,-97.72378968,105.3973214,Daphne,,
2079.0,4 years,A631695,Dog,Pit Bull Mix,Black/White,2009-07-07,6/13/2014 13:17,2014-06-13T13:17:00,,Return to Owner,Neutered Male,30.70717072,-97.53561472,257.5076389,Koda,,
2080.0,1 year,A750682,Cat,Domestic Shorthair Mix,Blue Tabby/White,2016-05-30,8/19/2017 11:22,2017-08-19T11:22:00,,Adoption,Spayed Female,30.55782052,-97.38115945,63.78194444,*Olivia,,
2081.0,7 years,A430368,Dog,Labrador Retriever Mix,Black/White,2006-03-26,2/21/2014 18:09,2014-02-21T18:09:00,,Adoption,Neutered Male,30.63597701,-97.46553389,412.8223214,Arenal,,
2082.0,1 year,A731200,Dog,Border Collie Mix,Tan/White,2015-07-18,7/19/2016 22:12,2016-07-19T22:12:00,,Return to Owner,Spayed Female,30.26917178,-97.645997,52.56071429,Cona,,
2083.0,4 months,A687258,Cat,Domestic Shorthair Mix,Brown Tabby,2014-05-02,9/19/2014 17:51,2014-09-19T17:51:00,,Adoption,Spayed Female,30.40461215,-97.34407771,20.10625,Chiquita,,
2084.0,5 months,A709234,Cat,Domestic Shorthair Mix,Blue Tabby/White,2015-03-06,8/25/2015 18:14,2015-08-25T18:14:00,,Adoption,Spayed Female,30.56555093,-97.42210259,24.67996032,*Leandra,,
2085.0,2 years,A689845,Dog,Miniature Schnauzer Mix,Gray/White,2012-10-10,10/12/2014 18:28,2014-10-12T18:28:00,,Return to Owner,Spayed Female,30.65073802,-97.64993531,104.6813492,Prieta,,
2086.0,1 year,A702339,Dog,American Bulldog Mix,White/Brown,2013-11-12,5/12/2015 17:57,2015-05-12T17:57:00,,Return to Owner,Intact Male,30.52679091,-97.38760045,78.10684524,Ayo,,
2087.0,2 months,A733561,Cat,Domestic Shorthair Mix,Brown Tabby,2016-07-24,10/3/2016 11:33,2016-10-03T11:33:00,,Adoption,Spayed Female,30.28998771,-97.70337344,10.21160714,*Salsa,,
2088.0,2 years,A737795,Dog,Labrador Retriever Mix,Tan,2014-11-04,11/10/2016 17:37,2016-11-10T17:37:00,,Adoption,Spayed Female,30.58310249,-97.40842539,105.3905754,Leia,,
2089.0,4 months,A667331,Cat,Domestic Shorthair Mix,Calico/Brown Tabby,2013-07-01,11/18/2013 14:14,2013-11-18T14:14:00,,Adoption,Spayed Female,30.70424653,-97.3194902,20.08472222,Cali,,
2090.0,1 year,A672171,Dog,Labrador Retriever Mix,Black/White,2012-05-05,2/22/2014 13:35,2014-02-22T13:35:00,,Adoption,Spayed Female,30.39603117,-97.53679158,94.08085317,Billie Jean,,
2091.0,2 months,A714450,Dog,Chihuahua Shorthair,Blue/White,2015-08-23,10/24/2015 16:41,2015-10-24T16:41:00,,Return to Owner,Neutered Male,30.27871819,-97.3998557,8.956448413,Rex,,
2092.0,7 years,A697660,Dog,Staffordshire/Bull Terrier,White/Black,2008-02-26,5/16/2015 16:46,2015-05-16T16:46:00,,Return to Owner,Neutered Male,30.37934183,-97.30949696,376.6712302,Buddy,,
2093.0,5 months,A670633,Dog,Plott Hound Mix,Brown Brindle,2013-08-12,1/15/2014 12:58,2014-01-15T12:58:00,Partner,Transfer,Intact Female,30.73489325,-97.58511882,22.36289683,*Fiona,,
2094.0,1 month,A729857,Cat,Domestic Shorthair Mix,Tortie,2016-05-17,6/24/2016 15:24,2016-06-24T15:24:00,Partner,Transfer,Intact Female,30.59626273,-97.7185635,5.520238095,,,
2095.0,1 weeks,A680704,Cat,Domestic Shorthair Mix,Lynx Point,2014-05-28,6/6/2014 14:39,2014-06-06T14:39:00,Partner,Transfer,Intact Male,30.39763549,-97.31790231,1.372916667,,,
2096.0,10 years,A676738,Dog,Boxer Mix,Brown,2004-04-14,4/16/2014 14:09,2014-04-16T14:09:00,,Return to Owner,Spayed Female,30.40430522,-97.35015699,522.0842262,Libby,,
2097.0,5 months,A676140,Dog,Chihuahua Shorthair Mix,Tan,2013-11-05,4/9/2014 16:40,2014-04-09T16:40:00,,Adoption,Spayed Female,30.54442315,-97.68555146,22.24206349,,,
2098.0,2 months,A687409,Dog,Golden Retriever Mix,Gold,2014-07-04,9/5/2014 17:08,2014-09-05T17:08:00,,Return to Owner,Spayed Female,30.34080406,-97.57171408,9.101984127,Stacy,,
2099.0,2 months,A747663,Cat,Domestic Shorthair Mix,Orange Tabby,2017-03-16,5/23/2017 11:26,2017-05-23T11:26:00,Foster,Adoption,Neutered Male,30.47062092,-97.62531953,9.78234127,,,
2100.0,12 years,A741299,Dog,German Shepherd Mix,Tan/Black,2004-12-31,1/5/2017 16:31,2017-01-05T16:31:00,Partner,Transfer,Intact Female,30.51994779,-97.41463661,626.9554563,*Iris,,
2101.0,3 years,A612598,Dog,Labrador Retriever Mix,Tan/White,2009-10-21,10/12/2013 17:21,2013-10-12T17:21:00,,Return to Owner,Neutered Male,30.73572216,-97.37631767,207.5318452,Harvey,,
2102.0,3 years,A721317,Dog,Pit Bull Mix,Black,2013-02-24,3/2/2016 18:16,2016-03-02T18:16:00,,Return to Owner,Spayed Female,30.40815296,-97.56304665,157.5373016,Sophie,,
2103.0,2 years,A715951,Dog,Pit Bull Mix,Blue/White,2013-11-12,2/28/2016 7:41,2016-02-28T07:41:00,,Adoption,Spayed Female,30.67476714,-97.31460135,119.7600198,*Maisy,,
2104.0,7 years,A593659,Dog,Labrador Retriever Mix,Black/White,2011-01-01,1/6/2018 13:21,2018-01-06T13:21:00,,Return to Owner,Spayed Female,30.45662269,-97.58396852,366.0794643,Sophie,,
2105.0,3 years,A743064,Cat,Domestic Shorthair Mix,Orange Tabby,2014-02-03,2/27/2017 12:30,2017-02-27T12:30:00,Partner,Transfer,Spayed Female,30.47910097,-97.2489962,160.0744048,Coco,,
2106.0,1 year,A710126,Dog,Chihuahua Shorthair Mix,Tan,2014-08-18,8/20/2015 13:33,2015-08-20T13:33:00,,Return to Owner,Intact Male,30.59225868,-97.72762467,52.50922619,Chico,,
2107.0,3 weeks,A709340,Cat,Domestic Shorthair Mix,White/Black,2015-07-16,8/7/2015 16:00,2015-08-07T16:00:00,Partner,Transfer,Intact Male,30.39475568,-97.59836082,3.238095238,,,
2108.0,4 weeks,A752991,Cat,Domestic Shorthair Mix,Brown Tabby,2017-06-05,7/5/2017 14:37,2017-07-05T14:37:00,Partner,Transfer,Intact Male,30.55489999,-97.36261418,4.372718254,*Verde,,
2109.0,6 months,A666490,Dog,Cairn Terrier Mix,Black,2013-05-02,11/3/2013 16:01,2013-11-03T16:01:00,Partner,Transfer,Intact Female,30.46485456,-97.43543671,26.52390873,,,
2110.0,1 month,A670123,Dog,Chihuahua Shorthair Mix,Brown,2013-11-17,1/3/2014 13:54,2014-01-03T13:54:00,,Return to Owner,Intact Female,30.70353937,-97.70479066,6.79702381,Chiquita,,
2111.0,2 years,A718040,Dog,Great Pyrenees Mix,White,2013-12-20,1/4/2016 19:41,2016-01-04T19:41:00,,Adoption,Neutered Male,30.60810115,-97.62346154,106.5457341,*Norris,,
2112.0,1 year,A751070,Cat,Domestic Shorthair Mix,Orange Tabby,2016-06-03,6/7/2017 0:00,2017-06-07T00:00:00,Snr,Transfer,Neutered Male,30.48084977,-97.38759648,52.71428571,,,
2113.0,10 months,A681818,Cat,Domestic Shorthair Mix,White/Orange Tabby,2013-08-20,7/15/2014 18:55,2014-07-15T18:55:00,,Adoption,Spayed Female,30.40637144,-97.25523327,47.11259921,Caramel,,
2114.0,2 years,A703593,Dog,Dachshund/Rat Terrier,Black/Tan,2013-05-27,6/11/2015 18:52,2015-06-11T18:52:00,,Adoption,Neutered Male,30.62441263,-97.37767034,106.540873,*Mack,,
2115.0,4 years,A749803,Cat,Domestic Shorthair Mix,Black,2012-09-19,8/10/2017 14:22,2017-08-10T14:22:00,,Adoption,Spayed Female,30.62273231,-97.43727744,255.228373,Shifonet,,
2116.0,5 years,A693416,Dog,Pit Bull Mix,Chocolate/White,2010-07-08,7/20/2015 14:10,2015-07-20T14:10:00,Partner,Transfer,Spayed Female,30.52192146,-97.34863521,262.655754,Natalia,,
2117.0,1 year,A683455,Other,Rabbit Sh Mix,White/Black,2013-07-10,7/16/2014 16:11,2014-07-16T16:11:00,Partner,Transfer,Unknown,30.60875378,-97.65058592,53.09632937,,,
2118.0,13 years,A375393,Dog,German Shorthair Pointer,White/Liver,2002-01-01,6/13/2015 14:22,2015-06-13T14:22:00,,Return to Owner,Neutered Male,30.47958517,-97.41420059,701.6569444,Dash,,
2119.0,2 years,A755859,Dog,Anatol Shepherd Mix,Fawn,2015-08-10,8/10/2017 16:27,2017-08-10T16:27:00,,Return to Owner,Intact Female,30.36301142,-97.70779959,104.5264881,Sansa,,
2120.0,10 months,A691884,Dog,Anatol Shepherd,White/Brown,2014-01-11,11/16/2014 13:15,2014-11-16T13:15:00,,Adoption,Neutered Male,30.66093259,-97.64326296,44.22172619,,,
2121.0,4 months,A749780,Dog,Dachshund Mix,Tan/White,2017-01-19,5/23/2017 17:57,2017-05-23T17:57:00,,Adoption,Neutered Male,30.7129009,-97.6779288,17.82113095,Toby,,
2122.0,2 months,A669830,Dog,German Shepherd Mix,Cream/Black,2013-10-21,12/28/2013 14:07,2013-12-28T14:07:00,Partner,Transfer,Intact Female,30.4032236,-97.26964916,9.798313492,,,
2123.0,1 year,A719922,Dog,Pit Bull Mix,Blue/White,2015-01-30,2/28/2016 13:22,2016-02-28T13:22:00,In Kennel,Missing,Intact Male,30.4919961,-97.64525176,56.36527778,Beast,,
2124.0,4 months,A759582,Dog,Anatol Shepherd Mix,Tan/White,2017-05-20,10/8/2017 18:20,2017-10-08T18:20:00,,Adoption,Spayed Female,30.62639081,-97.33918958,20.25198413,Bailee,,
2125.0,3 years,A671108,Cat,Domestic Shorthair Mix,Black/White,2011-01-18,1/19/2014 11:23,2014-01-19T11:23:00,,Return to Owner,Spayed Female,30.36141895,-97.48933799,156.7820437,Kirby,,
2126.0,2 years,A718969,Dog,Border Terrier Mix,Cream/White,2014-01-10,1/16/2016 19:02,2016-01-16T19:02:00,,Adoption,Neutered Male,30.38684778,-97.39571444,105.2561508,*Gorton,,
2127.0,8 years,A686152,Dog,Pit Bull Mix,Fawn/White,2006-08-17,10/22/2014 16:17,2014-10-22T16:17:00,,Adoption,Spayed Female,30.63868791,-97.67943482,426.9540675,Sandy,,
2128.0,2 years,A736011,Dog,German Shorthair Pointer Mix,Chocolate,2014-10-02,10/3/2016 14:17,2016-10-03T14:17:00,,Return to Owner,Neutered Male,30.37500943,-97.57531454,104.6564484,Rex,,
2129.0,8 months,A692880,Dog,Pit Bull Mix,Brown,2014-03-29,12/2/2014 17:40,2014-12-02T17:40:00,,Return to Owner,Spayed Female,30.4534118,-97.52458531,35.53373016,Daphne,,
2130.0,3 months,A740328,Cat,Domestic Shorthair,Black/White,2016-09-15,12/27/2016 18:03,2016-12-27T18:03:00,,Adoption,Neutered Male,30.34053854,-97.52763363,14.82172619,,,
2131.0,2 years,A745491,Dog,Dachshund Mix,Brown,2015-03-18,3/22/2017 12:20,2017-03-22T12:20:00,,Return to Owner,Intact Female,30.34060173,-97.25240741,105.0734127,Angel,,
2132.0,5 months,A737209,Dog,Chihuahua Shorthair Mix,Red,2016-05-25,10/27/2016 17:18,2016-10-27T17:18:00,,Adoption,Spayed Female,30.75496406,-97.38480541,22.24583333,,,
2133.0,2 years,A683835,Cat,Domestic Shorthair Mix,Orange Tabby,2012-07-15,7/16/2014 9:00,2014-07-16T09:00:00,SCRP,Transfer,Intact Male,30.51763181,-97.50667072,104.4821429,,,
2134.0,1 year,A731870,Dog,Pit Bull Mix,White/Tan,2015-03-28,9/8/2016 12:54,2016-09-08T12:54:00,,Adoption,Neutered Male,30.4654366,-97.27391014,75.79107143,*Snowman,,
2135.0,1 year,A681793,Cat,Domestic Medium Hair Mix,Black/White,2013-06-20,6/21/2014 16:19,2014-06-21T16:19:00,,Return to Owner,Spayed Female,30.68550773,-97.26178575,52.3828373,Dinah,,
2136.0,5 months,A672540,Dog,Newfoundland Mix,Black/White,2013-10-27,4/3/2014 8:34,2014-04-03T08:34:00,Foster,Adoption,Spayed Female,30.59744774,-97.45163771,22.62242063,*Jane,,
2137.0,1 year,A699102,Dog,Siberian Husky/Anatol Shepherd,Tan/White,2013-05-31,3/26/2015 16:53,2015-03-26T16:53:00,,Return to Owner,Neutered Male,30.3153812,-97.28373833,94.95763889,Buzz,,
2138.0,5 months,A673326,Cat,Domestic Shorthair Mix,Blue,2013-09-22,3/10/2014 17:38,2014-03-10T17:38:00,,Adoption,Neutered Male,30.61529613,-97.41167061,24.24781746,*Axel,,
2139.0,1 month,A762024,Dog,Cocker Spaniel Mix,Black,2017-10-01,11/13/2017 16:52,2017-11-13T16:52:00,Suffering,Euthanasia,Intact Female,30.73772064,-97.70276327,6.243253968,Puppy,,
2140.0,3 years,A698434,Dog,Australian Cattle Dog Mix,Black/White,2012-03-11,8/10/2015 19:25,2015-08-10T19:25:00,,Adoption,Spayed Female,30.65690508,-97.53697708,178.2584325,*Dolly,,
2141.0,1 month,A750049,Cat,Domestic Shorthair Mix,Brown Tabby,2017-05-02,7/1/2017 19:28,2017-07-01T19:28:00,Foster,Adoption,Spayed Female,30.32013077,-97.42549274,8.687301587,*Enchilada,,
2142.0,9 months,A687099,Dog,Australian Cattle Dog Mix,Black/White,2013-12-01,9/1/2014 14:36,2014-09-01T14:36:00,Rabies Risk,Euthanasia,Intact Male,30.71269465,-97.31565384,39.2297619,Chop,,
2143.0,10 months,A750786,Dog,Cairn Terrier Mix,Chocolate/White,2016-07-31,6/4/2017 19:05,2017-06-04T19:05:00,,Adoption,Neutered Male,30.69763761,-97.31141651,44.11359127,,,
2144.0,3 months,A753509,Cat,Domestic Medium Hair Mix,Brown Tabby/White,2017-04-07,7/14/2017 18:00,2017-07-14T18:00:00,,Adoption,Spayed Female,30.57472542,-97.26054472,14.10714286,Pepper,,
2145.0,2 weeks,A711091,Other,Squirrel Mix,Brown,2015-08-17,9/1/2015 16:20,2015-09-01T16:20:00,Medical,Euthanasia,Unknown,30.74475531,-97.40747511,2.240079365,,,
2146.0,3 years,A691765,Dog,Chow Chow,Buff,2011-11-08,12/16/2014 11:36,2014-12-16T11:36:00,,Adoption,Spayed Female,30.38898189,-97.36808746,162.0690476,Lila,,
2147.0,3 months,A680451,Cat,Domestic Longhair Mix,Orange Tabby/White,2014-04-01,7/20/2014 18:08,2014-07-20T18:08:00,,Adoption,Neutered Male,30.56984788,-97.50520919,15.82222222,*Simon,,
2148.0,8 months,A753945,Dog,Shih Tzu Mix,Cream/White,2016-11-13,7/17/2017 18:42,2017-07-17T18:42:00,Partner,Transfer,Spayed Female,30.37257418,-97.71276875,35.25416667,,,
2149.0,11 years,A725891,Dog,Miniature Pinscher Mix,Black/Tan,2005-05-03,8/19/2016 15:22,2016-08-19T15:22:00,Foster,Adoption,Spayed Female,30.64945675,-97.44818915,589.5200397,Margie,,
2150.0,4 months,A760291,Dog,Rat Terrier/Labrador Retriever,Black/White,2017-06-16,10/20/2017 16:14,2017-10-20T16:14:00,,Adoption,Neutered Male,30.47030368,-97.55285592,18.09662698,,,
2151.0,3 years,A669895,Dog,Labrador Retriever Mix,Red,2013-10-22,2/12/2017 16:24,2017-02-12T16:24:00,,Adoption,Spayed Female,30.45295189,-97.72820368,172.8119048,Stacy,,
2152.0,2 years,A718527,Dog,German Shepherd Mix,Black/Tan,2014-01-01,1/3/2016 9:37,2016-01-03T09:37:00,In Kennel,Died,Intact Female,30.74002572,-97.32680805,104.6286706,,,
2153.0,3 months,A756517,Cat,Domestic Shorthair Mix,Blue,2017-05-21,8/26/2017 17:02,2017-08-26T17:02:00,,Adoption,Spayed Female,30.44104725,-97.34173375,13.95853175,Aveta,,
2154.0,4 years,A714206,Dog,Chihuahua Shorthair Mix,Black/Tan,2011-10-20,11/8/2015 15:42,2015-11-08T15:42:00,Foster,Adoption,Neutered Male,30.62428596,-97.34886399,211.5220238,*Jimmy,,
2155.0,2 years,A757315,Dog,Border Collie Mix,Black/White,2015-09-01,11/19/2017 15:33,2017-11-19T15:33:00,,Return to Owner,Intact Female,30.56002626,-97.54102901,115.8068452,Shelby,,
2156.0,5 months,A702427,Dog,Great Pyrenees Mix,White,2014-11-28,5/17/2015 16:12,2015-05-17T16:12:00,Partner,Transfer,Spayed Female,30.50071673,-97.4752566,24.38214286,,,
2157.0,9 years,A506000,Dog,Labrador Retriever Mix,White/Tan,2006-10-08,9/21/2016 12:03,2016-09-21T12:03:00,Foster,Adoption,Neutered Male,30.63981097,-97.61613399,519.5002976,Lt,,
2158.0,7 years,A693022,Dog,Labrador Retriever Mix,Black,2007-11-30,12/4/2014 17:02,2014-12-04T17:02:00,Partner,Transfer,Spayed Female,30.59476668,-97.48473024,365.9585317,Lady,,
2159.0,8 years,A685025,Dog,Australian Cattle Dog Mix,Blue Merle,2009-08-01,10/12/2017 11:15,2017-10-12T11:15:00,,Return to Owner,Spayed Female,30.37932597,-97.42190309,427.78125,Diggy,,
2160.0,4 years,A613689,Dog,Dachshund/Chihuahua Shorthair,White/Brown,2009-11-08,6/30/2014 14:51,2014-06-30T14:51:00,,Return to Owner,Neutered Male,30.51400164,-97.66682617,242.23125,Diego,,
2161.0,5 years,A663228,Livestock,Miniature,Liver/Cream,2008-09-15,10/3/2013 10:59,2013-10-03T10:59:00,Partner,Transfer,Intact Male,30.66930908,-97.58651828,263.4939484,,,
2162.0,3 years,A617461,Dog,German Wirehaired Pointer,Black/Gray,2011-01-07,2/1/2014 12:21,2014-02-01T12:21:00,,Return to Owner,Neutered Male,30.29646389,-97.54868483,160.216369,Tank,,
2163.0,2 months,A758457,Cat,Siamese Mix,Flame Point,2017-09-03,11/9/2017 16:08,2017-11-09T16:08:00,,Adoption,Neutered Male,30.48068886,-97.64280386,9.667460317,,,
2164.0,2 months,A733528,Cat,Domestic Shorthair Mix,Orange Tabby/White,2016-07-10,9/17/2016 13:39,2016-09-17T13:39:00,,Adoption,Neutered Male,30.67430025,-97.60371303,9.938392857,*Marco,,
2165.0,2 years,A745263,Dog,Pit Bull Mix,Brown/Black,2015-03-15,4/14/2017 15:40,2017-04-14T15:40:00,Partner,Transfer,Intact Male,30.57829602,-97.46151983,108.8075397,*Pumba,,
2166.0,2 years,A681959,Dog,Australian Cattle Dog Mix,Tan/Black,2014-06-18,1/7/2017 11:48,2017-01-07T11:48:00,,Return to Owner,Spayed Female,30.61394348,-97.25049576,133.4988095,Sadie,,
2167.0,7 months,A740188,Dog,Pit Bull Mix,Black/Black,2016-05-12,12/20/2016 18:11,2016-12-20T18:11:00,,Adoption,Spayed Female,30.38727696,-97.64831322,31.82251984,Remi,,
2168.0,10 months,A735440,Cat,Domestic Shorthair,Brown Tabby,2016-01-23,11/25/2016 12:52,2016-11-25T12:52:00,,Adoption,Spayed Female,30.34424696,-97.3275288,43.93373016,*Phoebe,,
2169.0,5 years,A706536,Dog,English Bulldog,Tan/White,2010-06-30,3/29/2016 14:23,2016-03-29T14:23:00,,Return to Owner,Neutered Male,30.47958526,-97.50797573,299.9427579,Butch,,
2170.0,3 weeks,A688747,Cat,Domestic Shorthair Mix,Brown Tabby,2014-09-01,9/23/2014 13:23,2014-09-23T13:23:00,Partner,Transfer,Intact Female,30.51031402,-97.4622731,3.222519841,,,
2171.0,3 months,A737370,Cat,Domestic Shorthair Mix,Orange Tabby,2016-08-19,11/26/2016 15:57,2016-11-26T15:57:00,,Adoption,Neutered Male,30.7383716,-97.42139644,14.23779762,Pumpkin,,
2172.0,3 months,A761111,Cat,Domestic Shorthair Mix,Black,2017-08-15,12/11/2017 12:34,2017-12-11T12:34:00,,Adoption,Spayed Female,30.42326322,-97.68696945,16.93194444,,,
2173.0,3 months,A686803,Dog,Dachshund Mix,Red/White,2014-05-05,8/28/2014 17:02,2014-08-28T17:02:00,,Adoption,Neutered Male,30.46185831,-97.33915224,16.52996032,*Rupert,,
2174.0,6 days,A677777,Cat,Domestic Shorthair Mix,Orange Tabby,2014-04-23,4/29/2014 13:38,2014-04-29T13:38:00,Partner,Transfer,Intact Male,30.46925402,-97.58744508,0.938293651,,,
2175.0,1 year,A674920,Other,Opossum Mix,White,2013-03-20,3/20/2014 12:42,2014-03-20T12:42:00,Rabies Risk,Euthanasia,Unknown,30.51693232,-97.43508177,52.21845238,,,
2176.0,1 year,A763292,Dog,American Staffordshire Terrier Mix,Black/White,2016-12-06,1/13/2018 18:21,2018-01-13T18:21:00,,Adoption,Neutered Male,30.67798304,-97.47242475,57.68065476,*Michael,,
2177.0,8 months,A669270,Dog,English Foxhound Mix,White/Brown,2013-11-02,7/21/2014 16:15,2014-07-21T16:15:00,,Adoption,Neutered Male,30.71700893,-97.55358603,37.38244048,Zorro,,
2178.0,1 month,A765054,Dog,Anatol Shepherd/Great Pyrenees,Sable/White,2017-11-27,1/14/2018 15:50,2018-01-14T15:50:00,Partner,Transfer,Intact Male,30.28859935,-97.63070922,6.951388889,,,
2179.0,3 months,A757870,Cat,Domestic Shorthair Mix,Brown Tabby,2017-07-25,11/7/2017 15:05,2017-11-07T15:05:00,,Adoption,Neutered Male,30.33732682,-97.64791193,15.08978175,Kenny,,
2180.0,2 years,A738984,Dog,Pit Bull Mix,Fawn,2014-11-25,12/30/2016 18:00,2016-12-30T18:00:00,Partner,Transfer,Neutered Male,30.72610027,-97.28885172,109.5357143,*Herbie,,
2181.0,5 months,A716146,Cat,Domestic Shorthair Mix,Tortie,2015-10-31,4/13/2016 19:37,2016-04-13T19:37:00,Foster,Adoption,Spayed Female,30.2967357,-97.68701917,23.68819444,*Sally,,
2182.0,2 months,A702292,Dog,Labrador Retriever Mix,Black/White,2015-03-03,5/15/2015 18:00,2015-05-15T18:00:00,,Adoption,Neutered Male,30.39392769,-97.7376446,10.53571429,Oreo,,
2183.0,8 months,A706068,Cat,Snowshoe Mix,Seal Point,2014-10-24,6/29/2015 13:56,2015-06-29T13:56:00,Partner,Transfer,Intact Female,30.73616427,-97.33466121,35.51150794,,,
2184.0,11 months,A765467,Dog,Dachshund Mix,Blue Tick/Tricolor,2017-02-21,1/24/2018 16:50,2018-01-24T16:50:00,Partner,Transfer,Neutered Male,30.51685123,-97.3268358,48.24305556,,,
2185.0,3 months,A729376,Cat,Domestic Shorthair Mix,Orange Tabby/White,2016-03-17,6/24/2016 18:34,2016-06-24T18:34:00,,Adoption,Neutered Male,30.43101493,-97.24633757,14.25337302,,,
2186.0,6 months,A678900,Dog,Pit Bull Mix,White/Black,2013-10-14,5/14/2014 15:23,2014-05-14T15:23:00,,Return to Owner,Intact Female,30.30940002,-97.50694383,30.37728175,Juicy,,
2187.0,1 month,A709799,Dog,Australian Kelpie Mix,Black,2015-06-24,8/14/2015 13:21,2015-08-14T13:21:00,Partner,Transfer,Intact Female,30.7343106,-97.31453151,7.365178571,,,
2188.0,3 months,A712405,Cat,Domestic Shorthair Mix,Brown Tabby,2015-06-22,9/24/2015 14:38,2015-09-24T14:38:00,Partner,Transfer,Intact Female,30.68718439,-97.50575255,13.5156746,,,
2189.0,2 years,A725483,Dog,German Shepherd,Black/Brown,2014-04-29,5/3/2016 17:45,2016-05-03T17:45:00,,Adoption,Spayed Female,30.29734093,-97.42093414,105.1056548,Tilly,656174071f442de352558622,
2190.0,2 years,A670786,Dog,Pit Bull Mix,Tan/White,2012-01-14,1/16/2014 17:26,2014-01-16T17:26:00,,Return to Owner,Spayed Female,30.71074293,-97.71091575,104.8180556,Zaih,,
2191.0,4 months,A734882,Dog,Labrador Retriever Mix,Brown/White,2016-05-01,9/18/2016 17:03,2016-09-18T17:03:00,,Adoption,Neutered Male,30.28114935,-97.52096118,20.1014881,,,
2192.0,2 years,A760532,Dog,Catahoula Mix,Blue Merle,2015-10-19,12/3/2017 12:47,2017-12-03T12:47:00,,Adoption,Spayed Female,30.40286081,-97.29326365,110.9332341,Luna,,
2193.0,2 months,A737559,Dog,Pit Bull Mix,Black/White,2016-08-16,11/4/2016 17:32,2016-11-04T17:32:00,,Adoption,Spayed Female,30.47463456,-97.48642154,11.53293651,Corona,,
2194.0,4 months,A694404,Cat,Domestic Shorthair Mix,Black,2014-08-27,1/2/2015 17:39,2015-01-02T17:39:00,,Adoption,Spayed Female,30.74556242,-97.38555011,18.39077381,*Joni,,
2195.0,10 months,A695600,Dog,Pit Bull Mix,Brown,2014-03-18,2/8/2015 16:39,2015-02-08T16:39:00,Partner,Transfer,Spayed Female,30.46250659,-97.51086212,46.81339286,Sunshine,,
2196.0,8 years,A746993,Dog,Labrador Retriever Mix,Yellow,2009-04-19,4/19/2017 16:18,2017-04-19T16:18:00,Partner,Transfer,Spayed Female,30.33299347,-97.31979685,417.5255952,*Jolie,,
2197.0,2 years,A760784,Dog,Labrador Retriever Mix,Black/White,2015-10-23,10/25/2017 16:16,2017-10-25T16:16:00,,Return to Owner,Neutered Male,30.59829977,-97.65926956,104.8111111,Bacon,,
2198.0,9 months,A739004,Dog,Labrador Retriever Mix,Black/White,2016-04-15,1/18/2017 19:08,2017-01-18T19:08:00,,Adoption,Spayed Female,30.50760244,-97.72055205,39.8281746,Kali,,
2199.0,1 month,A715613,Cat,Domestic Shorthair Mix,Blue Tabby,2015-10-02,12/2/2015 17:00,2015-12-02T17:00:00,,Adoption,Neutered Male,30.63556634,-97.55983878,8.81547619,*Gandalf,,
2200.0,3 weeks,A753664,Dog,Beagle Mix,Brown,2017-06-18,7/11/2017 11:49,2017-07-11T11:49:00,Partner,Transfer,Intact Male,30.67817491,-97.3562533,3.356051587,,,
2201.0,10 years,A756497,Dog,Miniature Schnauzer Mix,Black,2007-08-23,8/23/2017 14:15,2017-08-23T14:15:00,,Return to Owner,Intact Female,30.73520479,-97.36640865,521.9419643,Ginger,,
2202.0,2 months,A717560,Cat,Domestic Shorthair Mix,Orange Tabby,2015-09-30,12/16/2015 15:24,2015-12-16T15:24:00,,Adoption,Neutered Male,30.65053671,-97.69532511,11.09166667,Milo,,
2203.0,4 years,A588789,Dog,Border Collie Mix,Chocolate/White,2010-07-18,5/31/2015 0:00,2015-05-31T00:00:00,Partner,Transfer,Neutered Male,30.36382822,-97.24376922,254,Austin,,
2204.0,10 months,A700407,Dog,Labrador Retriever Mix,Black,2014-07-13,6/7/2015 18:16,2015-06-07T18:16:00,,Return to Owner,Neutered Male,30.41696463,-97.51561725,47.10873016,Malo,,
2205.0,2 weeks,A682971,Cat,Domestic Longhair Mix,Brown Tabby/Orange,2014-06-20,7/5/2014 14:04,2014-07-05T14:04:00,Partner,Transfer,Intact Male,30.68965526,-97.67453066,2.226587302,,,
2206.0,1 year,A671066,Cat,Domestic Shorthair Mix,Brown Tabby/White,2012-07-17,1/21/2014 13:15,2014-01-21T13:15:00,Partner,Transfer,Neutered Male,30.51550732,-97.45130003,79.07886905,Cloud,,
2207.0,2 months,A751885,Cat,Domestic Shorthair Mix,Orange Tabby,2017-05-08,8/6/2017 16:51,2017-08-06T16:51:00,,Adoption,Neutered Male,30.75403572,-97.46109413,12.95744048,*Tommy,,
2208.0,7 months,A706827,Dog,Labrador Retriever Mix,Black,2014-12-08,7/26/2015 18:32,2015-07-26T18:32:00,,Adoption,Neutered Male,30.65556062,-97.73267943,32.96746032,Milo,,
2209.0,7 months,A692783,Cat,Domestic Shorthair Mix,Torbie,2014-04-25,11/26/2014 9:00,2014-11-26T09:00:00,SCRP,Transfer,Intact Female,30.32426511,-97.52544003,30.76785714,,,
2210.0,3 years,A743290,Dog,Labrador Retriever Mix,Black,2014-02-07,3/15/2017 0:00,2017-03-15T00:00:00,Partner,Transfer,Neutered Male,30.61935539,-97.70795541,161.7142857,Jerry,,
2211.0,4 months,A683663,Cat,Domestic Shorthair Mix,White/Orange Tabby,2014-02-13,7/14/2014 9:00,2014-07-14T09:00:00,SCRP,Transfer,Intact Female,30.27184791,-97.4038923,21.625,,,
2212.0,1 year,A764625,Other,Bat,Black,2017-01-02,1/3/2018 8:55,2018-01-03T08:55:00,Rabies Risk,Euthanasia,Unknown,30.71251264,-97.57972508,52.33878968,,,
2213.0,6 years,A586033,Dog,Beagle/Labrador Retriever,White,2010-01-02,2/21/2016 19:17,2016-02-21T19:17:00,,Adoption,Neutered Male,30.76076288,-97.54009441,320.2576389,Moose,,
2214.0,1 year,A715625,Other,Bat Mix,Brown,2014-11-06,11/8/2015 9:07,2015-11-08T09:07:00,Rabies Risk,Euthanasia,Unknown,30.51357433,-97.6347287,52.4828373,,,
2215.0,5 months,A751040,Dog,Jack Russell Terrier Mix,White/Brown,2017-01-03,6/10/2017 17:24,2017-06-10T17:24:00,,Adoption,Neutered Male,30.75097333,-97.66042715,22.675,*Nicholson,,
2216.0,1 year,A672742,Dog,Chihuahua Shorthair Mix,Black,2013-02-01,2/20/2014 13:40,2014-02-20T13:40:00,Partner,Transfer,Intact Female,30.53666962,-97.42184021,54.93849206,,,
2217.0,2 months,A672547,Dog,Manchester Terrier Mix,Tan,2013-12-15,2/16/2014 17:25,2014-02-16T17:25:00,,Adoption,Spayed Female,30.37984028,-97.71131795,9.103670635,Daisy,,
2218.0,2 years,A760331,Cat,American Shorthair Mix,Torbie,2015-08-21,10/29/2017 12:41,2017-10-29T12:41:00,,Adoption,Spayed Female,30.61809182,-97.35531854,114.3612103,Toffie,,
2219.0,1 year,A685577,Dog,Border Collie Mix,Black/White,2013-08-09,8/11/2014 11:19,2014-08-11T11:19:00,,Return to Owner,Neutered Male,30.40436613,-97.63879926,52.49593254,Buddy,,
2220.0,2 weeks,A702407,Cat,Domestic Shorthair Mix,Brown Tabby/White,2015-04-28,5/13/2015 13:59,2015-05-13T13:59:00,Partner,Transfer,Unknown,30.56761391,-97.54722726,2.22609127,,,
2221.0,3 weeks,A749047,Cat,Domestic Medium Hair Mix,White,2017-04-18,5/10/2017 18:56,2017-05-10T18:56:00,Partner,Transfer,Intact Male,30.56523835,-97.74009303,3.255555556,,,
2222.0,2 years,A711572,Dog,Chihuahua Shorthair Mix,Blue/Tan,2013-09-09,9/29/2015 15:09,2015-09-29T15:09:00,Medical,Euthanasia,Intact Female,30.40901585,-97.5502175,107.2330357,*Candy,,
2223.0,3 months,A761200,Cat,Domestic Shorthair Mix,Brown Tabby,2017-07-31,10/31/2017 13:36,2017-10-31T13:36:00,Suffering,Euthanasia,Intact Male,30.53390927,-97.63974094,13.22380952,,,
2224.0,1 year,A690756,Dog,Pembroke Welsh Corgi Mix,Tricolor,2013-10-25,10/29/2014 17:08,2014-10-29T17:08:00,,Adoption,Neutered Male,30.56041615,-97.3510358,52.81626984,,,
2225.0,2 years,A757341,Dog,Labrador Retriever Mix,Black/White,2015-09-01,10/3/2017 12:27,2017-10-03T12:27:00,Partner,Transfer,Intact Female,30.38141828,-97.73732174,109.0741071,19,,
2226.0,3 years,A696688,Cat,Domestic Shorthair Mix,Calico/White,2012-02-10,11/3/2015 12:24,2015-11-03T12:24:00,,Adoption,Spayed Female,30.72741088,-97.49328594,194.6452381,Mari,,
2227.0,2 weeks,A685318,Cat,Domestic Shorthair Mix,Black,2014-07-21,8/5/2014 16:21,2014-08-05T16:21:00,Partner,Transfer,Intact Female,30.70976743,-97.65356702,2.240178571,,,
2228.0,1 year,A679291,Dog,Siberian Husky/Labrador Retriever,Black/Tan,2013-05-19,6/1/2014 12:50,2014-06-01T12:50:00,,Adoption,Neutered Male,30.74255782,-97.69503919,54.07638889,Zeus,,
2229.0,2 months,A683802,Dog,Border Collie/Great Pyrenees,Black/White,2014-05-15,7/19/2014 18:40,2014-07-19T18:40:00,,Adoption,Neutered Male,30.67694769,-97.69724493,9.396825397,Riley,,
2230.0,1 year,A728669,Cat,Domestic Shorthair Mix,Black,2015-06-06,8/17/2016 12:07,2016-08-17T12:07:00,Foster,Adoption,Spayed Female,30.28701035,-97.731445,62.64355159,,,
2231.0,2 years,A731737,Dog,Pit Bull Mix,Tan/White,2014-07-26,9/11/2016 17:36,2016-09-11T17:36:00,,Adoption,Spayed Female,30.54388684,-97.52700892,111.247619,Sophie,,
2232.0,7 years,A755012,Dog,Chihuahua Shorthair/Jack Russell Terrier,White/Tricolor,2010-07-28,9/15/2017 12:17,2017-09-15T12:17:00,,Return to Owner,Spayed Female,30.39946851,-97.34651565,372.3588294,Annie,,
2233.0,2 years,A731205,Cat,Domestic Shorthair Mix,Tortie,2014-07-18,8/24/2016 19:02,2016-08-24T19:02:00,,Adoption,Spayed Female,30.35873904,-97.48658633,109.8275794,*Hana,,
2234.0,6 years,A681307,Cat,Domestic Shorthair Mix,Brown Tabby/White,2008-06-14,8/3/2014 8:34,2014-08-03T08:34:00,Suffering,Euthanasia,Spayed Female,30.72087766,-97.64096139,320.1938492,*Scarlet,,
2235.0,12 years,A728029,Dog,Chihuahua Shorthair Mix,Tan/White,2004-05-30,11/26/2016 16:28,2016-11-26T16:28:00,Foster,Adoption,Neutered Male,30.40453511,-97.47739067,651.9551587,Ceasar,,
2236.0,1 year,A720148,Dog,German Shepherd Mix,Brown/Black,2015-02-03,2/7/2016 18:21,2016-02-07T18:21:00,,Adoption,Spayed Female,30.68092298,-97.67645851,52.8235119,*Sally Jessy,,
2237.0,3 months,A706981,Cat,Domestic Shorthair Mix,Brown Tabby/White,2015-04-06,7/20/2015 14:57,2015-07-20T14:57:00,Partner,Transfer,Spayed Female,30.50265306,-97.40434478,15.0889881,*Teeny,,
2238.0,2 years,A759695,Other,Raccoon,Black/Gray,2015-10-06,10/6/2017 9:20,2017-10-06T09:20:00,Rabies Risk,Euthanasia,Unknown,30.57597725,-97.36451121,104.484127,,,
2239.0,4 months,A714203,Cat,Domestic Shorthair Mix,Calico,2015-06-19,10/25/2015 12:33,2015-10-25T12:33:00,,Adoption,Spayed Female,30.5629495,-97.61651113,18.36041667,*Marmalade,,
2240.0,10 years,A712193,Dog,Boxer Mix,White/Black,2005-09-19,9/20/2015 16:01,2015-09-20T16:01:00,Suffering,Euthanasia,Intact Male,30.65566849,-97.29568051,521.9524802,,,
2241.0,2 years,A755877,Cat,Domestic Medium Hair Mix,Orange Tabby/White,2015-08-10,8/13/2017 19:20,2017-08-13T19:20:00,Snr,Transfer,Neutered Male,30.35410791,-97.36091952,104.9722222,,,
2242.0,6 days,A725103,Cat,Domestic Shorthair Mix,Black,2016-04-20,4/26/2016 12:01,2016-04-26T12:01:00,Partner,Transfer,Unknown,30.69130973,-97.35579391,0.928670635,,,
2243.0,1 year,A699487,Dog,Norwich Terrier Mix,Buff/White,2014-03-28,5/13/2015 15:19,2015-05-13T15:19:00,Partner,Transfer,Spayed Female,30.41958875,-97.29235653,58.80545635,*Crunchella,,
2244.0,3 weeks,A735676,Cat,Domestic Shorthair Mix,Brown Tabby/White,2016-09-06,9/28/2016 13:48,2016-09-28T13:48:00,Partner,Transfer,Intact Male,30.63756128,-97.60093018,3.225,,,
2245.0,5 years,A706536,Dog,English Bulldog,Tan/White,2010-06-30,1/11/2016 12:46,2016-01-11T12:46:00,,Return to Owner,Neutered Male,30.2684869,-97.35519399,288.7902778,Butch,,
2246.0,1 year,A708787,Cat,Domestic Shorthair Mix,Brown Tabby,2014-01-31,8/1/2015 9:00,2015-08-01T09:00:00,SCRP,Transfer,Intact Male,30.68331616,-97.50503205,78.19642857,,,
2247.0,2 years,A637670,Dog,Pit Bull Mix,Blue/White,2011-09-20,2/28/2014 11:20,2014-02-28T11:20:00,,Return to Owner,Spayed Female,30.55324568,-97.48527781,127.4960317,Shadow,,
2248.0,6 years,A666364,Dog,Dachshund Mix,Brown,2007-10-31,11/10/2013 16:04,2013-11-10T16:04:00,,Return to Owner,Spayed Female,30.40466574,-97.6157189,314.6670635,Little Bit,,
2249.0,3 years,A695599,Dog,Dachshund Mix,Tan,2012-01-18,1/23/2015 12:17,2015-01-23T12:17:00,,Adoption,Spayed Female,30.74523634,-97.44112597,157.3588294,Ellabelle,,
2250.0,2 months,A757849,Cat,American Shorthair Mix,Black/White,2017-08-08,10/29/2017 17:57,2017-10-29T17:57:00,Foster,Adoption,Neutered Male,30.5262545,-97.32852184,11.82113095,*Cooper,,
2251.0,2 years,A719528,Dog,Pit Bull Mix,Brown Brindle/White,2014-01-22,2/13/2016 14:50,2016-02-13T14:50:00,,Adoption,Neutered Male,30.70202323,-97.46903481,107.5168651,*Norbert,,
2252.0,4 years,A663956,Dog,Australian Shepherd Mix,Tricolor,2009-09-27,12/1/2013 17:55,2013-12-01T17:55:00,,Adoption,Spayed Female,30.35124852,-97.52379565,218.1066468,Haven,,
2253.0,1 year,A758351,Other,Bat Mix,Brown,2016-09-14,9/15/2017 8:48,2017-09-15T08:48:00,In Kennel,Died,Unknown,30.41743243,-97.63378574,52.33809524,,,
2254.0,3 years,A705803,Dog,Boston Terrier Mix,Brown Brindle/White,2012-06-21,6/23/2015 11:07,2015-06-23T11:07:00,,Return to Owner,Neutered Male,30.51010843,-97.68403889,156.7804563,Gucci,,
2255.0,2 months,A710336,Cat,Domestic Longhair Mix,Brown Tabby/White,2015-07-06,9/21/2015 15:54,2015-09-21T15:54:00,Partner,Transfer,Intact Male,30.4193863,-97.57154156,11.09464286,*Rydell,,
2256.0,9 years,A666401,Dog,Chihuahua Shorthair Mix,Tricolor,2005-10-31,1/17/2015 14:00,2015-01-17T14:00:00,,Adoption,Neutered Male,30.5136485,-97.58914219,480.797619,*Clint,,
2257.0,2 years,A747053,Dog,Australian Cattle Dog Mix,Blue Tick,2015-04-13,4/17/2017 17:16,2017-04-17T17:16:00,,Adoption,Spayed Female,30.74542127,-97.28117752,105.1027778,,,
2258.0,2 years,A691471,Dog,Pit Bull Mix,Brown/White,2012-11-05,2/15/2015 11:01,2015-02-15T11:01:00,Partner,Transfer,Intact Male,30.35257962,-97.26878481,118.9227183,Munchies,,
2259.0,9 months,A683434,Dog,Dachshund/Australian Cattle Dog,Chocolate/Brown Merle,2013-09-10,7/10/2014 16:57,2014-07-10T16:57:00,Partner,Transfer,Intact Male,30.48651857,-97.55189304,43.38660714,,,
2260.0,3 months,A755475,Cat,Domestic Shorthair Mix,Orange Tabby,2017-06-25,9/30/2017 13:15,2017-09-30T13:15:00,,Adoption,Neutered Male,30.50503725,-97.54815876,13.9360119,*Laurel,,
2261.0,2 years,A760627,Dog,American Pit Bull Terrier Mix,Gray/White,2015-10-21,10/22/2017 11:55,2017-10-22T11:55:00,,Return to Owner,Neutered Male,30.76450445,-97.68133042,104.6423611,Zeus,,
2262.0,2 years,A630889,Dog,Siberian Husky Mix,White,2011-06-28,12/16/2013 19:07,2013-12-16T19:07:00,,Return to Owner,Spayed Female,30.50788788,-97.59525641,128.9709325,Baylah,,
2263.0,7 years,A560146,Cat,Domestic Shorthair Mix,Blue Tabby/White,2009-10-28,8/19/2017 17:06,2017-08-19T17:06:00,,Adoption,Neutered Male,30.68889416,-97.60687238,407.5303571,Eno,,
2264.0,2 years,A693312,Dog,Chihuahua Shorthair Mix,Yellow,2012-12-05,12/10/2014 15:23,2014-12-10T15:23:00,Partner,Transfer,Intact Male,30.50199186,-97.3951043,105.0915675,,,
2265.0,3 weeks,A701655,Cat,Domestic Shorthair Mix,Black,2015-04-10,5/2/2015 18:16,2015-05-02T18:16:00,Partner,Transfer,Intact Male,30.40012461,-97.37942443,3.251587302,,,
2266.0,6 months,A691524,Cat,Domestic Shorthair Mix,Tortie,2014-05-05,11/6/2014 9:00,2014-11-06T09:00:00,SCRP,Transfer,Intact Female,30.40791441,-97.72518275,26.48214286,,,
2267.0,4 weeks,A691643,Cat,Domestic Longhair Mix,Black Tabby,2014-10-16,11/14/2014 14:25,2014-11-14T14:25:00,Partner,Transfer,Intact Male,30.71501511,-97.44491399,4.228670635,,,
2268.0,2 months,A749145,Cat,Domestic Shorthair Mix,Orange Tabby/White,2017-03-11,5/28/2017 18:12,2017-05-28T18:12:00,,Adoption,Intact Female,30.48163985,-97.46060446,11.25119048,*Lavender,,
2269.0,3 years,A736157,Dog,Cardigan Welsh Corgi Mix,White/Black,2013-10-05,10/8/2016 13:33,2016-10-08T13:33:00,,Return to Owner,Intact Male,30.7186154,-97.46185457,157.0806548,Oreo,,
2270.0,3 years,A700270,Dog,Pit Bull Mix,Brown,2012-04-10,6/1/2015 18:11,2015-06-01T18:11:00,,Adoption,Neutered Male,30.71042329,-97.60280604,163.965377,*Turner,,
2271.0,1 month,A738085,Cat,Domestic Medium Hair Mix,Black/White,2016-10-09,11/26/2016 11:04,2016-11-26T11:04:00,In Kennel,Died,Unknown,30.57371831,-97.63262313,6.923015873,,,
2272.0,1 weeks,A678104,Cat,Domestic Shorthair Mix,Orange,2014-04-25,5/4/2014 17:28,2014-05-04T17:28:00,Partner,Transfer,Intact Male,30.47203365,-97.65714424,1.38968254,,,
2273.0,7 months,A743024,Dog,Chihuahua Shorthair/Jack Russell Terrier,Tricolor,2016-06-27,2/6/2017 15:27,2017-02-06T15:27:00,,Adoption,Neutered Male,30.64278304,-97.25843794,32.09196429,Eddy,,
2274.0,1 year,A737960,Dog,Chihuahua Shorthair Mix,Brown/Tan,2015-11-07,11/11/2016 11:58,2016-11-11T11:58:00,,Adoption,Neutered Male,30.58993746,-97.53463443,52.92837302,Coffee,,
2275.0,1 year,A668767,Dog,German Shepherd Mix,Black/Tan,2012-11-09,12/9/2013 18:29,2013-12-09T18:29:00,,Return to Owner,Intact Male,30.46938424,-97.27653169,56.53859127,Vincent,,
2276.0,2 months,A665901,Dog,Pit Bull Mix,Chocolate/White,2013-08-13,10/28/2013 12:47,2013-10-28T12:47:00,Partner,Transfer,Neutered Male,30.51287572,-97.27991797,10.93323413,,,
2277.0,3 years,A682138,Dog,Chihuahua Shorthair Mix,Black/White,2011-06-24,6/26/2014 11:07,2014-06-26T11:07:00,,Return to Owner,Spayed Female,30.76318541,-97.44802294,156.9233135,Frannie,,
2278.0,3 weeks,A691087,Cat,Domestic Shorthair Mix,Blue Tabby,2014-10-07,10/30/2014 10:37,2014-10-30T10:37:00,Partner,Transfer,Unknown,30.60874926,-97.41025791,3.34890873,,,
2279.0,1 year,A761521,Cat,American Shorthair Mix,Gray Tabby/White,2016-05-06,11/10/2017 19:14,2017-11-10T19:14:00,Snr,Transfer,Unknown,30.58769935,-97.30213807,79.11448413,Meridian,,
2280.0,1 year,A730669,Dog,Jack Russell Terrier Mix,White,2015-07-08,7/9/2016 16:05,2016-07-09T16:05:00,,Return to Owner,Intact Female,30.69445482,-97.38701997,52.52430556,Snow,,
2281.0,2 years,A694584,Dog,Pit Bull Mix,Brown/White,2012-12-31,12/31/2014 12:52,2014-12-31T12:52:00,,Return to Owner,Spayed Female,30.43250023,-97.31976999,104.3623016,Miss Crush,,
2282.0,8 months,A753130,Dog,Border Collie Mix,Black/White,2016-11-02,7/13/2017 15:40,2017-07-13T15:40:00,,Return to Owner,Intact Male,30.33950353,-97.27038716,36.23611111,Lego,,
2283.0,1 year,A716039,Cat,Siamese Mix,Seal Point,2014-05-13,11/13/2015 15:12,2015-11-13T15:12:00,Suffering,Euthanasia,Neutered Male,30.5676233,-97.24801086,78.51904762,Dirty,,
2284.0,6 months,A720818,Dog,Pointer Mix,Fawn/White,2015-08-15,2/23/2016 15:15,2016-02-23T15:15:00,,Adoption,Neutered Male,30.41853621,-97.39608227,27.51934524,*Atticus,,
2285.0,3 years,A744889,Dog,Dachshund/Chihuahua Shorthair,Tan/Black,2014-03-09,3/26/2017 18:45,2017-03-26T18:45:00,,Adoption,Neutered Male,30.44607207,-97.56117847,159.1116071,Louis,,
2286.0,1 year,A700888,Dog,Rhod Ridgeback/Pit Bull,White/Brown,2014-04-21,7/26/2015 12:16,2015-07-26T12:16:00,,Adoption,Neutered Male,30.37667282,-97.54948977,65.93015873,*Wilbur,,
2287.0,4 weeks,A685621,Other,Bat,Brown/Black,2014-07-10,8/10/2014 13:37,2014-08-10T13:37:00,,Disposal,Unknown,30.75326612,-97.54650437,4.509623016,,,
2288.0,1 month,A688213,Cat,Domestic Shorthair Mix,White/Gray,2014-08-09,9/16/2014 17:56,2014-09-16T17:56:00,Partner,Transfer,Intact Female,30.43952026,-97.6354439,5.53531746,,,
2289.0,12 years,A668298,Cat,Domestic Shorthair Mix,Blue/White,2001-12-01,12/6/2013 17:25,2013-12-06T17:25:00,Partner,Transfer,Spayed Female,30.7064113,-97.3722202,626.9608135,Cleo,,
2290.0,3 years,A717055,Dog,Labrador Retriever Mix,Yellow,2012-12-01,12/2/2015 18:37,2015-12-02T18:37:00,,Return to Owner,Neutered Male,30.41750121,-97.6654623,156.6822421,Sammy,,
2291.0,4 years,A694963,Dog,Pit Bull Mix,Blue/White,2012-01-07,7/5/2016 14:37,2016-07-05T14:37:00,,Return to Owner,Spayed Female,30.34236684,-97.57406995,234.5155754,Sheba,,
2292.0,2 years,A650399,Dog,Yorkshire Terrier/Chihuahua Longhair,Silver/Tan,2011-03-28,11/15/2013 16:23,2013-11-15T16:23:00,Partner,Transfer,Neutered Male,30.59020307,-97.4060823,137.6689484,Tyson,,
2293.0,6 years,A602465,Dog,Chihuahua Shorthair Mix,Brown,2011-03-02,4/28/2017 13:17,2017-04-28T13:17:00,,Return to Owner,Neutered Male,30.6527449,-97.3396216,321.3647817,Blessings,,
2294.0,4 weeks,A708985,Cat,Domestic Shorthair Mix,Brown Tabby,2015-07-12,8/9/2015 11:46,2015-08-09T11:46:00,Partner,Transfer,Intact Female,30.73383139,-97.25403653,4.070039683,*Abbie,,
2295.0,1 month,A750194,Cat,Domestic Shorthair Mix,Orange Tabby/White,2017-04-09,5/27/2017 17:58,2017-05-27T17:58:00,,Adoption,Intact Female,30.64344577,-97.73742327,6.964087302,Honey,,
2296.0,7 months,A668440,Dog,Labrador Retriever Mix,Tan,2013-05-04,12/5/2013 15:46,2013-12-05T15:46:00,Aggressive,Euthanasia,Intact Male,30.72071325,-97.71399236,30.80813492,,,
2297.0,4 years,A647538,Dog,Pit Bull Mix,Brown Brindle/White,2011-02-12,5/28/2015 10:09,2015-05-28T10:09:00,Aggressive,Euthanasia,Neutered Male,30.60466252,-97.38202401,223.7747024,Rocky,,
2298.0,2 years,A709407,Dog,Boxer Mix,Tan/White,2013-08-08,8/25/2015 14:41,2015-08-25T14:41:00,,Adoption,Spayed Female,30.56601911,-97.44258133,106.8016865,Nagini,,
2299.0,2 years,A685809,Dog,Dachshund/Australian Cattle Dog,Brown Brindle/White,2012-08-13,8/22/2014 17:52,2014-08-22T17:52:00,,Adoption,Spayed Female,30.48975016,-97.45415786,105.6777778,Darcy,,
2300.0,2 months,A753662,Cat,Domestic Shorthair Mix,Brown Tabby,2017-05-25,8/4/2017 21:48,2017-08-04T21:48:00,,Adoption,Neutered Male,30.38881482,-97.56187699,10.27261905,*Caden,,
2301.0,5 months,A662261,Cat,Domestic Medium Hair Mix,Black/White,2013-07-24,12/24/2013 12:55,2013-12-24T12:55:00,Partner,Transfer,Neutered Male,30.31637114,-97.7398513,21.93402778,*Kim,,
2302.0,1 month,A740985,Dog,Cairn Terrier Mix,Tan,2016-11-10,1/6/2017 17:41,2017-01-06T17:41:00,Foster,Adoption,Spayed Female,30.65893111,-97.58139334,8.248115079,Bowie,,
2303.0,10 months,A744416,Dog,Boxer Mix,Brown,2016-04-30,3/15/2017 12:27,2017-03-15T12:27:00,,Adoption,Spayed Female,30.48987029,-97.73298664,45.64553571,Dosha,,
2304.0,6 years,A709838,Dog,Yorkshire Terrier Mix,Sable,2009-08-13,8/23/2015 11:36,2015-08-23T11:36:00,,Return to Owner,Intact Male,30.59778418,-97.29873263,314.497619,Bandito,,
2305.0,12 years,A388691,Dog,Miniature Schnauzer Mix,Black/Gray,2003-05-16,11/29/2015 18:40,2015-11-29T18:40:00,,Return to Owner,Neutered Male,30.50309124,-97.50328249,654.3968254,Blaze,,
2306.0,1 year,A707241,Cat,Domestic Medium Hair Mix,Blue,2014-07-10,7/11/2015 9:00,2015-07-11T09:00:00,SCRP,Transfer,Unknown,30.48701276,-97.57028932,52.33928571,,,
2307.0,11 years,A740874,Dog,Chihuahua Shorthair Mix,Tan,2005-12-24,12/31/2016 17:11,2016-12-31T17:11:00,,Adoption,Neutered Male,30.26966793,-97.65957709,575.1022817,*Fig,,
2308.0,7 months,A761794,Dog,Labrador Retriever Mix,Black,2017-03-29,11/11/2017 13:34,2017-11-11T13:34:00,,Adoption,Spayed Female,30.44669997,-97.46465667,32.5093254,Coco,,
2309.0,4 months,A759984,Cat,Domestic Shorthair Mix,Black,2017-06-23,10/31/2017 11:20,2017-10-31T11:20:00,Partner,Transfer,Spayed Female,30.35783273,-97.71941948,18.63888889,,,
2310.0,10 years,A721747,Dog,Rat Terrier,White/Black,2006-03-03,3/14/2016 15:27,2016-03-14T15:27:00,,Adoption,Spayed Female,30.67428512,-97.71679665,523.5205357,Molly,,
2311.0,1 month,A683638,Cat,Domestic Shorthair Mix,Black,2014-06-06,7/25/2014 16:46,2014-07-25T16:46:00,Partner,Transfer,Intact Male,30.50842504,-97.50697927,7.099801587,,,
2312.0,3 months,A680036,Cat,Domestic Shorthair Mix,Black Smoke,2014-04-29,8/21/2014 17:38,2014-08-21T17:38:00,Foster,Adoption,Neutered Male,30.2882106,-97.65102576,16.3906746,Smoke Dawg,,
2313.0,1 year,A724377,Cat,Domestic Shorthair Mix,Black,2015-04-16,4/27/2016 10:58,2016-04-27T10:58:00,SCRP,Transfer,Spayed Female,30.50622167,-97.71744325,53.92242063,*Flo,,
2314.0,10 months,A715702,Dog,Chihuahua Shorthair/Dachshund,Brown,2015-01-08,11/15/2015 14:16,2015-11-15T14:16:00,Partner,Transfer,Intact Male,30.4360888,-97.7014466,44.51349206,*Kojak,,
2315.0,4 weeks,A749563,Cat,Domestic Shorthair Mix,Brown Tabby,2017-04-16,5/18/2017 15:36,2017-05-18T15:36:00,Partner,Transfer,Intact Male,30.39107198,-97.45550556,4.664285714,*Sam,,
2316.0,2 years,A677884,Dog,Pit Bull Mix,Brown,2012-04-30,8/16/2014 19:00,2014-08-16T19:00:00,,Adoption,Spayed Female,30.33565979,-97.44215717,119.827381,Juliette,,
2317.0,4 weeks,A721425,Dog,German Shepherd Mix,White/Brown,2016-01-26,2/28/2016 15:34,2016-02-28T15:34:00,Partner,Transfer,Intact Male,30.48091502,-97.54816909,4.806944444,*Jolly,,
2318.0,2 months,A725027,Cat,Siamese Mix,Flame Point,2016-04-10,6/30/2016 18:50,2016-06-30T18:50:00,Foster,Adoption,Neutered Male,30.66346828,-97.29532557,11.68353175,*Jackson,,
2319.0,2 years,A671513,Dog,Australian Cattle Dog/Labrador Retriever,Brown,2012-01-25,2/15/2014 12:47,2014-02-15T12:47:00,,Adoption,Neutered Male,30.74596117,-97.26880101,107.5046627,*Bogo,,
2320.0,13 years,A681417,Dog,Miniature Schnauzer Mix,Gray/White,2001-06-16,7/3/2014 16:00,2014-07-03T16:00:00,Partner,Transfer,Neutered Male,30.70783355,-97.53256001,680.8095238,Whiskers,,
2321.0,3 years,A656967,Dog,Australian Cattle Dog Mix,Blue Tick,2009-12-21,11/11/2013 15:31,2013-11-11T15:31:00,Aggressive,Euthanasia,Intact Male,30.67415731,-97.24364761,203.0923611,Homer,,
2322.0,2 weeks,A684378,Cat,Domestic Shorthair Mix,Black,2014-07-07,7/22/2014 17:34,2014-07-22T17:34:00,Partner,Transfer,Unknown,30.42712959,-97.46892729,2.247420635,,,
2323.0,2 years,A666592,Dog,Chihuahua Shorthair Mix,Buff/White,2011-05-04,11/10/2013 16:35,2013-11-10T16:35:00,,Adoption,Neutered Male,30.57516366,-97.30246401,131.6701389,Chewie,,
2324.0,1 month,A680380,Cat,Domestic Shorthair Mix,Brown Tabby,2014-05-11,7/11/2014 16:52,2014-07-11T16:52:00,In Foster,Died,Intact Male,30.63952591,-97.50328149,8.81468254,,,
2325.0,5 years,A711901,Dog,Australian Shepherd Mix,White/Brown,2010-09-13,9/17/2015 15:21,2015-09-17T15:21:00,,Return to Owner,Spayed Female,30.48459023,-97.67457535,261.5199405,Hope,,
2326.0,2 months,A685730,Dog,Labrador Retriever Mix,Black/White,2014-06-12,8/17/2014 17:29,2014-08-17T17:29:00,,Adoption,Neutered Male,30.63459876,-97.45367537,9.532638889,Willie,,
2327.0,9 years,A691126,Dog,Maltese/Miniature Poodle,White,2005-10-30,11/5/2014 11:27,2014-11-05T11:27:00,,Return to Owner,Neutered Male,30.60201843,-97.52774246,470.4967262,Max,,
2328.0,1 year,A701569,Other,Bat Mix,Brown,2014-05-01,5/4/2015 11:06,2015-05-04T11:06:00,Rabies Risk,Euthanasia,Unknown,30.38726672,-97.50409972,52.6375,,,
2329.0,2 years,A736208,Dog,Pomeranian Mix,Red/Tan,2014-10-06,11/17/2016 16:20,2016-11-17T16:20:00,,Return to Owner,Intact Male,30.40459337,-97.46865928,110.5257937,*Edward,,
2330.0,4 years,A711222,Dog,Pit Bull Mix,Brown/White,2011-11-03,11/3/2015 18:57,2015-11-03T18:57:00,,Return to Owner,Neutered Male,30.39353863,-97.36747715,208.8270833,Capone,,
2331.0,2 months,A662498,Cat,Domestic Shorthair Mix,Tortie,2013-07-20,10/19/2013 15:34,2013-10-19T15:34:00,Partner,Transfer,Intact Female,30.369705,-97.36044082,13.09265873,*Grace,,
2332.0,4 years,A674897,Dog,Lhasa Apso,Black/White,2010-03-20,3/20/2014 16:28,2014-03-20T16:28:00,,Return to Owner,Spayed Female,30.3798307,-97.4210583,208.8123016,Layla,,
2333.0,7 months,A734310,Dog,Boston Terrier,Black/White,2016-02-04,9/4/2016 14:35,2016-09-04T14:35:00,,Return to Owner,Neutered Male,30.51014992,-97.32323275,30.51537698,Audi,,
2334.0,2 years,A760453,Cat,Domestic Shorthair Mix,Blue Tabby/White,2015-10-18,12/6/2017 15:27,2017-12-06T15:27:00,Partner,Transfer,Spayed Female,30.74215976,-97.50839647,111.5205357,Cinderella,,
2335.0,1 year,A710478,Cat,Domestic Medium Hair Mix,Torbie,2014-08-23,8/24/2015 9:00,2015-08-24T09:00:00,SCRP,Transfer,Intact Female,30.70681051,-97.6323361,52.33928571,,,
2336.0,7 years,A697180,Dog,Shih Tzu Mix,Cream,2008-02-19,2/20/2015 14:00,2015-02-20T14:00:00,,Return to Owner,Neutered Male,30.46756748,-97.27923956,365.5119048,Mr. Pickles,,
2337.0,6 days,A698121,Dog,Labrador Retriever Mix,Brown,2015-02-28,3/6/2015 9:50,2015-03-06T09:50:00,Partner,Transfer,Unknown,30.72045478,-97.62055054,0.915674603,,,
2338.0,1 year,A765100,Dog,Pit Bull/Chow Chow,White/Black,2017-01-14,1/14/2018 18:08,2018-01-14T18:08:00,,Return to Owner,Neutered Male,30.40249414,-97.44660823,52.25079365,Logan,,
2339.0,6 months,A728042,Dog,Plott Hound Mix,Brown/White,2015-11-30,6/11/2016 13:14,2016-06-11T13:14:00,,Adoption,Spayed Female,30.30201564,-97.42528588,27.79305556,Karma,,
2340.0,6 months,A716637,Dog,German Shepherd Mix,Brown/Black,2015-05-07,11/27/2015 13:31,2015-11-27T13:31:00,Partner,Transfer,Spayed Female,30.68111846,-97.31827087,29.22331349,,,
2341.0,13 years,A715244,Cat,Domestic Shorthair Mix,Silver Tabby,2002-11-18,11/29/2015 19:17,2015-11-29T19:17:00,,Adoption,Neutered Male,30.66841279,-97.47657049,679.9719246,Smokey,,
2342.0,2 months,A736820,Dog,Chihuahua Shorthair/Dachshund,Black/Tan,2016-08-02,10/18/2016 11:19,2016-10-18T11:19:00,Partner,Transfer,Intact Female,30.50910851,-97.70591802,11.06736111,Daisy,,
2343.0,4 weeks,A677216,Cat,Domestic Shorthair Mix,Black,2014-03-21,4/21/2014 18:03,2014-04-21T18:03:00,Partner,Transfer,Intact Male,30.53061206,-97.57809748,4.536011905,,,
2344.0,1 year,A728332,Dog,Maltese Mix,White,2015-06-02,6/5/2016 12:11,2016-06-05T12:11:00,,Adoption,Spayed Female,30.56377317,-97.62342787,52.78680556,Spicey,,
2345.0,2 years,A685014,Dog,Catahoula/Australian Cattle Dog,Black,2012-08-01,8/10/2014 12:20,2014-08-10T12:20:00,Partner,Transfer,Intact Male,30.38913698,-97.72042536,105.6448413,Eli,,
2346.0,2 years,A678482,Dog,Miniature Poodle/Miniature Schnauzer,Black/White,2012-05-09,5/14/2014 19:15,2014-05-14T19:15:00,,Adoption,Neutered Male,30.32878199,-97.38650177,105.1145833,,,
2347.0,5 years,A717748,Cat,Domestic Shorthair Mix,Blue Cream/White,2010-12-14,12/29/2015 19:56,2015-12-29T19:56:00,Partner,Transfer,Intact Female,30.69541109,-97.51869567,263.1186508,*Sugar,,
2348.0,3 years,A734785,Dog,Pit Bull Mix,Fawn,2013-09-13,9/13/2016 16:36,2016-09-13T16:36:00,,Return to Owner,Intact Male,30.3336008,-97.28780288,156.6702381,Mac,,
2349.0,13 years,A762708,Cat,Domestic Shorthair Mix,Brown Tabby,2004-11-25,11/25/2017 15:24,2017-11-25T15:24:00,,Return to Owner,Neutered Male,30.74630303,-97.71192607,678.377381,Noah,,
2350.0,10 months,A678284,Cat,Domestic Shorthair Mix,Black,2013-07-06,5/7/2014 13:02,2014-05-07T13:02:00,SCRP,Transfer,Unknown,30.68050921,-97.27215704,43.64900794,,,
2351.0,2 years,A687077,Dog,Pit Bull Mix,Brown/White,2012-08-30,8/31/2014 11:21,2014-08-31T11:21:00,,Return to Owner,Intact Male,30.49119226,-97.33453654,104.496131,Hildago,,
2352.0,2 months,A756242,Cat,Domestic Shorthair Mix,Gray Tabby,2017-06-16,8/21/2017 18:01,2017-08-21T18:01:00,,Adoption,Neutered Male,30.44740207,-97.56838796,9.535813492,,,
2353.0,4 weeks,A705270,Cat,Domestic Shorthair,Black/White,2015-05-15,6/17/2015 12:45,2015-06-17T12:45:00,Partner,Transfer,Intact Female,30.45655494,-97.5964596,4.790178571,,,
2354.0,2 years,A619278,Dog,Great Pyrenees,White,2011-10-28,4/23/2014 16:55,2014-04-23T16:55:00,,Return to Owner,Intact Female,30.31863405,-97.48189328,129.8149802,Bella,,
2355.0,2 years,A737894,Cat,Domestic Shorthair Mix,Tortie,2014-11-06,11/7/2016 9:00,2016-11-07T09:00:00,Snr,Transfer,Spayed Female,30.62423593,-97.58130859,104.625,,,
2356.0,4 years,A714103,Cat,Munchkin Longhair Mix,Brown Tabby/White,2011-10-18,10/29/2015 11:24,2015-10-29T11:24:00,Partner,Transfer,Neutered Male,30.32502555,-97.38790989,210.3535714,,,
2357.0,4 years,A745897,Cat,Domestic Shorthair Mix,Black/White,2013-03-26,5/30/2017 9:59,2017-05-30T09:59:00,,Adoption,Spayed Female,30.5754849,-97.71259552,218.0594246,Pepper,,
2358.0,4 years,A724638,Dog,Pit Bull Mix,Brown/White,2012-04-19,4/23/2016 11:44,2016-04-23T11:44:00,,Return to Owner,Intact Male,30.76647255,-97.50449787,209.3555556,,,
2359.0,3 years,A755687,Other,Bat Mix,Brown,2014-08-07,8/7/2017 13:50,2017-08-07T13:50:00,,Disposal,Unknown,30.57577532,-97.66704113,156.6537698,,,
2360.0,10 months,A716751,Dog,Blue Lacy Mix,Fawn,2015-01-24,11/30/2015 17:52,2015-11-30T17:52:00,,Adoption,Neutered Male,30.6328885,-97.68722873,44.39206349,Donnor,,
2361.0,2 years,A756330,Cat,Domestic Shorthair Mix,Gray,2015-08-17,8/23/2017 12:03,2017-08-23T12:03:00,,Return to Owner,Neutered Male,30.66742728,-97.24686601,105.3574405,Mister Kitty,,
2362.0,3 months,A690538,Dog,Maltese Mix,White/Tan,2014-07-22,10/30/2014 11:19,2014-10-30T11:19:00,,Adoption,Spayed Female,30.33761352,-97.24935091,14.3530754,*Chelsea,,
2363.0,3 years,A688206,Cat,Domestic Longhair Mix,Orange Tabby,2011-09-16,9/17/2014 14:06,2014-09-17T14:06:00,Partner,Transfer,Neutered Male,30.68293067,-97.57496179,156.7982143,Garfield,,
2364.0,18 years,A756751,Cat,Domestic Shorthair Mix,White/Calico,1999-08-24,8/24/2017 17:58,2017-08-24T17:58:00,Suffering,Euthanasia,Spayed Female,30.73723867,-97.30801653,939.3926587,Lulu Bell,,
2365.0,9 years,A555413,Dog,Dachshund Mix,Brown,2007-05-18,10/14/2016 16:36,2016-10-14T16:36:00,,Return to Owner,Neutered Male,30.51404825,-97.39019127,491.0988095,Peewee,,
2366.0,2 years,A724108,Dog,Miniature Pinscher,Black/Tan,2014-04-12,4/21/2016 13:44,2016-04-21T13:44:00,,Return to Owner,Intact Female,30.35920564,-97.41443277,105.7960317,Brownie,,
2367.0,5 years,A764953,Dog,Miniature Poodle,White,2013-01-09,1/15/2018 14:03,2018-01-15T14:03:00,Partner,Transfer,Spayed Female,30.45415305,-97.4761121,261.7979167,,,
2368.0,1 year,A688633,Other,Bat,Brown,2013-09-21,9/21/2014 16:33,2014-09-21T16:33:00,Rabies Risk,Euthanasia,Unknown,30.31137577,-97.5628759,52.24136905,,,
2369.0,4 months,A663582,Cat,Domestic Shorthair Mix,Black,2013-08-06,12/27/2013 19:38,2013-12-27T19:38:00,Partner,Transfer,Neutered Male,30.41279977,-97.37578794,20.54543651,*Korovyov,,
2370.0,4 months,A764345,Cat,Domestic Shorthair Mix,Calico,2017-08-28,12/29/2017 13:41,2017-12-29T13:41:00,,Adoption,Spayed Female,30.65667946,-97.64538398,17.65287698,Madison,,
2371.0,1 year,A726171,Cat,Domestic Shorthair Mix,Torbie,2015-05-07,7/14/2016 16:00,2016-07-14T16:00:00,,Adoption,Spayed Female,30.62463039,-97.3707659,62.0952381,*Darla,,
2372.0,6 months,A748110,Dog,Australian Cattle Dog Mix,White/Tan,2016-10-29,5/27/2017 19:11,2017-05-27T19:11:00,,Adoption,Spayed Female,30.52817831,-97.56331277,30.11418651,*Crumpet,,
2373.0,2 years,A724648,Dog,Cairn Terrier Mix,Tricolor,2014-04-20,4/21/2016 18:57,2016-04-21T18:57:00,,Return to Owner,Intact Male,30.56297791,-97.2810602,104.6842262,Lyric,,
2374.0,1 weeks,A705156,Dog,American Staffordshire Terrier,Fawn,2015-06-11,6/19/2015 13:44,2015-06-19T13:44:00,Partner,Transfer,Intact Male,30.35965284,-97.60112569,1.224603175,,,
2375.0,5 months,A711435,Dog,Dachshund/Labrador Retriever,Brown Brindle,2015-04-06,9/10/2015 12:41,2015-09-10T12:41:00,Partner,Transfer,Intact Female,30.56149433,-97.71392744,22.50406746,*Minnie,,
2376.0,5 years,A712561,Cat,Domestic Shorthair Mix,Orange Tabby,2010-09-25,9/26/2015 9:00,2015-09-26T09:00:00,SCRP,Transfer,Intact Male,30.27739156,-97.52520218,261.0535714,,,
2377.0,8 years,A702291,Cat,Domestic Shorthair Mix,Orange Tabby,2007-05-11,5/13/2015 11:08,2015-05-13T11:08:00,Suffering,Euthanasia,Neutered Male,30.27788335,-97.33015158,417.7805556,Golden Boy,,
2378.0,2 months,A716931,Cat,Domestic Shorthair Mix,White,2015-11-25,2/16/2016 8:29,2016-02-16T08:29:00,Foster,Adoption,Spayed Female,30.28844106,-97.67522461,11.90763889,,,
2379.0,1 year,A730888,Dog,Black Mouth Cur Mix,Brown/White,2015-07-12,7/24/2016 18:35,2016-07-24T18:35:00,,Adoption,Spayed Female,30.743566,-97.34882249,54.11061508,Kaly,,
2380.0,3 weeks,A683432,Cat,Domestic Shorthair Mix,Tortie,2014-06-18,7/11/2014 19:10,2014-07-11T19:10:00,Partner,Transfer,Intact Female,30.42331745,-97.644489,3.399801587,,,
2381.0,1 month,A720493,Dog,Labrador Retriever Mix,Black/White,2015-12-17,2/13/2016 17:25,2016-02-13T17:25:00,,Adoption,Spayed Female,30.68619823,-97.72236004,8.389384921,Penelope,,
2382.0,1 week,A664236,Cat,Domestic Shorthair Mix,Orange/White,2013-09-24,10/1/2013 10:44,2013-10-01T10:44:00,Partner,Transfer,Unknown,30.69531295,-97.63073637,1.063888889,,,
2383.0,1 year,A705094,Dog,Staffordshire Mix,Blue/White,2014-06-18,7/5/2015 14:00,2015-07-05T14:00:00,,Adoption,Spayed Female,30.50413335,-97.59795502,54.6547619,Magna,,
2384.0,5 years,A736663,Cat,Domestic Medium Hair Mix,Orange Tabby,2011-10-14,10/15/2016 9:00,2016-10-15T09:00:00,Suffering,Euthanasia,Neutered Male,30.47727462,-97.30538366,261.1964286,Nicks,,
2385.0,2 months,A684583,Dog,Labrador Retriever/Newfoundland,Black,2014-05-18,7/29/2014 17:04,2014-07-29T17:04:00,,Adoption,Spayed Female,30.60072236,-97.31032139,10.38730159,,,
2386.0,1 year,A682781,Cat,Domestic Shorthair Mix,White/Black,2013-01-02,7/3/2014 9:00,2014-07-03T09:00:00,SCRP,Transfer,Neutered Male,30.30712363,-97.39405299,78.19642857,,,
2387.0,2 years,A733097,Dog,Pit Bull Mix,Chocolate/White,2014-08-17,3/26/2017 16:17,2017-03-26T16:17:00,,Adoption,Spayed Female,30.54237196,-97.35638026,136.0969246,Rylie,,
2388.0,10 years,A679964,Dog,Cocker Spaniel,Black/White,2004-05-28,6/4/2014 15:06,2014-06-04T15:06:00,Partner,Transfer,Intact Female,30.38780341,-97.55269825,522.8041667,Maddie,,
2389.0,5 months,A722293,Other,Bat,Brown,2015-09-14,3/14/2016 13:36,2016-03-14T13:36:00,Rabies Risk,Euthanasia,Unknown,30.65932739,-97.4330515,26.08095238,,,
2390.0,2 years,A669198,Dog,Pit Bull Mix,Tan/Brown,2011-12-16,6/24/2014 18:56,2014-06-24T18:56:00,,Adoption,Neutered Male,30.28450445,-97.7334642,131.684127,Cooper,,
2391.0,2 years,A691062,Cat,Domestic Shorthair Mix,White/Black,2014-07-29,1/3/2017 18:57,2017-01-03T18:57:00,,Adoption,Spayed Female,30.60940882,-97.40512291,127.1127976,Tiny,,
2392.0,2 years,A705930,Dog,Labrador Retriever/Border Collie,Chocolate/White,2014-06-22,4/23/2017 14:05,2017-04-23T14:05:00,,Adoption,Spayed Female,30.68726483,-97.41151282,148.0838294,Bleu,,
2393.0,1 year,A735534,Dog,Labrador Retriever Mix,Chocolate/Brown,2015-09-25,12/1/2016 18:06,2016-12-01T18:06:00,,Return to Owner,Intact Male,30.2778418,-97.63165032,61.96488095,*Knight,,
2394.0,1 month,A749019,Cat,Domestic Shorthair Mix,Brown Tabby,2017-03-19,5/11/2017 14:12,2017-05-11T14:12:00,Partner,Transfer,Intact Male,30.4461062,-97.47025778,7.655952381,,,
2395.0,1 year,A707062,Dog,Australian Cattle Dog Mix,Red Merle,2014-07-07,7/17/2015 14:55,2015-07-17T14:55:00,,Adoption,Neutered Male,30.30450798,-97.35017392,53.66021825,Hercules,,
2396.0,1 month,A704183,Cat,Domestic Shorthair Mix,Tortie,2015-04-25,6/7/2015 15:31,2015-06-07T15:31:00,Partner,Transfer,Intact Female,30.6446984,-97.56892825,6.235218254,,,
2397.0,1 year,A713124,Dog,Australian Cattle Dog,White/Tan,2014-10-02,10/6/2015 16:23,2015-10-06T16:23:00,Partner,Transfer,Spayed Female,30.41397414,-97.55626233,52.81180556,*Bonnie,,
2398.0,11 months,A659414,Dog,Chihuahua Shorthair Mix,Brown,2013-03-24,3/5/2014 17:58,2014-03-05T17:58:00,,Adoption,Spayed Female,30.44556865,-97.2816537,49.53551587,Ginger,,
2399.0,1 month,A678781,Dog,Border Collie Mix,Black/White,2014-04-06,6/3/2014 17:47,2014-06-03T17:47:00,,Adoption,Spayed Female,30.62715416,-97.62058082,8.39156746,Sadie,,
2400.0,9 months,A737135,Dog,Pit Bull Mix,White,2016-02-22,11/26/2016 16:50,2016-11-26T16:50:00,,Adoption,Spayed Female,30.54376663,-97.52024033,39.81448413,*Heidi,,
2401.0,12 years,A723866,Cat,Domestic Shorthair Mix,Brown Tabby/Black,2004-04-10,9/8/2016 13:08,2016-09-08T13:08:00,Foster,Adoption,Spayed Female,30.63409518,-97.72493868,647.7924603,Maggie,,
2402.0,3 years,A758773,Dog,Pit Bull Mix,White/Black,2014-09-21,9/26/2017 10:14,2017-09-26T10:14:00,Partner,Transfer,Intact Female,30.52791418,-97.3649502,157.346627,,,
2403.0,7 months,A740429,Cat,Domestic Shorthair Mix,Black/Black,2016-05-17,1/13/2017 19:07,2017-01-13T19:07:00,,Adoption,Neutered Male,30.6947312,-97.39960843,34.54236111,Elvis,,
2404.0,3 months,A703320,Dog,Catahoula Mix,White/Blue,2015-03-08,6/9/2015 17:38,2015-06-09T17:38:00,,Adoption,Neutered Male,30.45984274,-97.29862633,13.3906746,Remus,,
2405.0,1 year,A680578,Dog,Treeing Walker Coonhound Mix,Blue Tick,2013-06-04,7/24/2014 8:15,2014-07-24T08:15:00,Foster,Adoption,Spayed Female,30.58576317,-97.32807444,59.33482143,*Ruby,,
2406.0,2 months,A757097,Dog,Chihuahua Shorthair Mix,Tricolor,2017-06-29,8/31/2017 18:59,2017-08-31T18:59:00,,Adoption,Neutered Male,30.4640639,-97.37274088,9.112996032,,,
2407.0,1 year,A663879,Cat,Domestic Shorthair Mix,Calico,2012-09-25,12/8/2013 14:32,2013-12-08T14:32:00,Partner,Transfer,Spayed Female,30.41404585,-97.55682978,62.80079365,Halo,,
2408.0,4 months,A688188,Dog,American Bulldog Mix,Tan/White,2014-05-16,9/16/2014 15:09,2014-09-16T15:09:00,,Return to Owner,Intact Male,30.31758813,-97.48324841,17.66160714,Melo,,
2409.0,5 years,A722566,Cat,Domestic Shorthair Mix,Tortie,2011-03-18,3/23/2016 16:24,2016-03-23T16:24:00,Suffering,Euthanasia,Intact Female,30.6914638,-97.50386358,261.8119048,,,
2410.0,4 weeks,A691523,Dog,Chihuahua Longhair Mix,Black/White,2014-10-21,11/21/2014 13:19,2014-11-21T13:19:00,Partner,Transfer,Intact Male,30.70607349,-97.37810101,4.507837302,,,
2411.0,3 years,A697665,Dog,Chihuahua Shorthair Mix,Tan,2014-02-26,6/19/2017 16:49,2017-06-19T16:49:00,Partner,Transfer,Neutered Male,30.38522586,-97.25643505,172.8143849,Biggie,,
2412.0,6 years,A718748,Dog,Carolina Dog Mix,Brown,2011-01-06,1/29/2017 15:14,2017-01-29T15:14:00,,Adoption,Spayed Female,30.46275258,-97.66095747,316.519246,Casidy,,
2413.0,2 months,A666066,Cat,Domestic Shorthair Mix,Black/White,2013-09-17,11/24/2013 17:25,2013-11-24T17:25:00,,Adoption,Spayed Female,30.44877868,-97.41435837,9.817956349,Frenchie,,
2414.0,1 year,A673567,Other,Raccoon Mix,Gray/Black,2013-02-26,2/26/2014 15:22,2014-02-26T15:22:00,Suffering,Euthanasia,Unknown,30.57507096,-97.58458873,52.2343254,,,
2415.0,1 year,A764256,Dog,Australian Cattle Dog Mix,Black/White,2016-12-26,1/17/2018 16:09,2018-01-17T16:09:00,,Adoption,Spayed Female,30.31351154,-97.42748398,55.38184524,*Duchess,,
2416.0,6 years,A619107,Dog,German Shepherd Mix,Red/White,2011-01-25,5/2/2017 17:45,2017-05-02T17:45:00,,Return to Owner,Neutered Male,30.56737884,-97.67930173,327.1056548,Braulio,,
2417.0,5 months,A760683,Dog,Anatol Shepherd Mix,Tan/Tan,2017-05-07,10/26/2017 18:53,2017-10-26T18:53:00,,Adoption,Neutered Male,30.50343784,-97.58096144,24.68382937,,,
2418.0,3 years,A674353,Dog,Basenji/Australian Cattle Dog,Yellow,2011-03-11,4/6/2014 12:20,2014-04-06T12:20:00,,Adoption,Spayed Female,30.34366128,-97.69579698,160.359127,Penny,,
2419.0,8 years,A758993,Dog,Toy Fox Terrier Mix,Black/White,2009-09-25,10/1/2017 13:45,2017-10-01T13:45:00,,Adoption,Spayed Female,30.28932493,-97.62313364,418.3675595,Bailey,,
2420.0,3 years,A667090,Dog,Pit Bull Mix,Chocolate/White,2010-05-18,11/19/2013 11:02,2013-11-19T11:02:00,Behavior,Euthanasia,Intact Male,30.31841896,-97.62936352,183.0656746,Rex,,
2421.0,2 years,A640924,Dog,Pit Bull,Brown/White,2011-10-31,7/16/2014 9:10,2014-07-16T09:10:00,Rabies Risk,Euthanasia,Intact Male,30.39638094,-97.58281691,141.3402778,Loco,,
2422.0,12 years,A710817,Dog,Rat Terrier Mix,Tricolor,2003-08-28,9/5/2015 13:33,2015-09-05T13:33:00,,Adoption,Spayed Female,30.35428583,-97.50962816,627.366369,Cricket,,
2423.0,1 year,A697320,Dog,Chihuahua Shorthair Mix,Tan/White,2014-02-21,2/28/2015 18:09,2015-02-28T18:09:00,,Return to Owner,Spayed Female,30.65637153,-97.43145616,53.25089286,Chloe,,
2424.0,2 months,A758686,Cat,Domestic Shorthair Mix,Brown Tabby,2017-07-02,9/28/2017 13:57,2017-09-28T13:57:00,Partner,Transfer,Intact Female,30.47640515,-97.27091689,12.65446429,*Winky,,
2425.0,1 year,A739682,Cat,Domestic Shorthair Mix,Black,2015-12-06,12/10/2016 13:57,2016-12-10T13:57:00,Partner,Transfer,Neutered Male,30.27060476,-97.3293042,52.94017857,Shadow,,
2426.0,1 year,A705183,Dog,Pit Bull Mix,White/Brown,2014-06-14,10/15/2015 12:03,2015-10-15T12:03:00,Foster,Adoption,Neutered Male,30.48169441,-97.27854715,69.7860119,*Kenny,,
2427.0,2 months,A697599,Cat,Domestic Longhair Mix,Torbie,2014-12-25,2/28/2015 0:00,2015-02-28T00:00:00,Partner,Transfer,Intact Female,30.63729842,-97.48891136,9.285714286,*Jasper,,
2428.0,2 years,A720230,Dog,Lhasa Apso Mix,Cream,2014-02-05,2/10/2016 11:19,2016-02-10T11:19:00,Partner,Transfer,Neutered Male,30.47727775,-97.27330349,105.0673611,*Gordon,,
2429.0,7 years,A700095,Dog,Pit Bull Mix,Tan/White,2009-04-08,1/12/2017 17:54,2017-01-12T17:54:00,Partner,Transfer,Neutered Male,30.49416354,-97.28848573,405.2494048,Hercules,,
2430.0,1 month,A747909,Other,Opossum Mix,Gray/Black,2017-02-26,4/26/2017 18:26,2017-04-26T18:26:00,Suffering,Euthanasia,Unknown,30.4593547,-97.52674438,8.538293651,,,
2431.0,5 months,A654375,Dog,Pit Bull Mix,Chocolate/White,2013-05-04,10/21/2013 15:24,2013-10-21T15:24:00,,Return to Owner,Spayed Female,30.53397066,-97.32476106,24.37738095,Pixie,,
2432.0,5 years,A688773,Dog,Shih Tzu Mix,White/Brown,2009-09-23,10/20/2014 11:51,2014-10-20T11:51:00,Partner,Transfer,Neutered Male,30.38814629,-97.59447726,264.7848214,Chubs,,
2433.0,2 years,A760277,Dog,Staffordshire Mix,Blue/White,2015-10-15,11/24/2017 16:56,2017-11-24T16:56:00,,Adoption,Neutered Male,30.7621338,-97.47774263,110.2436508,*Roger,,
2434.0,1 month,A750122,Dog,Labrador Retriever Mix,Black,2017-04-08,5/24/2017 18:36,2017-05-24T18:36:00,Partner,Transfer,Intact Male,30.58144983,-97.62404414,6.682142857,Happy Camper,,
2435.0,2 months,A742065,Dog,Dalmatian Mix,White/Black,2016-11-14,1/18/2017 17:07,2017-01-18T17:07:00,,Adoption,Neutered Male,30.46023873,-97.65312136,9.387599206,,,
2436.0,3 months,A714278,Cat,Domestic Shorthair Mix,Black,2015-09-13,12/15/2015 11:55,2015-12-15T11:55:00,Foster,Adoption,Spayed Female,30.67844437,-97.57964737,13.35664683,Isabella,,
2437.0,10 months,A750363,Cat,Domestic Shorthair Mix,Black,2016-09-26,7/30/2017 15:09,2017-07-30T15:09:00,,Adoption,Neutered Male,30.66635432,-97.73178249,43.94732143,*Joey,,
2438.0,3 weeks,A710580,Cat,Domestic Shorthair Mix,Black Smoke,2015-08-02,8/24/2015 18:58,2015-08-24T18:58:00,Partner,Transfer,Intact Male,30.53584293,-97.26928233,3.255753968,,,
2439.0,1 year,A739878,Dog,American Staffordshire Terrier Mix,Red/White,2015-06-08,12/20/2016 14:38,2016-12-20T14:38:00,,Adoption,Spayed Female,30.29492485,-97.32137299,80.22996032,*Serafina,,
2440.0,1 year,A671749,Cat,Domestic Shorthair Mix,Brown Tabby,2013-01-30,1/31/2014 14:39,2014-01-31T14:39:00,SCRP,Transfer,Intact Female,30.56908333,-97.50922691,52.37291667,,,
2441.0,1 month,A726278,Cat,Domestic Shorthair Mix,Orange Tabby,2016-04-06,5/28/2016 15:53,2016-05-28T15:53:00,Partner,Transfer,Intact Female,30.43945695,-97.44152989,7.523115079,*Sarita,,
2442.0,1 year,A688038,Dog,Norwich Terrier/Yorkshire Terrier,Black/Brown,2013-09-13,9/17/2014 18:54,2014-09-17T18:54:00,,Adoption,Spayed Female,30.28935413,-97.3095004,52.82678571,Daisy,,
2443.0,4 years,A668972,Dog,Mastiff Mix,Black,2009-12-12,12/30/2013 14:40,2013-12-30T14:40:00,Rabies Risk,Euthanasia,Intact Male,30.68000668,-97.45586143,211.3730159,Mufasa,,
2444.0,2 months,A697598,Cat,Domestic Longhair Mix,Tortie,2014-12-25,2/28/2015 15:24,2015-02-28T15:24:00,Partner,Transfer,Intact Female,30.54290549,-97.61810035,9.377380952,*Jinx,,
2445.0,8 years,A725047,Dog,Miniature Schnauzer Mix,Black/Gray,2008-04-25,4/25/2016 17:39,2016-04-25T17:39:00,,Return to Owner,Intact Male,30.69341246,-97.50377246,417.533631,Max,,
2446.0,1 year,A758826,Cat,Domestic Shorthair Mix,Black/White,2016-09-22,10/6/2017 17:44,2017-10-06T17:44:00,,Adoption,Neutered Male,30.49925891,-97.27800834,54.2484127,Panda,,
2447.0,8 years,A681122,Cat,Domestic Shorthair Mix,Black,2006-06-12,6/24/2014 17:02,2014-06-24T17:02:00,,Return to Owner,Spayed Female,30.35401451,-97.70842088,419.244246,Millie,,
2448.0,8 years,A664991,Dog,Chihuahua Shorthair Mix,Black/Tan,2005-10-19,10/20/2013 18:20,2013-10-20T18:20:00,,Adoption,Neutered Male,30.35238646,-97.39745622,417.6805556,*Fritz,,
2449.0,2 years,A713388,Dog,Pit Bull Mix,Black,2013-10-06,10/9/2015 18:18,2015-10-09T18:18:00,,Return to Owner,Neutered Male,30.45244115,-97.37519506,104.8232143,Panther,,
2450.0,1 year,A736992,Bird,Cockatiel Mix,Gray/Yellow,2015-10-20,10/24/2016 13:11,2016-10-24T13:11:00,,Return to Owner,Unknown,30.73885379,-97.74000947,52.93561508,,,
2451.0,11 years,A731209,Dog,Labrador Retriever Mix,Black,2005-07-18,7/20/2016 21:59,2016-07-20T21:59:00,Partner,Transfer,Intact Male,30.67990547,-97.68130927,574.4165675,Midnight,,
2452.0,3 years,A690029,Cat,Domestic Shorthair Mix,Silver Tabby,2011-10-13,10/14/2014 9:00,2014-10-14T09:00:00,SCRP,Transfer,Unknown,30.55114351,-97.45703095,156.7678571,,,
2453.0,2 months,A672184,Dog,Chihuahua Shorthair/Jack Russell Terrier,Tan/White,2013-12-21,2/22/2014 12:03,2014-02-22T12:03:00,Foster,Adoption,Spayed Female,30.50504111,-97.67548429,9.07172619,Luna,,
2454.0,1 year,A742055,Cat,Domestic Shorthair Mix,Blue,2016-01-13,1/22/2017 19:17,2017-01-22T19:17:00,Partner,Transfer,Neutered Male,30.52440536,-97.45175513,53.68621032,,,
2455.0,11 years,A704459,Dog,Norfolk Terrier/Border Terrier,Cream,2004-06-05,6/6/2015 16:26,2015-06-06T16:26:00,,Return to Owner,Spayed Female,30.72188812,-97.37366102,574.0978175,Maui,,
2456.0,7 years,A661868,Cat,Russian Blue Mix,Blue,2006-08-26,11/15/2013 11:18,2013-11-15T11:18:00,Foster,Adoption,Spayed Female,30.37360114,-97.4459325,376.9244048,Purrsimmon,,
2457.0,2 days,A706755,Cat,Domestic Shorthair,Gray Tabby,2015-07-01,7/3/2015 11:04,2015-07-03T11:04:00,Partner,Transfer,Intact Male,30.45710017,-97.46553831,0.351587302,,,
2458.0,1 month,A756114,Dog,Labrador Retriever Mix,Black/White,2017-06-22,8/17/2017 17:09,2017-08-17T17:09:00,In Kennel,Died,Intact Female,30.63452909,-97.56231004,8.102083333,,,
2459.0,3 years,A686776,Dog,Siberian Husky,Black/White,2011-08-26,8/27/2014 18:33,2014-08-27T18:33:00,,Return to Owner,Neutered Male,30.58064473,-97.39787473,156.8247024,Koda,,
2460.0,4 years,A598751,Cat,Domestic Shorthair,Orange Tabby,2011-03-23,4/22/2015 11:55,2015-04-22T11:55:00,,Adoption,Spayed Female,30.60511057,-97.26710969,213.0709325,Ruby,,
2461.0,2 weeks,A726419,Dog,Labrador Retriever Mix,Brown Brindle,2016-04-25,5/10/2016 18:07,2016-05-10T18:07:00,Partner,Transfer,Unknown,30.27673988,-97.69345458,2.250694444,,,
2462.0,2 years,A711310,Dog,Miniature Schnauzer Mix,Gray/White,2013-09-05,9/9/2015 17:59,2015-09-09T17:59:00,,Adoption,Neutered Male,30.70228237,-97.44724301,104.9641865,,,
2463.0,2 months,A697586,Dog,Rottweiler Mix,Tricolor/White,2014-12-10,3/2/2015 17:26,2015-03-02T17:26:00,,Adoption,Spayed Female,30.40134764,-97.48101585,11.81805556,,,
2464.0,11 years,A339103,Dog,Labrador Retriever Mix,Brown/White,2004-01-12,4/21/2015 17:38,2015-04-21T17:38:00,,Return to Owner,Spayed Female,30.32529003,-97.29630996,588.2478175,Ani,,
2465.0,2 months,A747623,Dog,Boxer,Tan/White,2017-03-07,5/17/2017 16:32,2017-05-17T16:32:00,Foster,Adoption,Neutered Male,30.44695171,-97.5101541,10.24126984,,,
2466.0,1 year,A722085,Dog,Pit Bull Mix,Tan/White,2015-03-10,3/27/2016 0:00,2016-03-27T00:00:00,Partner,Transfer,Neutered Male,30.62149628,-97.63253121,54.71428571,*Ty,,
2467.0,6 years,A694261,Cat,Domestic Longhair Mix,Orange Tabby/White,2008-12-23,12/28/2014 14:05,2014-12-28T14:05:00,,Return to Owner,Neutered Male,30.4998117,-97.51745065,313.7981151,Moby,,
2468.0,4 months,A709962,Cat,Domestic Medium Hair Mix,Blue,2015-04-15,8/16/2015 9:00,2015-08-16T09:00:00,SCRP,Transfer,Intact Female,30.36389229,-97.58442814,17.625,,,
2469.0,3 years,A672744,Dog,Rottweiler Mix,Black/Tan,2011-02-17,4/17/2014 17:09,2014-04-17T17:09:00,Aggressive,Euthanasia,Intact Male,30.39526309,-97.35680808,165.1020833,Oso,,
2470.0,2 months,A704947,Cat,Domestic Medium Hair Mix,Black/White,2015-05-11,8/10/2015 13:10,2015-08-10T13:10:00,,Adoption,Neutered Male,30.71474402,-97.38357979,13.07837302,*Pete,,
2471.0,10 months,A668030,Dog,Border Terrier Mix,Brown Brindle,2013-01-26,12/1/2013 11:03,2013-12-01T11:03:00,Partner,Transfer,Intact Female,30.71174394,-97.53958483,44.20863095,*Kitty,,
2472.0,8 years,A676213,Cat,Domestic Shorthair Mix,Calico,2006-04-06,4/11/2014 16:00,2014-04-11T16:00:00,Partner,Transfer,Spayed Female,30.33799989,-97.4973745,418.2380952,Buddy Buddy,,
2473.0,3 months,A733199,Cat,Domestic Shorthair Mix,Torbie,2016-05-18,8/18/2016 17:28,2016-08-18T17:28:00,Suffering,Euthanasia,Unknown,30.65960965,-97.48190062,13.2468254,,,
2474.0,3 months,A741111,Cat,Domestic Shorthair Mix,Brown Tabby,2016-11-13,2/18/2017 12:18,2017-02-18T12:18:00,Foster,Adoption,Spayed Female,30.33012221,-97.45996293,13.93035714,*Bunny,,
2475.0,4 years,A755098,Dog,Labrador Retriever Mix,Black/White,2013-07-29,8/22/2017 8:06,2017-08-22T08:06:00,Foster,Adoption,Neutered Male,30.56280123,-97.36789683,212.1910714,Berkley,,
2476.0,2 years,A719218,Cat,Domestic Shorthair Mix,Brown Tabby/White,2014-01-15,1/20/2016 18:58,2016-01-20T18:58:00,SCRP,Transfer,Neutered Male,30.46066931,-97.38135841,105.1128968,,,
2477.0,2 years,A696264,Dog,Pit Bull Mix,Chocolate/White,2013-02-01,2/8/2015 17:26,2015-02-08T17:26:00,Aggressive,Euthanasia,Neutered Male,30.30089811,-97.34124567,105.3894841,Chocolate,,
2478.0,4 months,A763168,Cat,Domestic Shorthair Mix,Blue,2017-07-27,12/21/2017 13:26,2017-12-21T13:26:00,Partner,Transfer,Spayed Female,30.30659159,-97.56446633,21.07996032,*Jackie,,
2479.0,1 year,A684615,Dog,Chihuahua Shorthair Mix,Tan,2013-07-26,8/21/2014 14:20,2014-08-21T14:20:00,Partner,Transfer,Neutered Male,30.76175448,-97.48751091,55.94246032,*Goose,,
2480.0,3 years,A764623,Dog,Labrador Retriever Mix,Tan/White,2015-01-02,1/9/2018 17:12,2018-01-09T17:12:00,,Return to Owner,Neutered Male,30.45029008,-97.43389146,157.6738095,Scooby,,
2481.0,2 months,A754830,Cat,Domestic Shorthair Mix,Black/White,2017-05-31,8/3/2017 11:43,2017-08-03T11:43:00,Partner,Transfer,Intact Male,30.44280964,-97.66723961,9.212599206,*Waylon,,
2482.0,1 year,A693286,Other,Raccoon Mix,Gray/Black,2013-12-05,12/5/2014 11:49,2014-12-05T11:49:00,Rabies Risk,Euthanasia,Unknown,30.72130765,-97.57657864,52.21319444,,,
2483.0,3 years,A693451,Other,Opossum Mix,White/Gray,2011-12-08,12/8/2014 12:40,2014-12-08T12:40:00,Suffering,Euthanasia,Unknown,30.34617386,-97.52931827,156.6468254,,,
2484.0,1 year,A732145,Cat,Domestic Shorthair Mix,Black/White,2015-08-03,8/4/2016 9:00,2016-08-04T09:00:00,SCRP,Transfer,Spayed Female,30.65054129,-97.34248066,52.48214286,,,
2485.0,3 weeks,A694452,Cat,Domestic Shorthair Mix,Brown Tabby,2014-12-07,12/29/2014 10:55,2014-12-29T10:55:00,Partner,Transfer,Intact Female,30.40778145,-97.71920091,3.207837302,,,
2486.0,1 year,A756610,Other,Guinea Pig,Brown,2016-08-23,8/24/2017 13:30,2017-08-24T13:30:00,Partner,Transfer,Unknown,30.44532703,-97.31015881,52.36607143,,,
2487.0,1 year,A724704,Dog,Pit Bull Mix,Brown Brindle/White,2015-04-20,10/7/2016 13:16,2016-10-07T13:16:00,,Adoption,Spayed Female,30.5694276,-97.48153156,76.65039683,*Audrey,,
2488.0,8 years,A736104,Dog,Pomeranian Mix,Tricolor,2008-10-04,10/24/2016 0:00,2016-10-24T00:00:00,Partner,Transfer,Neutered Male,30.40006599,-97.43364635,420.2857143,Boog,,
2489.0,5 years,A689062,Dog,Pit Bull/Chinese Sharpei,Brown Brindle/White,2009-09-28,10/19/2014 9:42,2014-10-19T09:42:00,Aggressive,Euthanasia,Intact Female,30.58112041,-97.41130235,263.914881,Lita,,
2490.0,1 year,A665861,Dog,Australian Shepherd Mix,White/Red,2012-10-23,10/28/2013 17:59,2013-10-28T17:59:00,,Adoption,Spayed Female,30.26910435,-97.52653305,52.96418651,Mistic,,
2491.0,1 year,A739220,Dog,Labrador Retriever/Queensland Heeler,White/Brown,2015-11-29,1/14/2017 13:04,2017-01-14T13:04:00,,Adoption,Spayed Female,30.51087533,-97.40527209,58.93492063,Polly,,
2492.0,8 years,A707825,Cat,Domestic Shorthair Mix,Brown Tabby,2007-07-18,8/2/2015 13:06,2015-08-02T13:06:00,,Adoption,Neutered Male,30.40134029,-97.37769208,419.6494048,Rocco,,
2493.0,2 months,A720443,Dog,Pointer Mix,Black/White,2015-12-09,2/13/2016 18:27,2016-02-13T18:27:00,,Adoption,Neutered Male,30.36500617,-97.71433826,9.538392857,*Sleepy,,
2494.0,1 year,A735273,Dog,Pit Bull Mix,Blue/White,2015-09-21,11/5/2016 13:10,2016-11-05T13:10:00,,Adoption,Neutered Male,30.76339929,-97.25804446,58.79265873,*Butler,,
2495.0,2 weeks,A684564,Cat,Domestic Shorthair Mix,Black,2014-07-10,7/25/2014 16:22,2014-07-25T16:22:00,Partner,Transfer,Intact Male,30.42212884,-97.73476586,2.240277778,,,
2496.0,1 weeks,A713631,Cat,Domestic Shorthair Mix,Blue Tabby,2015-09-26,10/9/2015 19:12,2015-10-09T19:12:00,Partner,Transfer,Unknown,30.31057298,-97.60015439,1.971428571,,,
2497.0,2 years,A734645,Dog,Border Collie/Catahoula,Black/White,2014-09-10,9/17/2016 18:18,2016-09-17T18:18:00,,Adoption,Spayed Female,30.50649707,-97.73322176,105.5375,Maya,,
2498.0,4 years,A755783,Dog,German Shepherd Mix,Black/Tan,2013-08-08,8/13/2017 17:44,2017-08-13T17:44:00,,Adoption,Neutered Male,30.60602257,-97.47156315,209.534127,*Nelson,,
2499.0,11 years,A348272,Dog,Labrador Retriever/Chow Chow,Brown/Black,2003-08-14,7/24/2015 18:19,2015-07-24T18:19:00,,Adoption,Spayed Female,30.59082879,-97.47808505,623.2518849,Brandy,,
2500.0,10 years,A654970,Dog,Pointer Mix,White/Brown,2006-05-27,7/12/2016 9:38,2016-07-12T09:38:00,Foster,Adoption,Spayed Female,30.34602607,-97.5944117,528.4859127,*Zena,,
2501.0,1 year,A739993,Dog,Yorkshire Terrier Mix,Tan/Black,2015-12-10,12/11/2016 18:21,2016-12-11T18:21:00,,Return to Owner,Intact Male,30.41177886,-97.25633183,52.53779762,Puppet,,
2502.0,6 months,A752170,Other,Raccoon,Brown/Black,2016-12-19,6/20/2017 10:41,2017-06-20T10:41:00,Rabies Risk,Euthanasia,Unknown,30.54517597,-97.4386775,26.20644841,,,
2503.0,2 months,A724582,Cat,Domestic Shorthair Mix,Orange Tabby,2016-02-23,5/21/2016 14:38,2016-05-21T14:38:00,Foster,Adoption,Spayed Female,30.66676629,-97.31667033,12.65853175,*Honey,,
2504.0,2 years,A757240,Cat,Domestic Shorthair Mix,Orange Tabby,2015-08-31,9/12/2017 12:25,2017-09-12T12:25:00,,Adoption,Neutered Male,30.61035547,-97.69632388,106.2167659,Sam,,
2505.0,1 year,A743525,Dog,Pointer Mix,Chocolate/White,2016-02-12,2/19/2017 18:30,2017-02-19T18:30:00,,Adoption,Spayed Female,30.73830368,-97.42795626,53.39583333,*Symphony,,
2506.0,5 years,A739594,Cat,Domestic Shorthair,Blue,2011-12-05,12/10/2016 13:59,2016-12-10T13:59:00,Partner,Transfer,Neutered Male,30.27476667,-97.41898433,261.7975198,*Cecil,,
2507.0,2 months,A751113,Dog,Bulldog Mix,White/Brown,2017-03-13,6/4/2017 15:47,2017-06-04T15:47:00,,Return to Owner,Intact Male,30.47913804,-97.3400956,11.95109127,Yogi,,
2508.0,4 years,A667458,Dog,Pit Bull Mix,Brown Brindle/White,2013-01-18,7/23/2017 18:50,2017-07-23T18:50:00,,Return to Owner,Neutered Male,30.74414033,-97.72980727,235.3978175,Chino,,
2509.0,3 months,A722610,Cat,Domestic Shorthair Mix,Black Tabby,2015-12-19,3/25/2016 15:55,2016-03-25T15:55:00,,Adoption,Neutered Male,30.35613849,-97.28148083,13.95188492,Sparrow,,
2510.0,1 year,A718642,Dog,Great Pyrenees Mix,White,2015-01-04,1/5/2016 17:21,2016-01-05T17:21:00,,Return to Owner,Intact Female,30.61424972,-97.34769066,52.3889881,Sugar Bear,,
2511.0,1 year,A710866,Dog,German Shepherd Mix,Sable/Tan,2014-09-08,9/12/2015 17:06,2015-09-12T17:06:00,,Adoption,Neutered Male,30.32995497,-97.64445615,52.81607143,*Kenzo,,
2512.0,7 months,A692491,Dog,Black Mouth Cur Mix,Brown/Black,2014-04-21,11/30/2014 18:20,2014-11-30T18:20:00,,Adoption,Spayed Female,30.41802763,-97.51371274,31.96626984,Bailey,,
2513.0,2 months,A761277,Cat,Domestic Shorthair Mix,Black/White,2017-10-02,12/20/2017 18:32,2017-12-20T18:32:00,,Adoption,Neutered Male,30.39520944,-97.45705738,11.39603175,,,
2514.0,1 week,A757797,Cat,Domestic Shorthair Mix,Calico,2017-08-30,9/6/2017 14:00,2017-09-06T14:00:00,Partner,Transfer,Intact Female,30.46238689,-97.69698551,1.083333333,,,
2515.0,2 weeks,A707729,Cat,Domestic Shorthair Mix,Brown Tabby/White,2015-06-27,7/16/2015 18:39,2015-07-16T18:39:00,Partner,Transfer,Intact Male,30.43542105,-97.60460035,2.825297619,,,
2516.0,4 months,A667329,Cat,Domestic Shorthair Mix,Orange Tabby/White,2013-07-01,11/21/2013 13:34,2013-11-21T13:34:00,,Adoption,Neutered Male,30.28960735,-97.7097331,20.5093254,Tres,,
2517.0,8 months,A752364,Dog,Pit Bull Mix,Blue/White,2016-10-21,6/27/2017 18:02,2017-06-27T18:02:00,,Adoption,Spayed Female,30.40419413,-97.61639092,35.67876984,Lady,,
2518.0,3 months,A703585,Cat,Balinese Mix,Lynx Point,2015-04-27,8/4/2015 14:15,2015-08-04T14:15:00,Foster,Adoption,Spayed Female,30.42878315,-97.38689,14.22767857,*Willow,,
2519.0,1 year,A724884,Dog,Cardigan Welsh Corgi Mix,Red/White,2015-04-22,5/1/2016 17:27,2016-05-01T17:27:00,,Adoption,Neutered Male,30.43300208,-97.46833238,53.67529762,*Mason,,
2520.0,1 year,A727992,Dog,Plott Hound Mix,Brown Brindle/Brown,2015-05-29,9/4/2016 16:21,2016-09-04T16:21:00,Partner,Transfer,Neutered Male,30.41289364,-97.29169892,66.38303571,*Gage,,
2521.0,3 years,A675159,Dog,Labrador Retriever Mix,Brown,2011-03-24,3/24/2014 14:41,2014-03-24T14:41:00,Suffering,Euthanasia,Intact Female,30.36672356,-97.39586747,156.6588294,Barbie,,
2522.0,11 years,A759174,Cat,Domestic Shorthair Mix,Cream/White,2006-02-28,9/29/2017 12:39,2017-09-29T12:39:00,,Return to Owner,Unknown,30.71700668,-97.48972931,604.503869,,,
2523.0,10 months,A714859,Dog,Chihuahua Shorthair Mix,Black/White,2014-12-29,11/1/2015 18:04,2015-11-01T18:04:00,,Return to Owner,Neutered Male,30.73820625,-97.51719201,43.96468254,Junior,,
2524.0,10 months,A720200,Cat,Domestic Shorthair Mix,Black/White,2015-04-04,2/7/2016 12:22,2016-02-07T12:22:00,,Adoption,Spayed Female,30.72247128,-97.4696605,44.21646825,Boots,,
2525.0,8 years,A725691,Dog,Labrador Retriever/Pit Bull,Black/White,2008-05-01,8/31/2016 11:10,2016-08-31T11:10:00,Foster,Adoption,Spayed Female,30.53012866,-97.65563409,434.9236111,Bonnie,,
2526.0,2 years,A679111,Dog,Chihuahua Shorthair Mix,Brown/White,2012-05-16,5/21/2014 18:05,2014-05-21T18:05:00,,Adoption,Spayed Female,30.5097771,-97.40948012,105.1076389,,,
2527.0,2 years,A684344,Cat,Domestic Shorthair Mix,Black/White,2014-06-22,3/5/2017 12:01,2017-03-05T12:01:00,,Return to Owner,Spayed Female,30.52095505,-97.7034485,141.0715278,Babyprincess,,
2528.0,2 weeks,A704583,Cat,Domestic Shorthair Mix,Black,2015-05-22,6/6/2015 16:20,2015-06-06T16:20:00,Partner,Transfer,Unknown,30.44189982,-97.58952578,2.240079365,,,
2529.0,2 years,A763975,Dog,Landseer Mix,Black/Gray,2015-12-19,12/31/2017 15:20,2017-12-31T15:20:00,,Adoption,Neutered Male,30.48316168,-97.68119565,106.234127,*Domino,,
2530.0,1 day,A728067,Cat,Domestic Shorthair Mix,Blue,2016-05-29,5/30/2016 19:25,2016-05-30T19:25:00,Partner,Transfer,Unknown,30.29447475,-97.67387029,0.25843254,,,
2531.0,9 years,A721822,Dog,Great Dane Mix,Tan/White,2007-03-05,3/5/2016 12:17,2016-03-05T12:17:00,,Return to Owner,Neutered Male,30.75762727,-97.71413233,469.7874008,Khronos,,
2532.0,2 weeks,A753866,Cat,Domestic Medium Hair Mix,Black Smoke,2017-06-27,7/12/2017 14:14,2017-07-12T14:14:00,Partner,Transfer,Intact Female,30.43886961,-97.41595418,2.227579365,,,
2533.0,6 years,A685249,Dog,Catahoula/Labrador Retriever,Red,2008-08-04,8/4/2014 18:20,2014-08-04T18:20:00,Suffering,Euthanasia,Neutered Male,30.66806426,-97.64183272,313.109127,Booger,,
2534.0,2 months,A741994,Dog,Pit Bull Mix,White/Brown,2016-11-12,1/13/2017 18:08,2017-01-13T18:08:00,,Adoption,Spayed Female,30.49967975,-97.69048135,8.965079365,Soliel Amun,,
2535.0,2 months,A684030,Cat,Domestic Medium Hair Mix,Orange Tabby,2014-06-11,8/30/2014 16:15,2014-08-30T16:15:00,Foster,Adoption,Neutered Male,30.6575542,-97.51608426,11.52529762,*Hugo,,
2536.0,4 weeks,A724807,Dog,Australian Cattle Dog Mix,Brown,2016-04-22,5/21/2016 19:12,2016-05-21T19:12:00,Partner,Transfer,Unknown,30.70359699,-97.62261423,4.257142857,,,
2537.0,1 year,A700018,Dog,Cairn Terrier Mix,Silver/Chocolate,2013-10-06,4/10/2015 18:09,2015-04-10T18:09:00,,Adoption,Spayed Female,30.36096692,-97.28230043,78.82232143,Avery Mae,,
2538.0,2 years,A715176,Dog,Staffordshire Mix,Blue/White,2013-11-01,12/5/2015 17:54,2015-12-05T17:54:00,,Adoption,Spayed Female,30.46519214,-97.37079672,109.2494048,Zila,,
2539.0,1 year,A753332,Dog,Belgian Malinois Mix,Brown/Black,2016-07-05,7/5/2017 16:25,2017-07-05T16:25:00,,Return to Owner,Intact Male,30.63692534,-97.70023212,52.2405754,Vader,,
2540.0,5 months,A728134,Dog,Bull Terrier Miniature Mix,White/Brown,2015-12-31,6/4/2016 18:18,2016-06-04T18:18:00,,Adoption,Spayed Female,30.39454487,-97.50172539,22.39464286,*Maxine,,
2541.0,1 year,A716119,Cat,Domestic Shorthair Mix,Black,2014-11-14,11/18/2015 19:28,2015-11-18T19:28:00,SCRP,Transfer,Intact Male,30.37908975,-97.3400975,52.83015873,,,
2542.0,1 year,A760491,Other,Squirrel Mix,White,2016-10-18,10/18/2017 18:11,2017-10-18T18:11:00,Suffering,Euthanasia,Unknown,30.47127387,-97.45172358,52.25109127,,,
2543.0,3 years,A687670,Cat,Domestic Shorthair Mix,Orange Tabby,2011-09-08,9/11/2014 17:23,2014-09-11T17:23:00,,Adoption,Neutered Male,30.60255061,-97.62881612,157.1034722,Prince,,
2544.0,2 years,A670993,Cat,Domestic Shorthair Mix,Orange Tabby,2012-01-17,1/21/2014 15:16,2014-01-21T15:16:00,SCRP,Transfer,Intact Male,30.59747185,-97.27457061,105.090873,,,
2545.0,2 months,A680039,Cat,Domestic Longhair Mix,Blue/White,2014-03-07,6/2/2014 16:31,2014-06-02T16:31:00,,Adoption,Spayed Female,30.35588627,-97.59468579,12.52688492,*Molly,,
2546.0,15 years,A467567,Dog,Queensland Heeler Mix,Blue Merle,2002-04-09,11/6/2017 18:41,2017-11-06T18:41:00,,Return to Owner,Spayed Female,30.28819013,-97.32520654,812.9683532,Silky,,
2547.0,2 years,A654090,Cat,Domestic Shorthair Mix,Orange Tabby/White,2011-05-15,12/29/2013 12:28,2013-12-29T12:28:00,Partner,Transfer,Spayed Female,30.45986833,-97.28286111,137.0742063,Mamma Mia,,
2548.0,10 years,A683098,Cat,Domestic Shorthair Mix,Brown Tabby/White,2004-07-07,8/4/2014 14:34,2014-08-04T14:34:00,Partner,Transfer,Neutered Male,30.43199076,-97.29595348,525.8009921,*Plato,,
2549.0,1 year,A740435,Dog,Yorkshire Terrier Mix,Black/Brown,2015-12-17,12/21/2016 18:33,2016-12-21T18:33:00,,Adoption,Neutered Male,30.54612158,-97.65584058,52.96755952,,,
2550.0,4 years,A672075,Cat,Domestic Longhair Mix,Black/White,2010-02-03,2/3/2014 15:42,2014-02-03T15:42:00,Suffering,Euthanasia,Intact Male,30.51288158,-97.69528152,208.8077381,,,
2551.0,5 years,A762863,Dog,Australian Cattle Dog Mix,Black/Brown,2012-11-28,12/4/2017 12:41,2017-12-04T12:41:00,,Adoption,Neutered Male,30.39171444,-97.42344785,261.7897817,*Murphy,,
2552.0,1 year,A683685,Other,Dutch/Rabbit Sh,Brown/White,2013-07-13,7/16/2014 16:11,2014-07-16T16:11:00,Partner,Transfer,Intact Female,30.6740403,-97.68214053,52.66775794,,,
2553.0,1 year,A727106,Cat,Domestic Shorthair Mix,Blue Tabby,2015-05-18,5/22/2016 18:18,2016-05-22T18:18:00,SCRP,Transfer,Spayed Female,30.64020251,-97.64616115,52.96607143,,,
2554.0,2 months,A680129,Cat,Siamese Mix,Flame Point,2014-04-15,7/3/2014 17:40,2014-07-03T17:40:00,Foster,Adoption,Neutered Male,30.47042748,-97.27141227,11.39087302,*Hugh,,
2555.0,3 weeks,A713898,Cat,Domestic Shorthair Mix,Tortie,2015-09-22,10/15/2015 12:30,2015-10-15T12:30:00,Partner,Transfer,Intact Female,30.51519222,-97.52847935,3.360119048,,,
2556.0,1 year,A732294,Cat,Domestic Shorthair Mix,Brown Tabby,2015-08-26,8/26/2016 14:57,2016-08-26T14:57:00,Partner,Transfer,Intact Male,30.30927529,-97.37528913,52.37470238,,,
2557.0,2 weeks,A690062,Cat,Domestic Shorthair Mix,Black/White,2014-09-28,10/13/2014 17:46,2014-10-13T17:46:00,Partner,Transfer,Intact Male,30.62791974,-97.50408801,2.248611111,,,
2558.0,2 years,A670273,Dog,Labrador Retriever/Chesa Bay Retr,Brown/White,2011-11-01,3/21/2014 11:49,2014-03-21T11:49:00,Partner,Transfer,Spayed Female,30.4589879,-97.35485209,124.4989087,*Annie,,
2559.0,6 years,A694602,Dog,Chihuahua Shorthair Mix,Black/Tricolor,2008-12-31,1/6/2015 15:10,2015-01-06T15:10:00,,Adoption,Spayed Female,30.42586393,-97.53763919,313.9474206,*Jasmine,,
2560.0,1 year,A741475,Other,Bat Mix,Brown,2016-01-02,1/2/2017 18:57,2017-01-02T18:57:00,Rabies Risk,Euthanasia,Unknown,30.50063608,-97.32210605,52.3985119,,,
2561.0,2 years,A753399,Dog,Chihuahua Shorthair Mix,Tan/White,2015-07-05,7/13/2017 11:50,2017-07-13T11:50:00,Partner,Transfer,Intact Male,30.41778556,-97.24661801,105.6418651,*Cthulhu,,
2562.0,8 years,A678042,Dog,German Shepherd Mix,Black/Brown,2006-05-03,5/4/2014 18:23,2014-05-04T18:23:00,,Return to Owner,Spayed Female,30.41169186,-97.72734486,417.6808532,Sadie,,
2563.0,8 years,A743071,Dog,Pit Bull Mix,Red/White,2009-02-03,2/3/2017 15:01,2017-02-03T15:01:00,,Return to Owner,Intact Male,30.61770917,-97.54008705,417.5179563,Scrappy,,
2564.0,1 month,A680346,Cat,Domestic Shorthair Mix,Orange Tabby,2014-04-27,6/5/2014 14:55,2014-06-05T14:55:00,Partner,Transfer,Intact Male,30.31921975,-97.34578494,5.660218254,*Sam,,
2565.0,1 week,A708271,Cat,Domestic Shorthair Mix,Gray Tabby,2015-07-18,7/25/2015 16:29,2015-07-25T16:29:00,Partner,Transfer,Unknown,30.3779864,-97.72222086,1.098115079,,,
2566.0,4 months,A742175,Cat,Domestic Shorthair Mix,Blue/White,2016-09-16,1/17/2017 11:22,2017-01-17T11:22:00,,Return to Owner,Neutered Male,30.44883978,-97.37781144,17.6390873,Blaze,,
2567.0,9 years,A677267,Dog,German Shepherd Mix,Brown,2005-04-22,5/3/2014 12:22,2014-05-03T12:22:00,,Return to Owner,Spayed Female,30.70371584,-97.41632341,471.2164683,Dinky,,
2568.0,4 weeks,A730346,Cat,Domestic Shorthair Mix,Black Tabby,2016-06-02,7/2/2016 16:34,2016-07-02T16:34:00,Suffering,Euthanasia,Intact Male,30.61019588,-97.27152708,4.384325397,,,
2569.0,3 years,A688011,Cat,Domestic Shorthair Mix,Blue Tabby,2011-09-13,11/5/2014 15:47,2014-11-05T15:47:00,,Return to Owner,Neutered Male,30.67389435,-97.73551399,164.2368056,Cuddles,,
2570.0,2 years,A753390,Dog,Chihuahua Longhair/Dachshund Wirehair,Black,2015-07-05,7/18/2017 16:59,2017-07-18T16:59:00,,Return to Owner,Intact Male,30.27591016,-97.43249869,106.3868056,L.D.,,
2571.0,2 years,A667273,Cat,Russian Blue Mix,Blue,2011-11-15,11/20/2013 19:11,2013-11-20T19:11:00,SCRP,Transfer,Intact Male,30.76164362,-97.60532415,105.2570437,*Jonathon,,
2572.0,6 years,A644452,Dog,Pit Bull Mix,Brown Brindle/White,2010-12-27,2/12/2017 12:56,2017-02-12T12:56:00,,Adoption,Neutered Male,30.44695331,-97.42424408,319.934127,Acho,,
2573.0,2 weeks,A705077,Cat,Domestic Shorthair Mix,Tortie,2015-05-28,6/17/2015 12:35,2015-06-17T12:35:00,Partner,Transfer,Intact Female,30.48209224,-97.57594273,2.932043651,,,
2574.0,2 months,A689944,Cat,Domestic Shorthair Mix,Black,2014-07-27,10/19/2014 13:01,2014-10-19T13:01:00,,Adoption,Spayed Female,30.40229392,-97.32853903,12.07748016,*Zeppelin,,
2575.0,19 years,A765321,Cat,Domestic Shorthair Mix,Brown Tabby/White,1998-03-17,1/17/2018 18:45,2018-01-17T18:45:00,,Return to Owner,Neutered Male,30.69089298,-97.59231549,1035.254464,Tyler,,
2576.0,3 years,A761384,Dog,Australian Kelpie Mix,Red,2014-11-03,11/4/2017 13:20,2017-11-04T13:20:00,,Return to Owner,Neutered Male,30.719069,-97.6843946,156.7936508,Clyde,,
2577.0,10 years,A699197,Dog,Labrador Retriever Mix,Tan/White,2005-09-10,1/18/2016 19:37,2016-01-18T19:37:00,,Adoption,Spayed Female,30.52430437,-97.66879059,540.4024802,Honey,,
2578.0,2 years,A690266,Dog,Doberman Pinsch Mix,Black/Tan,2012-10-17,10/23/2014 17:58,2014-10-23T17:58:00,,Return to Owner,Neutered Male,30.45222495,-97.64633075,105.2498016,Jasper,,
2579.0,2 months,A730202,Cat,Domestic Shorthair Mix,Cream Tabby/White,2016-04-23,7/19/2016 17:08,2016-07-19T17:08:00,,Adoption,Neutered Male,30.45442021,-97.59591497,12.53055556,,,
2580.0,2 months,A699709,Dog,Akita Mix,Black/White,2015-01-17,4/5/2015 16:42,2015-04-05T16:42:00,,Adoption,Spayed Female,30.71364619,-97.49530173,11.2422619,,,
2581.0,10 months,A705423,Dog,German Shepherd/Labrador Retriever,Black/White,2015-02-11,12/19/2015 10:05,2015-12-19T10:05:00,Foster,Adoption,Neutered Male,30.32906375,-97.39132288,44.48859127,*Bronco,,
2582.0,12 years,A736988,Dog,Chihuahua Shorthair Mix,Tan/White,2004-10-20,3/18/2017 16:17,2017-03-18T16:17:00,Foster,Adoption,Neutered Male,30.51563789,-97.37211427,647.525496,Cesar,,
2583.0,14 years,A678971,Cat,Domestic Shorthair Mix,Brown Tabby,2000-05-14,5/17/2014 11:43,2014-05-17T11:43:00,Partner,Transfer,Spayed Female,30.58890628,-97.39849523,730.9268849,Squeaky,,
2584.0,1 month,A688091,Cat,Domestic Shorthair Mix,Black,2014-08-14,9/19/2014 14:36,2014-09-19T14:36:00,Partner,Transfer,Intact Female,30.33302823,-97.53151467,5.229761905,,,
2585.0,6 months,A752879,Other,Bat,Brown,2016-12-28,6/29/2017 8:55,2017-06-29T08:55:00,Rabies Risk,Euthanasia,Unknown,30.50853195,-97.58987212,26.19593254,,,
2586.0,2 months,A685157,Dog,Labrador Retriever/Pit Bull,Black/White,2014-06-15,8/29/2014 11:43,2014-08-29T11:43:00,Foster,Adoption,Spayed Female,30.72061673,-97.3063387,10.78402778,Sombra,,
2587.0,2 years,A706515,Dog,Chihuahua Shorthair Mix,Tan/White,2013-06-30,7/9/2015 20:25,2015-07-09T20:25:00,,Adoption,Neutered Male,30.69153829,-97.53621216,105.6929563,Bean,,
2588.0,1 month,A682559,Cat,Snowshoe Mix,Blue Point,2014-05-22,6/30/2014 10:46,2014-06-30T10:46:00,Partner,Transfer,Intact Male,30.66935137,-97.2945729,5.635515873,,,
2589.0,1 week,A746552,Cat,Domestic Shorthair Mix,Brown Tabby,2017-03-28,4/4/2017 17:16,2017-04-04T17:16:00,Partner,Transfer,Intact Female,30.4474706,-97.65815083,1.102777778,,,
2590.0,7 years,A707496,Dog,Pit Bull Mix,Fawn/White,2008-07-14,7/23/2015 16:46,2015-07-23T16:46:00,Partner,Transfer,Neutered Male,30.3462833,-97.40469512,366.528373,Balu,,
2591.0,1 month,A686395,Dog,Pointer Mix,White/Black,2014-06-29,8/21/2014 15:36,2014-08-21T15:36:00,Partner,Transfer,Intact Female,30.73345337,-97.43335873,7.664285714,,,
2592.0,1 year,A671631,Cat,Domestic Longhair Mix,White/Brown Tabby,2013-01-28,1/29/2014 15:32,2014-01-29T15:32:00,SCRP,Transfer,Unknown,30.30749968,-97.44855806,52.3781746,,,
2593.0,6 years,A733591,Dog,Pit Bull Mix,White/Brown,2010-08-24,9/1/2016 17:52,2016-09-01T17:52:00,Aggressive,Euthanasia,Spayed Female,30.64059767,-97.66254748,314.3920635,Jordan,,
2594.0,1 year,A672383,Dog,Pit Bull/Chinese Sharpei,White/Blue Cream,2012-08-09,2/15/2014 11:43,2014-02-15T11:43:00,Aggressive,Euthanasia,Intact Male,30.28111598,-97.45631435,79.35545635,Yayo,,
2595.0,2 years,A706131,Dog,Staffordshire Mix,Blue/White,2013-06-25,7/1/2015 17:00,2015-07-01T17:00:00,,Adoption,Neutered Male,30.48467535,-97.26745798,105.2440476,*West,,
2596.0,11 years,A517675,Dog,Australian Cattle Dog,White/Black,2004-07-29,9/20/2015 13:08,2015-09-20T13:08:00,,Adoption,Spayed Female,30.37504481,-97.4914134,581.506746,Blanca,,
2597.0,5 years,A699758,Dog,Labrador Retriever/Flat Coat Retriever,Brown Brindle,2010-04-02,4/7/2015 11:03,2015-04-07T11:03:00,Partner,Transfer,Neutered Male,30.37401483,-97.7099005,261.6372024,*River,,
2598.0,7 months,A721892,Cat,Domestic Shorthair Mix,Black,2015-08-06,3/21/2016 14:13,2016-03-21T14:13:00,Partner,Transfer,Neutered Male,30.29716248,-97.52760573,32.65605159,Fin,,
2599.0,1 year,A682590,Dog,Mastiff/Boxer,Tan/White,2014-01-30,12/16/2015 17:40,2015-12-16T17:40:00,,Adoption,Neutered Male,30.31148166,-97.29526679,97.96230159,Rex,,
2600.0,2 years,A750912,Dog,Leonberger Mix,Tricolor,2015-06-02,6/10/2017 13:36,2017-06-10T13:36:00,,Adoption,Neutered Male,30.28437596,-97.28150378,105.652381,Rocky,,
2601.0,1 year,A745159,Other,Bat,Brown,2016-03-13,3/13/2017 17:17,2017-03-13T17:17:00,Rabies Risk,Euthanasia,Unknown,30.37390915,-97.30818173,52.24573413,,,
2602.0,7 years,A705411,Dog,Weimaraner,Blue,2008-06-17,6/25/2015 11:13,2015-06-25T11:13:00,Partner,Transfer,Neutered Male,30.74254295,-97.30963605,366.3524802,*Shadow,,
2603.0,2 years,A631529,Dog,Chihuahua Shorthair/Parson Russell Terrier,White,2012-03-05,5/12/2014 12:03,2014-05-12T12:03:00,,Return to Owner,Spayed Female,30.35225101,-97.4542461,114.0717262,Lala,,
2604.0,3 years,A760747,Dog,Great Pyrenees Mix,White,2014-10-23,10/28/2017 17:57,2017-10-28T17:57:00,,Adoption,Spayed Female,30.35603875,-97.41421156,157.3925595,Emma,,
2605.0,5 months,A755677,Other,Bat,Brown,2017-02-07,8/7/2017 13:54,2017-08-07T13:54:00,Rabies Risk,Euthanasia,Unknown,30.60663785,-97.66002738,25.93988095,,,
2606.0,2 months,A688705,Cat,Domestic Shorthair Mix,White/Black,2014-07-07,10/4/2014 18:02,2014-10-04T18:02:00,,Adoption,Spayed Female,30.31499185,-97.66657785,12.82162698,Junie,,
2607.0,1 year,A703054,Cat,Domestic Shorthair Mix,Flame Point,2014-05-20,5/26/2015 12:20,2015-05-26T12:20:00,Partner,Transfer,Spayed Female,30.64284504,-97.61602187,53.0734127,*Sophie,,
2608.0,12 years,A666137,Dog,Harrier Mix,Tricolor,2001-10-27,11/15/2013 17:50,2013-11-15T17:50:00,,Adoption,Spayed Female,30.6887018,-97.63023821,628.9632937,Rue,,
2609.0,3 years,A605337,Dog,Pit Bull Mix,Brown/White,2010-09-06,8/18/2014 15:25,2014-08-18T15:25:00,,Adoption,Spayed Female,30.50367549,-97.33982155,206.0917659,Ruby,,
2610.0,3 years,A698514,Dog,German Shepherd Mix,Black/Brown,2013-03-13,8/25/2016 19:07,2016-08-25T19:07:00,,Return to Owner,Neutered Male,30.58800278,-97.64944693,180.2566468,Ragnar,,
2611.0,2 years,A666669,Dog,Cardigan Welsh Corgi Mix,Brown/White,2011-11-05,11/6/2013 17:09,2013-11-06T17:09:00,,Return to Owner,Neutered Male,30.57584052,-97.26493701,104.6735119,Tuna,,
2612.0,1 year,A666927,Other,Raccoon Mix,Gray/Black,2012-11-09,11/9/2013 15:18,2013-11-09T15:18:00,Rabies Risk,Euthanasia,Unknown,30.6303109,-97.58005109,52.23392857,,,
2613.0,2 years,A728728,Dog,Airedale Terrier Mix,Black/White,2014-06-07,6/9/2016 12:29,2016-06-09T12:29:00,,Return to Owner,Spayed Female,30.70691174,-97.32853397,104.7885913,Chloe,,
2614.0,2 months,A758482,Cat,Domestic Medium Hair Mix,White/Brown Tabby,2017-07-14,9/29/2017 16:08,2017-09-29T16:08:00,,Adoption,Neutered Male,30.27477785,-97.54478905,11.09603175,Buddy,,
2615.0,2 years,A687298,Dog,Chihuahua Shorthair Mix,White/Cream,2012-09-03,9/13/2014 9:30,2014-09-13T09:30:00,,Adoption,Spayed Female,30.4119897,-97.52333759,105.7708333,*Lila,,
2616.0,1 year,A719516,Cat,Domestic Longhair Mix,Lynx Point,2015-01-21,2/8/2016 18:48,2016-02-08T18:48:00,,Adoption,Neutered Male,30.64985094,-97.67026018,54.82619048,*Macavoy,,
2617.0,3 years,A763329,Dog,Labrador Retriever Mix,Brown/Black,2014-12-07,12/14/2017 15:49,2017-12-14T15:49:00,,Adoption,Spayed Female,30.55602537,-97.63204359,157.6655754,*Nutmeg,,
2618.0,10 months,A743764,Dog,Pointer Mix,White/Black,2016-04-16,2/17/2017 16:42,2017-02-17T16:42:00,,Adoption,Spayed Female,30.59145716,-97.55741365,43.95654762,Niels,,
2619.0,1 year,A680763,Dog,Chihuahua Shorthair Mix,Black,2012-12-07,6/7/2014 15:27,2014-06-07T15:27:00,Suffering,Euthanasia,Intact Female,30.4547442,-97.36960897,78.23482143,,,
2620.0,7 years,A734446,Dog,Miniature Poodle Mix,Tan/White,2009-09-08,9/8/2016 15:37,2016-09-08T15:37:00,,Return to Owner,Neutered Male,30.64411278,-97.67982487,365.3786706,Romeo,,
2621.0,2 years,A685166,Dog,Pit Bull Mix,Brown/Tan,2012-08-03,7/11/2015 18:22,2015-07-11T18:22:00,,Return to Owner,Neutered Male,30.74924539,-97.73644802,153.2521825,Hammer,,
2622.0,2 months,A764464,Dog,Soft Coated Wheaten Terrier Mix,Black/Tricolor,2017-10-15,1/4/2018 17:21,2018-01-04T17:21:00,,Adoption,Spayed Female,30.4394985,-97.73397909,11.67470238,Lilo,,
2623.0,2 months,A690160,Cat,Domestic Longhair Mix,Brown Tabby,2014-09-15,11/19/2014 9:31,2014-11-19T09:31:00,Foster,Adoption,Neutered Male,30.62367288,-97.38453495,9.342361111,*Desi,,
2624.0,2 years,A732319,Dog,Labrador Retriever Mix,White,2014-08-06,9/22/2016 12:55,2016-09-22T12:55:00,,Return to Owner,Neutered Male,30.73357504,-97.44346464,111.2197421,Benton,,
2625.0,12 years,A695310,Dog,Miniature Schnauzer Mix,Gray,2003-01-13,1/17/2015 13:44,2015-01-17T13:44:00,,Adoption,Neutered Male,30.69976534,-97.27277834,626.7960317,Elijah,,
2626.0,1 year,A737641,Cat,Domestic Shorthair Mix,Orange Tabby,2015-09-02,11/2/2016 11:02,2016-11-02T11:02:00,Suffering,Euthanasia,Intact Male,30.38727758,-97.34064413,61.0656746,,,
2627.0,1 year,A753210,Other,Bat,Brown,2016-07-03,7/5/2017 9:15,2017-07-05T09:15:00,Rabies Risk,Euthanasia,Unknown,30.54561013,-97.35881976,52.48363095,,,
2628.0,11 years,A741844,Cat,Himalayan Mix,Flame Point,2006-01-12,1/13/2017 11:25,2017-01-13T11:25:00,,Return to Owner,Neutered Male,30.35001799,-97.72819949,574.2108135,Yaowyaow,,
2629.0,7 months,A681113,Dog,Chihuahua Shorthair/Jack Russell Terrier,Tricolor,2013-11-12,6/24/2014 17:28,2014-06-24T17:28:00,,Return to Owner,Neutered Male,30.27612519,-97.54345814,32.10396825,Rocky,,
2630.0,4 months,A761232,Dog,Plott Hound Mix,Black/White,2017-07-01,11/9/2017 12:12,2017-11-09T12:12:00,Partner,Transfer,Neutered Male,30.4434389,-97.68986338,18.78690476,*Pepper,,
2631.0,3 months,A685497,Cat,Domestic Shorthair Mix,Brown Tabby,2014-05-08,8/9/2014 9:00,2014-08-09T09:00:00,SCRP,Transfer,Intact Female,30.48738356,-97.39848305,13.33928571,,,
2632.0,2 months,A728397,Cat,Siamese Mix,Lilac Point,2016-04-26,7/8/2016 17:09,2016-07-08T17:09:00,Foster,Adoption,Neutered Male,30.52705293,-97.59112806,10.53065476,,,
2633.0,2 months,A672548,Dog,Manchester Terrier Mix,Red,2013-12-15,2/16/2014 18:20,2014-02-16T18:20:00,,Adoption,Spayed Female,30.67553284,-97.73134233,9.109126984,Emma,,
2634.0,2 years,A725087,Cat,Domestic Longhair Mix,White/Orange Tabby,2014-04-25,6/19/2016 15:22,2016-06-19T15:22:00,,Adoption,Neutered Male,30.6896119,-97.5797949,112.3771825,*Handsome,,
2635.0,3 years,A699262,Dog,Staffordshire Mix,White/Black,2012-03-24,5/5/2015 14:35,2015-05-05T14:35:00,,Return to Owner,Spayed Female,30.63431076,-97.66946074,162.515377,Mika,,
2636.0,6 months,A698553,Dog,German Shepherd Mix,Black/Brown,2014-09-13,3/21/2015 12:14,2015-03-21T12:14:00,,Adoption,Neutered Male,30.43474918,-97.31620879,27.07281746,*Bil Bo,,
2637.0,3 years,A696537,Dog,Chihuahua Shorthair Mix,Tan,2012-02-06,3/11/2015 14:54,2015-03-11T14:54:00,,Return to Owner,Neutered Male,30.34057164,-97.53208916,161.3744048,Goofy,,
2638.0,10 years,A730548,Cat,Domestic Shorthair Mix,Black/White,2006-07-06,7/13/2016 14:10,2016-07-13T14:10:00,Partner,Transfer,Neutered Male,30.48820995,-97.64593402,522.9414683,,,
2639.0,6 years,A739937,Dog,Chihuahua Shorthair Mix,Black/White,2010-12-09,1/7/2017 16:00,2017-01-07T16:00:00,,Adoption,Neutered Male,30.27014774,-97.25466146,317.3809524,Taz,,
2640.0,2 months,A723708,Dog,Labrador Retriever Mix,Black,2016-02-05,4/10/2016 11:29,2016-04-10T11:29:00,Partner,Transfer,Intact Female,30.63890274,-97.29426752,9.35406746,,,
2641.0,1 month,A752926,Cat,Domestic Shorthair Mix,Black,2017-06-05,8/2/2017 14:47,2017-08-02T14:47:00,Partner,Transfer,Intact Female,30.47528138,-97.66648145,8.373710317,*Smurfette,,
2642.0,1 year,A755059,Dog,Labrador Retriever Mix,Tan,2016-01-28,8/21/2017 18:48,2017-08-21T18:48:00,,Adoption,Spayed Female,30.74783423,-97.28415353,81.68333333,*Edie,,
2643.0,4 months,A742628,Dog,Labrador Retriever Mix,White/Tan,2016-09-25,1/29/2017 16:54,2017-01-29T16:54:00,,Adoption,Intact Female,30.50393508,-97.70141606,18.10059524,Scottie,,
2644.0,2 years,A676121,Dog,Labrador Retriever Mix,Yellow,2012-07-04,11/23/2014 18:01,2014-11-23T18:01:00,Partner,Transfer,Spayed Female,30.49962877,-97.50153366,124.6786706,Lola,,
2645.0,2 weeks,A675295,Cat,Domestic Shorthair Mix,White/Brown Tabby,2014-03-11,3/26/2014 19:20,2014-03-26T19:20:00,Partner,Transfer,Intact Female,30.32168835,-97.62709601,2.257936508,,,
2646.0,2 months,A745796,Dog,Labrador Retriever Mix,Yellow,2016-12-27,3/28/2017 0:00,2017-03-28T00:00:00,Partner,Transfer,Intact Male,30.75639351,-97.52165297,13,,,
2647.0,5 months,A765579,Dog,Boston Terrier Mix,Black/White,2017-08-23,1/23/2018 17:46,2018-01-23T17:46:00,,Return to Owner,Intact Male,30.48138912,-97.35918572,21.96289683,Sergeant,,
2648.0,1 week,A682123,Cat,Domestic Shorthair Mix,Calico,2014-06-17,6/24/2014 19:14,2014-06-24T19:14:00,Partner,Transfer,Intact Female,30.42116902,-97.53772653,1.114484127,,,
2649.0,5 years,A734132,Dog,Pit Bull Mix,Brown/White,2012-09-01,12/28/2017 13:18,2017-12-28T13:18:00,,Rto-Adopt,Neutered Male,30.53044444,-97.42046382,277.7934524,Prince,,
2650.0,2 months,A689600,Dog,Miniature Pinscher/Chihuahua Shorthair,Brown/Black,2014-09-29,12/5/2014 8:04,2014-12-05T08:04:00,Foster,Adoption,Intact Male,30.32764553,-97.51007688,9.619444444,Scout,,
2651.0,4 months,A689909,Cat,Domestic Shorthair Mix,Orange Tabby/White,2014-06-11,10/19/2014 12:52,2014-10-19T12:52:00,,Adoption,Neutered Male,30.49646737,-97.34754055,18.64801587,Bashful,,
2652.0,1 year,A681696,Dog,Labrador Retriever Mix,Sable/White,2013-06-19,10/30/2014 10:24,2014-10-30T10:24:00,Foster,Adoption,Neutered Male,30.65636869,-97.41081017,71.2047619,Bo Bo,,
2653.0,2 months,A753591,Dog,Labrador Retriever Mix,Black,2017-04-27,7/13/2017 16:51,2017-07-13T16:51:00,,Adoption,Spayed Female,30.50820761,-97.30796386,11.10029762,*Charity,,
2654.0,2 months,A722225,Dog,Boxer Mix,Red,2015-12-25,3/17/2016 15:28,2016-03-17T15:28:00,,Adoption,Spayed Female,30.40912588,-97.71731176,11.94920635,*Lulu,,
2655.0,1 year,A668080,Other,Raccoon Mix,Gray/Black,2012-11-27,11/27/2013 12:27,2013-11-27T12:27:00,Suffering,Euthanasia,Unknown,30.35875618,-97.30424095,52.21696429,,,
2656.0,2 months,A761763,Dog,Cairn Terrier Mix,Tan,2017-11-02,1/7/2018 18:20,2018-01-07T18:20:00,Foster,Adoption,Neutered Male,30.30234832,-97.33628292,9.537698413,*Sweettart,,
2657.0,2 months,A712655,Cat,Domestic Shorthair Mix,Orange Tabby,2015-07-11,9/30/2015 17:33,2015-09-30T17:33:00,,Adoption,Neutered Male,30.52707845,-97.3502814,11.67589286,*Morty,,
2658.0,5 months,A710054,Dog,Miniature Schnauzer Mix,Black/Tan,2015-03-16,8/18/2015 17:46,2015-08-18T17:46:00,,Adoption,Spayed Female,30.66294327,-97.70825015,22.24861111,Cuddles,,
2659.0,3 months,A704714,Cat,Domestic Medium Hair Mix,Black,2015-05-14,8/31/2015 18:22,2015-08-31T18:22:00,,Adoption,Spayed Female,30.28597062,-97.3211407,15.68075397,*Paloma,,
2660.0,5 years,A699967,Dog,Pit Bull Mix,Black/White,2010-04-05,4/10/2015 16:01,2015-04-10T16:01:00,Partner,Transfer,Spayed Female,30.61111085,-97.45733936,261.6667659,Bala,,
2661.0,8 years,A536757,Dog,Miniature Poodle Mix,Buff,2007-03-04,6/21/2015 11:59,2015-06-21T11:59:00,,Return to Owner,Spayed Female,30.69917649,-97.71157373,433.0713294,Tona,,
2662.0,4 years,A663803,Dog,Australian Cattle Dog Mix,Blue Merle,2009-09-24,10/17/2013 17:26,2013-10-17T17:26:00,Foster,Adoption,Spayed Female,30.51281168,-97.44279674,212.1037698,Zoey,,
2663.0,3 weeks,A706088,Cat,Domestic Shorthair Mix,Calico,2015-06-02,6/24/2015 16:39,2015-06-24T16:39:00,Partner,Transfer,Unknown,30.38778222,-97.44315245,3.241964286,,,
2664.0,2 years,A700466,Dog,Chihuahua Longhair Mix,Brown,2013-04-14,4/24/2015 14:36,2015-04-24T14:36:00,,Return to Owner,Neutered Male,30.32943711,-97.4312102,105.8011905,Jackson,,
2665.0,4 months,A717103,Cat,Domestic Shorthair Mix,Orange Tabby,2015-10-11,2/15/2016 14:49,2016-02-15T14:49:00,,Adoption,Neutered Male,30.38277416,-97.7362897,18.23105159,*Herb,,
2666.0,1 year,A734859,Dog,Pit Bull Mix,Brown/White,2015-09-14,10/7/2016 17:21,2016-10-07T17:21:00,,Adoption,Neutered Male,30.39883449,-97.50948347,55.67470238,*Ethan,,
2667.0,3 years,A683564,Dog,Lhasa Apso Mix,White,2011-07-12,7/16/2014 13:37,2014-07-16T13:37:00,Partner,Transfer,Neutered Male,30.54035055,-97.55706982,157.2239087,,,
2668.0,4 years,A711783,Dog,American Bulldog/Pit Bull,White/Brown,2011-09-12,11/15/2015 15:28,2015-11-15T15:28:00,Partner,Transfer,Neutered Male,30.36137585,-97.439991,217.9492063,*Carl,,
2669.0,1 year,A683336,Dog,Chihuahua Shorthair Mix,Black/White,2013-02-09,7/14/2014 13:32,2014-07-14T13:32:00,,Adoption,Spayed Female,30.75823967,-97.57265665,74.36626984,Rosie,,
2670.0,3 years,A690093,Dog,Rhod Ridgeback Mix,Tan/White,2013-10-14,11/14/2016 11:39,2016-11-14T11:39:00,,Return to Owner,Spayed Female,30.38739562,-97.7042181,161.0693452,Rowdy,,
2671.0,1 year,A665085,Dog,Pit Bull Mix,White/Brown,2012-10-13,12/9/2013 16:20,2013-12-09T16:20:00,,Adoption,Neutered Male,30.2805542,-97.56192753,60.38293651,Blue,,
2672.0,2 months,A754502,Cat,Domestic Shorthair Mix,Brown Tabby/White,2017-06-21,9/2/2017 18:56,2017-09-02T18:56:00,,Adoption,Neutered Male,30.50935849,-97.66575263,10.54126984,*Bagel,,
2673.0,1 year,A695741,Dog,Pit Bull Mix,Brown/White,2014-01-21,2/4/2015 15:32,2015-02-04T15:32:00,,Adoption,Spayed Female,30.4458793,-97.35572423,54.23531746,*Libby,,
2674.0,1 year,A736119,Other,Rex Mix,White,2015-01-04,11/17/2016 16:32,2016-11-17T16:32:00,,Adoption,Neutered Male,30.54755358,-97.54328328,97.66984127,*Pipkin,,
2675.0,1 year,A648236,Dog,Australian Cattle Dog Mix,Red Tick/White,2012-04-24,2/26/2014 16:50,2014-02-26T16:50:00,,Return to Owner,Neutered Male,30.29315176,-97.63149539,96.24305556,Max,,
2676.0,5 months,A697480,Dog,Pit Bull Mix,Brown/White,2014-09-24,3/1/2015 17:36,2015-03-01T17:36:00,,Adoption,Spayed Female,30.33402845,-97.67713059,22.67619048,*Pepita,,
2677.0,2 months,A730146,Dog,Australian Cattle Dog Mix,Tricolor,2016-04-29,7/3/2016 18:11,2016-07-03T18:11:00,,Adoption,Spayed Female,30.53219962,-97.53199444,9.393948413,Matilda,,
2678.0,1 year,A723086,Dog,Pit Bull Mix,Blue/White,2015-03-26,4/5/2016 13:29,2016-04-05T13:29:00,,Adoption,Neutered Male,30.49418164,-97.30780815,53.79454365,*Bert,,
2679.0,5 months,A715363,Cat,Domestic Shorthair Mix,Torbie,2015-09-04,2/12/2016 13:35,2016-02-12T13:35:00,,Adoption,Spayed Female,30.51852677,-97.61253909,23.08085317,Grace,,
2680.0,2 years,A717112,Dog,Pit Bull Mix,White/Brown,2014-12-02,10/28/2017 16:56,2017-10-28T16:56:00,,Return to Owner,Neutered Male,30.60740208,-97.46323282,151.6722222,Fred,,
2681.0,2 years,A665590,Cat,Domestic Shorthair Mix,Brown Tabby,2013-08-20,9/10/2015 17:24,2015-09-10T17:24:00,,Adoption,Neutered Male,30.75343102,-97.49363357,107.3892857,*Marvin,,
2682.0,2 years,A719128,Dog,Norwich Terrier Mix,Tan/White,2014-01-13,1/17/2016 15:40,2016-01-17T15:40:00,,Adoption,Spayed Female,30.27324643,-97.57621681,104.9503968,*Lulu,,
2683.0,2 months,A730007,Cat,Domestic Shorthair Mix,Black,2016-05-21,8/6/2016 17:06,2016-08-06T17:06:00,Foster,Adoption,Neutered Male,30.4916036,-97.48164511,11.10178571,*Auggie,,
2684.0,7 months,A732438,Cat,Domestic Shorthair Mix,Black/White,2016-06-07,1/6/2017 11:59,2017-01-06T11:59:00,Partner,Transfer,Spayed Female,30.37881089,-97.36797723,30.49990079,*Onion,,
2685.0,2 months,A747882,Cat,Domestic Shorthair Mix,Cream Tabby/White,2017-02-11,4/30/2017 18:41,2017-04-30T18:41:00,,Adoption,Neutered Male,30.561052,-97.47976413,11.25406746,*Julius,,
2686.0,8 months,A743300,Dog,Harrier Mix,White/Red,2016-08-07,4/15/2017 9:26,2017-04-15T09:26:00,Foster,Adoption,Spayed Female,30.31399335,-97.396205,35.91329365,Ann,,
2687.0,7 months,A683574,Cat,Japanese Bobtail Mix,Calico,2013-12-12,7/24/2014 16:03,2014-07-24T16:03:00,,Adoption,Spayed Female,30.40198179,-97.38150268,32.09553571,Bell,,
2688.0,8 years,A673408,Dog,Chihuahua Shorthair Mix,White/Red,2006-02-23,3/12/2014 19:10,2014-03-12T19:10:00,,Adoption,Spayed Female,30.49963404,-97.62258822,419.9712302,Sabrina,,
2689.0,3 weeks,A705125,Cat,Domestic Shorthair Mix,Brown Tabby,2015-05-23,6/13/2015 14:32,2015-06-13T14:32:00,Partner,Transfer,Intact Male,30.45971116,-97.58840151,3.086507937,,,
2690.0,2 years,A760925,Other,Bat Mix,Black,2015-10-26,10/26/2017 10:13,2017-10-26T10:13:00,Rabies Risk,Euthanasia,Unknown,30.6988016,-97.60744534,104.4893849,,,
2691.0,2 years,A698597,Dog,Australian Kelpie Mix,White/Tricolor,2013-03-14,3/14/2015 18:07,2015-03-14T18:07:00,Behavior,Euthanasia,Intact Male,30.75744644,-97.73354478,104.3935516,Thiago,,
2692.0,4 weeks,A747290,Cat,Domestic Shorthair Mix,Torbie,2017-03-18,4/18/2017 14:40,2017-04-18T14:40:00,Partner,Transfer,Intact Female,30.35079185,-97.29577202,4.515873016,,,
2693.0,4 weeks,A664712,Dog,Chow Chow Mix,Black/Brown,2013-09-07,10/7/2013 19:06,2013-10-07T19:06:00,Suffering,Euthanasia,Unknown,30.72544672,-97.42366567,4.399404762,,,
2694.0,3 months,A682041,Cat,Domestic Shorthair Mix,Black/White,2014-03-08,7/2/2014 14:34,2014-07-02T14:34:00,Partner,Transfer,Neutered Male,30.32503174,-97.4108788,16.65813492,*Nicholas,,
2695.0,6 years,A599367,Dog,Chihuahua Shorthair Mix,Tan/White,2008-07-05,7/5/2014 17:36,2014-07-05T17:36:00,,Return to Owner,Spayed Female,30.5363839,-97.69934369,313.1047619,Princess,,
2696.0,3 years,A697745,Cat,Domestic Shorthair Mix,Calico,2012-02-27,3/3/2015 14:43,2015-03-03T14:43:00,Partner,Transfer,Spayed Female,30.46068129,-97.46600905,157.2304563,Callie,,
2697.0,3 years,A690497,Dog,Chihuahua Shorthair Mix,Black,2011-04-21,10/25/2014 15:29,2014-10-25T15:29:00,,Adoption,Spayed Female,30.54602432,-97.71593463,183.377877,Tinker Bell,,
2698.0,1 year,A723638,Dog,Chihuahua Shorthair/Pekingese,White/Brown,2014-10-04,4/26/2016 11:03,2016-04-26T11:03:00,Foster,Adoption,Spayed Female,30.36760117,-97.72470178,81.49434524,Elsa,,
2699.0,1 year,A742706,Cat,Domestic Shorthair Mix,Tan,2015-07-26,1/26/2017 13:54,2017-01-26T13:54:00,Suffering,Euthanasia,Unknown,30.42977572,-97.57218671,78.65416667,,,
2700.0,2 years,A666974,Dog,Miniature Poodle Mix,White/Black,2011-11-10,11/13/2013 15:35,2013-11-13T15:35:00,,Return to Owner,Spayed Female,30.70785132,-97.57023045,104.9499008,Bella,,
2701.0,1 year,A670563,Dog,Pit Bull Mix,Blue/White,2013-01-10,9/18/2014 15:37,2014-09-18T15:37:00,Partner,Transfer,Spayed Female,30.29267147,-97.39807818,88.09295635,Mia,,
2702.0,1 year,A724056,Cat,Domestic Shorthair Mix,Tortie,2015-04-11,4/18/2016 18:55,2016-04-18T18:55:00,SCRP,Transfer,Spayed Female,30.49407492,-97.72661433,53.39831349,,,
2703.0,5 years,A542615,Dog,Pit Bull Mix,Brown/Brown Brindle,2008-09-06,8/6/2014 11:16,2014-08-06T11:16:00,,Return to Owner,Neutered Male,30.44181958,-97.32097217,308.6384921,Dikembe,,
2704.0,3 months,A702585,Cat,Domestic Shorthair Mix,Black,2015-01-15,5/16/2015 9:00,2015-05-16T09:00:00,SCRP,Transfer,Intact Male,30.40889041,-97.50672874,17.33928571,,,
2705.0,3 years,A598610,Dog,Australian Kelpie Mix,Black Brindle,2010-04-30,12/7/2013 15:40,2013-12-07T15:40:00,,Adoption,Spayed Female,30.27463222,-97.39893728,188.2361111,Ellie,,
2706.0,2 months,A685371,Dog,German Shepherd Mix,Brown/Black,2014-06-06,8/10/2014 17:56,2014-08-10T17:56:00,,Adoption,Spayed Female,30.3748479,-97.62051037,9.392460317,,,
2707.0,1 weeks,A762451,Dog,German Shepherd Mix,Black/Tan,2017-11-17,11/26/2017 9:46,2017-11-26T09:46:00,Partner,Transfer,Unknown,30.43446621,-97.55169542,1.343849206,,,
2708.0,6 months,A670000,Cat,Domestic Shorthair Mix,Black,2013-07-01,1/11/2014 15:05,2014-01-11T15:05:00,Partner,Transfer,Neutered Male,30.73691693,-97.74189881,27.80406746,Tex,,
2709.0,4 years,A663299,Dog,Pit Bull Mix,Brown Brindle/White,2009-09-16,10/24/2013 10:34,2013-10-24T10:34:00,Aggressive,Euthanasia,Neutered Male,30.60964383,-97.71095401,214.205754,Jedi,,
2710.0,2 months,A751119,Cat,Domestic Shorthair Mix,Calico,2017-03-21,6/17/2017 13:39,2017-06-17T13:39:00,,Adoption,Spayed Female,30.56406857,-97.35982807,12.65267857,*Summer,,
2711.0,2 years,A704646,Dog,Chihuahua Shorthair Mix,White/Brown,2013-06-07,6/26/2015 16:42,2015-06-26T16:42:00,,Adoption,Spayed Female,30.33641396,-97.6812612,107.0994048,*Fiona,,
2712.0,2 weeks,A706071,Cat,Domestic Shorthair Mix,Brown Tabby,2015-06-09,6/24/2015 17:05,2015-06-24T17:05:00,Partner,Transfer,Unknown,30.72595509,-97.71181618,2.244543651,,,
2713.0,2 years,A685552,Dog,Golden Retriever Mix,Cream,2012-02-09,8/17/2014 11:07,2014-08-17T11:07:00,,Return to Owner,Spayed Female,30.30134965,-97.39610686,131.4947421,Ziva,,
2714.0,1 year,A754454,Cat,Domestic Shorthair Mix,Black,2016-07-21,7/25/2017 12:05,2017-07-25T12:05:00,Snr,Transfer,Unknown,30.29184394,-97.67680209,52.78621032,,,
2715.0,1 year,A677863,Dog,Cardigan Welsh Corgi/Miniature Pinscher,Brown,2013-04-30,5/7/2014 15:20,2014-05-07T15:20:00,,Adoption,Neutered Male,30.69989948,-97.5767585,53.23412698,Scooter,,
2716.0,3 years,A691049,Dog,Pit Bull Mix,Chocolate/White,2011-10-29,11/21/2014 17:42,2014-11-21T17:42:00,Behavior,Euthanasia,Neutered Male,30.68054133,-97.34316274,159.9625,*Ridley,,
2717.0,3 years,A665090,Other,Bat Mix,Black,2010-10-13,10/13/2013 15:39,2013-10-13T15:39:00,Rabies Risk,Euthanasia,Unknown,30.54692855,-97.67942623,156.6645833,,,
2718.0,1 year,A631986,Dog,Labrador Retriever Mix,Black/White,2012-04-11,11/12/2013 13:28,2013-11-12T13:28:00,,Return to Owner,Neutered Male,30.5827755,-97.64991123,82.93730159,Bishop,,
2719.0,2 months,A683328,Cat,Domestic Longhair Mix,Blue/White,2014-04-24,7/15/2014 17:48,2014-07-15T17:48:00,,Adoption,Neutered Male,30.28917278,-97.51364335,11.8202381,Solo,,
2720.0,2 years,A718909,Cat,Domestic Medium Hair Mix,Black/White,2014-01-09,4/26/2016 11:40,2016-04-26T11:40:00,Foster,Adoption,Spayed Female,30.28498313,-97.4715553,119.7837302,Moriah,,
2721.0,4 years,A575180,Dog,Pit Bull Mix,White/Black,2011-06-11,6/18/2015 12:34,2015-06-18T12:34:00,,Return to Owner,Neutered Male,30.6206239,-97.38436439,209.7890873,Blue,,
2722.0,1 year,A713408,Cat,Domestic Shorthair Mix,Brown Tabby,2014-10-06,11/28/2015 0:00,2015-11-28T00:00:00,,Adoption,Spayed Female,30.66245339,-97.67942588,59.71428571,Trinity,,
2723.0,4 months,A733862,Cat,Domestic Shorthair Mix,Orange Tabby,2016-04-13,8/29/2016 9:00,2016-08-29T09:00:00,SCRP,Transfer,Neutered Male,30.51411099,-97.31479709,19.76785714,,,
2724.0,6 months,A752728,Cat,Domestic Shorthair Mix,Black,2017-05-15,12/1/2017 13:57,2017-12-01T13:57:00,Foster,Adoption,Spayed Female,30.39997873,-97.59490351,28.65446429,*Topaz,,
2725.0,4 months,A687016,Cat,Domestic Shorthair Mix,Calico,2014-04-15,8/31/2014 9:00,2014-08-31T09:00:00,SCRP,Transfer,Intact Female,30.75165268,-97.34133728,19.76785714,,,
2726.0,2 years,A760393,Dog,Pit Bull Mix,Black/White,2015-10-17,10/17/2017 16:35,2017-10-17T16:35:00,,Return to Owner,Intact Male,30.51856838,-97.3897188,104.5272817,Nitro,,
2727.0,6 months,A734713,Dog,Australian Kelpie Mix,Black/White,2016-03-11,9/15/2016 17:20,2016-09-15T17:20:00,,Adoption,Spayed Female,30.56663758,-97.55913931,26.96031746,*Francine,,
2728.0,2 months,A664440,Cat,Domestic Shorthair Mix,Tortie,2013-08-12,10/19/2013 15:12,2013-10-19T15:12:00,,Adoption,Spayed Female,30.58043009,-97.67972853,9.804761905,*Sunshine,,
2729.0,1 month,A671188,Dog,Australian Cattle Dog Mix,Tricolor,2013-12-20,2/14/2014 17:09,2014-02-14T17:09:00,Foster,Adoption,Spayed Female,30.40121381,-97.69305032,8.102083333,*Junie,,
2730.0,1 year,A666973,Dog,Boxer Mix,Brown Brindle/White,2012-11-10,11/13/2013 15:34,2013-11-13T15:34:00,,Return to Owner,Neutered Male,30.75297187,-97.56230095,52.6640873,Bohdi,,
2731.0,5 months,A695341,Dog,Jack Russell Terrier/Chihuahua Shorthair,Brown,2014-08-14,1/18/2015 9:52,2015-01-18T09:52:00,Offsite,Adoption,Neutered Male,30.43929537,-97.38900733,22.48730159,Copper,,
2732.0,1 year,A678131,Dog,Jack Russell Terrier/Australian Cattle Dog,White/Black,2013-05-04,5/10/2014 14:10,2014-05-10T14:10:00,,Return to Owner,Neutered Male,30.47818336,-97.4632081,53.0843254,Peewee,,
2733.0,2 years,A671339,Dog,Pointer/Catahoula,White/Yellow Brindle,2012-01-22,1/30/2014 17:21,2014-01-30T17:21:00,,Adoption,Spayed Female,30.43545283,-97.39844497,105.6747024,,,
2734.0,2 months,A669764,Dog,Labrador Retriever Mix,Black,2013-10-11,1/2/2014 11:21,2014-01-02T11:21:00,Partner,Transfer,Intact Female,30.38409973,-97.5488194,11.92470238,,,
2735.0,2 months,A668306,Dog,German Shepherd Mix,Red,2013-10-17,12/23/2013 13:53,2013-12-23T13:53:00,,Adoption,Spayed Female,30.28071891,-97.58424833,9.65406746,,,
2736.0,7 months,A727723,Dog,Rottweiler Mix,Tan/Black,2015-10-26,5/27/2016 17:17,2016-05-27T17:17:00,,Return to Owner,Neutered Male,30.3528626,-97.70518728,30.67430556,Teddy Bear J,,
2737.0,3 weeks,A750243,Cat,Domestic Shorthair Mix,Brown Tabby,2017-05-02,5/25/2017 15:25,2017-05-25T15:25:00,Partner,Transfer,Intact Male,30.28567766,-97.56499212,3.377480159,,,
2738.0,2 months,A759129,Cat,Domestic Shorthair Mix,Brown Tabby,2017-07-27,9/28/2017 13:25,2017-09-28T13:25:00,Partner,Transfer,Intact Male,30.57524591,-97.35127625,9.079861111,,,
2739.0,1 year,A737425,Dog,Chihuahua Shorthair Mix,Black,2015-10-27,11/1/2016 17:11,2016-11-01T17:11:00,,Adoption,Neutered Male,30.63974241,-97.53372817,53.10228175,*Steadman,,
2740.0,2 months,A724686,Dog,St. Bernard Smooth Coat Mix,Tricolor,2016-02-20,4/24/2016 17:34,2016-04-24T17:34:00,,Adoption,Spayed Female,30.49718366,-97.61588519,9.247420635,,,
2741.0,2 months,A682053,Dog,American Staffordshire Terrier/Labrador Retriever,Black/White,2014-04-23,7/3/2014 18:55,2014-07-03T18:55:00,,Adoption,Spayed Female,30.41753382,-97.66116157,10.25545635,Ellie,,
2742.0,1 year,A692804,Cat,Siamese Mix,Lynx Point,2013-11-25,11/26/2014 9:00,2014-11-26T09:00:00,SCRP,Transfer,Intact Female,30.67175058,-97.49314584,52.33928571,,,
2743.0,4 years,A733821,Dog,Chihuahua Shorthair/Rat Terrier,Tricolor,2012-08-28,9/4/2016 16:43,2016-09-04T16:43:00,,Adoption,Spayed Female,30.27523309,-97.44307414,209.8137897,*Celine,,
2744.0,1 year,A699089,Other,Squirrel Mix,Brown/Tan,2014-03-22,3/22/2015 14:46,2015-03-22T14:46:00,Suffering,Euthanasia,Intact Female,30.70849067,-97.45960967,52.23075397,,,
2745.0,2 years,A761438,Dog,Pit Bull Mix,Brown Brindle/White,2015-11-04,11/17/2017 10:58,2017-11-17T10:58:00,Partner,Transfer,Neutered Male,30.7020267,-97.47689899,106.3509921,*Joey,,
2746.0,5 years,A761123,Dog,German Shepherd Mix,Black/Tan,2012-10-29,10/29/2017 18:07,2017-10-29T18:07:00,Partner,Transfer,Intact Female,30.63634913,-97.47642858,260.9649802,,,
2747.0,6 months,A722372,Other,Bat,Brown,2015-09-15,3/20/2016 17:36,2016-03-20T17:36:00,Rabies Risk,Euthanasia,Unknown,30.61637534,-97.37141882,26.81904762,,,
2748.0,3 weeks,A683430,Cat,Domestic Shorthair Mix,Blue Cream,2014-06-18,7/11/2014 19:09,2014-07-11T19:09:00,Partner,Transfer,Intact Male,30.28120556,-97.55715985,3.399702381,,,
2749.0,2 months,A725138,Dog,Weimaraner Mix,Blue/White,2016-03-11,5/18/2016 10:11,2016-05-18T10:11:00,Foster,Adoption,Spayed Female,30.45322248,-97.73129916,9.774900794,*Misty,,
2750.0,6 months,A695827,Cat,Domestic Shorthair Mix,Orange Tabby,2014-07-23,1/24/2015 9:00,2015-01-24T09:00:00,SCRP,Transfer,Intact Male,30.69598983,-97.68835945,26.48214286,,,
2751.0,1 year,A669054,Cat,Domestic Shorthair Mix,Blue Tabby,2012-12-13,12/18/2013 14:38,2013-12-18T14:38:00,SCRP,Transfer,Spayed Female,30.64210584,-97.42784005,52.94424603,*Izzy,,
2752.0,2 years,A714492,Dog,Siberian Husky Mix,Sable,2013-10-23,4/29/2016 11:37,2016-04-29T11:37:00,,Adoption,Spayed Female,30.48072059,-97.24626803,131.3548611,Emma Lou,,
2753.0,8 years,A494120,Dog,West Highland/Toy Fox Terrier,White,2007-07-31,4/7/2016 19:38,2016-04-07T19:38:00,,Adoption,Neutered Male,30.54817425,-97.28133172,453.4025794,Chino,,
2754.0,2 months,A763588,Cat,Domestic Shorthair Mix,Black,2017-09-23,12/16/2017 17:24,2017-12-16T17:24:00,,Adoption,Neutered Male,30.52057632,-97.28217441,12.10357143,,,
2755.0,2 months,A726795,Cat,Domestic Shorthair Mix,Brown Tabby/White,2016-03-30,6/14/2016 12:39,2016-06-14T12:39:00,Foster,Adoption,Neutered Male,30.52840655,-97.26425634,10.93244048,*Davey,,
2756.0,9 years,A745803,Dog,Pit Bull Mix,Tan/White,2008-03-24,9/4/2017 12:42,2017-09-04T12:42:00,,Return to Owner,Intact Male,30.53719489,-97.38111552,493.0755952,Coach,,
2757.0,8 years,A720712,Dog,Rat Terrier,White/Black,2008-02-14,2/28/2016 16:28,2016-02-28T16:28:00,,Adoption,Neutered Male,30.61027859,-97.48380258,419.5265873,*Eddie,,
2758.0,2 years,A671750,Cat,Domestic Shorthair Mix,Orange Tabby/White,2012-01-30,1/31/2014 14:39,2014-01-31T14:39:00,SCRP,Transfer,Neutered Male,30.46924865,-97.54909805,104.658631,,,
2759.0,2 years,A716880,Cat,Domestic Shorthair Mix,Black,2015-06-27,7/1/2017 15:57,2017-07-01T15:57:00,,Adoption,Neutered Male,30.70611008,-97.67518552,105.0949405,Bear,,
2760.0,2 months,A750767,Cat,Domestic Shorthair Mix,Brown Tabby/White,2017-04-24,6/29/2017 14:52,2017-06-29T14:52:00,Foster,Adoption,Neutered Male,30.41009971,-97.56242063,9.517063492,*Tony,,
2761.0,10 months,A679630,Dog,Chihuahua Longhair Mix,White,2013-06-24,5/24/2014 14:06,2014-05-24T14:06:00,,Died,Spayed Female,30.31377968,-97.67429323,47.79821429,Bella,,
2762.0,5 years,A759521,Dog,Shih Tzu,Silver,2012-10-03,10/4/2017 18:47,2017-10-04T18:47:00,,Return to Owner,Intact Male,30.33827613,-97.51804919,261.1118056,Fern,,
2763.0,9 months,A761569,Dog,American Bulldog,White/Brown Brindle,2017-02-25,11/26/2017 12:54,2017-11-26T12:54:00,,Adoption,Neutered Male,30.62142585,-97.30050465,39.21964286,Raider,,
2764.0,2 years,A749744,Dog,Pit Bull Mix,Blue/White,2015-05-19,5/19/2017 18:50,2017-05-19T18:50:00,,Return to Owner,Intact Male,30.40267551,-97.71794513,104.5406746,Blue,,
2765.0,2 months,A707321,Cat,Domestic Shorthair Mix,Tortie,2015-06-11,8/17/2015 17:45,2015-08-17T17:45:00,,Adoption,Spayed Female,30.73215555,-97.27552226,9.677083333,Bella,,
2766.0,1 year,A745848,Dog,Chihuahua Shorthair Mix,White,2016-03-25,4/3/2017 11:10,2017-04-03T11:10:00,Partner,Transfer,Neutered Male,30.6747193,-97.72415243,53.49503968,*Axel,,
2767.0,5 years,A661430,Cat,Domestic Shorthair Mix,Torbie,2008-08-20,10/6/2013 12:15,2013-10-06T12:15:00,In Kennel,Died,Spayed Female,30.28968883,-97.27674554,267.6443452,*Choochoo,,
2768.0,2 years,A713962,Dog,Labrador Retriever Mix,Black,2013-10-15,10/15/2015 18:59,2015-10-15T18:59:00,,Return to Owner,Spayed Female,30.33889206,-97.73352676,104.3987103,,,
2769.0,2 months,A760853,Cat,Domestic Shorthair Mix,Black Tabby,2017-09-19,12/2/2017 14:31,2017-12-02T14:31:00,Foster,Adoption,Neutered Male,30.42485405,-97.55689327,10.6578373,*Thunder,,
2770.0,2 months,A680137,Cat,Domestic Shorthair Mix,Torbie,2014-03-23,6/7/2014 13:36,2014-06-07T13:36:00,,Adoption,Spayed Female,30.69594298,-97.39801329,10.93809524,Sophie,,
2771.0,3 weeks,A680230,Cat,Domestic Shorthair Mix,Brown Tabby/White,2014-05-09,5/31/2014 12:27,2014-05-31T12:27:00,Partner,Transfer,Intact Male,30.35576713,-97.71509434,3.216964286,,,
2772.0,5 months,A730598,Dog,Labrador Retriever Mix,Black/White,2016-02-07,7/14/2016 15:57,2016-07-14T15:57:00,,Adoption,Neutered Male,30.64919167,-97.62725122,22.66636905,Ace,,
2773.0,3 years,A682040,Cat,Domestic Shorthair Mix,Brown Tabby/White,2010-12-23,7/2/2014 14:34,2014-07-02T14:34:00,Partner,Transfer,Spayed Female,30.64308231,-97.62801939,183.9438492,*Samantha,,
2774.0,2 months,A687512,Cat,Domestic Shorthair Mix,Cream Tabby,2014-06-28,9/9/2014 18:46,2014-09-09T18:46:00,,Adoption,Neutered Male,30.57208027,-97.32693139,10.54027778,Bluto,,
2775.0,3 months,A726332,Cat,Domestic Shorthair Mix,Brown Tabby,2016-04-02,7/3/2016 17:54,2016-07-03T17:54:00,,Adoption,Neutered Male,30.42481915,-97.73184452,13.24940476,Ramsey,,
2776.0,3 years,A676789,Dog,American Staffordshire Terrier Mix,White/Blue,2011-04-15,6/5/2014 19:03,2014-06-05T19:03:00,Partner,Transfer,Spayed Female,30.33513958,-97.49053801,163.9705357,Precious,,
2777.0,7 months,A749127,Dog,Pit Bull Mix,Blue/White,2016-09-12,5/12/2017 16:40,2017-05-12T16:40:00,,Return to Owner,Spayed Female,30.42306626,-97.46440888,34.67063492,Princess,,
2778.0,2 months,A682928,Cat,Domestic Shorthair Mix,Calico,2014-05-29,8/4/2014 17:47,2014-08-04T17:47:00,,Adoption,Spayed Female,30.3352182,-97.66219142,9.677281746,*Cheryl,,
2779.0,3 weeks,A679170,Cat,Domestic Shorthair Mix,White/Gray,2014-04-25,5/17/2014 14:00,2014-05-17T14:00:00,Partner,Transfer,Intact Female,30.75892863,-97.67898988,3.226190476,,,
2780.0,5 years,A685668,Other,Bat,Gray,2009-08-10,8/11/2014 8:51,2014-08-11T08:51:00,In Kennel,Died,Unknown,30.60219451,-97.70101625,261.0526786,,,
2781.0,10 years,A549214,Dog,Pit Bull Mix,Brown,2003-12-04,12/3/2013 18:15,2013-12-03T18:15:00,,Return to Owner,Spayed Female,30.61893767,-97.320727,521.8229167,Bella,,
2782.0,2 months,A736939,Cat,Domestic Shorthair Mix,Brown Tabby,2016-09-13,12/3/2016 12:49,2016-12-03T12:49:00,Foster,Adoption,Neutered Male,30.62615789,-97.26535871,11.64771825,*Jimmy,,
2783.0,8 months,A654170,Dog,Catahoula/Chow Chow,Red Merle,2013-03-16,11/16/2013 15:08,2013-11-16T15:08:00,Partner,Transfer,Neutered Male,30.52098367,-97.33459638,35.09007937,Tigger,,
2784.0,1 year,A750665,Dog,Labrador Retriever/Pit Bull,Brown,2016-05-30,7/2/2017 18:56,2017-07-02T18:56:00,,Adoption,Neutered Male,30.50393372,-97.63999521,56.96984127,*Reddy,,
2785.0,6 years,A610476,Dog,Border Terrier Mix,Tan,2011-05-23,12/18/2017 18:08,2017-12-18T18:08:00,,Return to Owner,Spayed Female,30.31290232,-97.60802456,343.1079365,Trinity,,
2786.0,2 months,A720974,Dog,Chihuahua Shorthair Mix,Brown/Tan,2015-12-03,2/22/2016 18:27,2016-02-22T18:27:00,,Adoption,Neutered Male,30.40407704,-97.34020933,11.68125,Russo,,
2787.0,6 years,A732500,Dog,Norwich Terrier Mix,Tan/White,2010-08-10,8/8/2016 19:28,2016-08-08T19:28:00,Suffering,Euthanasia,Neutered Male,30.47529099,-97.45962079,312.9730159,,,
2788.0,8 months,A695921,Cat,Domestic Shorthair Mix,Black,2014-05-25,2/2/2015 14:58,2015-02-02T14:58:00,,Adoption,Neutered Male,30.57410684,-97.27226939,36.23194444,Colugo,,
2789.0,4 years,A733820,Dog,Cocker Spaniel,Black/Brown,2012-08-27,9/6/2016 18:01,2016-09-06T18:01:00,,Return to Owner,Neutered Male,30.61755683,-97.46295104,210.2500992,Maris,,
2790.0,1 year,A698618,Other,Rabbit Sh Mix,White/Blue,2014-03-14,3/16/2015 18:08,2015-03-16T18:08:00,Partner,Transfer,Unknown,30.61290645,-97.62575697,52.53650794,,,
2791.0,1 year,A752049,Dog,German Shepherd,Black/Tan,2016-06-17,6/21/2017 18:43,2017-06-21T18:43:00,,Adoption,Neutered Male,30.68867323,-97.58591256,52.82569444,,656174071f442de352558622,
2792.0,2 months,A703572,Cat,Domestic Shorthair Mix,Calico,2015-04-27,6/29/2015 16:06,2015-06-29T16:06:00,,Adoption,Spayed Female,30.47183917,-97.32903432,9.095833333,*Sandra,,
2793.0,1 year,A728535,Dog,Chihuahua Shorthair/Shiba Inu,Tan/White,2015-06-05,6/9/2016 17:37,2016-06-09T17:37:00,,Adoption,Neutered Male,30.76402245,-97.41323036,52.96200397,Bruce,,
2794.0,4 weeks,A727356,Cat,Domestic Shorthair Mix,Brown Tabby/Black,2016-04-21,5/21/2016 15:54,2016-05-21T15:54:00,Partner,Transfer,Intact Female,30.75241289,-97.42122359,4.380357143,,,
2795.0,1 year,A724895,Cat,Domestic Shorthair Mix,Calico/Brown Tabby,2015-04-22,4/24/2016 9:46,2016-04-24T09:46:00,Rabies Risk,Euthanasia,Intact Female,30.5586637,-97.4036608,52.62956349,,,
2796.0,11 months,A691691,Dog,German Shepherd/Labrador Retriever,Red,2014-01-08,1/2/2015 18:52,2015-01-02T18:52:00,,Adoption,Spayed Female,30.76139434,-97.5086383,51.39801587,Tiva,,
2797.0,8 years,A750607,Cat,Domestic Shorthair Mix,White,2009-05-31,6/3/2017 11:46,2017-06-03T11:46:00,Partner,Transfer,Spayed Female,30.33717621,-97.41132084,417.9271825,Taboo,,
2798.0,1 year,A748736,Cat,Domestic Shorthair Mix,Black,2016-05-06,5/28/2017 17:34,2017-05-28T17:34:00,,Adoption,Neutered Male,30.29910497,-97.46199109,55.39027778,*Wink,,
2799.0,5 years,A676855,Dog,Rat Terrier/Chihuahua Shorthair,Tricolor/White,2009-04-15,4/22/2014 17:54,2014-04-22T17:54:00,Partner,Transfer,Spayed Female,30.56511964,-97.50969172,261.9636905,Chica,,
2800.0,1 month,A755951,Dog,Labrador Retriever Mix,Tan/White,2017-06-15,8/15/2017 18:46,2017-08-15T18:46:00,,Adoption,Spayed Female,30.47411259,-97.26813848,8.825992063,,,
2801.0,2 years,A679086,Cat,Domestic Shorthair Mix,Brown Tabby/White,2012-05-16,5/26/2014 14:48,2014-05-26T14:48:00,Partner,Transfer,Intact Female,30.61161841,-97.55112204,105.802381,*Smores,,
2802.0,3 years,A619861,Dog,Pit Bull/Boxer,Brown/White,2011-02-08,2/8/2014 18:25,2014-02-08T18:25:00,,Adoption,Spayed Female,30.3312975,-97.58272116,156.6810516,*Jessie,,
2803.0,4 years,A653367,Dog,Catahoula Mix,White/Black,2013-01-05,2/8/2017 0:00,2017-02-08T00:00:00,,Return to Owner,Intact Male,30.68427589,-97.63000174,213.5714286,Otis,,
2804.0,4 months,A712861,Cat,Domestic Shorthair Mix,Black/White,2015-05-14,10/7/2015 12:00,2015-10-07T12:00:00,Partner,Transfer,Neutered Male,30.28347219,-97.72442456,20.92857143,*Ajax,,
2805.0,2 years,A741700,Cat,Domestic Longhair Mix,Calico,2015-01-06,3/22/2017 12:06,2017-03-22T12:06:00,Partner,Transfer,Spayed Female,30.56547108,-97.67513796,115.214881,*Kat,,
2806.0,10 months,A699740,Dog,Cardigan Welsh Corgi/Chihuahua Shorthair,Brown/White,2014-08-01,6/6/2015 17:17,2015-06-06T17:17:00,Offsite,Adoption,Neutered Male,30.28753974,-97.25478217,44.24573413,Oliver,,
2807.0,2 months,A711853,Cat,Domestic Shorthair Mix,Brown Tabby,2015-08-12,11/7/2015 19:14,2015-11-07T19:14:00,,Adoption,Spayed Female,30.34618355,-97.44866775,12.54305556,*Nala,,
2808.0,2 months,A759054,Dog,Yorkshire Terrier Mix,Black,2017-07-25,9/28/2017 16:55,2017-09-28T16:55:00,Partner,Transfer,Intact Female,30.62928375,-97.43208369,9.38640873,,,
2809.0,2 years,A724918,Dog,Chihuahua Shorthair,Tan,2014-04-22,5/8/2016 15:51,2016-05-08T15:51:00,,Adoption,Spayed Female,30.72138152,-97.37656994,106.808631,*Ginger Snap,,
2810.0,5 years,A743139,Dog,Pit Bull Mix,Red,2012-02-04,2/23/2017 14:52,2017-02-23T14:52:00,,Return to Owner,Spayed Female,30.74408546,-97.66873153,263.8027778,Rayne,,
2811.0,2 weeks,A677631,Cat,Domestic Shorthair Mix,Black/White,2014-04-12,4/27/2014 12:07,2014-04-27T12:07:00,Partner,Transfer,Unknown,30.43511029,-97.56261159,2.214980159,,,
2812.0,4 years,A658626,Dog,Chihuahua Shorthair Mix,Tan/White,2012-07-12,2/19/2017 15:27,2017-02-19T15:27:00,,Adoption,Neutered Male,30.56627252,-97.59312543,240.5205357,Chuck Norris,,
2813.0,11 years,A716855,Cat,Domestic Shorthair Mix,Tortie,2004-11-27,12/30/2015 18:27,2015-12-30T18:27:00,,Adoption,Spayed Female,30.34222927,-97.47343426,578.68125,Faux,,
2814.0,8 months,A759638,Dog,Norfolk Terrier Mix,Cream,2017-02-05,10/15/2017 12:52,2017-10-15T12:52:00,,Adoption,Neutered Male,30.54002126,-97.39127239,36.0765873,Merlin,,
2815.0,9 years,A478560,Dog,Australian Cattle Dog Mix,Blue Tick/Brown,2007-01-14,4/3/2016 12:21,2016-04-03T12:21:00,,Adoption,Spayed Female,30.68594074,-97.74004951,481.0735119,Noel,,
